Title,KMeans Cluster,DBSCAN Cluster,Cluster Name
unbelievable moments caught on video,7,-1,Random / Miscellaneous
killswitch engage my last serenade official video,7,-1,Random / Miscellaneous
beabadoobee x laufey a night to remember official lyric video,7,-1,Random / Miscellaneous
chappell roan good luck babe official lyric video,7,37,Random / Miscellaneous
tate mcrae sports car official video,7,-1,Random / Miscellaneous
james bond 007 skyfall by adele official full music video,7,-1,Random / Miscellaneous
lady gaga bruno mars die with a smile official music video,7,-1,Random / Miscellaneous
gerry the pacemakers youll never walk alone official video,7,-1,Random / Miscellaneous
cris mj si no es contigo video oficial,7,-1,Random / Miscellaneous
bad bunny chencho corleone me porto bonito video oficial un verano sin ti,7,55,Random / Miscellaneous
rose bruno mars apt official music video,7,37,Random / Miscellaneous
huskysave pitch video group bb,7,-1,Random / Miscellaneous
bad bunny arcngel de la ghetto engo flow acho pr video oficial nslqvapm,7,-1,Random / Miscellaneous
perry como silver bells official lyric video,7,37,Random / Miscellaneous
wham last christmas official video,7,-1,Random / Miscellaneous
brenda lee rockin around the christmas tree official music video,7,-1,Random / Miscellaneous
frank sinatra mistletoe and holly official video,7,37,Random / Miscellaneous
bing crosby winter wonderland official video,7,37,Random / Miscellaneous
frank sinatra have yourself a merry little christmas official video,7,-1,Random / Miscellaneous
michael bubl its beginning look lot like christmas official music video,7,-1,Random / Miscellaneous
wreckfest official announcement trailer,7,-1,Random / Miscellaneous
olivia rodrigo bad idea right official video,7,-1,Random / Miscellaneous
olivia rodrigo good 4 u official video,7,-1,Random / Miscellaneous
megan thee stallion mamushi feat yuki chiba official video,7,37,Random / Miscellaneous
thrown on verge official video,7,-1,Random / Miscellaneous
joker folie deux official trailer,7,-1,Random / Miscellaneous
interstellar movie official trailer,7,-1,Random / Miscellaneous
big time rush boyfriend official video snoop dogg,7,-1,Random / Miscellaneous
big time rush worldwide official video,7,-1,Random / Miscellaneous
boston massachusetts usa 4k ultra hd 60fps video by drone,7,-1,Random / Miscellaneous
the boys season 4 official trailer prime video,7,-1,Random / Miscellaneous
spiderman 3 2007 official trailer hd,7,-1,Random / Miscellaneous
chicago city in usa 4k ultra hd video,7,-1,Random / Miscellaneous
bad bunny chencho corleone me porto bonito video oficial un verano sin ti,7,55,Random / Miscellaneous
bad bunny x jhay cortez dkiti video oficial,7,-1,Random / Miscellaneous
jere klein ando video oficial enfasis,7,-1,Random / Miscellaneous
the acolyte official trailer disney,7,-1,Random / Miscellaneous
kong skull island rise of king official final trailer,7,-1,Random / Miscellaneous
godzilla official main trailer hd,7,-1,Random / Miscellaneous
john denver take me home country roads official audio,7,-1,Random / Miscellaneous
giveon favorite mistake knock2 remix official audio,7,-1,Random / Miscellaneous
flats official fast food tier list,7,-1,Random / Miscellaneous
paolo ladino vol 4 official video,7,-1,Random / Miscellaneous
the official smash ultimate cheater tier list,7,-1,Random / Miscellaneous
the official smash ultimate cheater tier list,7,-1,Random / Miscellaneous
timbaland the way i are official music video keri hilson doe sebastian,7,-1,Random / Miscellaneous
the black eyed peas pump it official music video,7,-1,Random / Miscellaneous
coldplay viva la vida official video,7,-1,Random / Miscellaneous
bad bunny tit me pregunt video oficial un verano sin ti,7,55,Random / Miscellaneous
darell lollipop official video,7,182,Random / Miscellaneous
el alfa x darell x noriel 4k video oficial,7,-1,Random / Miscellaneous
wii marble music,7,-1,Random / Miscellaneous
frozen let it go singalong official disney uk,7,-1,Random / Miscellaneous
frozen let it go singalong official disney uk,7,-1,Random / Miscellaneous
frozen let it go singalong official disney uk,7,-1,Random / Miscellaneous
alexandra stan mr saxobeat official video,7,37,Random / Miscellaneous
pitbull back time official video,7,-1,Random / Miscellaneous
post malone swae lee sunflower spiderman into spiderverse official video,7,195,Random / Miscellaneous
6ix9ine is video game,7,-1,Random / Miscellaneous
eminem lose yourself 8d audio,7,205,Random / Miscellaneous
eminem lose yourself hd,7,206,Random / Miscellaneous
pitbull international love official video chris brown,7,-1,Random / Miscellaneous
cascada everytime we touch official video,7,-1,Random / Miscellaneous
katy perry hot n cold official music video,7,37,Random / Miscellaneous
travis scott bad bunny the weeknd kpop official music video,7,-1,Random / Miscellaneous
ryan castro peso pluma quema video oficial,7,208,Random / Miscellaneous
darell lollipop official video,7,182,Random / Miscellaneous
darell lollipop official video,7,182,Random / Miscellaneous
darell lollipop official video,7,182,Random / Miscellaneous
big time rush worldwide official video,7,-1,Random / Miscellaneous
el alfa x darell x noriel 4k video oficial,7,-1,Random / Miscellaneous
4k el alfa x darell x noriel fitdance coreografia dance video,7,-1,Random / Miscellaneous
el alfa x darell x noriel 4k video oficial,7,-1,Random / Miscellaneous
cabas enamorndonos official video,7,215,Random / Miscellaneous
the most disturbing video on youtube robert budd dwyers suicide video story,7,-1,Random / Miscellaneous
saw x 2023 official trailer tobin bell,7,-1,Random / Miscellaneous
stromae alors on danse official video,7,37,Random / Miscellaneous
numa numa original music video,7,-1,Random / Miscellaneous
diablo 4 official announcement cinematic trailer blizzcon 2019,7,-1,Random / Miscellaneous
charli xcx speed drive from barbie the album official audio,7,-1,Random / Miscellaneous
charli xcx speed drive from barbie the album official music video,7,-1,Random / Miscellaneous
nuketown zombies trailer official call of duty black ops video,7,-1,Random / Miscellaneous
6ix9ine hates his music,7,-1,Random / Miscellaneous
lil yachty cant resist,7,-1,Random / Miscellaneous
batman arkham trilogy official nintendo switch reveal trailer,7,-1,Random / Miscellaneous
an indepth look at lovecraftian video games,7,-1,Random / Miscellaneous
flo rida club cant handle me david guetta official music video step up 3d,7,233,Random / Miscellaneous
pitbull international love official video chris brown,7,-1,Random / Miscellaneous
cascada everytime we touch official video,7,-1,Random / Miscellaneous
maluma the weeknd hawi remix official video,7,-1,Random / Miscellaneous
travis scott bad bunny the weeknd kpop official music video,7,-1,Random / Miscellaneous
tainy rauw alejandro scifi official audio,7,37,Random / Miscellaneous
tainy rauw alejandro scifi official video,7,37,Random / Miscellaneous
ryan castro peso pluma quema video oficial,7,208,Random / Miscellaneous
el alfa x peso pluma plebada video oficial,7,-1,Random / Miscellaneous
becky g el alfa fulanito official video,7,234,Random / Miscellaneous
bad bunny ft el alfa la romana x100pre video oficial,7,-1,Random / Miscellaneous
brray jhayco ryan castro corazn roto remix official video,7,37,Random / Miscellaneous
arcangel bad bunny la jumpa video oficial sr santos,7,235,Random / Miscellaneous
deji ran official music video,7,237,Random / Miscellaneous
lionel messi cant stop playing video games,7,-1,Random / Miscellaneous
darell farruko caliente official video,7,238,Random / Miscellaneous
rocky road pt2 official video alano adan,7,37,Random / Miscellaneous
moneybagg yo rocky road feat kodak black official music video,7,-1,Random / Miscellaneous
charli xcx speed drive from barbie the album official audio,7,-1,Random / Miscellaneous
sky rompiendo feid myke towers el cielo official video,7,-1,Random / Miscellaneous
brray jhayco ryan castro corazn roto remix official video,7,37,Random / Miscellaneous
darell farruko caliente official video,7,238,Random / Miscellaneous
jhay cortez j balvin bad bunny no me conoce remix,7,245,Random / Miscellaneous
arcangel bad bunny la jumpa video oficial sr santos,7,235,Random / Miscellaneous
mrbeast most viral video ever,7,-1,Random / Miscellaneous
tpl bm otp london view music video pressplay,7,248,Random / Miscellaneous
arcangel bad bunny la jumpa video oficial sr santos,7,235,Random / Miscellaneous
eminem lose yourself 8d audio,7,205,Random / Miscellaneous
deji ran official music video,7,237,Random / Miscellaneous
deji ran official music video,7,237,Random / Miscellaneous
randolph manchild deji diss track official video,7,37,Random / Miscellaneous
jhay cortez j balvin bad bunny no me conoce remix,7,245,Random / Miscellaneous
rauw alejandro crame video oficial,7,-1,Random / Miscellaneous
arcangel bad bunny la jumpa video oficial sr santos,7,235,Random / Miscellaneous
pop smoke dior lil uzi vert remix,7,253,Random / Miscellaneous
reupload the gay song music video by jenna anna,7,-1,Random / Miscellaneous
arcangel bad bunny la jumpa video oficial sr santos,7,235,Random / Miscellaneous
tpl bm otp london view music video pressplay,7,248,Random / Miscellaneous
arcangel bad bunny la jumpa video oficial sr santos,7,235,Random / Miscellaneous
blessd de la ghetto darell instagram remix video oficial,7,-1,Random / Miscellaneous
pop smoke dior lil uzi vert remix,7,253,Random / Miscellaneous
blessd de la ghetto darell instagram remix video oficial,7,-1,Random / Miscellaneous
arcangel bad bunny la jumpa video oficial sr santos,7,235,Random / Miscellaneous
blessd de la ghetto darell instagram remix video oficial,7,-1,Random / Miscellaneous
pop smoke dior lil uzi vert remix,7,253,Random / Miscellaneous
arcangel bad bunny la jumpa video oficial sr santos,7,235,Random / Miscellaneous
hit gopro video ends,7,-1,Random / Miscellaneous
arcangel bad bunny la jumpa video oficial sr santos,7,235,Random / Miscellaneous
tiago pzk ozuna nos comemos video oficial,7,208,Random / Miscellaneous
rema calm down official music video,7,238,Random / Miscellaneous
arcangel bad bunny la jumpa,7,-1,Random / Miscellaneous
arcangel bad bunny la jumpa video oficial sr santos,7,235,Random / Miscellaneous
arcangel bad bunny la jumpa video oficial sr santos,7,235,Random / Miscellaneous
bad bunny chencho corleone me porto bonito video oficial un verano sin ti,7,55,Random / Miscellaneous
rauw alejandro chencho corleone desesperados video oficial,7,208,Random / Miscellaneous
rauw alejandro chencho corleone el efecto video oficial,7,-1,Random / Miscellaneous
jhay cortez j balvin bad bunny no me conoce remix,7,245,Random / Miscellaneous
mortal kombat 1 official announcement trailer,7,-1,Random / Miscellaneous
jimmy eat world the middle official music video,7,-1,Random / Miscellaneous
bring me the horizon lost official video,7,-1,Random / Miscellaneous
this video made chrismd 100000,7,-1,Random / Miscellaneous
josh turner would you go with me official music video,7,-1,Random / Miscellaneous
keith urban somebody like you official music video,7,-1,Random / Miscellaneous
kai cenat reacted my video,7,-1,Random / Miscellaneous
lil loaded,7,-1,Random / Miscellaneous
lil loaded,7,-1,Random / Miscellaneous
miniminter reveals chrismd video is fake,7,-1,Random / Miscellaneous
post malone swae lee sunflower spiderman into spiderverse official video,7,195,Random / Miscellaneous
post malone circles official music video,7,238,Random / Miscellaneous
lord huron the night we met official audio,7,284,Random / Miscellaneous
spiderman across the spiderverse official trailer hd,7,-1,Random / Miscellaneous
blanco brown the git up dance video,7,-1,Random / Miscellaneous
sheck wes mo bamba official music video,7,37,Random / Miscellaneous
meek mill lord knows tory lanez from creed original motion picture soundtrack official video,7,-1,Random / Miscellaneous
pop smoke dior lil uzi vert remix,7,253,Random / Miscellaneous
tobi manny destined for greatness feat janell official music video,7,299,Random / Miscellaneous
soccer pump up mix hype video 2015 hd,7,306,Random / Miscellaneous
imagine dragons believer official music video,7,238,Random / Miscellaneous
chamillionaire ridin official music video krayzie bone,7,37,Random / Miscellaneous
sade smooth operator official 1984,7,-1,Random / Miscellaneous
foster the people pumped up kicks official video,7,-1,Random / Miscellaneous
young money bed rock official music video,7,-1,Random / Miscellaneous
lil baby x gunna drip too hard official audio,7,313,Random / Miscellaneous
lil babydrip too hard,7,-1,Random / Miscellaneous
official beer pong rules,7,-1,Random / Miscellaneous
chris brown forever official hd video,7,-1,Random / Miscellaneous
sade smooth operator official 1984,7,-1,Random / Miscellaneous
sr welcome to brixton music video grm daily,7,-1,Random / Miscellaneous
post malone 21 savage rockstar official music video,7,-1,Random / Miscellaneous
lil baby x gunna drip too hard official audio,7,313,Random / Miscellaneous
pop smoke dior official video,7,321,Random / Miscellaneous
dance dior pop smoke,7,-1,Random / Miscellaneous
the best freekick video on youtube,7,322,Random / Miscellaneous
saweetie best friend feat doja cat official music video,7,-1,Random / Miscellaneous
don omar pobre diabla video oficial,7,208,Random / Miscellaneous
offset metro boomin ric flair drip official audio,7,324,Random / Miscellaneous
nelly just a dream official music video,7,-1,Random / Miscellaneous
jeremy zucker supercuts lyric video,7,-1,Random / Miscellaneous
meek mill lord knows official instrumental remade by dell beats,7,-1,Random / Miscellaneous
meek mill pray for em official instrumental prod by csick,7,328,Random / Miscellaneous
pop smoke dior lil uzi vert remix,7,253,Random / Miscellaneous
chris brown forever official hd video,7,-1,Random / Miscellaneous
lil baby gets overcharged by 225k,7,-1,Random / Miscellaneous
zzoilo aitana mon amour remix music video,7,-1,Random / Miscellaneous
claw tutorial video,7,-1,Random / Miscellaneous
lil yachty playboi carti talk about lil uzi vert,7,-1,Random / Miscellaneous
lana del rey summertime sadness official music video,7,37,Random / Miscellaneous
50 cent in da club official music video,7,-1,Random / Miscellaneous
tiago pzk ozuna nos comemos video oficial,7,208,Random / Miscellaneous
las ketchup the ketchup song asereje spanglish version official video,7,-1,Random / Miscellaneous
midnight paris official trailer hd 2011,7,-1,Random / Miscellaneous
khalid vertigo official audio,7,-1,Random / Miscellaneous
khalid self official audio,7,-1,Random / Miscellaneous
khalid paradise official audio,7,-1,Random / Miscellaneous
tiago pzk ozuna nos comemos video oficial,7,208,Random / Miscellaneous
tiago pzk ozuna nos comemos video oficial,7,208,Random / Miscellaneous
pop smoke dior official video,7,321,Random / Miscellaneous
tiago pzk ozuna nos comemos video oficial,7,208,Random / Miscellaneous
sidemen video crashed by fans,7,-1,Random / Miscellaneous
eminem lose yourself hd,7,206,Random / Miscellaneous
pop smoke dior lil uzi vert remix,7,253,Random / Miscellaneous
video making optichouse2013 thats problem,7,-1,Random / Miscellaneous
tiago pzk ozuna nos comemos video oficial,7,208,Random / Miscellaneous
meek mill 1942 flows official video,7,37,Random / Miscellaneous
papichuloteej sos marcos g official audio,7,-1,Random / Miscellaneous
tyler the creator juggernaut official video,7,-1,Random / Miscellaneous
pop smoke dior lil uzi vert remix,7,253,Random / Miscellaneous
official batman arkham knight announce trailer father son,7,-1,Random / Miscellaneous
papichuloteej sos marcos g official audio,7,-1,Random / Miscellaneous
dean martin silver bells official audio,7,-1,Random / Miscellaneous
kay flock shake it feat cardi b dougie b bory300 official video,7,-1,Random / Miscellaneous
pop smoke,7,-1,Random / Miscellaneous
pop smoke dior lil uzi vert remix,7,253,Random / Miscellaneous
jhay cortez myke towers los bo official video,7,-1,Random / Miscellaneous
pop smoke dior lil uzi vert remix,7,253,Random / Miscellaneous
cordae rnp feat anderson paak official lyric video,7,37,Random / Miscellaneous
benny blanco juice wrld graduation official music video,7,37,Random / Miscellaneous
lord huron the night we met official audio,7,284,Random / Miscellaneous
j balvin x bad bunny la cancin oasis video oficial,7,-1,Random / Miscellaneous
jhay cortez j balvin bad bunny no me conoce 8d audio 360 remix,7,-1,Random / Miscellaneous
sean paul j balvin contra la pared 8d audio,7,-1,Random / Miscellaneous
j balvin badshah tainy voodoo 8d audio,7,-1,Random / Miscellaneous
pop smoke dior lil uzi vert remix,7,253,Random / Miscellaneous
one two freddys coming for you lyric video,7,-1,Random / Miscellaneous
pop smoke dior lil uzi vert remix,7,253,Random / Miscellaneous
kay flock shake it feat cardi b dougie b bory300 official video,7,-1,Random / Miscellaneous
tpl bm otp london view music video pressplay,7,248,Random / Miscellaneous
mr c the slide man chacha slide official video,7,-1,Random / Miscellaneous
vic wobble baby official music video,7,238,Random / Miscellaneous
vic wobble official music video warner records,7,37,Random / Miscellaneous
dance dior pop smoke,7,-1,Random / Miscellaneous
rip pop smoke,7,-1,Random / Miscellaneous
drake x lil baby wants needs skit,7,-1,Random / Miscellaneous
chris brown forever official hd video,7,-1,Random / Miscellaneous
soccer pump up mix hype video 2015 hd,7,306,Random / Miscellaneous
imagine dragons demons official music video,7,238,Random / Miscellaneous
fall out boy centuries official video,7,-1,Random / Miscellaneous
the script hall of fame official video william,7,-1,Random / Miscellaneous
the script superheroes official video,7,-1,Random / Miscellaneous
pop smoke dior official video,7,321,Random / Miscellaneous
tpl bm otp london view music video pressplay,7,248,Random / Miscellaneous
ksi randolph beerus official music video,7,351,Random / Miscellaneous
pop smoke for the night audio lil baby dababy,7,-1,Random / Miscellaneous
bobby shmurda hot ngga official music video,7,37,Random / Miscellaneous
sheck wes mo bamba official music video,7,37,Random / Miscellaneous
lord huron the night we met official audio,7,284,Random / Miscellaneous
post malone swae lee sunflower spiderman into spiderverse official video,7,195,Random / Miscellaneous
lil agz sidetalk,7,-1,Random / Miscellaneous
los caminos de la vida los diablitos video,7,-1,Random / Miscellaneous
metro boomin dreamcatcher feat swae lee travis scott official audio,7,-1,Random / Miscellaneous
jhay cortez j balvin bad bunny no me conoce remix,7,245,Random / Miscellaneous
lokera rauw alejandro x lyanno x brray official video,7,-1,Random / Miscellaneous
bobby shmurda hot ngga official music video,7,37,Random / Miscellaneous
lewis capaldi before you go official video,7,365,Random / Miscellaneous
jaymes young infinity piano version official audio,7,-1,Random / Miscellaneous
jaymes young infinity official audio,7,-1,Random / Miscellaneous
chris brown forever official hd video,7,-1,Random / Miscellaneous
2pac hit em up dirty music video hd,7,-1,Random / Miscellaneous
jid surround sound feat 21 savage baby tate official music video,7,-1,Random / Miscellaneous
michael jackson beat it official 4k video,7,-1,Random / Miscellaneous
michael jackson man in the mirror official video,7,-1,Random / Miscellaneous
michael jackson billie jean official video,7,37,Random / Miscellaneous
coolio gangstas paradise feat lv official music video,7,37,Random / Miscellaneous
tpl bm otp london view music video pressplay,7,248,Random / Miscellaneous
denver colorado usa 4k ultra hd 60fps video by drone,7,-1,Random / Miscellaneous
baby keem trademark usa official audio,7,-1,Random / Miscellaneous
baby keem honest official video,7,238,Random / Miscellaneous
tpl bm otp london view music video pressplay,7,248,Random / Miscellaneous
dominic fike double negative skeleton milkshake official audio,7,324,Random / Miscellaneous
dominic fike wurli official audio,7,-1,Random / Miscellaneous
gayle abcdefu official music video,7,237,Random / Miscellaneous
the weeknd often nsfw official video,7,-1,Random / Miscellaneous
pop smoke dior official video,7,321,Random / Miscellaneous
jid surround sound feat 21 savage baby tate official music video,7,-1,Random / Miscellaneous
ksi x lil wayne lose official music video,7,375,Random / Miscellaneous
flo rida club cant handle me david guetta official music video step up 3d,7,233,Random / Miscellaneous
dominic fike double negative skeleton milkshake official audio,7,324,Random / Miscellaneous
j balvin x bad bunny la cancin oasis video oficial,7,-1,Random / Miscellaneous
bad bunny si veo a tu mam yhlqmdlg video oficial,7,55,Random / Miscellaneous
lewis capaldi before you go official video,7,365,Random / Miscellaneous
we were fifteen official visualizer,7,-1,Random / Miscellaneous
jaden your voice short performance video,7,-1,Random / Miscellaneous
rainbow bap remix official visualizer,7,-1,Random / Miscellaneous
j balvin bad bunny que pretendes 8d audio,7,-1,Random / Miscellaneous
bad sisters official trailer apple tv,7,-1,Random / Miscellaneous
black bird official trailer apple tv,7,-1,Random / Miscellaneous
black bird official trailer apple tv,7,-1,Random / Miscellaneous
rainbow bap remix official visualizer,7,-1,Random / Miscellaneous
lil uzi vert xo tour life 8d audio,7,-1,Random / Miscellaneous
papichuloteej sos marcos g official audio,7,-1,Random / Miscellaneous
bad bunny chencho corleone me porto bonito video oficial un verano sin ti,7,55,Random / Miscellaneous
dababy vibez official fortnite music video fortnite dababy lets gooo,7,-1,Random / Miscellaneous
dababy vibez official music video,7,237,Random / Miscellaneous
zayn vibez official video,7,215,Random / Miscellaneous
bad bunny tit me pregunt video oficial un verano sin ti,7,55,Random / Miscellaneous
w2s ricegum sucks ft ksi diss track official video,7,-1,Random / Miscellaneous
jid surround sound feat 21 savage baby tate official music video,7,-1,Random / Miscellaneous
raf official video,7,-1,Random / Miscellaneous
young thug day before with mac miller official audio,7,-1,Random / Miscellaneous
lake street dive hypotheticals official music video,7,37,Random / Miscellaneous
doja cat get into it yuh official video,7,-1,Random / Miscellaneous
bad bunny amorfoda video oficial,7,-1,Random / Miscellaneous
to palm trees official music video 2018,7,-1,Random / Miscellaneous
to selflessish prod j dilla official audio 2015,7,-1,Random / Miscellaneous
to buzzed feat willow official audio,7,-1,Random / Miscellaneous
rainbow bap remix official visualizer,7,-1,Random / Miscellaneous
eminem lose yourself hd,7,206,Random / Miscellaneous
imagine dragons demons official music video,7,238,Random / Miscellaneous
soccer pump up mix hype video 2015 hd,7,306,Random / Miscellaneous
dominic fike wurli official audio,7,-1,Random / Miscellaneous
dominic fike why official audio,7,-1,Random / Miscellaneous
dominic fike superstar sht official audio,7,-1,Random / Miscellaneous
dominic fike double negative skeleton milkshake official audio,7,324,Random / Miscellaneous
dominic fike double negative skeleton milkshake official audio,7,324,Random / Miscellaneous
bad bunny amorfoda video oficial,7,-1,Random / Miscellaneous
aventura bad bunny volv video oficial,7,-1,Random / Miscellaneous
jhay cortez j balvin bad bunny no me conoce remix,7,245,Random / Miscellaneous
bad bunny chencho corleone me porto bonito video oficial un verano sin ti,7,55,Random / Miscellaneous
rvssian farruko j balvin ponle official video,7,-1,Random / Miscellaneous
hereditary official trailer hd a24,7,-1,Random / Miscellaneous
sinister official trailer 1 2015 horror movie sequel hd,7,-1,Random / Miscellaneous
sinister official trailer 1 2012 ethan hawke horror movie hd,7,-1,Random / Miscellaneous
halloween ends official trailer,7,-1,Random / Miscellaneous
300k setup video,7,-1,Random / Miscellaneous
the best freekick video on youtube,7,322,Random / Miscellaneous
ksi two birds one stone official music video,7,-1,Random / Miscellaneous
ksi randolph beerus official music video,7,351,Random / Miscellaneous
unsolved mysteries caught on video,7,-1,Random / Miscellaneous
unbelievable moments caught on video,7,-1,Random / Miscellaneous
jhay cortez j balvin bad bunny no me conoce remix,7,245,Random / Miscellaneous
benny blanco juice wrld graduation official music video,7,37,Random / Miscellaneous
juice wrld cigarettes official music video,7,238,Random / Miscellaneous
snoop dogg wiz khalifa young wild free bruno mars official video,7,-1,Random / Miscellaneous
justin timberlake suit tie official video jayz,7,37,Random / Miscellaneous
reik manuel turizo aleluya video oficial,7,-1,Random / Miscellaneous
sidemen the gift ft sx official music video,7,398,Random / Miscellaneous
tobi manny destined for greatness feat janell official music video,7,299,Random / Miscellaneous
reik manuel turizo aleluya video oficial,7,-1,Random / Miscellaneous
logic 18002738255 alessia cara khalid official video,7,37,Random / Miscellaneous
bad bunny amorfoda video oficial,7,-1,Random / Miscellaneous
noche de brujas dime porqu video oficial,7,-1,Random / Miscellaneous
jaden summertime in paris willow official audio,7,402,Random / Miscellaneous
eminem lose yourself hd,7,206,Random / Miscellaneous
eminem lose yourself 8d audio,7,205,Random / Miscellaneous
lil uzi vert xo tour life 8d audio,7,-1,Random / Miscellaneous
jeremih impatient ty dolla ign official audio,7,324,Random / Miscellaneous
juice wrld up up and away official audio,7,-1,Random / Miscellaneous
mac miller earth feat future official audio,7,-1,Random / Miscellaneous
jack harlow whats poppin feat dababy tory lanez lil wayne official video,7,-1,Random / Miscellaneous
pop smoke dior 8d audio best version,7,-1,Random / Miscellaneous
pop smoke dior 9d audio,7,-1,Random / Miscellaneous
