Title,Cluster,Cluster Name
batman humbles redhood for being angry about dying,0,the / in / a / of / shorts
stop sleeping on wolverine marvel rivals,0,the / in / a / of / shorts
the sidemen argue theyre more talented than mrbeast agree to disagree,0,the / in / a / of / shorts
how stephen tries destroyed the worlds biggest football youtube channel,0,the / in / a / of / shorts
how bumblebee proved hes the greatest autobot ever,0,the / in / a / of / shorts
when van helsing put dracula in a coffin after becoming a werewolf,0,the / in / a / of / shorts
when king kong bodied 3 vrexes for a snow bunnys love,0,the / in / a / of / shorts
when sonic and shadow ran a dragon ball z level fade,0,the / in / a / of / shorts
who is spidermans greatest villain,0,the / in / a / of / shorts
ive mastered ghost dashing as black panther marvel rivals,0,the / in / a / of / shorts
saltiest gamer moments,0,the / in / a / of / shorts
good good decide our golf forfeits big wedge golf,0,the / in / a / of / shorts
good good decide our golf forfeits big wedge golf,0,the / in / a / of / shorts
winter soldier drops a world record 102 kills in my game l marvel rivals,0,the / in / a / of / shorts
logits and optimization class 4 uw econ484 econometrics and data science,0,the / in / a / of / shorts
winter soldier drops a world record 102 kills in my game l marvel rivals,0,the / in / a / of / shorts
good good decide our golf forfeits big wedge golf,0,the / in / a / of / shorts
biggest things ever stolen,0,the / in / a / of / shorts
sidemen survive 24 hours in uks most haunted house,0,the / in / a / of / shorts
dont watch these scary tiktoks alone,0,the / in / a / of / shorts
batman arkham asylum a horror retrospective,0,the / in / a / of / shorts
viewed the suds been kicking my butt for the past week spiderman ps4 vid within the next week,0,the / in / a / of / shorts
viewed cristiano ronaldo 17 karim benzema 16 ivan toney 16the english striker is keeping up with the big boys in the saudi pro league,0,the / in / a / of / shorts
when thanos ran solo squads on the avengers titan battle,0,the / in / a / of / shorts
destroying diamonds with venom insane ot hold road to grandmaster marvel rivals,0,the / in / a / of / shorts
w2s plays f1 racing,0,the / in / a / of / shorts
horror movies i could easily survive,0,the / in / a / of / shorts
when spiderman harry ran the fade all across new york over mj,0,the / in / a / of / shorts
15 minutes of satisfying marvel rivals hexakills,0,the / in / a / of / shorts
batman arkham asylum a horror retrospective,0,the / in / a / of / shorts
new secretary steals the show on her first day suits series shorts lawyer,0,the / in / a / of / shorts
harvey is winning big in poker suits,0,the / in / a / of / shorts
mike won the argument suits,0,the / in / a / of / shorts
who wouldnt want an assistant like donnatvseries shots tvshow,0,the / in / a / of / shorts
suits recap full series,0,the / in / a / of / shorts
harvey specters angriest moments suits,0,the / in / a / of / shorts
when van helsing put dracula in a coffin after becoming a werewolf,0,the / in / a / of / shorts
arsenal bottled it again,0,the / in / a / of / shorts
coulda been love episode 1 meet the bachelor,0,the / in / a / of / shorts
watch trump argues with zelenskyy in oval office,0,the / in / a / of / shorts
earthcam live new orleans street view,0,the / in / a / of / shorts
streamers crashing out over marvel rivals ranked,0,the / in / a / of / shorts
ninja marvel rivals rage compilation ft xqc and timthetatman,0,the / in / a / of / shorts
xqc is already raging in marvel rivals,0,the / in / a / of / shorts
petscop the dark story hidden in a haunted game,0,the / in / a / of / shorts
darkest humour on the internet,0,the / in / a / of / shorts
brain rot but its the 2010s,0,the / in / a / of / shorts
sidemen uno chaos mode,0,the / in / a / of / shorts
outrageous bad friends podcast moments,0,the / in / a / of / shorts
when optimus and bumblebee went on a kill streak of decepticons,0,the / in / a / of / shorts
how optimus prime sent sentinel lockdown to the scrap yard,0,the / in / a / of / shorts
a solid 8 minutes of useless info,0,the / in / a / of / shorts
how thanos bullied the infinty stone from the avengers in wakanda,0,the / in / a / of / shorts
when the avengers defended earth from thanoss goons,0,the / in / a / of / shorts
how kratos violated the gods of olympus in the worst ways,0,the / in / a / of / shorts
when godzilla x kong took turns cooking the monsterverse,0,the / in / a / of / shorts
sidemen debate club,0,the / in / a / of / shorts
sidemen react to plastic surgery gone too far,0,the / in / a / of / shorts
16 places youre not allowed to visit,0,the / in / a / of / shorts
how kratos violated the gods of olympus in the worst ways,0,the / in / a / of / shorts
making marvel rivals lobbies look easy,0,the / in / a / of / shorts
when godzilla kong showed skar king shimo why theyre the kings of the monsters,0,the / in / a / of / shorts
how the teenage mutant ninja turtles nearly became only children to shredder,0,the / in / a / of / shorts
when van helsing put dracula in a coffin after becoming a werewolf,0,the / in / a / of / shorts
how kevin defended his home alone from two goons,0,the / in / a / of / shorts
when the avengers had a civil war over the winter soldier,0,the / in / a / of / shorts
when the avengers had a civil war over the winter soldier,0,the / in / a / of / shorts
marvel rivals top 500 grind,0,the / in / a / of / shorts
why the enemy team perma bans the rank 1 black panther,0,the / in / a / of / shorts
w2s plays f1 racing,0,the / in / a / of / shorts
ksi deji plays scary games,0,the / in / a / of / shorts
w2s plays geoguessr and fifa 21 with anesongib,0,the / in / a / of / shorts
w2s cheats and pretends to act surprised,0,the / in / a / of / shorts
making an equaliser eq building a discordpy music bot part 15,0,the / in / a / of / shorts
audio data processing in python,0,the / in / a / of / shorts
sidemen describe youtubers in one word,0,the / in / a / of / shorts
sidemen rap or crap,0,the / in / a / of / shorts
the next meme cards against humanity,0,the / in / a / of / shorts
jjs new ep cards against humanity,0,the / in / a / of / shorts
when the indominus rex absolutely shut down jurassic world,0,the / in / a / of / shorts
how michael myers killed halloween for everyone,0,the / in / a / of / shorts
how michael myers killed halloween for everyone,0,the / in / a / of / shorts
craziest things spotted on google maps,0,the / in / a / of / shorts
livenow from fox,0,the / in / a / of / shorts
abc news live,0,the / in / a / of / shorts
change song pitch in python,0,the / in / a / of / shorts
pydub tutorial audio manipulation in python,0,the / in / a / of / shorts
batman and deathstroke were boxing batman arkham origins,0,the / in / a / of / shorts
batman turned killer croc into a purse batman arkham origins,0,the / in / a / of / shorts
stop sleeping on wolverine marvel rivals,0,the / in / a / of / shorts
how spiderman showed green goblin nothings friendly about him,0,the / in / a / of / shorts
dr strange doing in grandmaster what he couldnt in the mcu marvel rivals,0,the / in / a / of / shorts
audio data processing in python,0,the / in / a / of / shorts
how deadpool wolverine saved the marvel universe,0,the / in / a / of / shorts
when deadpool cooked up francis using maximum effort,0,the / in / a / of / shorts
when the avengers defended earth from thanoss goons,0,the / in / a / of / shorts
how thanos bullied the infinty stone from the avengers in wakanda,0,the / in / a / of / shorts
when optimus and bumblebee went on a kill streak of decepticons,0,the / in / a / of / shorts
when optimus prime tried sending bumblebee to the gulag,0,the / in / a / of / shorts
when spiderman and doc ock ran the fade all across zoo york ft codenamesuper,0,the / in / a / of / shorts
when the avengers destroyed new york city to stop loki,0,the / in / a / of / shorts
when the avengers destroyed new york city to stop loki,0,the / in / a / of / shorts
when spiderman hunted down the sinister six after getting jumped,0,the / in / a / of / shorts
quinn xcii couldve had it all prod luminox,0,the / in / a / of / shorts
adverts that are banned today,0,the / in / a / of / shorts
people dying inside,0,the / in / a / of / shorts
embarrassing facepalm moments,0,the / in / a / of / shorts
clips that made amp famous,0,the / in / a / of / shorts
clips that made ishowspeed famous 2,0,the / in / a / of / shorts
black and white image colorization using python opencv and deep learning,0,the / in / a / of / shorts
dumbest excuses for cheating exposed on tv,0,the / in / a / of / shorts
most awkward celebrity roasts,0,the / in / a / of / shorts
live tv goes wrong,0,the / in / a / of / shorts
banned youtubers you wont believe,0,the / in / a / of / shorts
sidemen controversial tweets,0,the / in / a / of / shorts
sidemen guess eachothers passwords,0,the / in / a / of / shorts
sidemen leak their camera rolls,0,the / in / a / of / shorts
sidemen agree or disagree,0,the / in / a / of / shorts
sidemen urban dictionary challenge offensive,0,the / in / a / of / shorts
sidemen forfeit blind date,0,the / in / a / of / shorts
iconic british tv moments,0,the / in / a / of / shorts
sidemen search destroy ksi masterclass,0,the / in / a / of / shorts
sidemen 500000 vs 500 mobile home road trip,0,the / in / a / of / shorts
tiktoks that are slightly offensive,0,the / in / a / of / shorts
seconds before disaster,0,the / in / a / of / shorts
people who were extremely unlucky,0,the / in / a / of / shorts
why united paid 80 million for maguire,0,the / in / a / of / shorts
sports fails so embarrassing youd want to retire immediately,0,the / in / a / of / shorts
komo 4,0,the / in / a / of / shorts
w2s look at these bloody slaves claiming credit for everything,0,the / in / a / of / shorts
weirdest things found on google earth,0,the / in / a / of / shorts
craziest things ever sold on the dark web,0,the / in / a / of / shorts
sidemen react to conspiracy theories that became true,0,the / in / a / of / shorts
holy sht ufc moments,0,the / in / a / of / shorts
spain road to victory euro 2024,0,the / in / a / of / shorts
the return cards against humanity,0,the / in / a / of / shorts
why is jj transforming cards against humanity,0,the / in / a / of / shorts
the next youtube drama cards against humanity,0,the / in / a / of / shorts
artificial intelligence and machine learning full course for beginners ai ml full course 2024,0,the / in / a / of / shorts
why deji doesnt record with us cards against humanity,0,the / in / a / of / shorts
jjs new ep cards against humanity,0,the / in / a / of / shorts
sidemen read hate comments,0,the / in / a / of / shorts
sidemen controversial agree or disagree,0,the / in / a / of / shorts
sidemen agree or disagree controversial edition,0,the / in / a / of / shorts
7 world class players who have a glaring weakness in their game,0,the / in / a / of / shorts
artificial intelligence and machine learning full course for beginners ai ml full course 2024,0,the / in / a / of / shorts
key fundamentals of ai and machine learning ai ml course for beginners,0,the / in / a / of / shorts
people getting caught in 4k,0,the / in / a / of / shorts
people caught in 4k,0,the / in / a / of / shorts
can dc compete with marvel rivals the sad truth,0,the / in / a / of / shorts
whos this person from history quiz,0,the / in / a / of / shorts
other telekinesis users vs darth vader like that starwars marvel darthvader edit,0,the / in / a / of / shorts
snoop doggs top 3 rappers,0,the / in / a / of / shorts
winter solider is so much fun i love ulting again again and again wintersoldier marvelrivals,0,the / in / a / of / shorts
canadian indians are the dumbest,0,the / in / a / of / shorts
harrys humour is unmatched w2s,0,the / in / a / of / shorts
people dying inside compilation,0,the / in / a / of / shorts
heres hogg deeney best end to a football match ever,0,the / in / a / of / shorts
most outrageous theo von clips,0,the / in / a / of / shorts
most outrageous theo von clips,0,the / in / a / of / shorts
tiktoks only the boys will understand,0,the / in / a / of / shorts
we found every youtubers first short,0,the / in / a / of / shorts
liverpool football club in a nutshell,0,the / in / a / of / shorts
how the media shapes the way we view the world bbc reel,0,the / in / a / of / shorts
sidemen memory test sus edition,0,the / in / a / of / shorts
sidemen guessmoji dumbest edition,0,the / in / a / of / shorts
more characters we need in marvel rivals,0,the / in / a / of / shorts
skins we need in marvel rivals,0,the / in / a / of / shorts
sidemen memory test,0,the / in / a / of / shorts
people who let their intrusive thoughts win,0,the / in / a / of / shorts
people with negative aura,0,the / in / a / of / shorts
marvel rivals ranked is a nightmare,0,the / in / a / of / shorts
sidemen pub quiz,0,the / in / a / of / shorts
sidemen guess how theyve brutally ranked each other,0,the / in / a / of / shorts
sidemen debate club,0,the / in / a / of / shorts
we bought 10 more abandoned storage units and made,0,the / in / a / of / shorts
venom the last dance postcredit scenes ending explained spoilers,0,the / in / a / of / shorts
the batman arkham movie chronological order batman arkham series,0,the / in / a / of / shorts
sidemen mafia but theres a medic role,0,the / in / a / of / shorts
moments athletes were caught cheating,0,the / in / a / of / shorts
quinn xcii couldve had it all prod luminox,0,the / in / a / of / shorts
biggest sidemen irl fails,0,the / in / a / of / shorts
sidemen offensive trivia,0,the / in / a / of / shorts
sidemen blind ranking outrageous edition,0,the / in / a / of / shorts
sidemen google ourselves,0,the / in / a / of / shorts
sidemen google feud,0,the / in / a / of / shorts
top 10 youtubers who have been arrested,0,the / in / a / of / shorts
prime football youtube nostalgia,0,the / in / a / of / shorts
the manager that almost destroyed arsenal,0,the / in / a / of / shorts
newcastle 20 arsenal live watchalong,0,the / in / a / of / shorts
sidemen whos most likely to impostor role,0,the / in / a / of / shorts
idiots in cars,0,the / in / a / of / shorts
sidemen extreme hot vs cold camping,0,the / in / a / of / shorts
sidemen 40000 vs 400 holiday europe edition,0,the / in / a / of / shorts
sidemen food truck road trip,0,the / in / a / of / shorts
sidemen 100000 mystery box challenge,0,the / in / a / of / shorts
sidemen spend 100000 on each other forfeit edition,0,the / in / a / of / shorts
sidemen one million pound drop irl challenge edition,0,the / in / a / of / shorts
our new cinema room,0,the / in / a / of / shorts
sidemen higher or lower instagram followers,0,the / in / a / of / shorts
sidemen higher or lower spotify monthly listeners 3,0,the / in / a / of / shorts
sidemen higher or lower youtube subscribers,0,the / in / a / of / shorts
the sidemen rate social media apps,0,the / in / a / of / shorts
sidemen higher or lower spotify monthly listeners 2,0,the / in / a / of / shorts
sidemen higher or lower spotify monthly listeners,0,the / in / a / of / shorts
sidemen fast food tier list,0,the / in / a / of / shorts
sidemen rate their own tiktoks,0,the / in / a / of / shorts
the sidemen rate their own songs,0,the / in / a / of / shorts
viewed nba players really thought shams got hacked instead of luka getting traded,0,the / in / a / of / shorts
sidemen weakest link sudden death edition,0,the / in / a / of / shorts
sidemen 20000 vs 20 plane ticket,0,the / in / a / of / shorts
sidemen forfeit foot golf,0,the / in / a / of / shorts
pizza cookoff vs ksi,0,the / in / a / of / shorts
sidemen lockdown protocol,0,the / in / a / of / shorts
sidemen supermarket sweep,0,the / in / a / of / shorts
i tested the worst rated restaurants,0,the / in / a / of / shorts
secret marvel rivals setting to stop bad teammates,0,the / in / a / of / shorts
i tested the worst rated restaurants,0,the / in / a / of / shorts
i tested fake fast food restaurants,0,the / in / a / of / shorts
new fortnite reload mode,0,the / in / a / of / shorts
the greatest fortnite duo returns,0,the / in / a / of / shorts
nfl scary hits warning knocked out,0,the / in / a / of / shorts
i packed a 2m icon in my toty pack opening,0,the / in / a / of / shorts
sidemen among us chaos mode but theres a third imposter role,0,the / in / a / of / shorts
i surprised my bestfriends with a 20000 present,0,the / in / a / of / shorts
i tested 24 restaurants in 24 hours,0,the / in / a / of / shorts
sidemen among us triple roles executioner veteran haunter,0,the / in / a / of / shorts
batman who laughs actually laughing,0,the / in / a / of / shorts
batman who laughs is goofy,0,the / in / a / of / shorts
the batman who laughs explained shorts comicstorian,0,the / in / a / of / shorts
the entire euros in a nutshell,0,the / in / a / of / shorts
we cooked the best michelin star dish from every decade,0,the / in / a / of / shorts
analysing toxic players to see if its a skill issue or support diff,0,the / in / a / of / shorts
this 200k grand finals had everyone losing it marvel rivals championship ft shroud xqc more,0,the / in / a / of / shorts
fc25 arsenal career mode episode 1,0,the / in / a / of / shorts
manchester uniteds greatest ever playerexe,0,the / in / a / of / shorts
the power of surprise features,0,the / in / a / of / shorts
me student access machine shop virtual tour,0,the / in / a / of / shorts
i spent 10 hours learning spiderman to prove hes the easiest hero in marvel rivals,0,the / in / a / of / shorts
sidemen among us thor role lightning strike to win,0,the / in / a / of / shorts
sidemen among us chaos mode but theres a third imposter role,0,the / in / a / of / shorts
how to pronounce fianna fil irish,0,the / in / a / of / shorts
tweets that might just save 2025,0,the / in / a / of / shorts
kiro 7,0,the / in / a / of / shorts
jon bernthal had trouble when he became the punisher,0,the / in / a / of / shorts
what a top 01 movement starlord looks like in marvel rivals,0,the / in / a / of / shorts
one busy week one easy template,0,the / in / a / of / shorts
the ultimate black panther guide for marvel rivals abilities combos mechanics and tech,0,the / in / a / of / shorts
the dark story lore of lethal company,0,the / in / a / of / shorts
we built lego drunk,0,the / in / a / of / shorts
opening a football shirt mystery box,0,the / in / a / of / shorts
avengers wake up marvel rivals is fire,0,the / in / a / of / shorts
i opened 5 retro mystery football shirt boxes,0,the / in / a / of / shorts
checking assumptions of the linear model,0,the / in / a / of / shorts
sidemen fc24 pack opening challenge the loser pays for everyone,0,the / in / a / of / shorts
sidemen forfeit pack opening challenge,0,the / in / a / of / shorts
ranking every hero from easiest to hardest in marvel rivals season 1,0,the / in / a / of / shorts
house of cards explained shakespeare history guilty pleasure,0,the / in / a / of / shorts
how to fillet every fish method mastery epicurious,0,the / in / a / of / shorts
lego lord of the rings baraddr review set 10333,0,the / in / a / of / shorts
every ten hag loss as manchester united manager the worst manager ever,0,the / in / a / of / shorts
the ultimate film studies watchlist,0,the / in / a / of / shorts
the 30 greatest film challenge 301,0,the / in / a / of / shorts
a brighter summer day 1991 trailer,0,the / in / a / of / shorts
the 2024 nobel prize in economics explained,0,the / in / a / of / shorts
president trump returns to office with busy inauguration day,0,the / in / a / of / shorts
the ultimate film studies watchlist,0,the / in / a / of / shorts
the 30 greatest film challenge 301,0,the / in / a / of / shorts
characters we need in marvel rivals,0,the / in / a / of / shorts
the wild story of how the mormons created utah,0,the / in / a / of / shorts
im fing drunk top 7 most erratic dui arrests,0,the / in / a / of / shorts
top 12 highspeed police chases caught on dashcam,0,the / in / a / of / shorts
diddy diddy go away drake drake go away but diddy freaky party,0,the / in / a / of / shorts
the bops on the bus go hawk tuah animated brain rot song,0,the / in / a / of / shorts
what rank 1 wolverine gameplay looks like,0,the / in / a / of / shorts
isnt that right princess,0,the / in / a / of / shorts
kiro 7,0,the / in / a / of / shorts
meet the deadliest cat on the planet,0,the / in / a / of / shorts
my most brutal wingsuit flight ever tschhorn 4491m swiss,0,the / in / a / of / shorts
30 onehit wonders of the 2010s,0,the / in / a / of / shorts
smoking a cigarette next to a world war 2 battleship,0,the / in / a / of / shorts
thrills and spills during cheese rolling contest 2024 in the uk,0,the / in / a / of / shorts
roasting a huge bull on a steel spit the best meat ive tasted,0,the / in / a / of / shorts
would you rather junk food edition food quiz,0,the / in / a / of / shorts
the family guy intro but race swapped,0,the / in / a / of / shorts
the ultimate bible quiz 3 rounds 3 levels 30 questions,0,the / in / a / of / shorts
w2s reveals his bedroom secrets,0,the / in / a / of / shorts
guess the country by stereotypical meme song,0,the / in / a / of / shorts
hit songs of 2024 spotify playlist,0,the / in / a / of / shorts
bro almost sold his rank fortnite fortnitefunny fortniteclips,0,the / in / a / of / shorts
ranking the worst haircuts,0,the / in / a / of / shorts
top memes of 2024 shorts mrbeast cobrakai memes,0,the / in / a / of / shorts
most vile villain ever in media,0,the / in / a / of / shorts
kendrick lamar humble but in lego,0,the / in / a / of / shorts
youtubers control our golf shots big wedge golf,0,the / in / a / of / shorts
building geonosis in 9 minutes lego star wars moc timelapse,0,the / in / a / of / shorts
3 tips to carry as adam warlock marvel rivals,0,the / in / a / of / shorts
the best team in marvel rivals will blow your mind invitational recap,0,the / in / a / of / shorts
mountain of hell the battle for 2nd place liam moynihan full race,0,the / in / a / of / shorts
talia has a massive,0,the / in / a / of / shorts
3 vs 3 scramble big wedge style who wins harry josh randy vs freezy simon lux,0,the / in / a / of / shorts
zerkaa coming in clutch bigwedge golf,0,the / in / a / of / shorts
lights out from josh bigwedge nightgolf,0,the / in / a / of / shorts
harry hitting a 300 yard bigwedge,0,the / in / a / of / shorts
big wedge bunker lesson goes wrong,0,the / in / a / of / shorts
big wedge drunk golf gets heated,0,the / in / a / of / shorts
harrys putting technique is a cheat code,0,the / in / a / of / shorts
imagine a hole in one in a worst ball scramble,0,the / in / a / of / shorts
whats in calfreezys golf bag,0,the / in / a / of / shorts
zerkaas golf club goes further than his ball,0,the / in / a / of / shorts
miniminter with the 330 yard drive,0,the / in / a / of / shorts
callux goes swimming in a bunker,0,the / in / a / of / shorts
w2s makes zerkaa miss his putt,0,the / in / a / of / shorts
big wedge cameraman stacks it,0,the / in / a / of / shorts
golf trick shots with miniminter,0,the / in / a / of / shorts
proper pov one of the greatest genji performances of all time team falcons vs crazy raccoon,0,the / in / a / of / shorts
1 genji necros fastest genji in overwatch 2,0,the / in / a / of / shorts
how to ghost dash with genji overwatch 2 tips,0,the / in / a / of / shorts
i spent 10 hours learning black panther to prove hes the most complex hero in marvel rivals,0,the / in / a / of / shorts
create your own memoji on iphone,0,the / in / a / of / shorts
i tested fake fast food restaurants,0,the / in / a / of / shorts
can miniminter zerkaa break 90,0,the / in / a / of / shorts
kai cenat fan being chased by the police,0,the / in / a / of / shorts
theo baker invents a new skill,0,the / in / a / of / shorts
stephen tries and angry ginge have beef,0,the / in / a / of / shorts
will virgil van dijk make more history,0,the / in / a / of / shorts
can miniminter zerkaa break 90,0,the / in / a / of / shorts
big wedge survival golf,0,the / in / a / of / shorts
big wedge 2v2 golf match in spain,0,the / in / a / of / shorts
the big wedge golf mini major,0,the / in / a / of / shorts
the big wedge golf mini major,0,the / in / a / of / shorts
big wedge golf worst ball scramble,0,the / in / a / of / shorts
big wedge golf tee flip challenge,0,the / in / a / of / shorts
lost my voice screaming my heart out finding frankie,0,the / in / a / of / shorts
spin the wheel golf challenge,0,the / in / a / of / shorts
big wedge golf spanish open,0,the / in / a / of / shorts
spider man homecoming 20172024 cast then and now 2017 vs 2024 marvel spiderman thenandnow mcu,0,the / in / a / of / shorts
kiro 7,0,the / in / a / of / shorts
the presidents rank every gobblegum,0,the / in / a / of / shorts
the presidents rank every gobblegum,0,the / in / a / of / shorts
the presidents rank every treyarch zombies map,0,the / in / a / of / shorts
the presidential zomboys take on origins,0,the / in / a / of / shorts
this fnaf game is stupid realistic,0,the / in / a / of / shorts
the big wedge team cup ep1,0,the / in / a / of / shorts
24 hours to score a goal in the furthest country,0,the / in / a / of / shorts
this is why manchester united fans hate angel di maria,0,the / in / a / of / shorts
psg spent 25 billion so why cant they win the champions league,0,the / in / a / of / shorts
the truth about overpriced footballers,0,the / in / a / of / shorts
the original batman arkham asylum was horrifying,0,the / in / a / of / shorts
viewed tired of this team tired of kai havertz tired of having the most diabolical selection of forwards known to mankind tired of life tbh,0,the / in / a / of / shorts
the arkham tapes the other batman analog horror,0,the / in / a / of / shorts
5 times batman has humiliated super villains,0,the / in / a / of / shorts
the presidential zomboys parallel peril part two,0,the / in / a / of / shorts
the big wedge team cup ep2,0,the / in / a / of / shorts
