Original_Title,Cleaned_Title,Cluster,Cluster_Name
Dwight Betrays Michael - The Office,dwight betrays michael office,0,Movies & Tv
Jim and Dwight Prank Todd Packer - The Office,jim dwight prank todd packer office,0,Movies & Tv
Dwight Don't Simp  - The Office US,dwight dont simp office us,0,Movies & Tv
BEST Cold Opens (Season 3)  - The Office US,cold opens season 3 office us,0,Movies & Tv
Valentine's Day At Dunder Mifflin  - The Office US,valentines day dunder mifflin office us,0,Movies & Tv
"Dwight, Angela and Andy: A Love Triangle - The Office US",dwight angela andy love triangle office us,0,Movies & Tv
Dwight's Concussion  - The Office US,dwights concussion office us,0,Movies & Tv
Jim's BBQ Invitations  - The Office US,jims bbq invitations office us,0,Movies & Tv
Lice Invasion - The Office US,lice invasion office us,0,Movies & Tv
Trivia Fluke - The Office US,trivia fluke office us,0,Movies & Tv
Dwight the Vampire Slayer - The Office,dwight vampire slayer office,0,Movies & Tv
Asian Jim - The Office US,asian jim office us,0,Movies & Tv
Michael Scott's Problematic Energy | The Office U.S. | Comedy Bites,michael scotts problematic energy office us comedy bites,0,Movies & Tv
Jim Saves the Christmas Party - The Office US,jim saves christmas party office us,0,Movies & Tv
Jim and Pam: Love At First Sight  - The Office US,jim pam love first sight office us,0,Movies & Tv
"Jim, Pam, and Karen  - The Office US",jim pam karen office us,0,Movies & Tv
Dwight and Angela  - The Office US,dwight angela office us,0,Movies & Tv
Andy Vs Dwight  - The Office US,andy dwight office us,0,Movies & Tv
Michael Scott Vs Corporate - The Office US,michael scott corporate office us,0,Movies & Tv
season 2 bloopers | The Office U.S. | Comedy Bites,season 2 bloopers office us comedy bites,0,Movies & Tv
Michael Scott VS Technology | The Office US | Comedy Bites,michael scott technology office us comedy bites,0,Movies & Tv
the office was too stunned to speak | The Office U.S. | Comedy Bites,office stunned speak office us comedy bites,0,Movies & Tv
The Downfall of Angela Martin | The Office US | Comedy Bites,downfall angela martin office us comedy bites,0,Movies & Tv
"Best Of The Accountants (Kevin, Oscar and Angela) | The Office U.S. | Comedy Bites",accountants kevin oscar angela office us comedy bites,0,Movies & Tv
the office doing absolutely no work | The Office US | Comedy Bites,office absolutely work office us comedy bites,0,Movies & Tv
Marry You - Jim and Pam,marry jim pam,0,Movies & Tv
The Best (and worst) of Pam's PRANKS - The Office US,worst pams pranks office us,0,Movies & Tv
the office committing crimes for 10 minutes straight | Comedy Bites,office committing crimes 10 minutes straight comedy bites,0,Movies & Tv
jim and dwight actually working together for 9 minutes 30 seconds | The Office U.S. | Comedy Bites,jim dwight actually working together 9 minutes 30 seconds office us comedy bites,0,Movies & Tv
everybody hates jim and pam | The Office U.S. | Comedy Bites,everybody hates jim pam office us comedy bites,0,Movies & Tv
Jim Walks in on a Half-Naked Angela | Season 3 Deleted Scene | The Office US,jim walks halfnaked angela season 3 deleted scene office us,0,Movies & Tv
Jim & Pam Get Hammered - The Office US,jim pam get hammered office us,0,Movies & Tv
jim halpert being the worst for 10 minutes straight | The Office U.S. | Comedy Bites,jim halpert worst 10 minutes straight office us comedy bites,0,Movies & Tv
just some niche the office cold opens that i personally enjoy | Comedy Bites,niche office cold opens personally enjoy comedy bites,0,Movies & Tv
The Ultimate Return to Office Solution,return office solution,0,Movies & Tv
The Best of Jim Lying to Dwight - The Office,jim lying dwight office,0,Movies & Tv
dwight schrute basically asking to be pranked for 10 minutes straight | The Office US | Comedy Bites,dwight schrute basically asking pranked 10 minutes straight office us comedy bites,0,Movies & Tv
Most UNDERRATED Pranks - Voted by YOU! - The Office US,underrated pranks voted office us,0,Movies & Tv
PRANKS But They Get Progressively More Elaborate - The Office,pranks get progressively elaborate office,0,Movies & Tv
jim and karen being a good couple for 8 minutes straight | The Office | Comedy Bites,jim karen good couple 8 minutes straight office comedy bites,0,Movies & Tv
The Office Wedding Dance - The Office,office wedding dance office,0,Movies & Tv
JK Wedding Entrance Dance,jk wedding entrance dance,0,Movies & Tv
The Best Company April Fools Pranks Ever,company april fools pranks ever,0,Movies & Tv
Best of Michael Scott's ENEMIES | The Office U.S. | Comedy Bites,michael scotts enemies office us comedy bites,0,Movies & Tv
The Roast of Michael Scott - The Office US,roast michael scott office us,0,Movies & Tv
Michael Scott Sensitivity Training - The Office US,michael scott sensitivity training office us,0,Movies & Tv
Jim & Dwight's Party Planning - The Office US,jim dwights party planning office us,0,Movies & Tv
Have I Not Proposed To You Yet? - The Office US | RomComs,proposed yet office us romcoms,0,Movies & Tv
Some Of Jim & Pam's Cutest Moments | The Office US | Comedy Bites,jim pams cutest office us comedy bites,0,Movies & Tv
the one blooper they KEPT in The Office? | #Shorts | Comedy Bites,one blooper kept office comedy bites,0,Movies & Tv
Every Time Pam Was Jealous - The Office US,every time pam jealous office us,0,Movies & Tv
"Jim, Pam & Karen | The Office LOVE TRIANGLE | Comedy Bites",jim pam karen office love triangle comedy bites,0,Movies & Tv
Karen Pranks Jim  - The Office US,karen pranks jim office us,0,Movies & Tv
Michael Myers at @spirithalloween 💀 NOOOOOOOO Merrick & @CorinneJoy #shorts,michael myers spirithalloween noooooooo merrick corinnejoy,0,Movies & Tv
JK Wedding Entrance Dance,jk wedding entrance dance,0,Movies & Tv
Jim and Pam |  I want you and always will | The Office,jim pam want always office,0,Movies & Tv
(The Office) Jim & Pam || You Are Everything ||,office jim pam everything,0,Movies & Tv
Jim & Pam - Open Your Eyes | The Office |,jim pam open eyes office,0,Movies & Tv
"New, Recently Discovered Seinfeld Bloopers (made for cast & crew)",recently discovered seinfeld bloopers made cast crew,0,Movies & Tv
Michael Jackson - Man In The Mirror (Official Video),michael jackson man mirror,0,Movies & Tv
Michael Jackson - Billie Jean (Official Video),michael jackson billie jean,0,Movies & Tv
You Are The Superior Being - The Office US,superior office us,0,Movies & Tv
Ted 2 - F. Scott Fitzgerald Scene | #shorts,ted 2 f scott fitzgerald scene,0,Movies & Tv
Talking to an Infectious Disease Doctor | Nimesh Patel | Stand Up Comedy,talking infectious disease doctor nimesh patel stand comedy,0,Movies & Tv
Rhianna Slaps Michael Cera #Shorts,rhianna slaps michael cera,0,Movies & Tv
Archangel Michael tattoo - time lapse,archangel michael tattoo time lapse,0,Movies & Tv
Michael the Archangel #shorts #tattoo,michael archangel tattoo,0,Movies & Tv
TED 2: The wedding scene,ted 2 wedding scene,0,Movies & Tv
NBA bloopers but they keep getting more embarrassing,nba bloopers keep getting embarrassing,0,Movies & Tv
FUNNIEST SIDEMEN PRANKS EVER!,funniest sidemen pranks ever,0,Movies & Tv
Iran's Milad Mohammadi Acrobatic Throw In Fail Vs Spain - World Cup 2018 Bloopers,irans milad mohammadi acrobatic throw fail spain world cup 2018 bloopers,0,Movies & Tv
Jim Saves the Christmas Party - The Office US,jim saves christmas party office us,0,Movies & Tv
Dwight's Accidental Discharge  - The Office US,dwights accidental discharge office us,0,Movies & Tv
Jim's Radio Prank on Dwight - The Office,jims radio prank dwight office,0,Movies & Tv
12 MORE Office Pranks That Totally Flummoxed Dwight Schrute | The Office | COZI Dozen,12 office pranks totally flummoxed dwight schrute office cozi dozen,0,Movies & Tv
Best of Dwight K. Schrute  - The Office US,dwight k schrute office us,0,Movies & Tv
The Office Wedding Dance - The Office,office wedding dance office,0,Movies & Tv
Best Christmas Pranks - The Office,christmas pranks office,0,Movies & Tv
Most Heartwarming Moments - The Office US,heartwarming office us,0,Movies & Tv
"9,986,000 Minutes  - The Office US",9986000 minutes office us,0,Movies & Tv
The Office Wedding Dance - The Office,office wedding dance office,0,Movies & Tv
Bloopers VS. The Actual Scene: The Office U.S. Edition | Comedy Bites,bloopers actual scene office us edition comedy bites,0,Movies & Tv
Jim and Pam |  I want you and always will | The Office,jim pam want always office,0,Movies & Tv
Pam Realises Jim is her Soulmate - The Office US | RomComs,pam realises jim soulmate office us romcoms,0,Movies & Tv
The Office Cast Reunites for Zoom Wedding: Some Good News with John Krasinski (Ep. 7),office cast reunites zoom wedding good news john krasinski ep 7,0,Movies & Tv
The Office Wedding Dance - The Office,office wedding dance office,0,Movies & Tv
Best Intro Ever - The Office US,intro ever office us,0,Movies & Tv
Best of the Cold Opens - The Office,cold opens office,0,Movies & Tv
Best of the Break Room | The Office U.S. | Comedy Bites,break room office us comedy bites,0,Movies & Tv
Jim's Best Pranks Against Dwight - The Office US,jims pranks dwight office us,0,Movies & Tv
Jim Pranking Dwight for 12 Minutes Straight - The Office US,jim pranking dwight 12 minutes straight office us,0,Movies & Tv
Season 5 Bloopers | The Office US | Comedy Bites,season 5 bloopers office us comedy bites,0,Movies & Tv
Most UNDERRATED Pranks - Voted by YOU! - The Office US,underrated pranks voted office us,0,Movies & Tv
Miniminter Pranks KSI,miniminter pranks ksi,0,Movies & Tv
THE BATMAN | Ave Maria / Vengeance Theme - Michael Giacchino (Trailer Music),batman ave maria vengeance theme michael giacchino music,0,Movies & Tv
CoD4 MIKE MYERS #1 with The Sidemen (Call Of Duty 4 Michael Myers),cod4 mike myers 1 sidemen call duty 4 michael myers,0,Movies & Tv
COLD CALLING my clients business LIVE #shorts,cold calling clients business live,0,Movies & Tv
Simon Pranks Talia On TikTok,simon pranks talia tiktok,0,Movies & Tv
"""Oooo, That Was Cold""",oooo cold,0,Movies & Tv
Michael Wears a Woman's Suit - The Office US,michael wears womans suit office us,0,Movies & Tv
The DVD Logo  - The Office US,dvd logo office us,0,Movies & Tv
Jim Saves Pam's Job - The Office,jim saves pams job office,0,Movies & Tv
Best of Michael VS Pam | The Office U.S. | Comedy Bites,michael pam office us comedy bites,0,Movies & Tv
Jinx - The Office US,jinx office us,0,Movies & Tv
Best of Office Gifts  - The Office US,office gifts office us,0,Movies & Tv
Most Heartwarming Moments - The Office US,heartwarming office us,0,Movies & Tv
Every Time Pam Was Jealous - The Office US,every time pam jealous office us,0,Movies & Tv
"Jim, Pam & Karen | The Office LOVE TRIANGLE | Comedy Bites",jim pam karen office love triangle comedy bites,0,Movies & Tv
Michael Scott Once Said… Your Favourite Michael Quotes | The Office | Comedy Bites,michael scott said favourite michael quotes office comedy bites,0,Movies & Tv
More of The Best Cold Opens  - The Office US,cold opens office us,0,Movies & Tv
Best Unscripted Moments - The Office US,unscripted office us,0,Movies & Tv
Every Jim Look by Anyone BUT Jim - The Office US,every jim look anyone jim office us,0,Movies & Tv
Every Time Jim Looks At The Camera  - The Office US,every time jim looks camera office us,0,Movies & Tv
The Office | Every Cold Open (Season 6 Part 2),office every cold open season 6 2,0,Movies & Tv
The Office | Every Cold Open (Season 7 Part 1),office every cold open season 7 1,0,Movies & Tv
The Office | Every Cold Open (Season 8 Part 1),office every cold open season 8 1,0,Movies & Tv
Best of Pam - The Office US,pam office us,0,Movies & Tv
Scott Lang Burgling My Heart For 11 Minutes,scott lang burgling heart 11 minutes,0,Movies & Tv
BEST PRANKS Season 5  - The Office US,pranks season 5 office us,0,Movies & Tv
BEST PRANKS Season 4 - The Office US,pranks season 4 office us,0,Movies & Tv
BEST PRANKS Season 3 - The Office US,pranks season 3 office us,0,Movies & Tv
BEST PRANKS (Season 7) - The Office US,pranks season 7 office us,0,Movies & Tv
BEST PRANKS (Season 6) - The Office US,pranks season 6 office us,0,Movies & Tv
Pam Walks In On Michael  - The Office US,pam walks michael office us,0,Movies & Tv
The Best of Jim Lying to Dwight - The Office,jim lying dwight office,0,Movies & Tv
Season 3 BLOOPERS | The Office US | Comedy Bites,season 3 bloopers office us comedy bites,0,Movies & Tv
The TOP 5 Office Episodes Written by the Cast | The Office U.S. | Comedy Bites,5 office episodes written cast office us comedy bites,0,Movies & Tv
Parkour PARKOUR - The Office US,parkour parkour office us,0,Movies & Tv
Michael Vs Toby | The Office US | Comedy Bites,michael toby office us comedy bites,0,Movies & Tv
Jim VS Toby | The Office U.S. | Comedy Bites,jim toby office us comedy bites,0,Movies & Tv
Valentine's Day At Dunder Mifflin  - The Office US,valentines day dunder mifflin office us,0,Movies & Tv
Jim + Pam | Make You Mine,jim pam make mine,0,Movies & Tv
Boom! Roasted - The Office US,boom roasted office us,0,Movies & Tv
The Roast of Michael Scott - The Office US,roast michael scott office us,0,Movies & Tv
Golden Ticket Idea - The Office US,golden ticket idea office us,0,Movies & Tv
The Squeaky Chair  - The Office US,squeaky chair office us,0,Movies & Tv
Scranton Branch is Closing - The Office US,scranton branch closing office us,0,Movies & Tv
The Merger - The Office US,merger office us,0,Movies & Tv
We Will Burn Utica To The Ground  - The Office US,burn utica ground office us,0,Movies & Tv
Cathy Tries to Seduce Jim  - The Office US,cathy tries seduce jim office us,0,Movies & Tv
Roy Sings at His Wedding - The Office,roy sings wedding office,0,Movies & Tv
The Hunt for Herr's Chips  - The Office US,hunt herrs chips office us,0,Movies & Tv
"Jim, Pam, and Karen  - The Office US",jim pam karen office us,0,Movies & Tv
Worst Of... Karen Being a Karen | The Office U.S. | Comedy Bites,worst karen karen office us comedy bites,0,Movies & Tv
Spontaneous  Pranks That Drove Dwight Insane - The Office,spontaneous pranks drove dwight insane office,0,Movies & Tv
Ryan VS Pam - The Office US,ryan pam office us,0,Movies & Tv
Best of the Break Room | The Office U.S. | Comedy Bites,break room office us comedy bites,0,Movies & Tv
Best Christmas Pranks - The Office,christmas pranks office,0,Movies & Tv
Best Cold Opens  - The Office US,cold opens office us,0,Movies & Tv
Michael & Stanley Love Pretzel Day  - The Office US,michael stanley love pretzel day office us,0,Movies & Tv
Jim Scares Dwight Prank (EXCLUSIVE) - The Office US,jim scares dwight prank exclusive office us,0,Movies & Tv
Andy Tears His Scrotum - The Office US,andy tears scrotum office us,0,Movies & Tv
The Office - Signs of a Declining Sitcom,office signs declining sitcom,0,Movies & Tv
every day Michael Scott wakes up and chooses violence | The Office U.S. | Comedy Bites,every day michael scott wakes chooses violence office us comedy bites,0,Movies & Tv
EVEN MORE Season 6 BLOOPERS | The Office US | Comedy Bites,even season 6 bloopers office us comedy bites,0,Movies & Tv
The Best Of Stanley  - The Office US,stanley office us,0,Movies & Tv
Crunch Those Numbers Again  - The Office US,crunch numbers office us,0,Movies & Tv
Jim Saves the Christmas Party - The Office US,jim saves christmas party office us,0,Movies & Tv
Season 7 Bloopers | The Office US | Comedy Bites,season 7 bloopers office us comedy bites,0,Movies & Tv
THE OFFICE ORIGINAL CASTING TAPES,office casting tapes,0,Movies & Tv
Season 6 BLOOPERS | The Office US | Comedy Bites,season 6 bloopers office us comedy bites,0,Movies & Tv
Season 5 Bloopers | The Office US | Comedy Bites,season 5 bloopers office us comedy bites,0,Movies & Tv
The Password - The Office US,password office us,0,Movies & Tv
Valentine's Day At Dunder Mifflin  - The Office US,valentines day dunder mifflin office us,0,Movies & Tv
Jim & Dwight's Party Planning - The Office US,jim dwights party planning office us,0,Movies & Tv
Jim & Dwight: The Best of FRENEMIES  - The Office US,jim dwight frenemies office us,0,Movies & Tv
Jim's Wedding Toast To Pam  - The Office US,jims wedding toast pam office us,0,Movies & Tv
Jim's Advice to Dwight About Love - Some sort of virus? - The Office,jims advice dwight love sort virus office,0,Movies & Tv
"9,986,000 Minutes  - The Office US",9986000 minutes office us,0,Movies & Tv
Season 4 Bloopers - The Office US | Comedy Bites,season 4 bloopers office us comedy bites,0,Movies & Tv
Happier - Pam x Jim - The Office,happier pam x jim office,0,Movies & Tv
The Office being Relatable for 8 Minutes - The Office US,office relatable 8 minutes office us,0,Movies & Tv
Jim & Dwight: The Best of FRENEMIES  - The Office US,jim dwight frenemies office us,0,Movies & Tv
Jim and Pam |  I want you and always will | The Office,jim pam want always office,0,Movies & Tv
sad pam :( | The Office U.S. | Comedy Bites,sad pam office us comedy bites,0,Movies & Tv
Pam Hits Michael  - The Office US,pam hits michael office us,0,Movies & Tv
The Moment Jim & Pam Went Public with Their Relationship - The Office US,moment jim pam went public relationship office us,0,Movies & Tv
The Office| JIM & PAM | MAKE YOU MINE,office jim pam make mine,0,Movies & Tv
JK Wedding Entrance Dance,jk wedding entrance dance,0,Movies & Tv
The Office Wedding Dance - The Office,office wedding dance office,0,Movies & Tv
Marry You - Jim and Pam,marry jim pam,0,Movies & Tv
Jim and Pam |  I want you and always will | The Office,jim pam want always office,0,Movies & Tv
Jim Halpert: OFFICE ROMANTIC  - The Office US,jim halpert office romantic office us,0,Movies & Tv
"Jim, Pam & Karen | The Office LOVE TRIANGLE | Comedy Bites",jim pam karen office love triangle comedy bites,0,Movies & Tv
Season 3 BLOOPERS | The Office US | Comedy Bites,season 3 bloopers office us comedy bites,0,Movies & Tv
Season 2 Bloopers - The Office US | Comedy Bites,season 2 bloopers office us comedy bites,0,Movies & Tv
Jim & Pam || What's a soulmate?,jim pam whats soulmate,0,Movies & Tv
Marry You - Jim and Pam,marry jim pam,0,Movies & Tv
Jim and Pam |  I want you and always will | The Office,jim pam want always office,0,Movies & Tv
Jim's Wedding Toast To Pam  - The Office US,jims wedding toast pam office us,0,Movies & Tv
The Office U.S. but it's just all the memes | Comedy Bites,office us memes comedy bites,0,Movies & Tv
Planking and the New Regional Manager - The Office US,planking regional manager office us,0,Movies & Tv
Most Heartwarming Moments - The Office US,heartwarming office us,0,Movies & Tv
Jim and Pam | The Story | The Office,jim pam story office,0,Movies & Tv
Jim and Pam |  I want you and always will | The Office,jim pam want always office,0,Movies & Tv
Jim Proposes to Pam - The Office US,jim proposes pam office us,0,Movies & Tv
jim halpert is the most romantic character on the office: change my mind | Comedy Bites,jim halpert romantic character office change mind comedy bites,0,Movies & Tv
Jim VS Pam VS Roy | The Office U.S. | Comedy Bites,jim pam roy office us comedy bites,0,Movies & Tv
Michael vs Toby  - The Office US,michael toby office us,0,Movies & Tv
The Office Wedding Dance - The Office,office wedding dance office,0,Movies & Tv
JK Wedding Entrance Dance,jk wedding entrance dance,0,Movies & Tv
Season 6 BLOOPERS | The Office US | Comedy Bites,season 6 bloopers office us comedy bites,0,Movies & Tv
Jim's Best Pranks Against Dwight - The Office US,jims pranks dwight office us,0,Movies & Tv
The Best of Jim  - The Office US,jim office us,0,Movies & Tv
"Killing Bin Laden, Hitler, and Toby  - The Office US",killing bin laden hitler toby office us,0,Movies & Tv
Michael Scott Sensitivity Training - The Office US,michael scott sensitivity training office us,0,Movies & Tv
Michael Scott's First and Last Interactions - The Office,michael scotts first last interactions office,0,Movies & Tv
"9,986,000 Minutes  - The Office US",9986000 minutes office us,0,Movies & Tv
The Office Wedding Dance - The Office,office wedding dance office,0,Movies & Tv
Season 2 Bloopers - The Office US | Comedy Bites,season 2 bloopers office us comedy bites,0,Movies & Tv
Best of the Cold Opens - The Office,cold opens office,0,Movies & Tv
Anger Management - The Office US,anger management office us,0,Movies & Tv
Angry Jim | The Office U.S. | Comedy Bites,angry jim office us comedy bites,0,Movies & Tv
Best Unscripted Moments - The Office US,unscripted office us,0,Movies & Tv
Jim & Pam - Open Your Eyes | The Office |,jim pam open eyes office,0,Movies & Tv
Pam Beesly | Not enough for you,pam beesly enough,0,Movies & Tv
(The Office) Jim & Pam || You Are Everything ||,office jim pam everything,0,Movies & Tv
Some Of Jim & Pam's Cutest Moments | The Office US | Comedy Bites,jim pams cutest office us comedy bites,0,Movies & Tv
Pam Flirts with Michael - The Office,pam flirts michael office,0,Movies & Tv
Season 3 BLOOPERS | The Office US | Comedy Bites,season 3 bloopers office us comedy bites,0,Movies & Tv
Jim and Pam: The Love Saga Continues  - The Office US,jim pam love saga continues office us,0,Movies & Tv
Most Heartwarming Moments - The Office US,heartwarming office us,0,Movies & Tv
Jim Pranking Dwight for 12 Minutes Straight - The Office US,jim pranking dwight 12 minutes straight office us,0,Movies & Tv
The Office Wedding Dance - The Office,office wedding dance office,0,Movies & Tv
Season 2 Bloopers - The Office US | Comedy Bites,season 2 bloopers office us comedy bites,0,Movies & Tv
Season 5 Bloopers | The Office US | Comedy Bites,season 5 bloopers office us comedy bites,0,Movies & Tv
Season 4 Bloopers - The Office US | Comedy Bites,season 4 bloopers office us comedy bites,0,Movies & Tv
Every Time Pam Was Jealous - The Office US,every time pam jealous office us,0,Movies & Tv
Pam questions her entire relationship with Jim - The Office highlights,pam questions entire relationship jim office highlights,0,Movies & Tv
Jim gets mad at Pam for not recording Cece,jim gets mad pam recording cece,0,Movies & Tv
Cathy Tries to Seduce Jim  - The Office US,cathy tries seduce jim office us,0,Movies & Tv
Jim and Pam | The Story | The Office,jim pam story office,0,Movies & Tv
Why Jim & Pam almost broke up (Season 9) | The Office,jim pam almost broke season 9 office,0,Movies & Tv
Jim and Pam |  I want you and always will | The Office,jim pam want always office,0,Movies & Tv
Rockstar Fooled us all lol..,rockstar fooled us lol,0,Movies & Tv
8-BALL FINAL | Shane Van Boening vs Rory Hendrickson | 2016 US Open 8-Ball Championship,8ball final shane van boening rory hendrickson 2016 us open 8ball championship,0,Movies & Tv
MICHAEL MYERS CUSTOM BLACK OPS 3 GAME MODE - BO3 MIKE MYERS,michael myers custom black ops 3 game mode bo3 mike myers,0,Movies & Tv
Jim and Pam |  I want you and always will | The Office,jim pam want always office,0,Movies & Tv
Dwight Howard and Anthony Davis get into an altercation on the bench 😲,dwight howard anthony davis get altercation bench,0,Movies & Tv
Jim and Pam |  I want you and always will | The Office,jim pam want always office,0,Movies & Tv
Jim and Pam |  I want you and always will | The Office,jim pam want always office,0,Movies & Tv
Jim & Pam: Real Love - The Office US,jim pam real love office us,0,Movies & Tv
Pam Beesly | Not enough for you,pam beesly enough,0,Movies & Tv
Andy Tears His Scrotum - The Office US,andy tears scrotum office us,0,Movies & Tv
Jim and Pam: Love At First Sight  - The Office US,jim pam love first sight office us,0,Movies & Tv
Jim Confesses His Love  - The Office US,jim confesses love office us,0,Movies & Tv
Vikkstar Is TOO Cold 🥶🧊,vikkstar cold,0,Movies & Tv
SIDEMEN BEST EVER PRANKS! 2,sidemen ever pranks 2,0,Movies & Tv
SIDEMEN BEST EVER PRANKS!,sidemen ever pranks,0,Movies & Tv
Instantly Open Your Third Eye and Activate Your Pineal Gland (Technique and Meditation),instantly open third eye activate pineal gland technique meditation,0,Movies & Tv
How to INSTANTLY Open Your Third Eye and ACTIVATE Your Pineal Gland! (Powerful Technique!),how instantly open third eye activate pineal gland powerful technique,0,Movies & Tv
Rashford: yo Ney cold innit. [FOOTAGE],rashford yo ney cold innit footage,0,Movies & Tv
Yo ney cold innit?,yo ney cold innit,0,Movies & Tv
US Open 2016 In Review: Kei Nishikori,us open 2016 review kei nishikori,0,Movies & Tv
Why the US government murdered Fred Hampton,us government murdered fred hampton,0,Movies & Tv
Djokovic Gets Underway; Verdasco Clashes with Mannarino | Belgrade Open 2021 Day 3 Highlights,djokovic gets underway verdasco clashes mannarino belgrade open 2021 day 3 highlights,0,Movies & Tv
How Dominic Thiem won his first Grand Slam! | US Open 2020,how dominic thiem first grand slam us open 2020,0,Movies & Tv
'Closing Time' at Dunder Mifflin -  The Office US,closing time dunder mifflin office us,0,Movies & Tv
SHOCKING OPEN GOAL MISSES 😱,shocking open goal misses,0,Movies & Tv
Nick Kyrgios smashes a racket & gets heated with the chair umpire | 2021 Australian Open Highlights,nick kyrgios smashes racket gets heated chair umpire 2021 australian open highlights,0,Movies & Tv
"NBA ""WIDE OPEN MISSED GAME WINNERS""",nba wide open missed game winners,0,Movies & Tv
