Original_Title,Cleaned_Title,Cluster,Cluster_Name
Chelsea v. Arsenal | PREMIER LEAGUE HIGHLIGHTS | 4/20/2022 | NBC Sports,chelsea v arsenal league highlights 4202022 sports,5,highlights / sports / league / v / united
Arsenal v. Manchester United | PREMIER LEAGUE HIGHLIGHTS | 4/23/2022 | NBC Sports,arsenal v manchester united league highlights 4232022 sports,5,highlights / sports / league / v / united
Newcastle United v. Manchester City | PREMIER LEAGUE HIGHLIGHTS | 8/21/2022 | NBC Sports,newcastle united v manchester city league highlights 8212022 sports,5,highlights / sports / league / v / united
Leeds United v. Chelsea | PREMIER LEAGUE HIGHLIGHTS | 8/21/2022 | NBC Sports,leeds united v chelsea league highlights 8212022 sports,5,highlights / sports / league / v / united
Crystal Palace v. Aston Villa | PREMIER LEAGUE HIGHLIGHTS | 8/20/2022 | NBC Sports,crystal palace v aston villa league highlights 8202022 sports,5,highlights / sports / league / v / united
Crystal Palace v. Aston Villa | PREMIER LEAGUE HIGHLIGHTS | 8/20/2022 | NBC Sports,crystal palace v aston villa league highlights 8202022 sports,5,highlights / sports / league / v / united
Everton v. Nottingham Forest | PREMIER LEAGUE HIGHLIGHTS | 8/20/2022 | NBC Sports,everton v nottingham forest league highlights 8202022 sports,5,highlights / sports / league / v / united
Leicester City v. Southampton | PREMIER LEAGUE HIGHLIGHTS | 8/20/2022 | NBC Sports,leicester city v southampton league highlights 8202022 sports,5,highlights / sports / league / v / united
Bournemouth v. Arsenal | PREMIER LEAGUE HIGHLIGHTS | 8/20/2022 | NBC Sports,bournemouth v arsenal league highlights 8202022 sports,5,highlights / sports / league / v / united
Most Unsportsmanlike & Disrespectful Moments In Football,unsportsmanlike disrespectful football,5,highlights / sports / league / v / united
Arsenal v. Leicester City | PREMIER LEAGUE HIGHLIGHTS | 8/13/2022 | NBC Sports,arsenal v leicester city league highlights 8132022 sports,5,highlights / sports / league / v / united
#9 Auburn vs #2 LSU Highlights | NCAAF Week 9 | College Football Highlights,auburn lsu highlights ncaaf week college football highlights,5,highlights / sports / league / v / united
#7 Florida vs #5 LSU Week 7 College Football Highlights 2019,florida lsu week college football highlights 2019,5,highlights / sports / league / v / united
#6 LSU vs #9 Texas Highlights | NCAAF Week 2 | College Football Highlights,lsu texas highlights ncaaf week college football highlights,5,highlights / sports / league / v / united
The Ultimate Sunday League Footballer | Vs Miniminter,sunday league footballer miniminter,5,highlights / sports / league / v / united
Tobi & Chris MD 2-Touch Shooting Challenge VS Premier League Footballers!,tobi chris md 2touch shooting challenge league footballers,5,highlights / sports / league / v / united
Moises Caicedo grabs Brighton edge over Manchester United | Premier League | NBC Sports,moises caicedo grabs brighton edge over manchester united league sports,5,highlights / sports / league / v / united
Brighton v. Manchester United | PREMIER LEAGUE HIGHLIGHTS | 5/7/2022 | NBC Sports,brighton v manchester united league highlights 572022 sports,5,highlights / sports / league / v / united
Messi doesn’t go easy on his children 😂 #shorts #football #soccer #messi,messi doesnt go easy children football soccer messi,5,highlights / sports / league / v / united
Scoring A Goal With Every Premier League Football From 2000-2020,scoring goal every league football 20002020,5,highlights / sports / league / v / united
Leicester City v. Manchester United | PREMIER LEAGUE HIGHLIGHTS | 10/16/2021 | NBC Sports,leicester city v manchester united league highlights 10162021 sports,5,highlights / sports / league / v / united
1 IN A MILLION MOMENTS IN SPORTS!,million sports,5,highlights / sports / league / v / united
Dominant Liverpool drub Man Utd to move top 🔝 | Liverpool 4-0 Man Utd | Premier League Highlights!,dominant liverpool drub man utd move liverpool 40 man utd league highlights,5,highlights / sports / league / v / united
Brighton v. Manchester United | PREMIER LEAGUE HIGHLIGHTS | 5/7/2022 | NBC Sports,brighton v manchester united league highlights 572022 sports,5,highlights / sports / league / v / united
Senegal vs Egypt | AFCON 2021 FINAL HIGHLIGHTS | 02/06/2022 | beIN SPORTS USA,senegal egypt afcon 2021 final highlights 02062022 bein sports usa,5,highlights / sports / league / v / united
Netherlands vs. Wales Highlights | UEFA Nations League | FOX SOCCER,netherlands wales highlights uefa nations league fox soccer,5,highlights / sports / league / v / united
Germany vs. Italy Highlights | UEFA Nations League | FOX SOCCER,germany italy highlights uefa nations league fox soccer,5,highlights / sports / league / v / united
HIGHLIGHTS | Alemania 5-2 Italia | UEFA Nations League 2022 - J4 | TUDN,highlights alemania 52 italia uefa nations league 2022 j4 tudn,5,highlights / sports / league / v / united
Germany vs. Italy Highlights | UEFA Nations League | FOX SOCCER,germany italy highlights uefa nations league fox soccer,5,highlights / sports / league / v / united
England vs. Hungary Highlights | UEFA Nations League | FOX SOCCER,england hungary highlights uefa nations league fox soccer,5,highlights / sports / league / v / united
HIGHLIGHTS | Francia VS Croacia | UEFA Nations League 2022 - J4 | TUDN,highlights francia croacia uefa nations league 2022 j4 tudn,5,highlights / sports / league / v / united
HIGHLIGHTS | Gales vs Bélgica | UEFA Nations League 2022 - J3 | TUDN,highlights gales blgica uefa nations league 2022 j3 tudn,5,highlights / sports / league / v / united
HIGHLIGHTS | Países Bajos 2-2 Polonia | UEFA Nations League 2022 - J3 | TUDN,highlights pases bajos 22 polonia uefa nations league 2022 j3 tudn,5,highlights / sports / league / v / united
HIGHLIGHTS | Inglaterra vs Italia | UEFA Nations League 2022 - J3 | TUDN,highlights inglaterra italia uefa nations league 2022 j3 tudn,5,highlights / sports / league / v / united
HIGHLIGHTS | Suiza vs España | UEFA Nations League 2022 - J3 | TUDN,highlights suiza espaa uefa nations league 2022 j3 tudn,5,highlights / sports / league / v / united
"WARRIORS at CELTICS | FULL GAME 3 NBA FINALS HIGHLIGHTS | June 8, 2022",warriors celtics game nba finals highlights june 2022,5,highlights / sports / league / v / united
HIGHLIGHTS | Suecia 1-2 Noruega | UEFA Nations League 2022 - J2 | TUDN,highlights suecia 12 noruega uefa nations league 2022 j2 tudn,5,highlights / sports / league / v / united
HIGHLIGHTS | España vs Portugal | UEFA Nations League 2022 - J1 | TUDN,highlights espaa portugal uefa nations league 2022 j1 tudn,5,highlights / sports / league / v / united
HIGHLIGHTS | Bélgica 6-1 Polonia | UEFA Nations League 2022 - J2 | TUDN,highlights blgica 61 polonia uefa nations league 2022 j2 tudn,5,highlights / sports / league / v / united
Germany vs. England highlights | UEFA Nations League | FOX SOCCER,germany england highlights uefa nations league fox soccer,5,highlights / sports / league / v / united
#6 Oklahoma vs #21 Texas Highlights (GAME OF THE YEAR!?) | Week 6 | 2021 College Football Highlights,oklahoma 21 texas highlights game year week 2021 college football highlights,5,highlights / sports / league / v / united
HIGHLIGHTS | Alemania vs Inglaterra | UEFA Nations League 2022 - J2 | TUDN,highlights alemania inglaterra uefa nations league 2022 j2 tudn,5,highlights / sports / league / v / united
HIGHLIGHTS | República Checa 2-2 España | UEFA Nations League 2022 - J2 | TUDN,highlights repblica checa 22 espaa uefa nations league 2022 j2 tudn,5,highlights / sports / league / v / united
HIGHLIGHTS | Bélgica 1-4 Países Bajos | UEFA Nations League 2022 - J1 | TUDN,highlights blgica 14 pases bajos uefa nations league 2022 j1 tudn,5,highlights / sports / league / v / united
#6 Oklahoma vs #21 Texas Highlights (GAME OF THE YEAR!?) | Week 6 | 2021 College Football Highlights,oklahoma 21 texas highlights game year week 2021 college football highlights,5,highlights / sports / league / v / united
#7 Florida vs #5 LSU Week 7 College Football Highlights 2019,florida lsu week college football highlights 2019,5,highlights / sports / league / v / united
#4 Oklahoma vs #1 LSU Highlights 2019 College Football Playoff Highlights,oklahoma lsu highlights 2019 college football playoff highlights,5,highlights / sports / league / v / united
#2 LSU vs #3 Alabama Highlights | Week 11 | College Football 2019,lsu alabama highlights week 11 college football 2019,5,highlights / sports / league / v / united
Crystal Palace v. Manchester United | PREMIER LEAGUE HIGHLIGHTS | 5/22/2022 | NBC Sports,crystal palace v manchester united league highlights 5222022 sports,5,highlights / sports / league / v / united
Brighton v. West Ham United | PREMIER LEAGUE HIGHLIGHTS | 5/22/2022 | NBC Sports,brighton v west ham united league highlights 5222022 sports,5,highlights / sports / league / v / united
Liverpool v. Wolves | PREMIER LEAGUE HIGHLIGHTS | 5/22/2022 | NBC Sports,liverpool v wolves league highlights 5222022 sports,5,highlights / sports / league / v / united
Arsenal v. Everton | PREMIER LEAGUE HIGHLIGHTS | 5/22/2022 | NBC Sports,arsenal v everton league highlights 5222022 sports,5,highlights / sports / league / v / united
Everton v. Crystal Palace | PREMIER LEAGUE HIGHLIGHTS | 5/19/2022 | NBC Sports,everton v crystal palace league highlights 5192022 sports,5,highlights / sports / league / v / united
Chelsea v. Leicester City | PREMIER LEAGUE HIGHLIGHTS | 5/19/2022 | NBC Sports,chelsea v leicester city league highlights 5192022 sports,5,highlights / sports / league / v / united
#6 LSU vs #9 Texas Highlights | NCAAF Week 2 | College Football Highlights,lsu texas highlights ncaaf week college football highlights,5,highlights / sports / league / v / united
College Football 2019 Best Moments & Highlights,college football 2019 highlights,5,highlights / sports / league / v / united
Aston Villa v. Crystal Palace | PREMIER LEAGUE HIGHLIGHTS | 5/15/2022 | NBC Sports,aston villa v crystal palace league highlights 5152022 sports,5,highlights / sports / league / v / united
Eintracht Frankfurt vs. Rangers: Extended Highlights | UEL | Final | CBS Sports Golazo,eintracht frankfurt rangers extended highlights uel final cbs sports golazo,5,highlights / sports / league / v / united
Newcastle  United v. Arsenal | PREMIER LEAGUE HIGHLIGHTS | 5/16/2022 | NBC Sports,newcastle united v arsenal league highlights 5162022 sports,5,highlights / sports / league / v / united
Southampton v. Liverpool | PREMIER LEAGUE HIGHLIGHTS | 5/17/2022 | NBC Sports,southampton v liverpool league highlights 5172022 sports,5,highlights / sports / league / v / united
Everton v. Brentford | PREMIER LEAGUE HIGHLIGHTS | 5/15/2022 | NBC Sports,everton v brentford league highlights 5152022 sports,5,highlights / sports / league / v / united
Leeds United v. Brighton | PREMIER LEAGUE HIGHLIGHTS | 5/15/2022 | NBC Sports,leeds united v brighton league highlights 5152022 sports,5,highlights / sports / league / v / united
West Ham United v. Manchester City | PREMIER LEAGUE HIGHLIGHTS | 5/15/2022 | NBC Sports,west ham united v manchester city league highlights 5152022 sports,5,highlights / sports / league / v / united
Demarai Gray stoppage-time stunner gets Everton in front | Premier League | NBC Sports,demarai gray stoppagetime stunner gets everton front league sports,5,highlights / sports / league / v / united
Chelsea vs. Real Madrid: Extended Highlights | UCL Quarter-Finals - Leg 1 | CBS Sports Golazo,chelsea real madrid extended highlights ucl quarterfinals leg cbs sports golazo,5,highlights / sports / league / v / united
Highlights & Goals | Tottenham vs. Arsenal 3-0 | Premier League | Telemundo Deportes,highlights goals tottenham arsenal 30 league telemundo deportes,5,highlights / sports / league / v / united
Watford v. Everton | PREMIER LEAGUE HIGHLIGHTS | 5/11/2022 | NBC Sports,watford v everton league highlights 5112022 sports,5,highlights / sports / league / v / united
Leeds United v. Chelsea | PREMIER LEAGUE HIGHLIGHTS | 5/11/2022 | NBC Sports,leeds united v chelsea league highlights 5112022 sports,5,highlights / sports / league / v / united
The Evolution of NBA Basketball,evolution nba basketball,5,highlights / sports / league / v / united
Luke Ayling gets red card for challenge on Gabriel Martinelli | Premier League | NBC Sports,luke ayling gets red card challenge gabriel martinelli league sports,5,highlights / sports / league / v / united
Leicester City v. Manchester United | PREMIER LEAGUE HIGHLIGHTS | 10/16/2021 | NBC Sports,leicester city v manchester united league highlights 10162021 sports,5,highlights / sports / league / v / united
Aston Villa v. Liverpool | PREMIER LEAGUE HIGHLIGHTS | 5/10/2022 | NBC Sports,aston villa v liverpool league highlights 5102022 sports,5,highlights / sports / league / v / united
Brighton tear apart lifeless Manchester United | Premier League Update | NBC Sports,brighton tear apart lifeless manchester united league update sports,5,highlights / sports / league / v / united
Liverpool v. Tottenham Hotspur | PREMIER LEAGUE HIGHLIGHTS | 5/7/2022 | NBC Sports,liverpool v tottenham hotspur league highlights 572022 sports,5,highlights / sports / league / v / united
Highlights & Goals | Leicester City vs. Everton 1-2 | Premier League | Telemundo Deportes,highlights goals leicester city everton 12 league telemundo deportes,5,highlights / sports / league / v / united
#2 LSU vs #3 Alabama Highlights | Week 11 | College Football 2019,lsu alabama highlights week 11 college football 2019,5,highlights / sports / league / v / united
Arsenal v. Leeds United | PREMIER LEAGUE HIGHLIGHTS | 5/8/2022 | NBC Sports,arsenal v leeds united league highlights 582022 sports,5,highlights / sports / league / v / united
Highlights & Goals | Brighton vs. Man. United 4-0 | Premier League | Telemundo Deportes,highlights goals brighton man united 40 league telemundo deportes,5,highlights / sports / league / v / united
Heung-min Son gets Tottenham Hotspur ahead of Liverpool at Anfield | Premier League | NBC Sports,heungmin son gets tottenham hotspur ahead liverpool anfield league sports,5,highlights / sports / league / v / united
Brighton v. Manchester United | PREMIER LEAGUE HIGHLIGHTS | 5/7/2022 | NBC Sports,brighton v manchester united league highlights 572022 sports,5,highlights / sports / league / v / united
Chelsea v. Wolves | PREMIER LEAGUE HIGHLIGHTS | 5/7/2022 | NBC Sports,chelsea v wolves league highlights 572022 sports,5,highlights / sports / league / v / united
Burnley v. Aston Villa | PREMIER LEAGUE HIGHLIGHTS | 5/7/2022 | NBC Sports,burnley v aston villa league highlights 572022 sports,5,highlights / sports / league / v / united
Real Madrid vs. Manchester City: Extended Highlights | UCL Semi-Finals - Leg 2 | CBS Sports Golazo,real madrid manchester city extended highlights ucl semifinals leg cbs sports golazo,5,highlights / sports / league / v / united
#2 Ohio State v #5 Michigan (2021) | College Football Week 13 | 2021 College Football Highlights,ohio state v michigan 2021 college football week 13 2021 college football highlights,5,highlights / sports / league / v / united
West Ham United v. Arsenal | PREMIER LEAGUE HIGHLIGHTS | 5/1/2022 | NBC Sports,west ham united v arsenal league highlights 512022 sports,5,highlights / sports / league / v / united
Everton v. Chelsea | PREMIER LEAGUE HIGHLIGHTS | 5/1/2022 | NBC Sports,everton v chelsea league highlights 512022 sports,5,highlights / sports / league / v / united
Tottenham Hotspur v. Leicester City | PREMIER LEAGUE HIGHLIGHTS | 5/1/2022 | NBC Sports,tottenham hotspur v leicester city league highlights 512022 sports,5,highlights / sports / league / v / united
Newcastle United v. Liverpool | PREMIER LEAGUE HIGHLIGHTS | 4/30/2022 | NBC Sports,newcastle united v liverpool league highlights 4302022 sports,5,highlights / sports / league / v / united
Manchester United v. Chelsea | PREMIER LEAGUE HIGHLIGHTS | 4/28/2022 | NBC Sports,manchester united v chelsea league highlights 4282022 sports,5,highlights / sports / league / v / united
West Ham vs. Eintracht Frankfurt: Extended Highlights | Semi-Final - 1st Leg | CBS Sports Golazo,west ham eintracht frankfurt extended highlights semifinal 1st leg cbs sports golazo,5,highlights / sports / league / v / united
Manchester City vs. Real Madrid: Extended Highlights | UCL Semi-Finals - Leg 1 | CBS Sports Golazo,manchester city real madrid extended highlights ucl semifinals leg cbs sports golazo,5,highlights / sports / league / v / united
Brighton v. Southampton | PREMIER LEAGUE HIGHLIGHTS | 4/24/2022 | NBC Sports,brighton v southampton league highlights 4242022 sports,5,highlights / sports / league / v / united
Crystal Palace v. Leeds United | PREMIER LEAGUE HIGHLIGHTS | 4/25/2022 | NBC Sports,crystal palace v leeds united league highlights 4252022 sports,5,highlights / sports / league / v / united
Liverpool v. Everton | PREMIER LEAGUE HIGHLIGHTS | 4/24/2022 | NBC Sports,liverpool v everton league highlights 4242022 sports,5,highlights / sports / league / v / united
LIVERPOOL 2-0 EVERTON | PREMIER LEAGUE HIGHLIGHTS,liverpool 20 everton league highlights,5,highlights / sports / league / v / united
Liverpool v. Manchester City | PREMIER LEAGUE HIGHLIGHTS | 11/10/19 | NBC Sports,liverpool v manchester city league highlights 111019 sports,5,highlights / sports / league / v / united
Man City v. Liverpool | PREMIER LEAGUE EXTENDED HIGHLIGHTS | 1/3/19 | NBC Sports,man city v liverpool league extended highlights 1319 sports,5,highlights / sports / league / v / united
Liverpool v. Man City | PREMIER LEAGUE CLASSIC MATCH | 1/14/18 | NBC Sports,liverpool v man city league classic match 11418 sports,5,highlights / sports / league / v / united
Liverpool v. Everton | PREMIER LEAGUE EXTENDED HIGHLIGHTS | 12/02/18 | NBC Sports,liverpool v everton league extended highlights 120218 sports,5,highlights / sports / league / v / united
Liverpool v. Everton | PREMIER LEAGUE HIGHLIGHTS | 4/24/2022 | NBC Sports,liverpool v everton league highlights 4242022 sports,5,highlights / sports / league / v / united
Chelsea v. West Ham United | PREMIER LEAGUE HIGHLIGHTS | 4/24/2022 | NBC Sports,chelsea v west ham united league highlights 4242022 sports,5,highlights / sports / league / v / united
"Newcastle United, Bruno Guimaraes win at the death v. Leicester City | Premier League | NBC Sports",newcastle united bruno guimaraes win death v leicester city league sports,5,highlights / sports / league / v / united
Granit Xhaka: 'I like to score against Manchester United' | Premier League | NBC Sports,granit xhaka score against manchester united league sports,5,highlights / sports / league / v / united
Manchester City v. Watford | PREMIER LEAGUE HIGHLIGHTS | 4/23/2022 | NBC Sports,manchester city v watford league highlights 4232022 sports,5,highlights / sports / league / v / united
Arsenal v. Manchester United | PREMIER LEAGUE HIGHLIGHTS | 4/23/2022 | NBC Sports,arsenal v manchester united league highlights 4232022 sports,5,highlights / sports / league / v / united
Cristiano Ronaldo free kick puts Manchester United back ahead | Premier League | NBC Sports,cristiano ronaldo free kick puts manchester united back ahead league sports,5,highlights / sports / league / v / united
Manchester United v. Liverpool | PREMIER LEAGUE HIGHLIGHTS | 10/24/2021 | NBC Sports,manchester united v liverpool league highlights 10242021 sports,5,highlights / sports / league / v / united
Liverpool v. Manchester United | PREMIER LEAGUE HIGHLIGHTS | 4/19/2022 | NBC Sports,liverpool v manchester united league highlights 4192022 sports,5,highlights / sports / league / v / united
Manchester City v. Brighton | PREMIER LEAGUE HIGHLIGHTS | 4/20/2022 | NBC Sports,manchester city v brighton league highlights 4202022 sports,5,highlights / sports / league / v / united
Chelsea v. Arsenal | PREMIER LEAGUE HIGHLIGHTS | 4/20/2022 | NBC Sports,chelsea v arsenal league highlights 4202022 sports,5,highlights / sports / league / v / united
Bronny was going for it 🤣 #shorts #nba #basketball,bronny going nba basketball,5,highlights / sports / league / v / united
football funny,football,5,highlights / sports / league / v / united
Even Kobe was shocked 🤣 #nba #basketball #shorts,even kobe shocked nba basketball,5,highlights / sports / league / v / united
#6 Oklahoma vs #21 Texas Highlights (GAME OF THE YEAR!?) | Week 6 | 2021 College Football Highlights,oklahoma 21 texas highlights game year week 2021 college football highlights,5,highlights / sports / league / v / united
Manchester United v. Norwich City | PREMIER LEAGUE HIGHLIGHTS | 4/16/2022 | NBC Sports,manchester united v norwich city league highlights 4162022 sports,5,highlights / sports / league / v / united
Bayern vs. Villarreal: Extended Highlights | UCL Quarter-Finals - Leg 2 | CBS Sports Golazo,bayern villarreal extended highlights ucl quarterfinals leg cbs sports golazo,5,highlights / sports / league / v / united
Highlights & Goals | Man. City vs. Liverpool 2-2 | Premier League | Telemundo Deportes,highlights goals man city liverpool 22 league telemundo deportes,5,highlights / sports / league / v / united
Leicester City v. Crystal Palace | PREMIER LEAGUE HIGHLIGHTS | 4/10/2022 | NBC Sports,leicester city v crystal palace league highlights 4102022 sports,5,highlights / sports / league / v / united
Aston Villa v. Tottenham Hotspur | PREMIER LEAGUE HIGHLIGHTS | 4/9/2022 | NBC Sports,aston villa v tottenham hotspur league highlights 492022 sports,5,highlights / sports / league / v / united
Chelsea vs. Real Madrid: Extended Highlights | UCL Quarter-Finals - Leg 1 | CBS Sports Golazo,chelsea real madrid extended highlights ucl quarterfinals leg cbs sports golazo,5,highlights / sports / league / v / united
Chelsea 1-3 Real Madrid | Champions League Highlights,chelsea 13 real madrid champions league highlights,5,highlights / sports / league / v / united
Everton v. Manchester United | PREMIER LEAGUE HIGHLIGHTS | 4/9/2022 | NBC Sports,everton v manchester united league highlights 492022 sports,5,highlights / sports / league / v / united
Villarreal vs. Bayern: Extended Highlights | UCL Quarter-Finals Leg 1 | CBS Sports Golazo,villarreal bayern extended highlights ucl quarterfinals leg cbs sports golazo,5,highlights / sports / league / v / united
Chelsea vs. Real Madrid: Extended Highlights | UCL Quarter-Finals - Leg 1 | CBS Sports Golazo,chelsea real madrid extended highlights ucl quarterfinals leg cbs sports golazo,5,highlights / sports / league / v / united
#6 Michigan vs #8 Michigan State Highlights | College Football Week 9 | 2021 College Football,michigan michigan state highlights college football week 2021 college football,5,highlights / sports / league / v / united
#3 Alabama vs Auburn Highlights (INSANE OVERTIME THRILLER!) | 2021 Iron Bowl | 2021 College Football,alabama auburn highlights insane overtime thriller 2021 iron bowl 2021 college football,5,highlights / sports / league / v / united
#5 Georgia vs #3 Clemson Highlights | College Football Week 1 | 2021 College Football Highlights,georgia clemson highlights college football week 2021 college football highlights,5,highlights / sports / league / v / united
#12 Oregon vs #3 Ohio State Highlights | College Football Week 2 | 2021 College Football Highlights,12 oregon ohio state highlights college football week 2021 college football highlights,5,highlights / sports / league / v / united
Aston Villa v. Arsenal | PREMIER LEAGUE HIGHLIGHTS | 3/19/2022 | NBC Sports,aston villa v arsenal league highlights 3192022 sports,5,highlights / sports / league / v / united
Manchester City v. Tottenham Hotspur | PREMIER LEAGUE HIGHLIGHTS | 2/19/2022 | NBC Sports,manchester city v tottenham hotspur league highlights 2192022 sports,5,highlights / sports / league / v / united
Arsenal v. Liverpool | PREMIER LEAGUE HIGHLIGHTS | 3/16/2022 | NBC Sports,arsenal v liverpool league highlights 3162022 sports,5,highlights / sports / league / v / united
Wolves v. Leeds United | PREMIER LEAGUE HIGHLIGHTS | 3/18/2022 | NBC Sports,wolves v leeds united league highlights 3182022 sports,5,highlights / sports / league / v / united
Manchester City vs. Paris Saint-Germain: Extended Highlights | Group Stage - MD 5 | CBS Sports Go…,manchester city paris saintgermain extended highlights group stage md cbs sports go,5,highlights / sports / league / v / united
Real Madrid vs. PSG: Extended Highlights | UCL Round of 16 - Leg 2 | CBS Sports Golazo,real madrid psg extended highlights ucl round 16 leg cbs sports golazo,5,highlights / sports / league / v / united
Man. United vs. Atlético Madrid: Extended Highlights | UCL Round of 16 - Leg 2 | CBS Sports Golazo,man united atltico madrid extended highlights ucl round 16 leg cbs sports golazo,5,highlights / sports / league / v / united
Ajax vs. Benfica: Extended Highlights | UCL Round of 16 - Leg 2 | CBS Sports Golazo,ajax benfica extended highlights ucl round 16 leg cbs sports golazo,5,highlights / sports / league / v / united
Brighton v. Tottenham Hotspur | PREMIER LEAGUE HIGHLIGHTS | 3/16/2022 | NBC Sports,brighton v tottenham hotspur league highlights 3162022 sports,5,highlights / sports / league / v / united
Everton v. Newcastle | PREMIER LEAGUE HIGHLIGHTS | 3/17/2022 | NBC Sports,everton v newcastle league highlights 3172022 sports,5,highlights / sports / league / v / united
Lille vs. Chelsea: Extended Highlights | UCL Round of 16 - Leg 2 | CBS Sports Golazo,lille chelsea extended highlights ucl round 16 leg cbs sports golazo,5,highlights / sports / league / v / united
Man. United vs. Atlético Madrid: Extended Highlights | UCL Round of 16 - Leg 2 | CBS Sports Golazo,man united atltico madrid extended highlights ucl round 16 leg cbs sports golazo,5,highlights / sports / league / v / united
