Title,Cluster,Cluster Name
prime was one of one shorts,4,the / of / in / sidemen / us
impaulsive discuss harry w2s with the sidemen,4,the / of / in / sidemen / us
npcs in real life,4,the / of / in / sidemen / us
the comeback of dreams sidemen gaming,4,the / of / in / sidemen / us
taking on division 6 sidemen gaming,4,the / of / in / sidemen / us
top 3 exercises for bigger biceps,4,the / of / in / sidemen / us
10 most brutal deaths in history,4,the / of / in / sidemen / us
conquering the division sort of sidemen gaming,4,the / of / in / sidemen / us
most spectacular skills of the season,4,the / of / in / sidemen / us
he walked in at the wrong time,4,the / of / in / sidemen / us
ethan in the dog house,4,the / of / in / sidemen / us
guess the rapper,4,the / of / in / sidemen / us
all the ways to say fatneek,4,the / of / in / sidemen / us
ksi vs cal the dragon,4,the / of / in / sidemen / us
the sidemen laugh at ksi for 25 minutes straight,4,the / of / in / sidemen / us
must win games sidemen gaming,4,the / of / in / sidemen / us
must win games sidemen gaming,4,the / of / in / sidemen / us
the 7 levels of drunk,4,the / of / in / sidemen / us
10 most dangerous jobs in the world,4,the / of / in / sidemen / us
10 most dangerous jobs in the world,4,the / of / in / sidemen / us
the end of clubs sidemen gaming,4,the / of / in / sidemen / us
welcome to the university of georgia,4,the / of / in / sidemen / us
the campus tour university of georgia,4,the / of / in / sidemen / us
friends sidemen pro clubs,4,the / of / in / sidemen / us
the rage quit sidemen pro clubs,4,the / of / in / sidemen / us
the sidemen pro clubs journey begins sidemen fifa 21 pro clubs,4,the / of / in / sidemen / us
the most beautiful 2022 world cup kits released so far,4,the / of / in / sidemen / us
going for the title sidemen fifa 21 pro clubs,4,the / of / in / sidemen / us
goals red cards and more goals sidemen gaming,4,the / of / in / sidemen / us
chest triceps my full week of training day 5 of 7,4,the / of / in / sidemen / us
sidemen break pro clubs world record,4,the / of / in / sidemen / us
the sidemen laugh at ksi for 25 minutes straight,4,the / of / in / sidemen / us
sidemen youtuber guess who,4,the / of / in / sidemen / us
chest triceps my full week of training day 5 of 7,4,the / of / in / sidemen / us
deltoids traps abs forearms my easy day my full week of training day 4 of 7,4,the / of / in / sidemen / us
ksi getting bullied for 11 minutes,4,the / of / in / sidemen / us
the most offensive tiktoker,4,the / of / in / sidemen / us
the campus tour university of georgia,4,the / of / in / sidemen / us
the sidemen laugh at ksi for 25 minutes straight,4,the / of / in / sidemen / us
the sidemen laugh at ksi for 25 minutes straight,4,the / of / in / sidemen / us
defibrillator prank goes horribly wrong the office us shorts,4,the / of / in / sidemen / us
5 worst man made disasters,4,the / of / in / sidemen / us
most useless megaprojects in the world part 2,4,the / of / in / sidemen / us
the secrets of the 7 world wonders,4,the / of / in / sidemen / us
the myth of south america,4,the / of / in / sidemen / us
sidemen 30000 tiktok game,4,the / of / in / sidemen / us
the most embarrassing sidemen tweets of all time,4,the / of / in / sidemen / us
worst sidemen trims of all time,4,the / of / in / sidemen / us
the life of a dubai billionaire,4,the / of / in / sidemen / us
one of the greatest speeches ever ray lewis,4,the / of / in / sidemen / us
top 10 greatest archaeological discoveries ever,4,the / of / in / sidemen / us
top 20 most unexplored places on earth,4,the / of / in / sidemen / us
which country is the greatest in football history,4,the / of / in / sidemen / us
who is in the ucl group of death,4,the / of / in / sidemen / us
does saintmaximin deserve to be at the 2022 world cup,4,the / of / in / sidemen / us
richest football players shorts soccer football hnto1k,4,the / of / in / sidemen / us
the real gym bro,4,the / of / in / sidemen / us
predicting the winner of every big league,4,the / of / in / sidemen / us
are the sidemen happy in life,4,the / of / in / sidemen / us
10 solid minutes of geography culture facts,4,the / of / in / sidemen / us
best bicep workout,4,the / of / in / sidemen / us
guess the price of this billionaires row penthouse in nyc shorts,4,the / of / in / sidemen / us
best bicep workout,4,the / of / in / sidemen / us
best quad exercises of all time,4,the / of / in / sidemen / us
the sidemen laugh at ksi for 25 minutes straight,4,the / of / in / sidemen / us
dirtiest players in football history,4,the / of / in / sidemen / us
clips that made ishowspeed famous 2,4,the / of / in / sidemen / us
sidemen christmas quiz,4,the / of / in / sidemen / us
ksi talks about the sidemen beef shorts ksi sidemen,4,the / of / in / sidemen / us
the best back training guide how to target each part,4,the / of / in / sidemen / us
the sidemen play trivial pursuit sidemen gaming,4,the / of / in / sidemen / us
golf but everyone quits sidemen gaming,4,the / of / in / sidemen / us
what goalkeepers say during games part 1 shorts,4,the / of / in / sidemen / us
best bicep workout,4,the / of / in / sidemen / us
the best back training guide how to target each part,4,the / of / in / sidemen / us
theo would get 8 goals in the pl,4,the / of / in / sidemen / us
tyler the creator on the nword,4,the / of / in / sidemen / us
most embarrassing records in football,4,the / of / in / sidemen / us
sidemen play worlds scariest game,4,the / of / in / sidemen / us
the sidemen are in prison,4,the / of / in / sidemen / us
types of high people,4,the / of / in / sidemen / us
the most epic battles in gta history,4,the / of / in / sidemen / us
7 worst transfer windows of all time,4,the / of / in / sidemen / us
is udonis haslem the greatest role player of all time shorts nba tiktok basketball newvideo,4,the / of / in / sidemen / us
top 20 biggest conspiracy theories of all time,4,the / of / in / sidemen / us
ksi proves hes the best at fifa,4,the / of / in / sidemen / us
the mystical forest sidemen gaming,4,the / of / in / sidemen / us
the best worst chest exercises to build muscle ranked,4,the / of / in / sidemen / us
quotes that made the sidemen famous,4,the / of / in / sidemen / us
the best back training guide how to target each part,4,the / of / in / sidemen / us
sidemen guess the emoji challenge,4,the / of / in / sidemen / us
who will win sidemen gaming,4,the / of / in / sidemen / us
the game is being clowned for flopping shorts,4,the / of / in / sidemen / us
how russias war exposed the dark side of luxury london,4,the / of / in / sidemen / us
i asked every football club in europe for free football shirts,4,the / of / in / sidemen / us
sidemen guess the emoji challenge,4,the / of / in / sidemen / us
the architecture of antilia explained,4,the / of / in / sidemen / us
top 5 reasons to move to sunrise florida,4,the / of / in / sidemen / us
jjs first win on golf with friends sidemen gaming,4,the / of / in / sidemen / us
top finishes of 2021 so far,4,the / of / in / sidemen / us
a brand new golf map sidemen gaming,4,the / of / in / sidemen / us
the truth about sidemen among us,4,the / of / in / sidemen / us
dumbest sidemen among us ever,4,the / of / in / sidemen / us
what 1 billion buys you around the world,4,the / of / in / sidemen / us
10 best defenders this season,4,the / of / in / sidemen / us
top 20 most iconic news headlines of all time,4,the / of / in / sidemen / us
the most sus video on the internet,4,the / of / in / sidemen / us
what was the worst year in human history answers with joe,4,the / of / in / sidemen / us
the best 2020 mma knockouts,4,the / of / in / sidemen / us
top finishes of 2022 so far,4,the / of / in / sidemen / us
the most iconic photo shorts,4,the / of / in / sidemen / us
we saw the last one standing,4,the / of / in / sidemen / us
how does the slowest player in the nba warmup,4,the / of / in / sidemen / us
check the comments shorts,4,the / of / in / sidemen / us
alexa whats the name of this song shorts comedy,4,the / of / in / sidemen / us
2 of amerikas most wanted,4,the / of / in / sidemen / us
lebron picks his 3 players in nba history,4,the / of / in / sidemen / us
tyler the creator vs the crowd shorts,4,the / of / in / sidemen / us
10 most controversial decisions in football,4,the / of / in / sidemen / us
the true definition of a good cop,4,the / of / in / sidemen / us
is this the sidemen biggest problem,4,the / of / in / sidemen / us
the biggest purchase in walmart history,4,the / of / in / sidemen / us
ksi has had a stinker sidemen among us,4,the / of / in / sidemen / us
the dad hatter shorts,4,the / of / in / sidemen / us
ranking the sidemen diss tracks,4,the / of / in / sidemen / us
tobi not being happy in life,4,the / of / in / sidemen / us
sidemen go camping,4,the / of / in / sidemen / us
inside the richest zip code in the us,4,the / of / in / sidemen / us
first to guess the password wins,4,the / of / in / sidemen / us
sidemen categories,4,the / of / in / sidemen / us
greatest trash talkers in football history,4,the / of / in / sidemen / us
whats your biggest regret in life,4,the / of / in / sidemen / us
sidemen play among us but the imposter gets hacked,4,the / of / in / sidemen / us
top 10 highest paid athletes of 2021,4,the / of / in / sidemen / us
top 10 scariest horror movies,4,the / of / in / sidemen / us
10 greatest signature moves in football history pt 2,4,the / of / in / sidemen / us
sidemen 30 second categories challenge,4,the / of / in / sidemen / us
sidemen hide and seek in a school,4,the / of / in / sidemen / us
the 7 levels of high,4,the / of / in / sidemen / us
the 3 levels of being high,4,the / of / in / sidemen / us
sidemen crossing battle royale,4,the / of / in / sidemen / us
the 7 levels of being drunk,4,the / of / in / sidemen / us
who do i hate most in the sidemen,4,the / of / in / sidemen / us
the one rule for sidemen tinder,4,the / of / in / sidemen / us
the funniest moment in lookalike cam in history via thehouseofiman,4,the / of / in / sidemen / us
the greatest coin toss in nfl history shorts,4,the / of / in / sidemen / us
so much happens on the first day of school shortss,4,the / of / in / sidemen / us
sidemen best intro,4,the / of / in / sidemen / us
sidemen rage at the worlds most impossible game,4,the / of / in / sidemen / us
sidemen gta but loser gets slapped,4,the / of / in / sidemen / us
ksi being bullied by the sidemen,4,the / of / in / sidemen / us
the fbis top 10 most wanted explained fixedupdated version in description,4,the / of / in / sidemen / us
10 throws to guess the nfl player,4,the / of / in / sidemen / us
im the guy from mr beast,4,the / of / in / sidemen / us
where do the sidemen see themselves in 5 yearssidemen shorts,4,the / of / in / sidemen / us
ksi getting violated in morpheuss funeral ksi sidemen,4,the / of / in / sidemen / us
guess the nba player or swim,4,the / of / in / sidemen / us
best back to school tech 2022,4,the / of / in / sidemen / us
i played pig vs the best shooter in the pac 12,4,the / of / in / sidemen / us
the 1 quarterback in the class of 2025 shorts,4,the / of / in / sidemen / us
he walked in at the wrong time,4,the / of / in / sidemen / us
the best back training guide how to target each part,4,the / of / in / sidemen / us
biggest irl livestream fails of all time,4,the / of / in / sidemen / us
i asked the world chess champion the hardest question,4,the / of / in / sidemen / us
tommyinnit rages at ksi and sidemen,4,the / of / in / sidemen / us
guess the country,4,the / of / in / sidemen / us
the fastest man in history period,4,the / of / in / sidemen / us
guess the rapper,4,the / of / in / sidemen / us
sidemen 10000 parkour challenge,4,the / of / in / sidemen / us
what is the creation of adam,4,the / of / in / sidemen / us
the taliban explained,4,the / of / in / sidemen / us
the unused concepts of the dark knight trilogy,4,the / of / in / sidemen / us
should a man pay for the first date do the sidemen think the same,4,the / of / in / sidemen / us
baseball players make the best quarterbacks shorts,4,the / of / in / sidemen / us
ethan in the dog house,4,the / of / in / sidemen / us
ksi one joke goksi sidemen,4,the / of / in / sidemen / us
the number 1 artist who had beef with the sidemen,4,the / of / in / sidemen / us
the return of hood spongebob shorts,4,the / of / in / sidemen / us
reacting to the funniest jokes,4,the / of / in / sidemen / us
best w2s pick up lines 1 sidemen w2s,4,the / of / in / sidemen / us
footballers who own songs like for part 2 shorts,4,the / of / in / sidemen / us
ksi dangerous jokesksi sidemen,4,the / of / in / sidemen / us
my 10 favorite countries after visiting them all,4,the / of / in / sidemen / us
games the game,4,the / of / in / sidemen / us
proof the sidemen still got game,4,the / of / in / sidemen / us
w2s being shit at among us for 6 minutes,4,the / of / in / sidemen / us
i created a 50 state us battle simulator,4,the / of / in / sidemen / us
who is the dumbest sidemen member,4,the / of / in / sidemen / us
michael jordan on the greatest player of all time,4,the / of / in / sidemen / us
always the same,4,the / of / in / sidemen / us
ksi dark jokes 2 sidemen ksi,4,the / of / in / sidemen / us
the most wholesome in basketball history via posterized,4,the / of / in / sidemen / us
omegle jokes sidemen ksi,4,the / of / in / sidemen / us
the sidemen house is returning,4,the / of / in / sidemen / us
w2s new setup and room tour,4,the / of / in / sidemen / us
tobi from the sidemen shows his on instagram live,4,the / of / in / sidemen / us
the 6 best delt building exercises youre not doing,4,the / of / in / sidemen / us
sidemen play the scariest game ever,4,the / of / in / sidemen / us
why 2016 was the best year in nba history,4,the / of / in / sidemen / us
the most heartwarming moment in sports history,4,the / of / in / sidemen / us
the constant devolution of society shorts,4,the / of / in / sidemen / us
the habitshorts,4,the / of / in / sidemen / us
why messi walks 85 of the game,4,the / of / in / sidemen / us
put this in the olympics shorts,4,the / of / in / sidemen / us
the nightmare,4,the / of / in / sidemen / us
sidemen complete this challenge win 10000,4,the / of / in / sidemen / us
the sidemen bake off,4,the / of / in / sidemen / us
the final images we will ever see of pluto and arrokoth,4,the / of / in / sidemen / us
sidemen tinder in real life 4 usa youtube edition,4,the / of / in / sidemen / us
tobjizzle moving mad in the us,4,the / of / in / sidemen / us
ksi and tobi do blcked on mia malkova in sidemen tinder real life 4,4,the / of / in / sidemen / us
who harry wants at the next sidemen charity match,4,the / of / in / sidemen / us
questions no one knows the answers to full version,4,the / of / in / sidemen / us
sidemen tinder in real life 3,4,the / of / in / sidemen / us
fifa 23 will be the last fifa,4,the / of / in / sidemen / us
would talia let simon do a 20 women vs 1 sidemen video,4,the / of / in / sidemen / us
sidemen tinder in real life 3,4,the / of / in / sidemen / us
sidemen tinder in real life uk youtube edition,4,the / of / in / sidemen / us
the coldest play in among us history,4,the / of / in / sidemen / us
richest kids in the world,4,the / of / in / sidemen / us
sidemen tinder in real life 4 usa youtube edition,4,the / of / in / sidemen / us
the sidemen play fifa 22 pro clubs,4,the / of / in / sidemen / us
belong in the sun,4,the / of / in / sidemen / us
the only college advice video u need,4,the / of / in / sidemen / us
how i graduated from stanford in 3 years,4,the / of / in / sidemen / us
most offensive sidemen tinder lines,4,the / of / in / sidemen / us
i received a straight red my full game analysis,4,the / of / in / sidemen / us
w2s cancels the question,4,the / of / in / sidemen / us
w2s pranks the sidemen behind the scenes,4,the / of / in / sidemen / us
sidemen tinder in real life 4 usa youtube edition,4,the / of / in / sidemen / us
a day in the life of an mit aerospace engineering student ep 2,4,the / of / in / sidemen / us
a day in the life of an mit aerospace engineering student ep 1,4,the / of / in / sidemen / us
sidemen fall guys is back,4,the / of / in / sidemen / us
the 7 levels of high,4,the / of / in / sidemen / us
football challenges with chrismd,4,the / of / in / sidemen / us
7 days in syria in 2022,4,the / of / in / sidemen / us
taking mushrooms on the first day of school,4,the / of / in / sidemen / us
taking acid on the last day of school,4,the / of / in / sidemen / us
the menacing case of the monster with 21 faces,4,the / of / in / sidemen / us
the dark knight trilogy,4,the / of / in / sidemen / us
worst trip of my life,4,the / of / in / sidemen / us
stupid things i have done while high part 3,4,the / of / in / sidemen / us
the 7 levels of high,4,the / of / in / sidemen / us
50 crazy world records in the usa,4,the / of / in / sidemen / us
a day in the life of a division 1 soccer player penn state,4,the / of / in / sidemen / us
top 7 most insane military drills,4,the / of / in / sidemen / us
sidemen giant slip and slide football,4,the / of / in / sidemen / us
sidemen world cup wipeout challenge,4,the / of / in / sidemen / us
sidemen rank every fall guys level,4,the / of / in / sidemen / us
worst sidemen trims of all time,4,the / of / in / sidemen / us
sidemen gogglebox,4,the / of / in / sidemen / us
the suspicious death of harry houdini,4,the / of / in / sidemen / us
a day in my life busy college student edition 33,4,the / of / in / sidemen / us
top 10 people survived the impossible,4,the / of / in / sidemen / us
the horrifying murders of the zodiac killer,4,the / of / in / sidemen / us
the suspicious case of the reykjavik confessions,4,the / of / in / sidemen / us
top 10 richest beggars in the world,4,the / of / in / sidemen / us
top 10 most disturbing human experiments,4,the / of / in / sidemen / us
luckiest people of all time,4,the / of / in / sidemen / us
dominic fike being and relatable for 4 minutes,4,the / of / in / sidemen / us
jersey v guernsey 2 the epic football rematch ft w2s,4,the / of / in / sidemen / us
sidemen giant slip and slide football,4,the / of / in / sidemen / us
my cat and i fooled the world,4,the / of / in / sidemen / us
a team of youtubers,4,the / of / in / sidemen / us
the last ever sidemen pro clubs episode,4,the / of / in / sidemen / us
biggest hits in nfl history,4,the / of / in / sidemen / us
insane hidden details in hereditary that make it one of the creepiest horrors ever,4,the / of / in / sidemen / us
why sinister is the scariest movie ever made,4,the / of / in / sidemen / us
sidemen tinder in real life uk youtube edition,4,the / of / in / sidemen / us
my top 20 fifa 15 packs,4,the / of / in / sidemen / us
10 biggest lies ever told in history,4,the / of / in / sidemen / us
sidemen vs 50 bots on fall guys,4,the / of / in / sidemen / us
the wheel sidemen edition,4,the / of / in / sidemen / us
top 5 underdogs to watch at the fifa world cup,4,the / of / in / sidemen / us
sidemen geoguessr battle royale,4,the / of / in / sidemen / us
chest exercises ranked best to worst,4,the / of / in / sidemen / us
most expensive cars of 2021,4,the / of / in / sidemen / us
most expensive mistakes in history,4,the / of / in / sidemen / us
moments people died inside,4,the / of / in / sidemen / us
funniest sidemen fails of all time,4,the / of / in / sidemen / us
the rarest fifa card in history,4,the / of / in / sidemen / us
sidemen react to their reddit 3,4,the / of / in / sidemen / us
the best packs of all time fifa 15 countdown,4,the / of / in / sidemen / us
last minute goals that shocked the world,4,the / of / in / sidemen / us
the best goal of this video becomes an nft,4,the / of / in / sidemen / us
scoring a goal on every fifa from 98 to 20 ft w2s,4,the / of / in / sidemen / us
i opened 1 insane pack on every fifa from 1520,4,the / of / in / sidemen / us
fifa 15 no way,4,the / of / in / sidemen / us
most unbelievable world records of all time,4,the / of / in / sidemen / us
moments people died inside,4,the / of / in / sidemen / us
the sidemen are splitting up sidemen rumours,4,the / of / in / sidemen / us
sidemen most likely to challenge,4,the / of / in / sidemen / us
omgggg the all day pack opening fifa 16,4,the / of / in / sidemen / us
sidemen viral point game,4,the / of / in / sidemen / us
day in the life of an investment banking intern,4,the / of / in / sidemen / us
the sidemen get drunk,4,the / of / in / sidemen / us
sidemen ball launcher challenge,4,the / of / in / sidemen / us
sidemen find out their football stats,4,the / of / in / sidemen / us
the best freekick video on youtube,4,the / of / in / sidemen / us
sidemen penalty shootout,4,the / of / in / sidemen / us
the sidemen rank the best tinder lines,4,the / of / in / sidemen / us
who is the best sidemen striker,4,the / of / in / sidemen / us
scoring a goal on every fifa from 98 to 20 ft w2s,4,the / of / in / sidemen / us
sidemen 10000 crossbar challenge,4,the / of / in / sidemen / us
sidemen 10000 call out penalties,4,the / of / in / sidemen / us
the most epic search and discard ever,4,the / of / in / sidemen / us
top 15 things to do in mar del plata argentina,4,the / of / in / sidemen / us
10 best things to do in montreal montreal travel guide,4,the / of / in / sidemen / us
sidemen box of lies,4,the / of / in / sidemen / us
my best fifa 16 team gone wrong,4,the / of / in / sidemen / us
top 10 facts you didnt know about the earth,4,the / of / in / sidemen / us
top 10 most dangerous flights in the world,4,the / of / in / sidemen / us
ultimate penalty challenge,4,the / of / in / sidemen / us
what was the sidemen sunday video of 2020,4,the / of / in / sidemen / us
most expensive homes in london,4,the / of / in / sidemen / us
best of ksimon,4,the / of / in / sidemen / us
ksi insults simon in front of talia,4,the / of / in / sidemen / us
best last minute goals in football,4,the / of / in / sidemen / us
sidemen react to k in ksi stands for knowledge,4,the / of / in / sidemen / us
who broke fifa,4,the / of / in / sidemen / us
ksi one question goksi sidemen,4,the / of / in / sidemen / us
origin of the anime kid shorts,4,the / of / in / sidemen / us
a story for the ages,4,the / of / in / sidemen / us
inside the worlds only 7 star hotel,4,the / of / in / sidemen / us
the greatest fifa 17 team,4,the / of / in / sidemen / us
the boy with the world under his feet,4,the / of / in / sidemen / us
a very expensive game of rockpaperscissors,4,the / of / in / sidemen / us
ksis worst first date,4,the / of / in / sidemen / us
the best fifa team you can make,4,the / of / in / sidemen / us
worst punishments in the history of mankind,4,the / of / in / sidemen / us
sidemen react to life at 600lb,4,the / of / in / sidemen / us
sidemen react to among us animation 3,4,the / of / in / sidemen / us
reacting to the 8 year evolution of the sidemen,4,the / of / in / sidemen / us
most iconic football clips of all time,4,the / of / in / sidemen / us
most devastating goals in football,4,the / of / in / sidemen / us
8 players who were one season wonders,4,the / of / in / sidemen / us
top 10 events that could have ended the world,4,the / of / in / sidemen / us
the sidemen anniversary awards 2019,4,the / of / in / sidemen / us
fifa 15 2000 sidemen wager,4,the / of / in / sidemen / us
autotune vs no autotune who is the 5 shorts,4,the / of / in / sidemen / us
the funniest moment from beta squad mafia,4,the / of / in / sidemen / us
the flower in minecraft,4,the / of / in / sidemen / us
scoring 1 goal like the greatest players ever,4,the / of / in / sidemen / us
greatest fifa pack opening of all time,4,the / of / in / sidemen / us
scariest theories in the world,4,the / of / in / sidemen / us
craziest things ever sold on the dark web,4,the / of / in / sidemen / us
the most horrifying planets ever discovered,4,the / of / in / sidemen / us
mr beast got angry at the sidemen for this,4,the / of / in / sidemen / us
surprising the sidemen with rare shoes,4,the / of / in / sidemen / us
the weakest link sidemen edition,4,the / of / in / sidemen / us
biggest diving fails of all time,4,the / of / in / sidemen / us
the 12 most dangerous islands,4,the / of / in / sidemen / us
the best of stephen tries w2s chrismd willne,4,the / of / in / sidemen / us
sidemen pub golf europe edition,4,the / of / in / sidemen / us
drunk harry makes fun of simon,4,the / of / in / sidemen / us
a very expensive game of rockpaperscissors,4,the / of / in / sidemen / us
ksis worst first date,4,the / of / in / sidemen / us
the triple chest is real,4,the / of / in / sidemen / us
how the lost cities of the amazon were finally found,4,the / of / in / sidemen / us
where will everyone sleep during the qatar world cup,4,the / of / in / sidemen / us
chrismd disqualifies the best calfreezy goal ever seen,4,the / of / in / sidemen / us
building new york in minecraft for 1000,4,the / of / in / sidemen / us
most iconic vikkstar123 moments of all time 1,4,the / of / in / sidemen / us
i traveled to 5 countries in 48 hours,4,the / of / in / sidemen / us
sidemen react to life at 600lb,4,the / of / in / sidemen / us
countries with the best school lunches,4,the / of / in / sidemen / us
uk vs us mcdonalds,4,the / of / in / sidemen / us
ksi and chrismd prank the sidemen with a 1000 iq play,4,the / of / in / sidemen / us
the texas runaway,4,the / of / in / sidemen / us
the time chrismd fooled the world,4,the / of / in / sidemen / us
most insane like a boss moments,4,the / of / in / sidemen / us
the 10 most aggressive animals in the world,4,the / of / in / sidemen / us
sidemen guess the income of strangers,4,the / of / in / sidemen / us
rappers with the most expensive jewelery,4,the / of / in / sidemen / us
sidemen pub golf europe edition,4,the / of / in / sidemen / us
sidemen hole in the wall,4,the / of / in / sidemen / us
sidemen rage at impossible fall guys map,4,the / of / in / sidemen / us
asking w2s to join the sidemen shorts,4,the / of / in / sidemen / us
