Title,Cluster,Cluster Name
sidemen among us but the lobby has 1000 iq,4,the / of / in / sidemen / us
sidemen among us but the lobby has 0 iq,4,the / of / in / sidemen / us
learn how to use imovie in 5 minutes,4,the / of / in / sidemen / us
ishowspeed the worst football player of all time,4,the / of / in / sidemen / us
batman joker meet for the first time l batman arkham origins,4,the / of / in / sidemen / us
batman joker meet for the first time l batman arkham origins,4,the / of / in / sidemen / us
sidemen game of lies,4,the / of / in / sidemen / us
pointless sidemen edition,4,the / of / in / sidemen / us
most expensive mistakes in history,4,the / of / in / sidemen / us
top 10 scariest places in the world,4,the / of / in / sidemen / us
2 hours of best sidemen gta to watch while you eat,4,the / of / in / sidemen / us
the best spiderman suits ever,4,the / of / in / sidemen / us
sidemen guess the song rematch,4,the / of / in / sidemen / us
when spiderman harry ran the fade all across new york over mj,4,the / of / in / sidemen / us
15 minutes of satisfying marvel rivals hexakills,4,the / of / in / sidemen / us
harvey is winning big in poker suits,4,the / of / in / sidemen / us
the worst team of all time marvel rivals experience 4 ft jaynovah monkeydolive,4,the / of / in / sidemen / us
sterling the worst performance of all time,4,the / of / in / sidemen / us
sidemen tinder in real life 4 usa youtube edition,4,the / of / in / sidemen / us
these women dropped out of sidemen tinder 4,4,the / of / in / sidemen / us
petscop the dark story hidden in a haunted game,4,the / of / in / sidemen / us
a solid 8 minutes of useless info,4,the / of / in / sidemen / us
how kratos violated the gods of olympus in the worst ways,4,the / of / in / sidemen / us
sidemen react to the strangest addictions,4,the / of / in / sidemen / us
how kratos violated the gods of olympus in the worst ways,4,the / of / in / sidemen / us
sidemen describe youtubers in one word,4,the / of / in / sidemen / us
most satisfying inventions in the world,4,the / of / in / sidemen / us
10 biggest lies ever told in history,4,the / of / in / sidemen / us
sidemen last to leave the football pitch,4,the / of / in / sidemen / us
sidemen first to leave the football pitch,4,the / of / in / sidemen / us
craziest street interviews of all time,4,the / of / in / sidemen / us
clips that made ishowspeed famous 2,4,the / of / in / sidemen / us
greatest roasts of all time,4,the / of / in / sidemen / us
3 hours of sidemen quiplash,4,the / of / in / sidemen / us
sidemen play trivial pursuit for 3 hour straight,4,the / of / in / sidemen / us
sidemen play trivial pursuit for 3 hour straight,4,the / of / in / sidemen / us
sidemen guess the emoji challenge,4,the / of / in / sidemen / us
sidemen guess the song challenge,4,the / of / in / sidemen / us
sidemen dumbest guess the lyric,4,the / of / in / sidemen / us
sidemen guess the emoji youtuber edition,4,the / of / in / sidemen / us
sidemen colour blind challenge,4,the / of / in / sidemen / us
the angriest sidemen video ever rage quit,4,the / of / in / sidemen / us
sidemen 30 second categories challenge,4,the / of / in / sidemen / us
sidemen get cancelled challenge,4,the / of / in / sidemen / us
best to catch a predator moments,4,the / of / in / sidemen / us
worst sidemen jokes of all time,4,the / of / in / sidemen / us
the worst swat team of all time ready or not,4,the / of / in / sidemen / us
sidemen spend 1 for every calorie you eat for 24 hours,4,the / of / in / sidemen / us
sidemen rush but we use the worst players possible,4,the / of / in / sidemen / us
the cringiest tv ads of all time,4,the / of / in / sidemen / us
most extreme fails,4,the / of / in / sidemen / us
the worst design fails ever,4,the / of / in / sidemen / us
most unlucky people in the world,4,the / of / in / sidemen / us
best moresidemen moments of all time,4,the / of / in / sidemen / us
the sidemen play higher or lower sidemen gaming,4,the / of / in / sidemen / us
w2s about the egyptian slaves w2s funniest in the sidemen reacts,4,the / of / in / sidemen / us
craziest things ever sold on the dark web,4,the / of / in / sidemen / us
top scary coincidences in history,4,the / of / in / sidemen / us
most legendary trash talk in football,4,the / of / in / sidemen / us
most legendary red cards in football,4,the / of / in / sidemen / us
top 25 most incredible football goals of the year,4,the / of / in / sidemen / us
top scary coincidences in history,4,the / of / in / sidemen / us
scariest theories in the world,4,the / of / in / sidemen / us
top 10 worst animated movie rip offs,4,the / of / in / sidemen / us
craziest red cards in football 2,4,the / of / in / sidemen / us
craziest red cards in football,4,the / of / in / sidemen / us
why deji doesnt record with us cards against humanity,4,the / of / in / sidemen / us
the sidemen play codenames,4,the / of / in / sidemen / us
sidemen codenames,4,the / of / in / sidemen / us
7 world class players who have a glaring weakness in their game,4,the / of / in / sidemen / us
4 hours of offensive sidemen reacts to fall asleep,4,the / of / in / sidemen / us
people getting caught in 4k,4,the / of / in / sidemen / us
people caught in 4k,4,the / of / in / sidemen / us
the klopp era top 10 crazy matches,4,the / of / in / sidemen / us
10 years of mixing advice in 10 minutes,4,the / of / in / sidemen / us
most savage sidemen tinder lines,4,the / of / in / sidemen / us
most offensive sidemen tinder lines,4,the / of / in / sidemen / us
quotes that made the sidemen famous,4,the / of / in / sidemen / us
sidemen react to k in ksi stands for knowledge,4,the / of / in / sidemen / us
heres hogg deeney best end to a football match ever,4,the / of / in / sidemen / us
most iconic football clips of all time,4,the / of / in / sidemen / us
liverpool football club in a nutshell,4,the / of / in / sidemen / us
how the media shapes the way we view the world bbc reel,4,the / of / in / sidemen / us
sidemen guess the celebrity harry vs everyone edition,4,the / of / in / sidemen / us
sidemen guess the celebrity,4,the / of / in / sidemen / us
sidemen guess the model,4,the / of / in / sidemen / us
sidemen guess the model,4,the / of / in / sidemen / us
do all the sidemen think the same deji edition,4,the / of / in / sidemen / us
sidemen liars bar ksi edition,4,the / of / in / sidemen / us
sidemen liars bar in real life,4,the / of / in / sidemen / us
sidemen three way,4,the / of / in / sidemen / us
the batman arkham movie chronological order batman arkham series,4,the / of / in / sidemen / us
first to guess the sidemen password wins,4,the / of / in / sidemen / us
can the sidemen find the imposter,4,the / of / in / sidemen / us
who is the smartest sidemen member,4,the / of / in / sidemen / us
sidemen youtuber guess who,4,the / of / in / sidemen / us
worst sidemen among us throws of all time,4,the / of / in / sidemen / us
sidemen among us infinity war thanos role,4,the / of / in / sidemen / us
best of sidemen reacts 2023,4,the / of / in / sidemen / us
ksi getting bullied for 11 minutes,4,the / of / in / sidemen / us
vikkstars most savage moments of all time,4,the / of / in / sidemen / us
biggest sidemen irl fails,4,the / of / in / sidemen / us
best last minute goals in football,4,the / of / in / sidemen / us
biggest mistakes in football,4,the / of / in / sidemen / us
biggest mistakes in football,4,the / of / in / sidemen / us
the biggest snakes in football,4,the / of / in / sidemen / us
sidemen pop the balloon,4,the / of / in / sidemen / us
sidemen blind ranking outrageous edition,4,the / of / in / sidemen / us
are sidemen on the same wavelength,4,the / of / in / sidemen / us
most iconic tbjzl moments of all time,4,the / of / in / sidemen / us
the big wedge golf mini major 2,4,the / of / in / sidemen / us
sidemen uk vs us slang,4,the / of / in / sidemen / us
top 10 most spoilt kids in the world,4,the / of / in / sidemen / us
top 10 youtubers who have been arrested,4,the / of / in / sidemen / us
worst airport security fails of all time,4,the / of / in / sidemen / us
sidemen guess the emoji youtuber edition,4,the / of / in / sidemen / us
sidemen whos most likely to impostor edition,4,the / of / in / sidemen / us
who is the dumbest sidemen member,4,the / of / in / sidemen / us
who is the smartest sidemen,4,the / of / in / sidemen / us
outrageous pop the balloon moments,4,the / of / in / sidemen / us
sidemen react to which ex was best in bed,4,the / of / in / sidemen / us
sidemen find the hottest person,4,the / of / in / sidemen / us
most brutal moments on the button,4,the / of / in / sidemen / us
sidemen would you rather challenge 2,4,the / of / in / sidemen / us
best worst sidemen jokes of all time,4,the / of / in / sidemen / us
best sidemen your mum jokes 1,4,the / of / in / sidemen / us
funniest sidemen forfeits of all time,4,the / of / in / sidemen / us
the 2010 world cup is overrated,4,the / of / in / sidemen / us
lockdown arsenal the worst team ever,4,the / of / in / sidemen / us
sidemen taskmaster,4,the / of / in / sidemen / us
w2s most offensive moments of all time,4,the / of / in / sidemen / us
best of sidemen reacts 2024,4,the / of / in / sidemen / us
most savage comebacks of all time,4,the / of / in / sidemen / us
who is the most athletic sidemen,4,the / of / in / sidemen / us
sidemen vs worlds best geoguessr player,4,the / of / in / sidemen / us
sidemen most expensive car challenge,4,the / of / in / sidemen / us
sidemen taskmaster,4,the / of / in / sidemen / us
the worst transfers of all time,4,the / of / in / sidemen / us
the sidemen rate their own songs,4,the / of / in / sidemen / us
sidemen among us cooking challenge,4,the / of / in / sidemen / us
worst sidemen trims of all time,4,the / of / in / sidemen / us
the price is right sidemen edition,4,the / of / in / sidemen / us
sidemen the price is right,4,the / of / in / sidemen / us
do all the sidemen think the same josh edition,4,the / of / in / sidemen / us
sidemen worlds hardest cooking challenge,4,the / of / in / sidemen / us
sidemen worlds hardest food challenge,4,the / of / in / sidemen / us
i tried the best vs worst rated takeaway,4,the / of / in / sidemen / us
sidemen among us cops vs robbers roles,4,the / of / in / sidemen / us
sidemen halloween fortnite,4,the / of / in / sidemen / us
the insane history of carnage,4,the / of / in / sidemen / us
fortnite set us a challenge,4,the / of / in / sidemen / us
the greatest sidemen comeback,4,the / of / in / sidemen / us
the greatest fortnite duo returns,4,the / of / in / sidemen / us
sidemen among us but the imposters have magic powers,4,the / of / in / sidemen / us
sidemen among us airlock madness,4,the / of / in / sidemen / us
sidemen among us chaos mode but theres a third imposter role,4,the / of / in / sidemen / us
sidemen among us phantom mystic roles,4,the / of / in / sidemen / us
sidemen among us xmas chaos mode hypnotist edition,4,the / of / in / sidemen / us
the batman who laughs explained,4,the / of / in / sidemen / us
the batman who laughs explained shorts comicstorian,4,the / of / in / sidemen / us
sidemen among us but the whole lobbies infected,4,the / of / in / sidemen / us
sidemen among us grinch role but its the dumbest lobby of all time,4,the / of / in / sidemen / us
sidemen among us chaos mode,4,the / of / in / sidemen / us
the story of the greatest world cup ever,4,the / of / in / sidemen / us
sidemen among us traitor role betray the crew to win,4,the / of / in / sidemen / us
sidemen among us but we add a new role every single game 2 hour special,4,the / of / in / sidemen / us
sidemen among us but we add a new role every single game 2 hour special,4,the / of / in / sidemen / us
sidemen among us traitor role betray the crew to win,4,the / of / in / sidemen / us
sidemen among us lovers role ksi returns,4,the / of / in / sidemen / us
the story of the greatest world cup ever,4,the / of / in / sidemen / us
the best year of music,4,the / of / in / sidemen / us
the power of surprise features,4,the / of / in / sidemen / us
sidemen among us puppet master role take control of other players,4,the / of / in / sidemen / us
sidemen among us revive role bring dead bodies back to life,4,the / of / in / sidemen / us
sidemen among us thor role lightning strike to win,4,the / of / in / sidemen / us
sidemen among us ksi shapeshifter masterclass,4,the / of / in / sidemen / us
sidemen among us mafia role theres 3 imposters,4,the / of / in / sidemen / us
sidemen among us but everything is double speed,4,the / of / in / sidemen / us
sidemen among us chaos mode but theres a third imposter role,4,the / of / in / sidemen / us
sidemen among us chaos mode painful edition,4,the / of / in / sidemen / us
sidemen among us but the imposters can talk to each other,4,the / of / in / sidemen / us
x men the full story,4,the / of / in / sidemen / us
sidemen among us proximity chat but everyones a jester,4,the / of / in / sidemen / us
sidemen toty challenge pack the best player you can before the timer runs out,4,the / of / in / sidemen / us
big wedge king of the hill golf challenge,4,the / of / in / sidemen / us
sidemen among us proximity chat shapeshifter special,4,the / of / in / sidemen / us
sidemen among us draft mode choose your own role,4,the / of / in / sidemen / us
sidemen among us but you can rewind time,4,the / of / in / sidemen / us
new sidemen among us 10 hours special,4,the / of / in / sidemen / us
10 hours of sidemen among us to fall asleep,4,the / of / in / sidemen / us
new sidemen play quiplash 90 minutes edition,4,the / of / in / sidemen / us
10 hours of sidemen among us to fall asleep,4,the / of / in / sidemen / us
most likely to leave the sidemen first,4,the / of / in / sidemen / us
i made marvel rivals game of the year worthy,4,the / of / in / sidemen / us
the dark story lore of lethal company,4,the / of / in / sidemen / us
2 hours of best sidemen gta to watch while you eat,4,the / of / in / sidemen / us
sidemen fut draft challenge vs pro for 10000,4,the / of / in / sidemen / us
who will be the main villain of the dcu,4,the / of / in / sidemen / us
ranking every hero from easiest to hardest in marvel rivals season 1,4,the / of / in / sidemen / us
the brutality of the strangers chapter 1,4,the / of / in / sidemen / us
the top 10 best lego sets of 2024,4,the / of / in / sidemen / us
lockdown arsenal the worst team ever,4,the / of / in / sidemen / us
the dark reality of being an arsenal fan,4,the / of / in / sidemen / us
who has the best villains batman vs spiderman,4,the / of / in / sidemen / us
the 30 greatest film challenge 2 3160,4,the / of / in / sidemen / us
the 30 greatest film challenge 301,4,the / of / in / sidemen / us
is the nba becoming a daddys money league,4,the / of / in / sidemen / us
the dark reality of being an arsenal fan,4,the / of / in / sidemen / us
the philosophy of house of cards wisecrack edition,4,the / of / in / sidemen / us
the 30 greatest film challenge 2 3160,4,the / of / in / sidemen / us
the 30 greatest film challenge 301,4,the / of / in / sidemen / us
the wild story of how the mormons created utah,4,the / of / in / sidemen / us
1 hour of sidemen guess the link,4,the / of / in / sidemen / us
craziest high speed police chase of all time 2,4,the / of / in / sidemen / us
craziest high speed police chase of all time,4,the / of / in / sidemen / us
60 minutes thats a lot of minutes,4,the / of / in / sidemen / us
the most notorious serial killers explained in 24 minutes,4,the / of / in / sidemen / us
i played every horror game ever made in one video,4,the / of / in / sidemen / us
i played every horror game ever made in one video,4,the / of / in / sidemen / us
i found a battle royale horror game,4,the / of / in / sidemen / us
my top 5 ski runs of 2023 gopro pov 4k,4,the / of / in / sidemen / us
the office but everyone is goofing off,4,the / of / in / sidemen / us
the office but its just the debates,4,the / of / in / sidemen / us
my 50 songs of 2023,4,the / of / in / sidemen / us
i am the highest ranking sidemen,4,the / of / in / sidemen / us
ranking the worst haircuts,4,the / of / in / sidemen / us
first meme of 2025,4,the / of / in / sidemen / us
memes is this the first meme of 2024,4,the / of / in / sidemen / us
first meme of 2024,4,the / of / in / sidemen / us
the first meme of 2024,4,the / of / in / sidemen / us
most vile villain ever in media,4,the / of / in / sidemen / us
harry hates the sidemen girlfriends w2s,4,the / of / in / sidemen / us
harry finds his ball in the ocean,4,the / of / in / sidemen / us
the first ever big wedge hole in one,4,the / of / in / sidemen / us
the worst golf shot in big wedge history,4,the / of / in / sidemen / us
who can hit their 7 iron the furthest at big wedge,4,the / of / in / sidemen / us
the worlds best golf halfway hut,4,the / of / in / sidemen / us
funniest big wedge moment ever,4,the / of / in / sidemen / us
big wedge play among us golf 3,4,the / of / in / sidemen / us
the worst superhero movies ever,4,the / of / in / sidemen / us
this is how the rank 1 black panther plays in ranked marvel rivals,4,the / of / in / sidemen / us
proper pov one of the greatest genji performances of all time team falcons vs crazy raccoon,4,the / of / in / sidemen / us
i spent 10 hours learning black panther to prove hes the most complex hero in marvel rivals,4,the / of / in / sidemen / us
i played knock offs of the most famous games gta cod minecraft fortnite,4,the / of / in / sidemen / us
sidemen spin the wheel,4,the / of / in / sidemen / us
proof im the best fortnite player in the sidemen,4,the / of / in / sidemen / us
call of duty zombies but i start at round 100,4,the / of / in / sidemen / us
this girl travelled across the world for chrismd,4,the / of / in / sidemen / us
big wedge play among us golf 2,4,the / of / in / sidemen / us
the big wedge golf mini major,4,the / of / in / sidemen / us
the big wedge golf mini major,4,the / of / in / sidemen / us
spin the wheel golf challenge,4,the / of / in / sidemen / us
call of duty20250106213512,4,the / of / in / sidemen / us
legendary red cards in football,4,the / of / in / sidemen / us
dirty plays in football,4,the / of / in / sidemen / us
the big wedge team cup the finale,4,the / of / in / sidemen / us
the big wedge team cup ep1,4,the / of / in / sidemen / us
10 disturbing details in the arkham games part 4,4,the / of / in / sidemen / us
the arkham tapes the other batman analog horror,4,the / of / in / sidemen / us
the big wedge team cup ep2,4,the / of / in / sidemen / us
big wedge golf but our clubs are the handicap,4,the / of / in / sidemen / us
big wedge golf but our clubs are the handicap,4,the / of / in / sidemen / us
sidemen survive the 7 wonders of the world,4,the / of / in / sidemen / us
the presidential zomboys drop into fortnite,4,the / of / in / sidemen / us
the most horrible traps used in the vietnam war,4,the / of / in / sidemen / us
the most terrifying monster we can imagine,4,the / of / in / sidemen / us
top 20 underappreciated wonders of the world,4,the / of / in / sidemen / us
top 10 us cities everyones fleeing in 2025,4,the / of / in / sidemen / us
the presidential zomboys draw blood of the dead,4,the / of / in / sidemen / us
asmr golf in the mountains of montana,4,the / of / in / sidemen / us
the presidential zomboys escape mob of the dead,4,the / of / in / sidemen / us
how the biggest football club in england lost all respect,4,the / of / in / sidemen / us
how to make the best hot chocolate of all time 4 ways,4,the / of / in / sidemen / us
komo 4 in multiview,4,the / of / in / sidemen / us
entire comedy show of only crowd work,4,the / of / in / sidemen / us
the big football quiz of the year 2024,4,the / of / in / sidemen / us
the worst political slogan of all time,4,the / of / in / sidemen / us
worst indian ever,4,the / of / in / sidemen / us
indians are the best matchmakers,4,the / of / in / sidemen / us
a special message for all the fathers out there today,4,the / of / in / sidemen / us
the greatest wingman,4,the / of / in / sidemen / us
is this the greatest diss in wild n out history,4,the / of / in / sidemen / us
he wasnt in the friendzone after all,4,the / of / in / sidemen / us
exploring the new nether in minecraft full stream,4,the / of / in / sidemen / us
the 2010 world cup is overrated,4,the / of / in / sidemen / us
i cant win a game of og fortnite,4,the / of / in / sidemen / us
my first ever fortnite ranked game,4,the / of / in / sidemen / us
the downfall of diary of a wimpy kid,4,the / of / in / sidemen / us
i finally played the socalled batman arkham game,4,the / of / in / sidemen / us
the biggest snakes in football,4,the / of / in / sidemen / us
the most disappointing nation in football history,4,the / of / in / sidemen / us
its all over for marcus rashford,4,the / of / in / sidemen / us
the brutality of tarot,4,the / of / in / sidemen / us
sidemen play og fortnite,4,the / of / in / sidemen / us
the worst transfers of all time,4,the / of / in / sidemen / us
the story of the greatest world cup ever,4,the / of / in / sidemen / us
sidemen rank up on fortnite ballistic,4,the / of / in / sidemen / us
sidemen rank up on fortnite ballistic,4,the / of / in / sidemen / us
first time sidemen play fortnite ballistic,4,the / of / in / sidemen / us
the unfair matches of the roman colosseum,4,the / of / in / sidemen / us
sidemen play og fortnite with lazarbeam and lachlan,4,the / of / in / sidemen / us
the worst job in hell the sonderkommando of auschwitz,4,the / of / in / sidemen / us
lockdown arsenal the worst team ever,4,the / of / in / sidemen / us
the big wedge team cup the finale,4,the / of / in / sidemen / us
the most talented human in history,4,the / of / in / sidemen / us
the pa and the manhattan prince 2023 full movie,4,the / of / in / sidemen / us
longlegs every time the devil was hidden in the background of a scene things you missed,4,the / of / in / sidemen / us
the tomb of saint peter explained,4,the / of / in / sidemen / us
the dark science of crucifixion,4,the / of / in / sidemen / us
the lost footage of the hypnagogic archive,4,the / of / in / sidemen / us
the most hairiest man ive ever cut in my career,4,the / of / in / sidemen / us
the curiousity of a penguin,4,the / of / in / sidemen / us
the top 10 pieces of evidence from buzzfeed unsolved and ghost files,4,the / of / in / sidemen / us
i tried the top 5 restaurants in america,4,the / of / in / sidemen / us
realistic villains who should be in the batman part ii,4,the / of / in / sidemen / us
the brutality of smile,4,the / of / in / sidemen / us
i made the most satisfying desk,4,the / of / in / sidemen / us
the different types of yns,4,the / of / in / sidemen / us
bruce wayne the batman,4,the / of / in / sidemen / us
komo 4 in multiview,4,the / of / in / sidemen / us
batman becomes the batman who laughs,4,the / of / in / sidemen / us
the ultimate office iceberg easter eggs theories and more,4,the / of / in / sidemen / us
the ultimate office iceberg easter eggs theories and more,4,the / of / in / sidemen / us
nfl doing too much moments,4,the / of / in / sidemen / us
ranking the top 3 players in every position full debate,4,the / of / in / sidemen / us
dressing room drama the of all or nothing,4,the / of / in / sidemen / us
one hour of the greatest streetbeefs matches,4,the / of / in / sidemen / us
big wedge play among us golf 2,4,the / of / in / sidemen / us
i bought the most minimalist tech ever,4,the / of / in / sidemen / us
7 most disastrous career moves of all time,4,the / of / in / sidemen / us
i bought the most minimalist tech ever,4,the / of / in / sidemen / us
every style of hot dog we could find across the us,4,the / of / in / sidemen / us
i stayed in every hotel at disney world,4,the / of / in / sidemen / us
the problem with football fans,4,the / of / in / sidemen / us
heated who are the best youngsters in the world,4,the / of / in / sidemen / us
rejected from the only college i applied to nyu rejection,4,the / of / in / sidemen / us
the deadly traps of the vietnam war,4,the / of / in / sidemen / us
the drunkest owners of bar rescue season 5,4,the / of / in / sidemen / us
minecraft gaming setup shorts,4,the / of / in / sidemen / us
harvesting all the wheat at once,4,the / of / in / sidemen / us
minecrafts most insane build ever,4,the / of / in / sidemen / us
i tried the worlds most expensive burger,4,the / of / in / sidemen / us
ranking the top 5 pl players in every position 2324,4,the / of / in / sidemen / us
the big wedge golf mini major,4,the / of / in / sidemen / us
komo 4 in multiview,4,the / of / in / sidemen / us
top 10 hottest world leaders and royalty,4,the / of / in / sidemen / us
top 10 most handsome f1 drivers,4,the / of / in / sidemen / us
top 20 most handsome footballers in the world 2023,4,the / of / in / sidemen / us
the hottest nba players of 2022,4,the / of / in / sidemen / us
top 10 most handsome football players in the nfl,4,the / of / in / sidemen / us
the big wedge golf mini major,4,the / of / in / sidemen / us
the big wedge golf mini major,4,the / of / in / sidemen / us
jims simplest prank the office us,4,the / of / in / sidemen / us
you never forget the office us,4,the / of / in / sidemen / us
the most terrifying things in our universe,4,the / of / in / sidemen / us
the worst lego sets,4,the / of / in / sidemen / us
the history of american chip flavors,4,the / of / in / sidemen / us
casually explained the food of the world,4,the / of / in / sidemen / us
komo 4 in multiview,4,the / of / in / sidemen / us
the worst disasters in history,4,the / of / in / sidemen / us
the chase big wedge golf challenge,4,the / of / in / sidemen / us
the worst picks you can make in every round of your fantasy drafts,4,the / of / in / sidemen / us
i remade gta in minecraft,4,the / of / in / sidemen / us
18 minutes of wreckfest gameplay,4,the / of / in / sidemen / us
the 9 year old haaland sunday leagues greatest moments 10,4,the / of / in / sidemen / us
nfl best catches of the 20232024 season,4,the / of / in / sidemen / us
