Title,Cluster,Cluster Name
the most lit live shows concerts compilation 2 ft kanye west travis scott lil uzi vert,0,the / in / a / of / shorts
sidemen crossing battle royale,0,the / in / a / of / shorts
instant regret moments,0,the / in / a / of / shorts
sidemen race across europe challenge,0,the / in / a / of / shorts
final inesperado en chunchi chimborazo part 1 i geo lema,0,the / in / a / of / shorts
ajax road to the semi final 201819,0,the / in / a / of / shorts
warren hue shows his super saiyan freestyle ability in front of da goat himself,0,the / in / a / of / shorts
27 colleges in 2 minutes college decision reactions 2022 realistic iviesstanfordt20nescac,0,the / in / a / of / shorts
i interviewed youtubers 1 year apart,0,the / in / a / of / shorts
harry attempts an indian accent,0,the / in / a / of / shorts
building w2s setup,0,the / in / a / of / shorts
the peoples striker,0,the / in / a / of / shorts
ksi gives a sneak peak to new single,0,the / in / a / of / shorts
longest drives part 1 410 yards kyleberkshire golf pga shorts,0,the / in / a / of / shorts
long drive champion tries to hit the green on a 555yard par 5 at bay hill golf digest,0,the / in / a / of / shorts
w2s panenkas chrismd and costs him 1000,0,the / in / a / of / shorts
hide seek in spurs 1 billion stadium,0,the / in / a / of / shorts
england vs germany england knock germany out of euro 2020,0,the / in / a / of / shorts
i built a 10000 football watch zone,0,the / in / a / of / shorts
lil uzi vert xo tour liif3 live at gov ball 2018,0,the / in / a / of / shorts
drake travis scott and lebron james sicko mode,0,the / in / a / of / shorts
kendrick lamar performs maad city live in toronto sound academy aug 2 2013,0,the / in / a / of / shorts
bobby shmurda performs hot ngga at powerhouse nyc,0,the / in / a / of / shorts
pop smoke welcome to the party live raw clip bertobie9046,0,the / in / a / of / shorts
nets vs 76ers philly marches into east semis game 5,0,the / in / a / of / shorts
ben simmons gets harassed by philly fans so he trolls them by dunking 76ers vs nets nba fans boo,0,the / in / a / of / shorts
nba isaiah thomas 2017 mix hall of fame,0,the / in / a / of / shorts
isaiah thomas without you hd emotional,0,the / in / a / of / shorts
heres hogg deeney best end to a football match ever,0,the / in / a / of / shorts
from the stand watford score after leicester miss penalty watch in hd,0,the / in / a / of / shorts
mr brightside at michigan stadium on 91121 university of michigan,0,the / in / a / of / shorts
galantis runaway u i gioni remix,0,the / in / a / of / shorts
jon bellion all time low boxinbox lionsize remix,0,the / in / a / of / shorts
jon bellion all time low boxinlion remix ft logic,0,the / in / a / of / shorts
gareth bale reacts to micah richards on mnf i ate him for lunch,0,the / in / a / of / shorts
vik woke up and chose violence today for 4 minutes,0,the / in / a / of / shorts
sidemen drunk bingo,0,the / in / a / of / shorts
average and instantaneous rate of change of a function over an interval a point calculus,0,the / in / a / of / shorts
slope and equation of normal tangent line of curve at given point calculus function graphs,0,the / in / a / of / shorts
21 finding the slope of a tangent line example 1,0,the / in / a / of / shorts
michael jordan speaks at a celebration of life for kobe and gianna bryant,0,the / in / a / of / shorts
heart touching emotional mothers love status shorts mother emotional love,0,the / in / a / of / shorts
a birthday surprise that left steve harvey in tears,0,the / in / a / of / shorts
steve harvey breaks down after seeing his mamas house,0,the / in / a / of / shorts
i wanted to save my mother terry crews goalcast,0,the / in / a / of / shorts
mothers day song a mothers love gena hill lyric video,0,the / in / a / of / shorts
nfl quarterback dwayne haskins dead at 24,0,the / in / a / of / shorts
dwayne haskins knew from an early age hed be a buckeye,0,the / in / a / of / shorts
how dwayne haskins spent his first 1m in the nfl my first million gq sports,0,the / in / a / of / shorts
dwayne haskins dies after being hit by a car in south florida sportscenter,0,the / in / a / of / shorts
antony created a skill never seen in football,0,the / in / a / of / shorts
the loudest siuuu youll ever hear,0,the / in / a / of / shorts
cristiano ronaldo says inshallah on instagram live,0,the / in / a / of / shorts
w2s hitler salute sidemen deleted scene from accents challenge,0,the / in / a / of / shorts
harry w2s hates charity lol,0,the / in / a / of / shorts
last to leave centre circle wins 10000 ft w2s challenge,0,the / in / a / of / shorts
sidemen 100000 split or steal,0,the / in / a / of / shorts
sidemen 50000 tipping point,0,the / in / a / of / shorts
sidemen rap or crap,0,the / in / a / of / shorts
sidemen 50000 az drinking challenge gone wrong,0,the / in / a / of / shorts
sidemen pub golf gone wrong,0,the / in / a / of / shorts
sidemen impossible 100000 footgolf challenge,0,the / in / a / of / shorts
sidemen one million pound drop,0,the / in / a / of / shorts
last sidemen to stop running wins 10000,0,the / in / a / of / shorts
nyc apartment tour 16500000 upper east side modern duplex,0,the / in / a / of / shorts
the moment villanova won the 2016 ncaa basketball championship,0,the / in / a / of / shorts
one shining moment heartbreak version 2018,0,the / in / a / of / shorts
march madness pump up 2017 believer,0,the / in / a / of / shorts
eminem till i collapse hd,0,the / in / a / of / shorts
carrying deji on fortnite battle royale,0,the / in / a / of / shorts
my bro gets a 193 fut draft world record fifa 20,0,the / in / a / of / shorts
sidemen word association,0,the / in / a / of / shorts
robbie loses his patience with ty bringing up things from 20 years ago,0,the / in / a / of / shorts
this chrismd volley wouldve gone down in youtube history,0,the / in / a / of / shorts
sidemen extreme punishment pool,0,the / in / a / of / shorts
sidemen silent library,0,the / in / a / of / shorts
we took 100 shots vs cal the dragon and scored goals,0,the / in / a / of / shorts
loudest on the pga tour,0,the / in / a / of / shorts
w2s hitler salute sidemen deleted scene from accents challenge,0,the / in / a / of / shorts
sidemen silent library,0,the / in / a / of / shorts
you destroyed our family jaden smith confronts jada pinkett smith after the oscars,0,the / in / a / of / shorts
have some respect will smith rages on james corden for mocking jada pinkett just after the oscars,0,the / in / a / of / shorts
quirky quiplash but tobi hates simon,0,the / in / a / of / shorts
15 levels of pool easy to complex wired,0,the / in / a / of / shorts
donnell rawlings breakfast club but its only the jokes,0,the / in / a / of / shorts
my dad passed away about a year ago,0,the / in / a / of / shorts
zhu good life audio,0,the / in / a / of / shorts
mac miller good news,0,the / in / a / of / shorts
lego batman speedruns are utterly broken,0,the / in / a / of / shorts
fortnite brought back tilted towers,0,the / in / a / of / shorts
jayz kanye west nias in paris drake remix,0,the / in / a / of / shorts
calculus 1 introduction to limits,0,the / in / a / of / shorts
kobe bryant says shaq should be the goat,0,the / in / a / of / shorts
mark goldbridge reacting to mancity champions league draw,0,the / in / a / of / shorts
chunkz was just violating yung filly,0,the / in / a / of / shorts
every single w2s rap from mad verse city,0,the / in / a / of / shorts
questionable quiplash sidemen gaming,0,the / in / a / of / shorts
calculus 1 introduction to limits,0,the / in / a / of / shorts
sidemen geoguessr bullseye mode,0,the / in / a / of / shorts
self isolation quiplash sidemen gaming,0,the / in / a / of / shorts
sidemen describe youtubers in one word,0,the / in / a / of / shorts
mikel arteta rates the sidemens football ability,0,the / in / a / of / shorts
the clip that convinced man city to sign de bruyne,0,the / in / a / of / shorts
asmr best 20mins of gum chewing no talking,0,the / in / a / of / shorts
fortnite winterfest in a nutshell,0,the / in / a / of / shorts
fortnite brought back tilted towers,0,the / in / a / of / shorts
the end of fortnite event went stupid,0,the / in / a / of / shorts
theo baker voice cracks at the worst possible time,0,the / in / a / of / shorts
new sidemen sunday leaked,0,the / in / a / of / shorts
most offensive cards against humanity ever,0,the / in / a / of / shorts
completely appropriate quiplash sidemen gaming,0,the / in / a / of / shorts
brand new quiplash sidemen gaming,0,the / in / a / of / shorts
vikkstar has unmatched athleticism,0,the / in / a / of / shorts
another questionable quiplash sidemen gaming,0,the / in / a / of / shorts
sidemen instagram qa,0,the / in / a / of / shorts
every single w2s rap from mad verse city,0,the / in / a / of / shorts
sidemen instagram qa,0,the / in / a / of / shorts
sidemen trippy olympics,0,the / in / a / of / shorts
11 unforgettable mac miller moments ranked ridiculousness,0,the / in / a / of / shorts
wesley fofana out for the season after broken leg vs villarreal,0,the / in / a / of / shorts
a circle has the equation x2 y2 25 write an equation of the line tangent,0,the / in / a / of / shorts
lucki sosa in this audi prod oxy,0,the / in / a / of / shorts
sidemen give advice,0,the / in / a / of / shorts
the batman arkham deleted scene 2022 robert pattinson barry keoghan,0,the / in / a / of / shorts
nc state university campus tour main campus tour with adam,0,the / in / a / of / shorts
parsons the new school for design school tour part oneuniversity center,0,the / in / a / of / shorts
inside the new schools university center students move in to the dormitories,0,the / in / a / of / shorts
texas am campus tour 2021 taking a day off school to visit campus o,0,the / in / a / of / shorts
how to use the quadratic formula polynomial and rational functions algebra ii khan academy,0,the / in / a / of / shorts
evaluate for theta between 0 and 2pi,0,the / in / a / of / shorts
origin of chav,0,the / in / a / of / shorts
the btecmen,0,the / in / a / of / shorts
harrys card gets declined,0,the / in / a / of / shorts
the timing was impectable,0,the / in / a / of / shorts
sidemen rock paper scissors tournament,0,the / in / a / of / shorts
ksis magic trick,0,the / in / a / of / shorts
vikkstar predicts ksis next fight,0,the / in / a / of / shorts
harry breaks simons neck,0,the / in / a / of / shorts
what happens in vegas stays in vegas,0,the / in / a / of / shorts
dont mess with whamstar123,0,the / in / a / of / shorts
ethan gets a yellow card,0,the / in / a / of / shorts
zerkaas 200 iq prank on ksi,0,the / in / a / of / shorts
harry x tommy t unreleased track,0,the / in / a / of / shorts
tobi makes a dad joke,0,the / in / a / of / shorts
most awkward fan interaction,0,the / in / a / of / shorts
harry firms a gut punch from ksi sidementurn8 ad,0,the / in / a / of / shorts
ksi breaks a wooden spoon on vikkstar sidementurn8 ad,0,the / in / a / of / shorts
harrys dream house,0,the / in / a / of / shorts
every mans greatest fear,0,the / in / a / of / shorts
which sidemen could win squid games,0,the / in / a / of / shorts
harry cant afford shoes,0,the / in / a / of / shorts
sidemen predict jake paul vs tommy fury,0,the / in / a / of / shorts
fans break into sidemen shoot,0,the / in / a / of / shorts
harry calls josh irrelevant,0,the / in / a / of / shorts
ethan the poo pusher,0,the / in / a / of / shorts
harry dropping bars,0,the / in / a / of / shorts
they were perfectly in sync,0,the / in / a / of / shorts
the sidestreet boys,0,the / in / a / of / shorts
ksis covid christmas story,0,the / in / a / of / shorts
harry calls viks fianc a b,0,the / in / a / of / shorts
ksi assaults the royal family,0,the / in / a / of / shorts
harry left them speachless,0,the / in / a / of / shorts
vikkstar drops a thought bomb,0,the / in / a / of / shorts
lazarbeam is special,0,the / in / a / of / shorts
a very normal question,0,the / in / a / of / shorts
guess whos back back again,0,the / in / a / of / shorts
tobi smartest sidemen confirmed,0,the / in / a / of / shorts
post game interview,0,the / in / a / of / shorts
behz caught in 4k,0,the / in / a / of / shorts
teamwork makes the dreamwork,0,the / in / a / of / shorts
w2s behzingas sidemen sunday tiktok,0,the / in / a / of / shorts
behzingas on hard drugs,0,the / in / a / of / shorts
its always the voice cracks,0,the / in / a / of / shorts
how callux almost perished,0,the / in / a / of / shorts
no tax,0,the / in / a / of / shorts
a deals a deal,0,the / in / a / of / shorts
harrys new album cover goes hard,0,the / in / a / of / shorts
uw red square live cam,0,the / in / a / of / shorts
jayz kanye west nias in paris drake remix,0,the / in / a / of / shorts
will smith hits chris rock on oscars stage after joke about jada pinkettsmith,0,the / in / a / of / shorts
chris rock after being slapped at the oscars,0,the / in / a / of / shorts
travis scott hearing drakes sicko mode verse for the first time,0,the / in / a / of / shorts
women rate the strongest sidemen,0,the / in / a / of / shorts
why khabib wasnt happy after beating conor mcgregor,0,the / in / a / of / shorts
gary vee done it again,0,the / in / a / of / shorts
chunkz was disappointed in yung filly,0,the / in / a / of / shorts
harry christopher george lewis,0,the / in / a / of / shorts
fan throws their id at tyler the creator,0,the / in / a / of / shorts
davies explaining why he didnt get messis jersey after the 82 trashing of barcelona by bayern,0,the / in / a / of / shorts
w2s weighs himself,0,the / in / a / of / shorts
ksi getting violated meme,0,the / in / a / of / shorts
vikkstar makes w2s real laugh rare,0,the / in / a / of / shorts
96 hours inside afghanistan in 2020,0,the / in / a / of / shorts
lionel messi where the insane becomes the routine,0,the / in / a / of / shorts
everyone feared this lionel messi,0,the / in / a / of / shorts
harrys dream house,0,the / in / a / of / shorts
every mans greatest fear,0,the / in / a / of / shorts
which sidemen could win squid games,0,the / in / a / of / shorts
harry cant afford shoes,0,the / in / a / of / shorts
sidemen predict jake paul vs tommy fury,0,the / in / a / of / shorts
fans break into sidemen shoot,0,the / in / a / of / shorts
harry calls josh irrelevant,0,the / in / a / of / shorts
ethan the poo pusher,0,the / in / a / of / shorts
harry dropping bars,0,the / in / a / of / shorts
they were perfectly in sync,0,the / in / a / of / shorts
the sidestreet boys,0,the / in / a / of / shorts
ksis covid christmas story,0,the / in / a / of / shorts
the brown variant,0,the / in / a / of / shorts
harry calls viks fianc a b,0,the / in / a / of / shorts
ksi assaults the royal family,0,the / in / a / of / shorts
harry left them speachless,0,the / in / a / of / shorts
vikkstar drops a thought bomb,0,the / in / a / of / shorts
lazarbeam is special,0,the / in / a / of / shorts
a very normal question,0,the / in / a / of / shorts
guess whos back back again,0,the / in / a / of / shorts
tobi smartest sidemen confirmed,0,the / in / a / of / shorts
w2s demonstrates a flykick,0,the / in / a / of / shorts
post game interview,0,the / in / a / of / shorts
behz caught in 4k,0,the / in / a / of / shorts
teamwork makes the dreamwork,0,the / in / a / of / shorts
w2s behzingas sidemen sunday tiktok,0,the / in / a / of / shorts
behzingas on hard drugs,0,the / in / a / of / shorts
its always the voice cracks,0,the / in / a / of / shorts
how callux almost perished,0,the / in / a / of / shorts
no tax,0,the / in / a / of / shorts
a deals a deal,0,the / in / a / of / shorts
harrys new album cover goes hard,0,the / in / a / of / shorts
what happens in vegas stays in vegas,0,the / in / a / of / shorts
the boy who broke the march madness bracket,0,the / in / a / of / shorts
50 hours in a country that doesnt exist on a map transnistria,0,the / in / a / of / shorts
i lived with wolves for 72 hours,0,the / in / a / of / shorts
96 hours inside afghanistan in 2020,0,the / in / a / of / shorts
france 4k 60fps flanders city of lille,0,the / in / a / of / shorts
top things to do in lille france day trip to lille from london day trip from london by train,0,the / in / a / of / shorts
48 hours in lille ft the 12 best restaurants bars frances unsung hero,0,the / in / a / of / shorts
ksi moving mad on talia mars instagram,0,the / in / a / of / shorts
when simon miniminter joined the girls in 20 vs 1 ksi dating challenge simon dates ksi leaves,0,the / in / a / of / shorts
man united under ralf rangnick in a nutshell exe,0,the / in / a / of / shorts
modern warfare toxic trash talk compilation funny moments trolling mw,0,the / in / a / of / shorts
harry maguire defender of the century,0,the / in / a / of / shorts
harry maguire getting paid too much for 60 seconds,0,the / in / a / of / shorts
why the mac charger comes apart,0,the / in / a / of / shorts
the fresh prince of bel air theme song full,0,the / in / a / of / shorts
fresh prince of bel air theme song lyrics,0,the / in / a / of / shorts
the worst college basketball game was so historically awful a ranked team scored just 24 points,0,the / in / a / of / shorts
4channer goes missing in 2013,0,the / in / a / of / shorts
ksi destroys simon again,0,the / in / a / of / shorts
full reaction to italys stunning loss to north macedonia espn fc,0,the / in / a / of / shorts
vikkstar gets vikkstard,0,the / in / a / of / shorts
2021 rewind how every march madness bracket busted game by game,0,the / in / a / of / shorts
reporters asking nba players stupid questions,0,the / in / a / of / shorts
federer gives the scientific explanation why the ball bounced twice,0,the / in / a / of / shorts
nikola jokic with the slowest most unathletic poster dunk youll ever see,0,the / in / a / of / shorts
lucki sosa in this audi prod oxy,0,the / in / a / of / shorts
the air fouled me,0,the / in / a / of / shorts
return my serve win 100,0,the / in / a / of / shorts
playing some kendrick lamar until i feel black again,0,the / in / a / of / shorts
the legend of the bermuda triangle,0,the / in / a / of / shorts
a creators dive into turmoil,0,the / in / a / of / shorts
the cult in a boarding school,0,the / in / a / of / shorts
the backrooms fear of being forgotten,0,the / in / a / of / shorts
the conspiracy theory tier list,0,the / in / a / of / shorts
im obsessed with midnight in paris,0,the / in / a / of / shorts
harrys unmuted scream my heart shattered after hearing this,0,the / in / a / of / shorts
calfreezy exposes miniminter shorts,0,the / in / a / of / shorts
shorts cattivone,0,the / in / a / of / shorts
how callux almost perished,0,the / in / a / of / shorts
shorts ksi vs dave at the brits britsunseen with youtube,0,the / in / a / of / shorts
lilypichu shows you the bait ever in valorant,0,the / in / a / of / shorts
steph curry explains his moment against kobe bryant shorts,0,the / in / a / of / shorts
yo yo ksi,0,the / in / a / of / shorts
ross and monicas awkward,0,the / in / a / of / shorts
blueface on twitch with adin ross and ddg,0,the / in / a / of / shorts
w2ss celebrity crush shorts,0,the / in / a / of / shorts
cordae you need 30000000 to really afford a 100000 cuban rapper interview mindset,0,the / in / a / of / shorts
this 15 year old kid earned 1000000,0,the / in / a / of / shorts
conor mcgregors most iconic quote,0,the / in / a / of / shorts
hmm page 100 shorts,0,the / in / a / of / shorts
warren hue shows his super saiyan freestyle ability in front of da goat himself,0,the / in / a / of / shorts
ksi breaks wooden spoon on vikkstar,0,the / in / a / of / shorts
sidemen spelling bee,0,the / in / a / of / shorts
the dark knight rises bruce and selina ball scene hd,0,the / in / a / of / shorts
sidemen spelling bee,0,the / in / a / of / shorts
the cult in a boarding school,0,the / in / a / of / shorts
oh wait actually the wordle opener is not crane,0,the / in / a / of / shorts
gotham needs you the dark knight 4k hdr imax,0,the / in / a / of / shorts
we recreated footballs most satisfying goals,0,the / in / a / of / shorts
the sound illusion that makes dunkirk so intense,0,the / in / a / of / shorts
the attempt on john paul iis life,0,the / in / a / of / shorts
jayz kanye west nias in paris drake remix,0,the / in / a / of / shorts
top 3 unguardable moves simple basketball moves,0,the / in / a / of / shorts
best march madness moments of alltime 2022 updated buzzer beaters dunks upsets,0,the / in / a / of / shorts
where is harvey dent the dark knight 4k hdr imax,0,the / in / a / of / shorts
sidemen las vegas forfeit hide and seek,0,the / in / a / of / shorts
life is beautiful official trailer hd roberto benigni nicoletta braschi miramax,0,the / in / a / of / shorts
study music music that makes u more inspired to study workchill lofi mix to relax stress relief,0,the / in / a / of / shorts
joker escapes batman saves dent the dark knight 4k hdr,0,the / in / a / of / shorts
loyola chicago vs nevada ramblers on to the elite 8,0,the / in / a / of / shorts
loyola chicago vs miami relive the buzzerbeating thriller in 10 minutes,0,the / in / a / of / shorts
the riddler scene from the batman that needed nearly 200 takes,0,the / in / a / of / shorts
the batman ave maria vengeance theme michael giacchino trailer music,0,the / in / a / of / shorts
the batman breakdown full movie analysis details you missed,0,the / in / a / of / shorts
the batman director explains the inspiration behind his joker,0,the / in / a / of / shorts
we took 100 shots vs a 50 rated keeper and scored goals,0,the / in / a / of / shorts
unreleased sidemen hide and seek,0,the / in / a / of / shorts
sidemen hide and seek in beta squad house,0,the / in / a / of / shorts
and here we go batman vs joker the dark knight 4k hdr imax,0,the / in / a / of / shorts
new renegade dance with charli damelio tiktok compilation best dance challenges 2020,0,the / in / a / of / shorts
the dark knight rises cranes court cases hd imax,0,the / in / a / of / shorts
the russian doll man,0,the / in / a / of / shorts
batman begins 36 movie clip the doctor isnt in 2005 hd,0,the / in / a / of / shorts
best attempt at a troll class,0,the / in / a / of / shorts
new suit toys the dark knight 4k hdr imax,0,the / in / a / of / shorts
john wick chapter 2 2017 gun shopping scene 210 movieclips,0,the / in / a / of / shorts
jayz kanye west nias in paris drake remix,0,the / in / a / of / shorts
the batman ending post credit scene easter eggs cameo scene and things you missed,0,the / in / a / of / shorts
the batman ending detail you missed in postcredit scene,0,the / in / a / of / shorts
like a double moab sorta,0,the / in / a / of / shorts
jayz kanye west nias in paris drake remix,0,the / in / a / of / shorts
warren hue shows his super saiyan freestyle ability in front of da goat himself,0,the / in / a / of / shorts
50 cent surprises fan who says he aint the goat,0,the / in / a / of / shorts
hardest ap exams by pass rate shorts,0,the / in / a / of / shorts
is my boyfriend an alpha male,0,the / in / a / of / shorts
batman interrogates the joker the dark knight 4k hdr,0,the / in / a / of / shorts
the batman main trailer,0,the / in / a / of / shorts
score 12 penalties win an iphone 12,0,the / in / a / of / shorts
sidemen punishment pool insane,0,the / in / a / of / shorts
oi chris hit that,0,the / in / a / of / shorts
ksi lamborghini explicit ft p money,0,the / in / a / of / shorts
eating 100 chicken wings and drinking a glass of vinegar,0,the / in / a / of / shorts
playing the obj or trying to atleast,0,the / in / a / of / shorts
the grind the struggle,0,the / in / a / of / shorts
the new chokii,0,the / in / a / of / shorts
warren hue shows his super saiyan freestyle ability in front of da goat himself,0,the / in / a / of / shorts
eating the worlds hottest noodles,0,the / in / a / of / shorts
everything is opposite,0,the / in / a / of / shorts
eating 120 slices of pizza dont try this,0,the / in / a / of / shorts
mike tyson made 600 million in his boxing career and lost everything,0,the / in / a / of / shorts
logan paul destroys jake paul with 4 words,0,the / in / a / of / shorts
dont judge motivate shorts,0,the / in / a / of / shorts
will khabib fight in ufc again,0,the / in / a / of / shorts
24 hr spanish test on husband part 2 shorts,0,the / in / a / of / shorts
spiderman no way home telegram link tomholland ksi telegram new others,0,the / in / a / of / shorts
fan grabs mic from pop hunna shorts,0,the / in / a / of / shorts
reporting a scary situation to the police in japan shorts,0,the / in / a / of / shorts
vladimir anton those were the days,0,the / in / a / of / shorts
slavery fifa the rematch,0,the / in / a / of / shorts
quickfire questions challenge,0,the / in / a / of / shorts
warren hue shows his super saiyan freestyle ability in front of da goat himself,0,the / in / a / of / shorts
getting rejected by an hm employee,0,the / in / a / of / shorts
warren hue shows his super saiyan freestyle ability in front of da goat himself,0,the / in / a / of / shorts
warren hue shows his super saiyan freestyle ability in front of da goat himself,0,the / in / a / of / shorts
elf 210 best movie quote bye buddy hope you find your dad 2003,0,the / in / a / of / shorts
warren hue shows his super saiyan freestyle ability in front of da goat himself,0,the / in / a / of / shorts
hard fast rap trap beat instrumental freestyle beat flow perfect free type beat 2022,0,the / in / a / of / shorts
tommyinnit ruins our game sidemen fifa 21 pro clubs,0,the / in / a / of / shorts
ksi censored moment,0,the / in / a / of / shorts
how big these kids are playing sports nowadays by supremedreams1 rdcworld1,0,the / in / a / of / shorts
first time on dig nuked,0,the / in / a / of / shorts
warren hue shows his super saiyan freestyle ability in front of da goat himself,0,the / in / a / of / shorts
warren hue shows his super saiyan freestyle ability in front of da goat himself,0,the / in / a / of / shorts
2 hours of a moaning turtle,0,the / in / a / of / shorts
