Title,Cluster,Cluster Name
best of angry ginge rage moments,0,50 / gta / top
best angry ginge moments,0,50 / gta / top
coldest sidemen moments,0,50 / gta / top
dumbest sidemen among us moments,0,50 / gta / top
sidemen among us but the lobby has 1000 iq,0,50 / gta / top
sidemen among us but the lobby has 0 iq,0,50 / gta / top
learn how to use imovie in 5 minutes,0,50 / gta / top
gta 5 funny moments 192 with the sidemen gta 5 online funny moments,0,50 / gta / top
gta 5 funny moments 191 with the sidemen gta 5 online funny moments,0,50 / gta / top
gta 5 funny moments 72 with the sidemen gta v online funny moments,0,50 / gta / top
gta 5 funny moments 46 gate launch glitch with ksi zerkaa mm7games behzinga tbjzl gta v,0,50 / gta / top
gta 5 funny moments 155 free roam challenges with the sidemen gta 5 online funny moments,0,50 / gta / top
gta 5 funny moments 300 best of with vikkstar gta 5 online funny moments,0,50 / gta / top
gta 5 funny moments 398 with vikkstar gta 5 online funny moments,0,50 / gta / top
ishowspeed the worst football player of all time,0,50 / gta / top
sidemen game of lies,0,50 / gta / top
pointless sidemen edition,0,50 / gta / top
most expensive mistakes in history,0,50 / gta / top
top 10 scariest places in the world,0,50 / gta / top
2 hours of best sidemen gta to watch while you eat,0,50 / gta / top
the best spiderman suits ever,0,50 / gta / top
sidemen guess the song rematch,0,50 / gta / top
marvel rivals wtf funny moments 17,0,50 / gta / top
the worst team of all time marvel rivals experience 4 ft jaynovah monkeydolive,0,50 / gta / top
most outrageous moresidemen moments,0,50 / gta / top
w2s most offensive moments,0,50 / gta / top
sidemen react top w2s rage moments,0,50 / gta / top
best ksi rage moments,0,50 / gta / top
controversial moments,0,50 / gta / top
players managers extreme moments,0,50 / gta / top
sterling the worst performance of all time,0,50 / gta / top
sidemen tinder in real life 4 usa youtube edition,0,50 / gta / top
these women dropped out of sidemen tinder 4,0,50 / gta / top
about sidemen tinder 4,0,50 / gta / top
best sidemen roasts moments,0,50 / gta / top
best jj olatunji moments,0,50 / gta / top
best sidemen beef era moments,0,50 / gta / top
best big wedge golf moments,0,50 / gta / top
sidemen debate club,0,50 / gta / top
embarrassing live tv moments,0,50 / gta / top
sidemen react to the strangest addictions,0,50 / gta / top
sidemen categories football edition,0,50 / gta / top
sidemen being bad at sports for 9 minutes,0,50 / gta / top
funniest sidemen twitch moments,0,50 / gta / top
sidemen rap or crap,0,50 / gta / top
most satisfying inventions in the world,0,50 / gta / top
best vikkstar rage moments,0,50 / gta / top
10 biggest lies ever told in history,0,50 / gta / top
cards against humanity 10 with vikkstar,0,50 / gta / top
sidemen last to leave the football pitch,0,50 / gta / top
sidemen first to leave the football pitch,0,50 / gta / top
sidemen play tiktok games 2 hours edition,0,50 / gta / top
best instant karma moments,0,50 / gta / top
sidemen react to embarrasing public moments,0,50 / gta / top
people with 0 iq set 8 moments,0,50 / gta / top
craziest street interviews of all time,0,50 / gta / top
funniest ishowspeed fifa moments,0,50 / gta / top
funniest ishowspeed rage moments,0,50 / gta / top
funniest football charity match moments ever,0,50 / gta / top
sidemen play tiktok games 2 hours edition,0,50 / gta / top
sidemen play tiktok games 2 hours edition,0,50 / gta / top
greatest roasts of all time,0,50 / gta / top
best cheap expensive moments,0,50 / gta / top
most underrated moresidemen moments,0,50 / gta / top
sidemen best gta moments,0,50 / gta / top
3 hours of sidemen quiplash,0,50 / gta / top
sidemen play trivial pursuit for 3 hour straight,0,50 / gta / top
sidemen play trivial pursuit for 3 hour straight,0,50 / gta / top
sidemen guess the emoji challenge,0,50 / gta / top
sidemen guess the song challenge,0,50 / gta / top
sidemen dumbest guess the lyric,0,50 / gta / top
sidemen guess the emoji youtuber edition,0,50 / gta / top
sidemen association challenge,0,50 / gta / top
sidemen colour blind challenge,0,50 / gta / top
the angriest sidemen video ever rage quit,0,50 / gta / top
sidemen 30 second categories challenge,0,50 / gta / top
sidemen get cancelled challenge,0,50 / gta / top
best to catch a predator moments,0,50 / gta / top
most outrageous scared straight moments,0,50 / gta / top
sidemen 5 second challenge controversial edition,0,50 / gta / top
sidemen family feud sidemen gaming,0,50 / gta / top
worst sidemen jokes of all time,0,50 / gta / top
the worst swat team of all time ready or not,0,50 / gta / top
999 iq gaming moments,0,50 / gta / top
sidemen spend 1 for every calorie you eat for 24 hours,0,50 / gta / top
sidemen rush but we use the worst players possible,0,50 / gta / top
the cringiest tv ads of all time,0,50 / gta / top
most extreme fails,0,50 / gta / top
moments before disaster,0,50 / gta / top
the worst design fails ever,0,50 / gta / top
999 iq moments,0,50 / gta / top
most unlucky people in the world,0,50 / gta / top
funniest sidemen among us moments,0,50 / gta / top
best moresidemen moments of all time,0,50 / gta / top
w2s offensive moments,0,50 / gta / top
the sidemen play higher or lower sidemen gaming,0,50 / gta / top
w2s about egyptian slaves w2s funniest sidemen reacts,0,50 / gta / top
king 5,0,50 / gta / top
most legendary trash talk in football,0,50 / gta / top
most legendary red cards in football,0,50 / gta / top
top 25 most incredible football goals of the year,0,50 / gta / top
rarest moments in football,0,50 / gta / top
scariest theories in the world,0,50 / gta / top
worst ever movie cgi moments,0,50 / gta / top
nba rage moments,0,50 / gta / top
why deji doesnt record with us cards against humanity,0,50 / gta / top
the sidemen play codenames,0,50 / gta / top
sidemen codenames,0,50 / gta / top
4 hours of offensive sidemen reacts to fall asleep,0,50 / gta / top
best sidemen quiplash moments,0,50 / gta / top
most offensive sidemen cards against humanity moments,0,50 / gta / top
best sidemen lockdown moments,0,50 / gta / top
best sidemen drunk moments,0,50 / gta / top
the klopp era top 10 crazy matches,0,50 / gta / top
10 years of mixing advice 10 minutes,0,50 / gta / top
underrated w2s moments shorts,0,50 / gta / top
funniest sidemen gta fails,0,50 / gta / top
sidemen banter is too funny sidemen,0,50 / gta / top
most savage sidemen tinder lines,0,50 / gta / top
most offensive sidemen tinder lines,0,50 / gta / top
quotes that made the sidemen famous,0,50 / gta / top
sidemen cancelled moments,0,50 / gta / top
most iconic sidemen moments of all time,0,50 / gta / top
biggest sidemen gta fails,0,50 / gta / top
most gangsta moments in sports,0,50 / gta / top
most iconic football clips of all time,0,50 / gta / top
sidemen memory test sus edition,0,50 / gta / top
0 iq moments,0,50 / gta / top
sidemen guessmoji dumbest edition,0,50 / gta / top
sidemen guess the celebrity harry vs everyone edition,0,50 / gta / top
sidemen guess the celebrity,0,50 / gta / top
sidemen guess the model,0,50 / gta / top
sidemen guess the model,0,50 / gta / top
sidemen memory test,0,50 / gta / top
do all the sidemen think the same deji edition,0,50 / gta / top
sidemen pub quiz,0,50 / gta / top
sidemen silent challenge,0,50 / gta / top
sidemen liars bar ksi edition,0,50 / gta / top
sidemen liars bar in real life,0,50 / gta / top
sidemen rank their top 3,0,50 / gta / top
sidemen three way,0,50 / gta / top
sidemen debate club,0,50 / gta / top
sidemen offensive 5 second challenge,0,50 / gta / top
sidemen 5 second challenge,0,50 / gta / top
first to guess the sidemen password wins,0,50 / gta / top
sidemen password game,0,50 / gta / top
can the sidemen find the imposter,0,50 / gta / top
who is the smartest sidemen member,0,50 / gta / top
sidemen youtuber guess who,0,50 / gta / top
smart or cheating moments in sports,0,50 / gta / top
worst sidemen among us throws of all time,0,50 / gta / top
best sidemen lockdown among us moments,0,50 / gta / top
funniest sidemen among us,0,50 / gta / top
sidemen among us infinity war thanos role,0,50 / gta / top
best of sidemen reacts 2023,0,50 / gta / top
funniest sidemen gaming moments,0,50 / gta / top
ksi getting bullied for 11 minutes,0,50 / gta / top
best stop vikkstar abuse moments,0,50 / gta / top
vikkstars most savage moments of all time,0,50 / gta / top
biggest sidemen irl fails,0,50 / gta / top
dumbest sidemen moments,0,50 / gta / top
best last minute goals in football,0,50 / gta / top
biggest mistakes in football,0,50 / gta / top
sidemen offensive trivia,0,50 / gta / top
biggest mistakes in football,0,50 / gta / top
the biggest snakes in football,0,50 / gta / top
ranking men by attractiveness 5 guys 5 girls,0,50 / gta / top
sidemen pop the balloon,0,50 / gta / top
sidemen blind ranking outrageous edition,0,50 / gta / top
are sidemen on the same wavelength,0,50 / gta / top
1 more hour of sidemenreacts funniest moments,0,50 / gta / top
w2s being bog for 10 minutes,0,50 / gta / top
most iconic tbjzl moments of all time,0,50 / gta / top
the big wedge golf mini major 2,0,50 / gta / top
sidemen google feud,0,50 / gta / top
sidemen uk vs us slang,0,50 / gta / top
top 10 most spoilt kids in the world,0,50 / gta / top
top 10 youtubers who have been arrested,0,50 / gta / top
worst airport security fails of all time,0,50 / gta / top
sidemen guess the emoji youtuber edition,0,50 / gta / top
sidemen whos most likely to impostor edition,0,50 / gta / top
who is the dumbest sidemen member,0,50 / gta / top
who is the smartest sidemen,0,50 / gta / top
sidemen react to which ex was best in bed,0,50 / gta / top
sidemen find the hottest person,0,50 / gta / top
most brutal moments on the button,0,50 / gta / top
sidemen would you rather challenge 2,0,50 / gta / top
best sidemen abroad moments,0,50 / gta / top
severely underrated sidemen sunday moments,0,50 / gta / top
best sidemen friends moments,0,50 / gta / top
funniest side gameshow moments,0,50 / gta / top
funniest side moments of all time,0,50 / gta / top
best worst sidemen jokes of all time,0,50 / gta / top
best sidemen your mum jokes 1,0,50 / gta / top
funniest sidemen forfeits of all time,0,50 / gta / top
best old sidemen moments,0,50 / gta / top
best sidemen beef era moments,0,50 / gta / top
top 10 sidemen charity match moments,0,50 / gta / top
lockdown arsenal the worst team ever,0,50 / gta / top
sidemen whos most likely to impostor role,0,50 / gta / top
sidemen taskmaster,0,50 / gta / top
best jj olatunji moments,0,50 / gta / top
w2s most offensive moments,0,50 / gta / top
best sidemen house moments,0,50 / gta / top
w2s most offensive moments of all time,0,50 / gta / top
best sidemen 20v1 moments,0,50 / gta / top
best of sidemen reacts 2024,0,50 / gta / top
most savage comebacks of all time,0,50 / gta / top
who is the most athletic sidemen,0,50 / gta / top
sidemen vs worlds best geoguessr player,0,50 / gta / top
sidemen most expensive car challenge,0,50 / gta / top
sidemen 100000 mystery box challenge,0,50 / gta / top
sidemen taskmaster,0,50 / gta / top
the worst transfers of all time,0,50 / gta / top
the sidemen rate their own songs,0,50 / gta / top
sidemen among us cooking challenge,0,50 / gta / top
worst sidemen trims of all time,0,50 / gta / top
the price is right sidemen edition,0,50 / gta / top
sidemen the price is right,0,50 / gta / top
do all the sidemen think the same josh edition,0,50 / gta / top
sidemen 10000 vs 10 football match,0,50 / gta / top
sidemen forfeit foot golf,0,50 / gta / top
sidemen worlds hardest cooking challenge,0,50 / gta / top
sidemen worlds hardest food challenge,0,50 / gta / top
sidemen among us cops vs robbers roles,0,50 / gta / top
sidemen halloween fortnite,0,50 / gta / top
new fortnite chapter 5 with josh filly,0,50 / gta / top
the insane history of carnage,0,50 / gta / top
fortnite set us a challenge,0,50 / gta / top
the greatest sidemen comeback,0,50 / gta / top
the greatest fortnite duo returns,0,50 / gta / top
funniest new sidemen among us moments,0,50 / gta / top
sidemen among us but the imposters have magic powers,0,50 / gta / top
sidemen among us airlock madness,0,50 / gta / top
sidemen among us chaos mode but theres a third imposter role,0,50 / gta / top
sidemen among us phantom mystic roles,0,50 / gta / top
sidemen among us xmas chaos mode hypnotist edition,0,50 / gta / top
the batman who laughs explained,0,50 / gta / top
sidemen among us but the whole lobbies infected,0,50 / gta / top
sidemen among us grinch role but its the dumbest lobby of all time,0,50 / gta / top
sidemen among us chaos mode,0,50 / gta / top
sidemen among us traitor role betray the crew to win,0,50 / gta / top
sidemen among us but we add a new role every single game 2 hour special,0,50 / gta / top
sidemen among us but we add a new role every single game 2 hour special,0,50 / gta / top
sidemen among us traitor role betray the crew to win,0,50 / gta / top
sidemen among us lovers role ksi returns,0,50 / gta / top
the best year of music,0,50 / gta / top
sidemen among us puppet master role take control of other players,0,50 / gta / top
sidemen among us revive role bring dead bodies back to life,0,50 / gta / top
sidemen among us thor role lightning strike to win,0,50 / gta / top
sidemen among us ksi shapeshifter masterclass,0,50 / gta / top
sidemen among us mafia role theres 3 imposters,0,50 / gta / top
sidemen among us but everything is double speed,0,50 / gta / top
sidemen among us chaos mode but theres a third imposter role,0,50 / gta / top
sidemen among us chaos mode painful edition,0,50 / gta / top
sidemen among us but the imposters can talk to each other,0,50 / gta / top
sidemen among us proximity chat but everyones a jester,0,50 / gta / top
sidemen toty challenge pack the best player you can before the timer runs out,0,50 / gta / top
big wedge king of the hill golf challenge,0,50 / gta / top
sidemen among us proximity chat shapeshifter special,0,50 / gta / top
sidemen among us draft mode choose your own role,0,50 / gta / top
new sidemen among us 10 hours special,0,50 / gta / top
kpix 5,0,50 / gta / top
10 hours of sidemen among us to fall asleep,0,50 / gta / top
new sidemen play quiplash 90 minutes edition,0,50 / gta / top
10 hours of sidemen among us to fall asleep,0,50 / gta / top
coldest sidemen gta moments,0,50 / gta / top
most likely leave sidemen first,0,50 / gta / top
new sidemen play gta v 10 hours to fall asleep,0,50 / gta / top
new 5 hours of sidemen gta v to watch while you eat,0,50 / gta / top
new sidemen play gta v 7 hours special,0,50 / gta / top
revenge moments football,0,50 / gta / top
football strange moments,0,50 / gta / top
2 hours of best sidemen gta to watch while you eat,0,50 / gta / top
new 2 hours of sidemen gta v to watch while you eat,0,50 / gta / top
new sidemen play gta v 9 hours to fall asleep,0,50 / gta / top
new sidemen play gta v 7 hours to fall asleep,0,50 / gta / top
gta 5 funny moments 320 with vikkstar gta 5 online funny moments,0,50 / gta / top
gta 5 funny moments soggy ramp rage wksi zerkaa w2s vikkstar miniminter,0,50 / gta / top
gta 5 funny moments 521 with vikkstar,0,50 / gta / top
sidemen forfeit pack opening challenge,0,50 / gta / top
sidemen fut draft challenge vs pro for 10000,0,50 / gta / top
new sidemen play gta v 7 hours to fall asleep,0,50 / gta / top
the brutality of the strangers chapter 1,0,50 / gta / top
the top 10 best lego sets of 2024,0,50 / gta / top
lockdown arsenal the worst team ever,0,50 / gta / top
the dark reality of being an arsenal fan,0,50 / gta / top
the 30 greatest film challenge 2 3160,0,50 / gta / top
new sidemen play gta v 7 hours to fall asleep,0,50 / gta / top
the dark reality of being an arsenal fan,0,50 / gta / top
the philosophy of house of cards wisecrack edition,0,50 / gta / top
new sidemen play gta v 6 hours to fall asleep,0,50 / gta / top
new sidemen play gta v 6 hours to fall asleep,0,50 / gta / top
new sidemen play gta v 2 hours of the funniest moments,0,50 / gta / top
new 3 hours of the funniest sidemen gta v,0,50 / gta / top
the 30 greatest film challenge 2 3160,0,50 / gta / top
new 3 hours of sidemen gta v to watch while you eat,0,50 / gta / top
1 hour of sidemen guess the link,0,50 / gta / top
craziest high speed police chase of all time,0,50 / gta / top
60 minutes thats lot of minutes,0,50 / gta / top
the most notorious serial killers explained 24 minutes,0,50 / gta / top
the office but its just debates,0,50 / gta / top
family guy funny moments 30 minutes,0,50 / gta / top
my 50 songs of 2023,0,50 / gta / top
ranking the worst haircuts,0,50 / gta / top
top 5 best street moments,0,50 / gta / top
first meme of 2025,0,50 / gta / top
first meme of 2024,0,50 / gta / top
the first meme of 2024,0,50 / gta / top
harry hates sidemen girlfriends w2s,0,50 / gta / top
the first ever big wedge hole one,0,50 / gta / top
the worst golf shot big wedge history,0,50 / gta / top
the worlds best golf halfway hut,0,50 / gta / top
funniest big wedge moment ever,0,50 / gta / top
golf trick shots with miniminter,0,50 / gta / top
big wedge play among us golf 3,0,50 / gta / top
the worst superhero movies ever,0,50 / gta / top
i played knock offs of most famous games gta cod minecraft fortnite,0,50 / gta / top
sidemen spin the wheel,0,50 / gta / top
proof im best fortnite player sidemen,0,50 / gta / top
big wedge play among us golf 2,0,50 / gta / top
the big wedge golf mini major,0,50 / gta / top
the big wedge golf mini major,0,50 / gta / top
king 5,0,50 / gta / top
sidemen sidemen team football challenge,0,50 / gta / top
spin the wheel golf challenge,0,50 / gta / top
football most impossible moments,0,50 / gta / top
the big wedge team cup the finale,0,50 / gta / top
ishowspeed getting mad 10 minutes straight,0,50 / gta / top
sidemen survive the 7 wonders of the world,0,50 / gta / top
king 5,0,50 / gta / top
top 10 us cities everyones fleeing 2025,0,50 / gta / top
0 respect moments football,0,50 / gta / top
the presidential zomboys escape mob of dead,0,50 / gta / top
sidemen 4 4 on fc25 rush,0,50 / gta / top
revenge karma moments football,0,50 / gta / top
big wedge punishment golf challenge,0,50 / gta / top
how the biggest football club england lost all respect,0,50 / gta / top
king 5,0,50 / gta / top
how make the best hot chocolate of all time 4 ways,0,50 / gta / top
entire comedy show of only crowd work,0,50 / gta / top
the big football quiz of the year 2024,0,50 / gta / top
the worst political slogan of all time,0,50 / gta / top
worst indian ever,0,50 / gta / top
indians are the best matchmakers,0,50 / gta / top
the greatest wingman,0,50 / gta / top
top 5 antony fyp football viralvideo,0,50 / gta / top
the biggest snakes in football,0,50 / gta / top
the most disappointing nation football history,0,50 / gta / top
sidemen play og fortnite,0,50 / gta / top
the worst transfers of all time,0,50 / gta / top
first time sidemen play fortnite ballistic,0,50 / gta / top
sidemen play og fortnite with lazarbeam and lachlan,0,50 / gta / top
the worst job in hell the sonderkommando of auschwitz,0,50 / gta / top
lockdown arsenal the worst team ever,0,50 / gta / top
the big wedge team cup the finale,0,50 / gta / top
the most talented human history,0,50 / gta / top
the dark science of crucifixion,0,50 / gta / top
the curiousity of penguin,0,50 / gta / top
football most heated moments,0,50 / gta / top
the top 10 pieces of evidence from buzzfeed unsolved ghost files,0,50 / gta / top
i tried top 5 restaurants america,0,50 / gta / top
football revenge karma moments,0,50 / gta / top
the brutality of smile,0,50 / gta / top
king 5,0,50 / gta / top
i made the most satisfying desk,0,50 / gta / top
king 5,0,50 / gta / top
king 5,0,50 / gta / top
king 5,0,50 / gta / top
king 5 multiview,0,50 / gta / top
sidemen play liars bar,0,50 / gta / top
the ultimate office iceberg easter eggs theories more,0,50 / gta / top
the ultimate office iceberg easter eggs theories more,0,50 / gta / top
king 5,0,50 / gta / top
ishowspeed football charity match best moments,0,50 / gta / top
ishowspeed funny moments compilation try not to laugh 11,0,50 / gta / top
nfl doing too much moments,0,50 / gta / top
dressing room drama the of all or nothing,0,50 / gta / top
big wedge play among us golf 2,0,50 / gta / top
king 5,0,50 / gta / top
7 most disastrous career moves of all time,0,50 / gta / top
the problem with football fans,0,50 / gta / top
heated who are best youngsters world,0,50 / gta / top
king 5 multiview,0,50 / gta / top
the drunkest owners of bar rescue season 5,0,50 / gta / top
minecraft gaming setup shorts,0,50 / gta / top
minecrafts most insane build ever,0,50 / gta / top
i tried the worlds most expensive burger,0,50 / gta / top
ranking the top 5 pl players every position 2324,0,50 / gta / top
sidemen team golf tournament,0,50 / gta / top
sidemen silent challenge,0,50 / gta / top
the big wedge golf mini major,0,50 / gta / top
king 5 multiview,0,50 / gta / top
top 10 most handsome f1 drivers,0,50 / gta / top
top 20 most handsome footballers the world 2023,0,50 / gta / top
the hottest nba players of 2022,0,50 / gta / top
top 10 most handsome nba players,0,50 / gta / top
top 10 most handsome football players nfl,0,50 / gta / top
the big wedge golf mini major,0,50 / gta / top
the big wedge golf mini major,0,50 / gta / top
jims simplest prank the office us,0,50 / gta / top
you never forget the office us,0,50 / gta / top
big wedge punishment golf challenge,0,50 / gta / top
the most terrifying things our universe,0,50 / gta / top
king 5,0,50 / gta / top
the worst lego sets,0,50 / gta / top
king 5,0,50 / gta / top
casually explained the food of world,0,50 / gta / top
ghost stories funny dub moments,0,50 / gta / top
king 5 multiview,0,50 / gta / top
king 5,0,50 / gta / top
the worst disasters history,0,50 / gta / top
the chase big wedge golf challenge,0,50 / gta / top
i remade gta in minecraft,0,50 / gta / top
18 minutes of wreckfest gameplay,0,50 / gta / top
the 9 year old haaland sunday leagues greatest moments 10,0,50 / gta / top
nfl best catches of 20232024 season,0,50 / gta / top
5 things the experts do in fantasy football drafts,0,50 / gta / top
the most terrifying cults ever exist,0,50 / gta / top
sidemen codenames,0,50 / gta / top
the sidemen play codenames,0,50 / gta / top
we opened the most chaotic restaurant ever,0,50 / gta / top
best of kill tony 642 hard edit,0,50 / gta / top
funny moments kill tony 675 hard edit,0,50 / gta / top
best of kill tony 674 hard edit,0,50 / gta / top
funny moments kill tony 646 hard edit,0,50 / gta / top
best of kill tony 645 hard edit,0,50 / gta / top
chrismd carries sidemen video for 14 minutes straight,0,50 / gta / top
we opened the most chaotic restaurant ever,0,50 / gta / top
i played in the most expensive golf tournament ever again,0,50 / gta / top
big wedge drunk golf challenge,0,50 / gta / top
best of kill tony 669,0,50 / gta / top
funny moments kill tony ep 668,0,50 / gta / top
sidemen minecraft build battle gone wrong,0,50 / gta / top
big wedge drunk golf challenge,0,50 / gta / top
best of kill tony 662,0,50 / gta / top
funny moments kill tony 661,0,50 / gta / top
funniest moments kill tony 644 hard edit,0,50 / gta / top
funny moments kill tony ep 649 hard edit,0,50 / gta / top
the office but context was found wrong place the office us,0,50 / gta / top
the best trades with every minecraft villager guide,0,50 / gta / top
best of kill tony 659,0,50 / gta / top
best of kill tony 658,0,50 / gta / top
funny moments kill tony 656,0,50 / gta / top
best moments from kill tony ep637 hard edit,0,50 / gta / top
the worst transfers of all time,0,50 / gta / top
lockdown arsenal the worst team ever,0,50 / gta / top
best of kill tony 641 hard edit,0,50 / gta / top
reacting to the glory days of youtube,0,50 / gta / top
the best way to get enchants in minecraft,0,50 / gta / top
best of kill tony 671 hard edit,0,50 / gta / top
funny moments kill tony 670 hard edit,0,50 / gta / top
best of kill tony 669,0,50 / gta / top
w2s willne stephen tries chrismds best moments,0,50 / gta / top
tony hinchcliffe being a savage for 10 minutes straight,0,50 / gta / top
smartest basketball moment of all time shorts,0,50 / gta / top
big wedge vs pro golfer challenge,0,50 / gta / top
big wedge vs pro golfer challenge,0,50 / gta / top
the most dangerous subway america,0,50 / gta / top
the most useless megaprojects world,0,50 / gta / top
the big wedge golf mini major,0,50 / gta / top
sidemen among us but the imposters can talk to each other,0,50 / gta / top
the big wedge golf mini major,0,50 / gta / top
sidemen play the end of fortnite og,0,50 / gta / top
big wedge vs pro golfer challenge,0,50 / gta / top
sidemen olympics 2024,0,50 / gta / top
spin the wheel golf challenge,0,50 / gta / top
king 5 multiview,0,50 / gta / top
sidemen house challenge in minecraft sidemen gaming,0,50 / gta / top
sidemen minecraft meme olympics sidemen gaming,0,50 / gta / top
over 2 hours of the office fan theory compilation,0,50 / gta / top
caseoh ranking food compilation 20 minutes,0,50 / gta / top
old shyamalan gives it away 5 minutes explained,0,50 / gta / top
19 minutes straight of bartender fails,0,50 / gta / top
top 10 knockouts at rio 2016 olympics top moments,0,50 / gta / top
the monsters beneath us the monument mythos,0,50 / gta / top
homelander all powers fights scenes the boys gen v season 1 4,0,50 / gta / top
the best finishes of 2024 so far,0,50 / gta / top
every mcu phase explained 10 minutes,0,50 / gta / top
impractical jokers funniest moments mashup part 24,0,50 / gta / top
impractical jokers funniest moments mashup part 23,0,50 / gta / top
stop worrying about calories the office us,0,50 / gta / top
ranking all nba logos worst best,0,50 / gta / top
this game has 0 reasons being this funny,0,50 / gta / top
football most heated moments,0,50 / gta / top
olympic sports explained by office comedy bites,0,50 / gta / top
the best goal of this video gets hung the louvre,0,50 / gta / top
20 minutes of useless information about gta v,0,50 / gta / top
