Title,KMeans Cluster,DBSCAN Cluster,Cluster Name
geazy power official video nef the pharaoh plo,7,-1,Random / Miscellaneous
roddy ricch the box official music video reaction,7,-1,Random / Miscellaneous
geazy power official video nef the pharaoh plo,7,-1,Random / Miscellaneous
geazy the plan official video,7,-1,Random / Miscellaneous
the best freekick video on youtube,7,322,Random / Miscellaneous
ksi x lil wayne lose official music video,7,375,Random / Miscellaneous
jenna anne the gay song lyric video,7,-1,Random / Miscellaneous
tee grizzley first day out official music video reaction,7,-1,Random / Miscellaneous
uw informatics application video,7,-1,Random / Miscellaneous
tick tickboom official teaser netflix,7,-1,Random / Miscellaneous
venom let there be carnage official trailer hd,7,-1,Random / Miscellaneous
venom let there be carnage official trailer hd,7,-1,Random / Miscellaneous
lil baby gunna business is business official audio,7,-1,Random / Miscellaneous
nio garcia x j balvin x bad bunny am remix video oficial,7,-1,Random / Miscellaneous
venom official trailer 2021,7,-1,Random / Miscellaneous
venom let there be carnage official trailer hd,7,-1,Random / Miscellaneous
ksi x lil wayne lose official music video,7,375,Random / Miscellaneous
venom let there be carnage official trailer hd,7,-1,Random / Miscellaneous
sidemen the movie official trailer,7,-1,Random / Miscellaneous
the best freekick video on youtube,7,322,Random / Miscellaneous
sidemen beef lets be havin you diss track official video,7,-1,Random / Miscellaneous
spiderman no way home official teaser trailer,7,-1,Random / Miscellaneous
randolph manchild deji diss track official video,7,37,Random / Miscellaneous
ksi randolph beerus lyrics official lyrics,7,-1,Random / Miscellaneous
ksi randolph beerus official music video,7,351,Random / Miscellaneous
spiderman no way home official teaser trailer hd,7,-1,Random / Miscellaneous
geazy running wild tumblr girls official video kossisko,7,37,Random / Miscellaneous
ksi randolph beerus official music video,7,351,Random / Miscellaneous
ksi x lil wayne lose official music video,7,375,Random / Miscellaneous
jack harlow automatic official audio,7,-1,Random / Miscellaneous
juice wrld hear me calling official music video reaction w juice wrld,7,-1,Random / Miscellaneous
ski mask the slump god admit it official music video w ski mask adin ross,7,-1,Random / Miscellaneous
tory lanez skat feat dababy official music video reaction w tory lanez adin ross,7,-1,Random / Miscellaneous
6ix9ine gooba official music video reaction,7,238,Random / Miscellaneous
w2s ksi sucks ricegum ksi diss track official video reaction,7,-1,Random / Miscellaneous
qa video questions,7,-1,Random / Miscellaneous
tobi manny destined for greatness feat janell official music video,7,299,Random / Miscellaneous
three lions footballs coming home official video,7,-1,Random / Miscellaneous
randolph manchild deji diss track official video,7,37,Random / Miscellaneous
the end sidemen diss track deji reply official music video,7,-1,Random / Miscellaneous
ksis little brother deji diss track official music video,7,299,Random / Miscellaneous
w2s ksi sucks ricegum ksi diss track official video,7,-1,Random / Miscellaneous
ksi x lil wayne lose official music video,7,375,Random / Miscellaneous
ksi two birds one stone official music video,7,-1,Random / Miscellaneous
ksi randolph beerus official music video,7,351,Random / Miscellaneous
ksi x lil wayne lose official music video,7,375,Random / Miscellaneous
ksi x lil wayne lose official music video,7,375,Random / Miscellaneous
kodaline brother official video,7,-1,Random / Miscellaneous
ksi x lil wayne lose official music video,7,375,Random / Miscellaneous
nolifeshaq reacts ksi x lil wayne lose,7,-1,Random / Miscellaneous
ksi x lil wayne lose official music video,7,375,Random / Miscellaneous
lionel messi the goat official movie,7,-1,Random / Miscellaneous
she lost everything she loved coldplay fix you sad music video,7,-1,Random / Miscellaneous
lion mentality motivational video,7,-1,Random / Miscellaneous
success is lonely road motivational video,7,-1,Random / Miscellaneous
breakup motivational video one bad day,7,-1,Random / Miscellaneous
smiley over the top feat drake official audio,7,-1,Random / Miscellaneous
fetty wap trap queen official video prod by tony fadd,7,453,Random / Miscellaneous
tinie tempah girls like zara larsson official video,7,-1,Random / Miscellaneous
tobi manny destined for greatness feat janell official music video,7,299,Random / Miscellaneous
jack harlow whats poppin feat dababy tory lanez lil wayne official video,7,-1,Random / Miscellaneous
a boogie wit da hoodie drowning feat kodak black official audio,7,-1,Random / Miscellaneous
aap rocky praise the lord da shine official video skepta,7,-1,Random / Miscellaneous
ksi cap feat offset official music video,7,-1,Random / Miscellaneous
ksi randolph beerus official music video,7,351,Random / Miscellaneous
deji sidemen diss track official music video,7,-1,Random / Miscellaneous
sidemen the gift ft sx official music video,7,398,Random / Miscellaneous
bts mic drop steve aoki remix official mv,7,-1,Random / Miscellaneous
cardi b bodak yellow official music video,7,-1,Random / Miscellaneous
usher yeah official video lil jon ludacris,7,-1,Random / Miscellaneous
mkto classic official video,7,182,Random / Miscellaneous
prince royce stuck on feeling official lyric video snoop dogg,7,-1,Random / Miscellaneous
trapp tarell my suicide letter full storyofficial music video,7,-1,Random / Miscellaneous
meek mill lord knows official instrumental remade by dell beats,7,-1,Random / Miscellaneous
billie eilish ocean eyes official music video,7,37,Random / Miscellaneous
young thug meek mill tshyne that go official audio young stoner life,7,-1,Random / Miscellaneous
lil baby feat lil uzi vert commercial official audio,7,-1,Random / Miscellaneous
nav dont need friends feat lil baby,7,-1,Random / Miscellaneous
money man 24 official video lil baby,7,-1,Random / Miscellaneous
gunna oh okay young thug lil baby official music video,7,-1,Random / Miscellaneous
deji ran official music video,7,237,Random / Miscellaneous
randolph manchild deji diss track official video,7,37,Random / Miscellaneous
ksi two birds one stone official music video,7,-1,Random / Miscellaneous
chrismd lost over 100000 making this video,7,-1,Random / Miscellaneous
macklemore x ryan lewis wings official music video,7,-1,Random / Miscellaneous
macklemore ryan lewis thrift shop feat wanz official video,7,453,Random / Miscellaneous
macklemore ryan lewis cant hold us feat ray dalton official music video,7,-1,Random / Miscellaneous
deorro x chris brown five more hours official video ultra records,7,-1,Random / Miscellaneous
omarion ft chris brown jhene aiko post to be official music video,7,-1,Random / Miscellaneous
fetty wap my way feat monty official video,7,-1,Random / Miscellaneous
fetty wap 679 feat remy boyz official video,7,37,Random / Miscellaneous
chris brown look at me now official video lil wayne busta rhymes,7,-1,Random / Miscellaneous
saweetie best friend feat doja cat official music video,7,-1,Random / Miscellaneous
ksi killa killa thrilla thrilla feat aiyanalee official music video,7,-1,Random / Miscellaneous
ksi two birds one stone official music video,7,-1,Random / Miscellaneous
sidemen the gift ft sx official music video,7,398,Random / Miscellaneous
deorro x chris brown five more hours official video ultra records,7,-1,Random / Miscellaneous
benny blanco juice wrld graduation official music video,7,37,Random / Miscellaneous
logic 18002738255 alessia cara khalid official video,7,37,Random / Miscellaneous
olivia rodrigo all i want official video,7,-1,Random / Miscellaneous
anson seabra broken official lyric video,7,37,Random / Miscellaneous
anson seabra i cant carry this anymore official lyric video,7,-1,Random / Miscellaneous
the weeknd earned it from fifty shades of grey official lyric video,7,-1,Random / Miscellaneous
everybody loves an outlaw i see red official lyric video,7,-1,Random / Miscellaneous
wisin yandel jennifer lopez follow the leader official video jennifer lopez,7,-1,Random / Miscellaneous
ksi killa killa feat aiyanalee official lyric video,7,299,Random / Miscellaneous
lil wayne 6 foot 7 foot cory gunz explicit official music video,7,-1,Random / Miscellaneous
ksi killa killa thrilla thrilla feat aiyanalee official music video,7,-1,Random / Miscellaneous
follow the leader lyric video,7,-1,Random / Miscellaneous
anson seabra i cant carry this anymore official lyric video,7,-1,Random / Miscellaneous
cardi b bodak yellow official music video,7,-1,Random / Miscellaneous
coolio gangstas paradise feat lv official music video,7,37,Random / Miscellaneous
pop smoke welcome to the party official lyrics meaning verified,7,-1,Random / Miscellaneous
jackboys pop smoke travis scott gatti 8d audio,7,-1,Random / Miscellaneous
travis scott goosebumps kendrick lamar 8d audio,7,423,Random / Miscellaneous
lil yachty nbayoungboat audio youngboy never broke again,7,-1,Random / Miscellaneous
lil yachty nbayoungboat audio youngboy never broke again,7,-1,Random / Miscellaneous
the unholy official trailer hd now playing theaters,7,-1,Random / Miscellaneous
future lil uzi vert thats it official music video,7,-1,Random / Miscellaneous
tee grizzley vaults lil yachty official lyric video,7,-1,Random / Miscellaneous
tee grizzley vaults lil yachty official video,7,-1,Random / Miscellaneous
tory lanez stupid again official music video edited by tory lanez joann,7,453,Random / Miscellaneous
money man 24 official video lil baby,7,-1,Random / Miscellaneous
lil uzi vert xo tour llif3 official lyric video,7,-1,Random / Miscellaneous
gryffin bipolar sunshine whole heart official video,7,37,Random / Miscellaneous
logic 18002738255 alessia cara khalid official audio,7,324,Random / Miscellaneous
the kid laroi without you official video,7,-1,Random / Miscellaneous
logic 18002738255 alessia cara khalid official video,7,37,Random / Miscellaneous
logic 18002738255 alessia cara khalid official audio,7,324,Random / Miscellaneous
colbie caillat try official video,7,-1,Random / Miscellaneous
jackboys pop smoke travis scott gatti 8d audio,7,-1,Random / Miscellaneous
official minecraft trailer,7,-1,Random / Miscellaneous
bobby shmurda hot ngga official music video,7,37,Random / Miscellaneous
the best freekick video on youtube,7,322,Random / Miscellaneous
naka sauce official audio,7,-1,Random / Miscellaneous
juice wrld lucid dreams official music video,7,-1,Random / Miscellaneous
soccer pump up mix hype video 2015 hd,7,306,Random / Miscellaneous
msoc 2019 ncaa tournament hype video,7,-1,Random / Miscellaneous
cepilln la feria de cepillin video oficial hd,7,-1,Random / Miscellaneous
jack harlow hey big head official audio,7,-1,Random / Miscellaneous
lil baby gunna drake never recover official audio,7,452,Random / Miscellaneous
