Title,Cluster,Cluster Name
top 25 most incredible football goals of the year,4,the / of / in / sidemen / us
ksi vs the easter bunny,4,the / of / in / sidemen / us
the sidemen laugh at ksi for 25 minutes straight,4,the / of / in / sidemen / us
golf but everyone quits sidemen gaming,4,the / of / in / sidemen / us
golf with your enemies sidemen gaming,4,the / of / in / sidemen / us
do all the sidemen think the same 2,4,the / of / in / sidemen / us
do all the sidemen think the same,4,the / of / in / sidemen / us
biggest upsets of the 2021 college football season,4,the / of / in / sidemen / us
sidemen 500 car challenge,4,the / of / in / sidemen / us
ksi when the bully becomes the bullied for 5 minutes,4,the / of / in / sidemen / us
worst golf shots of the year 2021,4,the / of / in / sidemen / us
what are the odds most unique shots on the pga tour,4,the / of / in / sidemen / us
top 10 tiger woods shots on the pga tour,4,the / of / in / sidemen / us
going to 3 nba games in 24 hours,4,the / of / in / sidemen / us
nba lagging in real life moments,4,the / of / in / sidemen / us
heres hogg deeney best end to a football match ever,4,the / of / in / sidemen / us
im at an all time low,4,the / of / in / sidemen / us
ksi is too rich for the sidemen sidemen shorts,4,the / of / in / sidemen / us
just a typical sidemen compilation,4,the / of / in / sidemen / us
sidemen 10000 easter egg hunt,4,the / of / in / sidemen / us
the power of a mothers love,4,the / of / in / sidemen / us
w2s being shit at among us for 6 minutes,4,the / of / in / sidemen / us
funniest sidemen forfeits of all time,4,the / of / in / sidemen / us
most insane panic rooms in the world,4,the / of / in / sidemen / us
superhuman skills in football,4,the / of / in / sidemen / us
playing the first ever spiderman game,4,the / of / in / sidemen / us
sidemen play golf it but the map is impossible,4,the / of / in / sidemen / us
playing fall guys on golf sidemen gaming,4,the / of / in / sidemen / us
sidemen big fat quiz of the year 2020,4,the / of / in / sidemen / us
among us in golf it sidemen gaming,4,the / of / in / sidemen / us
sidemen punishment basketball,4,the / of / in / sidemen / us
the ultimate sidemen ping pong tournament,4,the / of / in / sidemen / us
the most embarrassing sidemen tweets of all time,4,the / of / in / sidemen / us
sidemen pub golf europe edition,4,the / of / in / sidemen / us
ksi being bullied by the sidemen 2,4,the / of / in / sidemen / us
sidemen guess the song challenge,4,the / of / in / sidemen / us
real life fortnite challenge vs my bro,4,the / of / in / sidemen / us
the sidemen play survive the internet sidemen gaming,4,the / of / in / sidemen / us
the sidemens biggest cancelled moments,4,the / of / in / sidemen / us
just a typical sidemen compilation,4,the / of / in / sidemen / us
the k in ksi stands for knowledge 3,4,the / of / in / sidemen / us
the k in ksi stands for knowledge 2,4,the / of / in / sidemen / us
best of sidemen challenges,4,the / of / in / sidemen / us
this would end the sidemen,4,the / of / in / sidemen / us
my favorite computer science programming project of all time how i broke the coding barrier,4,the / of / in / sidemen / us
the k in ksi stands for knowledge 2,4,the / of / in / sidemen / us
the k in ksi stands for knowledge 3,4,the / of / in / sidemen / us
the k in ksi stands for knowledge 3,4,the / of / in / sidemen / us
whos got bigger wood out of you 2,4,the / of / in / sidemen / us
yung filly is not the at history,4,the / of / in / sidemen / us
sidemen find out their football stats,4,the / of / in / sidemen / us
the sidemen play quiplash sidemen gaming,4,the / of / in / sidemen / us
who is the best sidemen striker,4,the / of / in / sidemen / us
quiplash with the boys sidemen gaming,4,the / of / in / sidemen / us
sidemen describe youtubers in one word,4,the / of / in / sidemen / us
sidemen categories,4,the / of / in / sidemen / us
sidemen 10000 call out penalties,4,the / of / in / sidemen / us
the end of fortnite event went stupid,4,the / of / in / sidemen / us
sidemen 10000 crossbar challenge,4,the / of / in / sidemen / us
most offensive cards against humanity ever,4,the / of / in / sidemen / us
the deadest sidemen jokes ever,4,the / of / in / sidemen / us
sidemen ball launcher challenge,4,the / of / in / sidemen / us
the best freekick video on youtube,4,the / of / in / sidemen / us
sidemen best of quiplash,4,the / of / in / sidemen / us
sidemen blind dating but all the answers are outrageous 2,4,the / of / in / sidemen / us
sidemen blind dating but all the answers are outrageous,4,the / of / in / sidemen / us
w2s making the sidemen laugh,4,the / of / in / sidemen / us
the worst line in scriptwriting history,4,the / of / in / sidemen / us
superhuman skills in football,4,the / of / in / sidemen / us
most humiliating skills,4,the / of / in / sidemen / us
best football skills 202122 15,4,the / of / in / sidemen / us
the sidemen are splitting up sidemen rumours,4,the / of / in / sidemen / us
who harry wants at the next sidemen charity match,4,the / of / in / sidemen / us
inside the new schools university center students move in to the dormitories,4,the / of / in / sidemen / us
sidemen tinder 4 got cancelled again,4,the / of / in / sidemen / us
first to guess the sidemen password wins,4,the / of / in / sidemen / us
this hurt callux the most,4,the / of / in / sidemen / us
the btecmen,4,the / of / in / sidemen / us
ksi has the skills,4,the / of / in / sidemen / us
longest game ever,4,the / of / in / sidemen / us
sidemen do the wap,4,the / of / in / sidemen / us
harry breaks the set of a sidemen video,4,the / of / in / sidemen / us
sidemen party behind the scenes ad,4,the / of / in / sidemen / us
sidemen party behind the scenes part two ad,4,the / of / in / sidemen / us
sidemen party behind the scenes part three ad,4,the / of / in / sidemen / us
it happens to the of us,4,the / of / in / sidemen / us
the time ksi nearly killed miniminter,4,the / of / in / sidemen / us
who will be in the next sidemen tinder,4,the / of / in / sidemen / us
vikkstar the virgin,4,the / of / in / sidemen / us
will sidemen get fifa 22 kits,4,the / of / in / sidemen / us
sidemen call out the haters,4,the / of / in / sidemen / us
the next sidemen tinder idea,4,the / of / in / sidemen / us
the most outrageous amazon review ever,4,the / of / in / sidemen / us
ksi loses 4k in 1 minute,4,the / of / in / sidemen / us
the dumbest sidemen,4,the / of / in / sidemen / us
women rate the strongest sidemen,4,the / of / in / sidemen / us
ksi watches w2s almost injure the sidemen,4,the / of / in / sidemen / us
the most exciting voice in sports gus johnson best calls of all time,4,the / of / in / sidemen / us
sidemen party behind the scenes ad,4,the / of / in / sidemen / us
sidemen party behind the scenes part two ad,4,the / of / in / sidemen / us
sidemen party behind the scenes part three ad,4,the / of / in / sidemen / us
it happens to the of us,4,the / of / in / sidemen / us
the time ksi nearly killed miniminter,4,the / of / in / sidemen / us
who will be in the next sidemen tinder,4,the / of / in / sidemen / us
vikkstar the virgin,4,the / of / in / sidemen / us
will sidemen get fifa 22 kits,4,the / of / in / sidemen / us
sidemen call out the haters,4,the / of / in / sidemen / us
the next sidemen tinder idea,4,the / of / in / sidemen / us
the most outrageous amazon review ever,4,the / of / in / sidemen / us
ksi loses 4k in 1 minute,4,the / of / in / sidemen / us
who harry wants at the next sidemen charity match,4,the / of / in / sidemen / us
do the sidemen think the same as onlyfans girls,4,the / of / in / sidemen / us
when simon miniminter joined the girls in 20 vs 1 ksi dating challenge simon dates ksi leaves,4,the / of / in / sidemen / us
biggest upsets of the 202122 college football season,4,the / of / in / sidemen / us
trash talk in call of duty mw2,4,the / of / in / sidemen / us
trash talking in call of duty games,4,the / of / in / sidemen / us
he fell for the oldest trick in the book,4,the / of / in / sidemen / us
i went on a 2nd date with the sidemen 20 vs 1 girl,4,the / of / in / sidemen / us
harry maguire defender of the century,4,the / of / in / sidemen / us
top 5 worst zombie maps of all time call of duty bo2 bo and waw maps,4,the / of / in / sidemen / us
ksi when the bully becomes the bullied for 5 minutes,4,the / of / in / sidemen / us
w2s being shit at among us for 6 minutes,4,the / of / in / sidemen / us
one of the rarest things that can happen in bo2,4,the / of / in / sidemen / us
the legend of the bermuda triangle,4,the / of / in / sidemen / us
the cult in a boarding school,4,the / of / in / sidemen / us
the backrooms fear of being forgotten,4,the / of / in / sidemen / us
kairo anatomy of the scariest scene ever,4,the / of / in / sidemen / us
searching for the five,4,the / of / in / sidemen / us
gemini and the end of the world,4,the / of / in / sidemen / us
all of harrys terrible pick up lines from sidemen tinder,4,the / of / in / sidemen / us
the reason why dennis rodman is the greatest rebounder of all time,4,the / of / in / sidemen / us
shorts ksi vs dave at the brits britsunseen with youtube,4,the / of / in / sidemen / us
lilypichu shows you the bait ever in valorant,4,the / of / in / sidemen / us
ksi and behzinga talk about the sidemen beef,4,the / of / in / sidemen / us
one of the most satisfying scene in the tv history friends friendstvshow rachel ross phoebe,4,the / of / in / sidemen / us
the time ksi nearly killed miniminter,4,the / of / in / sidemen / us
2017 nba playoffs best moments to remember,4,the / of / in / sidemen / us
the sidemen being awkward around girls for 12 more minutes straight,4,the / of / in / sidemen / us
the sidemen being awkward around girls for 12 minutes straight,4,the / of / in / sidemen / us
out of pocket joke from harry,4,the / of / in / sidemen / us
best of sidemen sundays 14,4,the / of / in / sidemen / us
the dark knight rises bruce and selina ball scene hd,4,the / of / in / sidemen / us
the worst 20 seconds of basketball youll ever see,4,the / of / in / sidemen / us
the most dangerous sport in the world rugby,4,the / of / in / sidemen / us
sidemen categories,4,the / of / in / sidemen / us
best of sidemen sundays 7,4,the / of / in / sidemen / us
the cult in a boarding school,4,the / of / in / sidemen / us
best of sidemen sundays 13,4,the / of / in / sidemen / us
best of sidemen sundays 12,4,the / of / in / sidemen / us
best of sidemen sundays 11,4,the / of / in / sidemen / us
best of sidemen sundays 9,4,the / of / in / sidemen / us
best of sidemen sundays 8,4,the / of / in / sidemen / us
best of sidemen sundays 13,4,the / of / in / sidemen / us
sidemen hide seek in a football stadium,4,the / of / in / sidemen / us
best of sidemen sundays 26,4,the / of / in / sidemen / us
best of sidemen sundays 27,4,the / of / in / sidemen / us
sidemen complete this challenge win 10000,4,the / of / in / sidemen / us
all 68 ncaa tournament teams in 12 minutes,4,the / of / in / sidemen / us
everything wrong with batman begins in 6 minutes or less,4,the / of / in / sidemen / us
best of sidemen sundays 25,4,the / of / in / sidemen / us
best of sidemen sundays 24,4,the / of / in / sidemen / us
best moments of the 2021 ncaa march madness tournament,4,the / of / in / sidemen / us
the craziest day in college basketball history,4,the / of / in / sidemen / us
the riddler scene from the batman that needed nearly 200 takes,4,the / of / in / sidemen / us
best of sidemen sundays 12,4,the / of / in / sidemen / us
the batman funeral scene in theaters march 4,4,the / of / in / sidemen / us
top 10 most difficult piano pieces,4,the / of / in / sidemen / us
best of sidemen sundays 21,4,the / of / in / sidemen / us
best of sidemen sundays 20,4,the / of / in / sidemen / us
best of sidemen sundays 19,4,the / of / in / sidemen / us
everything great about the dark knight,4,the / of / in / sidemen / us
sidemen 10 million mansion hide and seek,4,the / of / in / sidemen / us
gus johnsons best college football calls,4,the / of / in / sidemen / us
for the year 3s,4,the / of / in / sidemen / us
and here we go batman vs joker the dark knight 4k hdr imax,4,the / of / in / sidemen / us
best of sidemen sundays 18,4,the / of / in / sidemen / us
best of sidemen sundays 17,4,the / of / in / sidemen / us
the pizza challenge,4,the / of / in / sidemen / us
he is a god of the game,4,the / of / in / sidemen / us
best of sidemen sundays 11,4,the / of / in / sidemen / us
dominic fike being unintentionally for 4 minutes straight pt2,4,the / of / in / sidemen / us
batman unmasked the psychology of the dark knight documentary,4,the / of / in / sidemen / us
the batman ending detail you missed in postcredit scene,4,the / of / in / sidemen / us
chrismd loses patience with the sidemen,4,the / of / in / sidemen / us
the riddler scene in the batman that went too far,4,the / of / in / sidemen / us
sidemen complete this challenge win 10000,4,the / of / in / sidemen / us
kill the batman the joker meets the mob the dark knight 4k hdr imax,4,the / of / in / sidemen / us
batman interrogates the joker the dark knight 4k hdr,4,the / of / in / sidemen / us
the batman main trailer,4,the / of / in / sidemen / us
the chase sidemen edition 2019,4,the / of / in / sidemen / us
the best goal of this video becomes an nft,4,the / of / in / sidemen / us
that wouldve been the moment of my life,4,the / of / in / sidemen / us
the grind the struggle,4,the / of / in / sidemen / us
the new chokii,4,the / of / in / sidemen / us
for the year 3s,4,the / of / in / sidemen / us
sidemen wheel of fortune,4,the / of / in / sidemen / us
the most savage sidemen moments of all time,4,the / of / in / sidemen / us
if the sidemen werent famous,4,the / of / in / sidemen / us
sidemen charity match challenges,4,the / of / in / sidemen / us
the sidemen helium challenge,4,the / of / in / sidemen / us
the cube sidemen edition,4,the / of / in / sidemen / us
the next sidemen tinder idea,4,the / of / in / sidemen / us
kendrick lamar is the most humble rapper ever,4,the / of / in / sidemen / us
the best beef in the game between eminem and mgk,4,the / of / in / sidemen / us
w2s tries prime for the first time,4,the / of / in / sidemen / us
my favorite player on each team part 8,4,the / of / in / sidemen / us
why the penn state whiteout is the best atmosphere in sports,4,the / of / in / sidemen / us
the game that put penn state on the map a game to remember,4,the / of / in / sidemen / us
karma in football,4,the / of / in / sidemen / us
the most effective strategy,4,the / of / in / sidemen / us
just a typical sidemen compilation,4,the / of / in / sidemen / us
scoring 1 goal like the greatest players ever,4,the / of / in / sidemen / us
w2s making the sidemen laugh,4,the / of / in / sidemen / us
8 flips in the air shorts,4,the / of / in / sidemen / us
how an army dentist had one of the most heroic deaths in us history shorts,4,the / of / in / sidemen / us
the dark knight rises bruce and bane in the pit hd,4,the / of / in / sidemen / us
is this the worst moment in basketball history shorts,4,the / of / in / sidemen / us
biggest hits of the 20212022 nfl season,4,the / of / in / sidemen / us
greatest us sports moments of the last decade 20102019,4,the / of / in / sidemen / us
in defense of the gentrification building,4,the / of / in / sidemen / us
the freekick challenge,4,the / of / in / sidemen / us
the most dramatic trade announcement in nba history,4,the / of / in / sidemen / us
nba send him to prison moments,4,the / of / in / sidemen / us
top 10 clap back by harry,4,the / of / in / sidemen / us
this is football 201617 the beautiful game,4,the / of / in / sidemen / us
cod4 mike myers 1 with the sidemen call of duty 4 michael myers,4,the / of / in / sidemen / us
the chase sidemen edition 2019,4,the / of / in / sidemen / us
the duo vs the pooo,4,the / of / in / sidemen / us
the chase sidemen edition 2019,4,the / of / in / sidemen / us
this is football 201617 the beautiful game,4,the / of / in / sidemen / us
an unexpected fireworks display harry potter and the order of the phoenix,4,the / of / in / sidemen / us
boggart harry potter and the prisoner of azkaban,4,the / of / in / sidemen / us
harry is chosen harry potter and the goblet of fire,4,the / of / in / sidemen / us
the best lamborghini aventador engine sounds ever,4,the / of / in / sidemen / us
transformers dark of the moon all megatron scenes,4,the / of / in / sidemen / us
the craziest moments from the office shorts,4,the / of / in / sidemen / us
football challenges with the worlds best goalkeepers,4,the / of / in / sidemen / us
this is football 201617 the beautiful game,4,the / of / in / sidemen / us
my top 10 ksi youtube videos,4,the / of / in / sidemen / us
the most dangerous sport in the world nfl,4,the / of / in / sidemen / us
i took 1526 shots and my top 10 goals are insane,4,the / of / in / sidemen / us
the best goal of this video becomes an nft,4,the / of / in / sidemen / us
harry potter getting in trouble for 3 minutes straight,4,the / of / in / sidemen / us
romione being the cutest couple for 4 minutes and 4 seconds straight,4,the / of / in / sidemen / us
hermione and ron arguing for 3 minutes straight,4,the / of / in / sidemen / us
the 5 most powerful slytherins in harry potter ranked,4,the / of / in / sidemen / us
ron weasley being a mood for 4 minutes straight,4,the / of / in / sidemen / us
just a typical sidemen compilation,4,the / of / in / sidemen / us
lionel messi most important goals ever the big games man hd,4,the / of / in / sidemen / us
handing out the diaper with the sniper,4,the / of / in / sidemen / us
ksi w2s among us masterclass,4,the / of / in / sidemen / us
harry potter is dead harry potter and the deathly hallows part 2,4,the / of / in / sidemen / us
nfl scary hits of the 2021 season warning,4,the / of / in / sidemen / us
scumptop 5 plays of his career,4,the / of / in / sidemen / us
optic scump whos the in the gameeeeeeee,4,the / of / in / sidemen / us
nba the brick factory compilation,4,the / of / in / sidemen / us
the best goal of this video becomes an nft,4,the / of / in / sidemen / us
the single shot challenge easy,4,the / of / in / sidemen / us
rocking out with the shotfun,4,the / of / in / sidemen / us
the worst teammates in warzone,4,the / of / in / sidemen / us
the best goal of this video becomes an nft,4,the / of / in / sidemen / us
sidemen big fat quiz of the year 2019,4,the / of / in / sidemen / us
comeback of the century mp7,4,the / of / in / sidemen / us
ranking the most powerful avengers in the mcu,4,the / of / in / sidemen / us
moving at the speed of light 14 sens,4,the / of / in / sidemen / us
the future of the past,4,the / of / in / sidemen / us
the time joe burrow beat 9 texas on the road,4,the / of / in / sidemen / us
the most expensive 50000000 penthouse in hudson yards nyc shorts,4,the / of / in / sidemen / us
the raptor switches to paddles for one game,4,the / of / in / sidemen / us
the best goal of this video becomes an nft,4,the / of / in / sidemen / us
the most dangerous sport in the world nfl,4,the / of / in / sidemen / us
the most dangerous sport in the world rugby,4,the / of / in / sidemen / us
sidemen big fat quiz of the year 2019,4,the / of / in / sidemen / us
the power of thinking for yourself,4,the / of / in / sidemen / us
the most dangerous sport in the world rugby,4,the / of / in / sidemen / us
the most dangerous sport in the world nfl,4,the / of / in / sidemen / us
6ix9ine is in a video game,4,the / of / in / sidemen / us
the most satisfying sound in the world,4,the / of / in / sidemen / us
the gonadolaaaas,4,the / of / in / sidemen / us
sidemen one word interview,4,the / of / in / sidemen / us
sidemen tinder in real life 3 best,4,the / of / in / sidemen / us
sidemen blind dating but all the answers are outrageous,4,the / of / in / sidemen / us
sethy on the news,4,the / of / in / sidemen / us
best cl knock out matches ever 4,4,the / of / in / sidemen / us
w2s making the sidemen laugh,4,the / of / in / sidemen / us
sidemen blind dating but all the answers are outrageous 2,4,the / of / in / sidemen / us
sidemen blind dating but all the answers are outrageous,4,the / of / in / sidemen / us
the sidemen tinder irl but its only harry,4,the / of / in / sidemen / us
it happens to the of us,4,the / of / in / sidemen / us
f the sidemen,4,the / of / in / sidemen / us
i found a battle royale horror game,4,the / of / in / sidemen / us
call of duty zombies but i start at round 100,4,the / of / in / sidemen / us
russell westbrook may be the most delusional player in nba history,4,the / of / in / sidemen / us
5 of the best brunches in london ft truffle scrambled eggs pancakes a full english,4,the / of / in / sidemen / us
are these the best date spots in london ft 5 dates in 1 day,4,the / of / in / sidemen / us
is this the best place in europe amalfi travel vlog,4,the / of / in / sidemen / us
20 most incredible lego world records,4,the / of / in / sidemen / us
the mysterious history of cocacola documentary,4,the / of / in / sidemen / us
the rise fall of the worlds most notorious private army,4,the / of / in / sidemen / us
round of applause for the who,4,the / of / in / sidemen / us
nba thinking outside the box moments,4,the / of / in / sidemen / us
sidemen new years day golf,4,the / of / in / sidemen / us
peter parker being a child of the genz for nine minutes,4,the / of / in / sidemen / us
peter parker getting in trouble for 3 minutes straight,4,the / of / in / sidemen / us
tom holland being a dork for 12 minutes and 46 seconds,4,the / of / in / sidemen / us
the cast of spiderman play say what the playlist,4,the / of / in / sidemen / us
amazing goals of the year 2021,4,the / of / in / sidemen / us
goldman sachs the most evil bankers in the world,4,the / of / in / sidemen / us
trolling ksi with custom names on among us,4,the / of / in / sidemen / us
michael wears a womans suit the office us,4,the / of / in / sidemen / us
the dvd logo the office us,4,the / of / in / sidemen / us
sidemen tinder in real life 2,4,the / of / in / sidemen / us
spiderman all powers from the films tom holland,4,the / of / in / sidemen / us
the most miserable city in america,4,the / of / in / sidemen / us
best of all peter parkers tingles,4,the / of / in / sidemen / us
most spectacular skills of the year 2021,4,the / of / in / sidemen / us
of peter parker,4,the / of / in / sidemen / us
batman unmasked the psychology of the dark knight documentary,4,the / of / in / sidemen / us
harry w2s being the member of the sidemen,4,the / of / in / sidemen / us
dunder mifflin plays basketball the office,4,the / of / in / sidemen / us
nba i run this city moments,4,the / of / in / sidemen / us
most spectacular skills of the year 2021,4,the / of / in / sidemen / us
deadpool all dirty funniest jokes coolest best moments,4,the / of / in / sidemen / us
deadpool all powers from the films,4,the / of / in / sidemen / us
kill the batman the joker meets the mob the dark knight 4k hdr imax,4,the / of / in / sidemen / us
the last ever sidemen among us,4,the / of / in / sidemen / us
jim saves pams job the office,4,the / of / in / sidemen / us
the weakest link sidemen edition 2,4,the / of / in / sidemen / us
jim gets revenge on ryan the office,4,the / of / in / sidemen / us
the wolf of wall street im not leaving,4,the / of / in / sidemen / us
best of michael vs pam the office us comedy bites,4,the / of / in / sidemen / us
the voice most emotional audition ever,4,the / of / in / sidemen / us
peter parker and tony stark being father and son for 4 minutes straight,4,the / of / in / sidemen / us
best of spider man saves,4,the / of / in / sidemen / us
jinx the office us,4,the / of / in / sidemen / us
40 kills alone world record most kills ever in fortnite history fortnite battle royale,4,the / of / in / sidemen / us
of peter parker,4,the / of / in / sidemen / us
the history of the spiderman movies rt essentials movieclips,4,the / of / in / sidemen / us
w2s being w2s for 10 minutes ft vikk corinna talia,4,the / of / in / sidemen / us
best of office gifts the office us,4,the / of / in / sidemen / us
uw to return to online learning for start of 2022 fox 13 seattle,4,the / of / in / sidemen / us
flightreacts dumbest moments of all time,4,the / of / in / sidemen / us
drunk and disorderly the office us,4,the / of / in / sidemen / us
the funniest game of 2021,4,the / of / in / sidemen / us
the roast of the sidemen,4,the / of / in / sidemen / us
most heartwarming moments the office us,4,the / of / in / sidemen / us
every time pam was jealous the office us,4,the / of / in / sidemen / us
jim pam karen the office love triangle comedy bites,4,the / of / in / sidemen / us
michael scott once said your favourite michael quotes the office comedy bites,4,the / of / in / sidemen / us
deadpool all dirty funniest jokes coolest best moments,4,the / of / in / sidemen / us
the day ryan changed forever the office us,4,the / of / in / sidemen / us
sidemen crossing battle royale,4,the / of / in / sidemen / us
peter parker being a child of the genz for nine minutes,4,the / of / in / sidemen / us
ranking every episode of the office,4,the / of / in / sidemen / us
life at university of washington neurology residency,4,the / of / in / sidemen / us
day in the life of a neuroscience student,4,the / of / in / sidemen / us
ranking every episode of the office,4,the / of / in / sidemen / us
what spiderman no way home means for the future of venom,4,the / of / in / sidemen / us
clean tackle is the most satisfying thing in football,4,the / of / in / sidemen / us
nba mocking the opponent moments,4,the / of / in / sidemen / us
who is the best spiderman tobey maguire vs andrew garfield vs tom holland,4,the / of / in / sidemen / us
more of the best cold opens the office us,4,the / of / in / sidemen / us
most devastating goals in football,4,the / of / in / sidemen / us
best unscripted moments the office us,4,the / of / in / sidemen / us
