Original_Title,Cleaned_Title,Cluster,Cluster_Name
Brighton v. Luton Town | PREMIER LEAGUE HIGHLIGHTS | 8/12/2023 | NBC Sports,brighton v luton town league highlights 8122023 sports,5,highlights / sports / league / v / united
Premier league academy Baller Vs Grassroots Baller 🔥🔥🔥#football #soccer #1v1,league academy baller grassroots baller football soccer 1v1,5,highlights / sports / league / v / united
Best skills compilation‼️🥶 #football #soccer #skills,skills compilation football soccer skills,5,highlights / sports / league / v / united
Like when you see the nutmeg‼️#soccer #skills #football,see nutmegsoccer skills football,5,highlights / sports / league / v / united
Wait for the last one‼️🤯 #football #soccer #skills,wait last one football soccer skills,5,highlights / sports / league / v / united
POV: You Find Out You’re 1% Brazilian 🇧🇷 #shorts #football #soccer,pov find out youre brazilian football soccer,5,highlights / sports / league / v / united
Best skills compilation‼️🥶 #football #soccer #skills,skills compilation football soccer skills,5,highlights / sports / league / v / united
Best skills compilation‼️ #football #soccer #skills,skills compilation football soccer skills,5,highlights / sports / league / v / united
Which skill was your favourite⁉️ #football #soccer #skills,skill favourite football soccer skills,5,highlights / sports / league / v / united
Like when you see a nutmeg‼️ #football #soccer #skills,see nutmeg football soccer skills,5,highlights / sports / league / v / united
Which one is your favourite⁉️ #football #soccer #skills,one favourite football soccer skills,5,highlights / sports / league / v / united
Watch the Full Video out now‼️ #football #soccer #skills,watch video out now football soccer skills,5,highlights / sports / league / v / united
You just found out you’re 1% Brazilian‼️🇧🇷 #football #soccer #skills,found out youre brazilian football soccer skills,5,highlights / sports / league / v / united
2 skills that make you a baller! 🔥 #football #soccer #skills,skills make baller football soccer skills,5,highlights / sports / league / v / united
You just found out you’re 1% Brazilian 🇧🇷 #football #soccer #skills,found out youre brazilian football soccer skills,5,highlights / sports / league / v / united
Best skills compilation‼️ #football #soccer #skills,skills compilation football soccer skills,5,highlights / sports / league / v / united
Top 25 Premier League goals of 2022-23 season | NBC Sports,25 league goals 202223 season sports,5,highlights / sports / league / v / united
1 in a Million Moments in Sports,million sports,5,highlights / sports / league / v / united
Liverpool v. Manchester City | PREMIER LEAGUE HIGHLIGHTS | 11/10/19 | NBC Sports,liverpool v manchester city league highlights 111019 sports,5,highlights / sports / league / v / united
Wolves v. Manchester City | PREMIER LEAGUE HIGHLIGHTS | 12/27/19 | NBC Sports,wolves v manchester city league highlights 122719 sports,5,highlights / sports / league / v / united
Neymar Football Skill Tutorial  🇧🇷⚽️🔥| #football #soccer #skills,neymar football skill tutorial football soccer skills,5,highlights / sports / league / v / united
USA vs. Mexico: Extended Highlights | CONCACAF Nations League | CBS Sports Golazo,usa mexico extended highlights concacaf nations league cbs sports golazo,5,highlights / sports / league / v / united
Touch and pass challenge‼️ #football #soccer #skills,touch pass challenge football soccer skills,5,highlights / sports / league / v / united
I’m running at you like this.. what do you do⁉️ #football #soccer #skills,im running do do football soccer skills,5,highlights / sports / league / v / united
I’m running at you like this… what do you do⁉️ #football #soccer #skills,im running do do football soccer skills,5,highlights / sports / league / v / united
2 touches that make you a baller 🔥 #football #skills #soccer,touches make baller football skills soccer,5,highlights / sports / league / v / united
What ⭐️ skiller are you? 👀 #football #soccer #skills,skiller football soccer skills,5,highlights / sports / league / v / united
Have you used this skill in a match??✋#football #soccer #shorts,have used skill matchfootball soccer,5,highlights / sports / league / v / united
LEARN OFF THE BALL MOVEMENT for WINGER🔥#football #soccer #shorts,learn off ball movement wingerfootball soccer,5,highlights / sports / league / v / united
Joe Willock gives Newcastle United liftoff against Chelsea | Premier League | NBC Sports,joe willock gives newcastle united liftoff against chelsea league sports,5,highlights / sports / league / v / united
Demarai Gray stoppage-time stunner gets Everton in front | Premier League | NBC Sports,demarai gray stoppagetime stunner gets everton front league sports,5,highlights / sports / league / v / united
Top 25 Premier League goals of 2022-23 season | NBC Sports,25 league goals 202223 season sports,5,highlights / sports / league / v / united
Wait for it… 🤯 #football #soccer #shorts,wait football soccer,5,highlights / sports / league / v / united
2 skills for attacking players 💯 #football #soccer #skills,skills attacking players football soccer skills,5,highlights / sports / league / v / united
Top 25 Premier League goals of 2022-23 season | NBC Sports,25 league goals 202223 season sports,5,highlights / sports / league / v / united
I had to give it a go‼️ #football #shorts #soccer,had give go football soccer,5,highlights / sports / league / v / united
Rate this skill 1-10‼️ #football #soccer #skills,rate skill 110 football soccer skills,5,highlights / sports / league / v / united
Best skills compilation‼️ #football #soccer #skills,skills compilation football soccer skills,5,highlights / sports / league / v / united
2 skills that make you a baller 💯 #football #soccer #skills,skills make baller football soccer skills,5,highlights / sports / league / v / united
2 skills that make you a baller 💯 #football #soccer #skills,skills make baller football soccer skills,5,highlights / sports / league / v / united
You just found out you are 1% Brazilian 🇧🇷 #football #soccer,found out brazilian football soccer,5,highlights / sports / league / v / united
Rate the last skill 1-10 👀🚀 #football #soccer #skills,rate last skill 110 football soccer skills,5,highlights / sports / league / v / united
Like when you see the panna‼️ #football #soccer #skills,see panna football soccer skills,5,highlights / sports / league / v / united
Would this work in a game⁉️🥶 #football #soccer #skills,would work game football soccer skills,5,highlights / sports / league / v / united
How many stepovers did you count⁉️👀 #football #soccer #skills,many stepovers did count football soccer skills,5,highlights / sports / league / v / united
Best skills compilation‼️ #football #soccer #skills,skills compilation football soccer skills,5,highlights / sports / league / v / united
Manchester United v. Chelsea | PREMIER LEAGUE HIGHLIGHTS | 5/25/2023 | NBC Sports,manchester united v chelsea league highlights 5252023 sports,5,highlights / sports / league / v / united
2 skills that make you a baller! 🔥 #soccer #football #shorts,skills make baller soccer football,5,highlights / sports / league / v / united
2 skills that make you 1% Brazilian! 🇧🇷 #football #soccer #skills,skills make brazilian football soccer skills,5,highlights / sports / league / v / united
POV: You Find Out You’re 1% Brazilian 🇧🇷 #shorts #football #soccer,pov find out youre brazilian football soccer,5,highlights / sports / league / v / united
Brighton v. Manchester City | PREMIER LEAGUE HIGHLIGHTS | 5/24/2023 | NBC Sports,brighton v manchester city league highlights 5242023 sports,5,highlights / sports / league / v / united
Brighton v. Southampton | PREMIER LEAGUE HIGHLIGHTS | 5/21/2023 | NBC Sports,brighton v southampton league highlights 5212023 sports,5,highlights / sports / league / v / united
Manchester City v. Chelsea | PREMIER LEAGUE HIGHLIGHTS | 5/21/2023 | NBC Sports,manchester city v chelsea league highlights 5212023 sports,5,highlights / sports / league / v / united
#6 Oklahoma vs #21 Texas Highlights (GAME OF THE YEAR!?) | Week 6 | 2021 College Football Highlights,oklahoma 21 texas highlights game year week 2021 college football highlights,5,highlights / sports / league / v / united
Nottingham Forest v. Arsenal | PREMIER LEAGUE HIGHLIGHTS | 5/20/2023 | NBC Sports,nottingham forest v arsenal league highlights 5202023 sports,5,highlights / sports / league / v / united
Fulham v. Crystal Palace | PREMIER LEAGUE HIGHLIGHTS | 5/20/2023 | NBC Sports,fulham v crystal palace league highlights 5202023 sports,5,highlights / sports / league / v / united
Wolves v. Everton | PREMIER LEAGUE HIGHLIGHTS | 5/20/2023 | NBC Sports,wolves v everton league highlights 5202023 sports,5,highlights / sports / league / v / united
Tottenham Hotspur v. Brentford | PREMIER LEAGUE HIGHLIGHTS | 5/20/2023 | NBC Sports,tottenham hotspur v brentford league highlights 5202023 sports,5,highlights / sports / league / v / united
Liverpool v. Aston Villa | PREMIER LEAGUE HIGHLIGHTS | 5/20/2023 | NBC Sports,liverpool v aston villa league highlights 5202023 sports,5,highlights / sports / league / v / united
2 skills that make you a baller 💯 #skills #football #soccer,skills make baller skills football soccer,5,highlights / sports / league / v / united
2 skills that make you a baller 💯 #football #skills #soccer,skills make baller football skills soccer,5,highlights / sports / league / v / united
Wait for the last one‼️🤯 #football #soccer #skills,wait last one football soccer skills,5,highlights / sports / league / v / united
2 skills that make you a baller 💯 #football #soccer #skills,skills make baller football soccer skills,5,highlights / sports / league / v / united
Brighton v. Leicester City | PREMIER LEAGUE HIGHLIGHTS | 9/4/2022 | NBC Sports,brighton v leicester city league highlights 942022 sports,5,highlights / sports / league / v / united
Brighton v. Manchester United | PREMIER LEAGUE HIGHLIGHTS | 5/7/2022 | NBC Sports,brighton v manchester united league highlights 572022 sports,5,highlights / sports / league / v / united
Manchester United v. Brighton | PREMIER LEAGUE HIGHLIGHTS | 8/7/2022 | NBC Sports,manchester united v brighton league highlights 872022 sports,5,highlights / sports / league / v / united
Brighton v. Manchester United | PREMIER LEAGUE HIGHLIGHTS | 5/4/2023 | NBC Sports,brighton v manchester united league highlights 542023 sports,5,highlights / sports / league / v / united
Arsenal v. Brighton | PREMIER LEAGUE HIGHLIGHTS | 5/14/2023 | NBC Sports,arsenal v brighton league highlights 5142023 sports,5,highlights / sports / league / v / united
2 skills that make you a baller 💯 #football #soccer #skills,skills make baller football soccer skills,5,highlights / sports / league / v / united
You're NFL play if you...#sub #football #House of memories#NFL,youre nfl play yousub football house memoriesnfl,5,highlights / sports / league / v / united
What level can you do⁉️ #football #soccer #skills,level can do football soccer skills,5,highlights / sports / league / v / united
Chelsea v. Nottingham Forest | PREMIER LEAGUE HIGHLIGHTS | 5/13/2023 | NBC Sports,chelsea v nottingham forest league highlights 5132023 sports,5,highlights / sports / league / v / united
#soccer #football #futbol #ronaldo,soccer football futbol ronaldo,5,highlights / sports / league / v / united
10 years of football.. touch edition‼️ #football #soccer #shorts,years football touch edition football soccer,5,highlights / sports / league / v / united
Skill tutorial ⚽️#football #footballskills #footballshorts #soccer #soccerskills,skill tutorial football footballskills footballshorts soccer soccerskills,5,highlights / sports / league / v / united
2 skills that make you a baller 💯 #football #soccer #skills,skills make baller football soccer skills,5,highlights / sports / league / v / united
LEARN Di Maria Kick fake #football #soccer #shorts,learn di maria kick fake football soccer,5,highlights / sports / league / v / united
Brighton v. Manchester United | PREMIER LEAGUE HIGHLIGHTS | 5/4/2023 | NBC Sports,brighton v manchester united league highlights 542023 sports,5,highlights / sports / league / v / united
Highlights & Goals | Brighton v. Man. United 1-0 | Premier League | Telemundo Deportes,highlights goals brighton v man united league telemundo deportes,5,highlights / sports / league / v / united
Kvaratskhelia Sock Tutorial #kvaratskhelia #football #soccer,kvaratskhelia sock tutorial kvaratskhelia football soccer,5,highlights / sports / league / v / united
Brighton v. Manchester United | PREMIER LEAGUE HIGHLIGHTS | 5/4/2023 | NBC Sports,brighton v manchester united league highlights 542023 sports,5,highlights / sports / league / v / united
When no one likes you on the team 😂😂 #football #shorts #soccer #sundayleague,no one likes team football soccer sundayleague,5,highlights / sports / league / v / united
The Nicest Man In Sunday League Mic'd Up #football #soccer #shorts #sundayleague #micdup,nicest man sunday league micd up football soccer sundayleague micdup,5,highlights / sports / league / v / united
Leicester City v. Everton | PREMIER LEAGUE HIGHLIGHTS | 5/1/2023 | NBC Sports,leicester city v everton league highlights 512023 sports,5,highlights / sports / league / v / united
Manchester United v. Aston Villa | PREMIER LEAGUE HIGHLIGHTS | 4/30/2023 | NBC Sports,manchester united v aston villa league highlights 4302023 sports,5,highlights / sports / league / v / united
Arsenal v. Chelsea | PREMIER LEAGUE HIGHLIGHTS | 5/2/2023 | NBC Sports,arsenal v chelsea league highlights 522023 sports,5,highlights / sports / league / v / united
Liverpool v. Tottenham Hotspur | PREMIER LEAGUE HIGHLIGHTS | 4/30/2023 | NBC Sports,liverpool v tottenham hotspur league highlights 4302023 sports,5,highlights / sports / league / v / united
Chelsea v. Brentford | PREMIER LEAGUE HIGHLIGHTS | 4/26/2023 | NBC Sports,chelsea v brentford league highlights 4262023 sports,5,highlights / sports / league / v / united
Sunday League Striker Mic'd Up #football #shorts #micdup #sports #soccer #sundayleague,sunday league striker micd up football micdup sports soccer sundayleague,5,highlights / sports / league / v / united
Sunday League Rafael Leao Mic'd Up #football #shorts #micdup #sports #soccer #sundayleague,sunday league rafael leao micd up football micdup sports soccer sundayleague,5,highlights / sports / league / v / united
Brighton v. Wolves | PREMIER LEAGUE HIGHLIGHTS | 4/29/2023 | NBC Sports,brighton v wolves league highlights 4292023 sports,5,highlights / sports / league / v / united
Arsenal v. Southampton | PREMIER LEAGUE HIGHLIGHTS | 4/21/2023 | NBC Sports,arsenal v southampton league highlights 4212023 sports,5,highlights / sports / league / v / united
UEFA Champions League Anthem with Lyrics #football #shorts #ucl,uefa champions league anthem lyrics football ucl,5,highlights / sports / league / v / united
Chelsea v. Brighton | PREMIER LEAGUE HIGHLIGHTS | 4/15/2023 | NBC Sports,chelsea v brighton league highlights 4152023 sports,5,highlights / sports / league / v / united
Erling Haaland savage in front of Thierry 😂🤣🔥 Champions League highlights Europa League,erling haaland savage front thierry champions league highlights europa league,5,highlights / sports / league / v / united
My Premier League TOTS,league tots,5,highlights / sports / league / v / united
Leeds United v. Liverpool | PREMIER LEAGUE HIGHLIGHTS | 4/17/2023 | NBC Sports,leeds united v liverpool league highlights 4172023 sports,5,highlights / sports / league / v / united
Qatar vs. Ecuador Highlights | 2022 FIFA World Cup,qatar ecuador highlights 2022 fifa,5,highlights / sports / league / v / united
Chelsea v. Brighton | PREMIER LEAGUE HIGHLIGHTS | 4/15/2023 | NBC Sports,chelsea v brighton league highlights 4152023 sports,5,highlights / sports / league / v / united
Tottenham Hotspur v. Bournemouth | PREMIER LEAGUE HIGHLIGHTS | 4/15/2023 | NBC Sports,tottenham hotspur v bournemouth league highlights 4152023 sports,5,highlights / sports / league / v / united
Start/Bench/Cut/Trade Wide Receivers #nfl #football #shorts,startbenchcuttrade wide receivers nfl football,5,highlights / sports / league / v / united
Highlights & Goals | Tottenham v. Bournemouth 2-3 | Premier League | Telemundo Deportes,highlights goals tottenham v bournemouth 23 league telemundo deportes,5,highlights / sports / league / v / united
Chelsea v. Brighton | PREMIER LEAGUE HIGHLIGHTS | 4/15/2023 | NBC Sports,chelsea v brighton league highlights 4152023 sports,5,highlights / sports / league / v / united
Aston Villa v. Newcastle United | PREMIER LEAGUE HIGHLIGHTS | 4/15/2023 | NBC Sports,aston villa v newcastle united league highlights 4152023 sports,5,highlights / sports / league / v / united
Man United vs. Sevilla: Extended Highlights | UEL Quarter-Finals - Leg 1 | CBS Sports Golazo,man united sevilla extended highlights uel quarterfinals leg cbs sports golazo,5,highlights / sports / league / v / united
AC Milan vs. Napoli: Extended Highlights | UCL Quarter-Finals - Leg 1 | CBS Sports Golazo,ac milan napoli extended highlights ucl quarterfinals leg cbs sports golazo,5,highlights / sports / league / v / united
Real Madrid vs. Chelsea: Extended Highlights | UCL Quarter-Finals - Leg 1 | CBS Sports Golazo,real madrid chelsea extended highlights ucl quarterfinals leg cbs sports golazo,5,highlights / sports / league / v / united
ONE OF THE BEST SUNDAY LEAGUE GOALS YOU WILL EVER SEE! INCREDIBLE ONE TOUCH FOOTBALL!,one sunday league goals will ever see incredible one touch football,5,highlights / sports / league / v / united
Wolves v. Chelsea | PREMIER LEAGUE HIGHLIGHTS | 4/8/2023 | NBC Sports,wolves v chelsea league highlights 482023 sports,5,highlights / sports / league / v / united
Leeds United v. Crystal Palace | PREMIER LEAGUE HIGHLIGHTS | 4/9/2023 | NBC Sports,leeds united v crystal palace league highlights 492023 sports,5,highlights / sports / league / v / united
Liverpool v. Arsenal | PREMIER LEAGUE HIGHLIGHTS | 4/9/2023 | NBC Sports,liverpool v arsenal league highlights 492023 sports,5,highlights / sports / league / v / united
Tottenham Hotspur v. Brighton | PREMIER LEAGUE HIGHLIGHTS | 4/8/2023 | NBC Sports,tottenham hotspur v brighton league highlights 482023 sports,5,highlights / sports / league / v / united
Manchester United v. Everton | PREMIER LEAGUE HIGHLIGHTS | 4/8/2023 | NBC Sports,manchester united v everton league highlights 482023 sports,5,highlights / sports / league / v / united
West Ham v. Newcastle | PREMIER LEAGUE HIGHLIGHTS | 4/5/2023 | NBC Sports,west ham v newcastle league highlights 452023 sports,5,highlights / sports / league / v / united
Leeds United v. Nottingham Forest | PREMIER LEAGUE HIGHLIGHTS | 4/4/2023 | NBC Sports,leeds united v nottingham forest league highlights 442023 sports,5,highlights / sports / league / v / united
Bournemouth v. Brighton | PREMIER LEAGUE HIGHLIGHTS | 4/4/2023 | NBC Sports,bournemouth v brighton league highlights 442023 sports,5,highlights / sports / league / v / united
Everton v. Tottenham Hotspur | PREMIER LEAGUE HIGHLIGHTS | 4/3/2023 | NBC Sports,everton v tottenham hotspur league highlights 432023 sports,5,highlights / sports / league / v / united
Newcastle United v. Manchester United | PREMIER LEAGUE HIGHLIGHTS | 4/2/2023 | NBC Sports,newcastle united v manchester united league highlights 422023 sports,5,highlights / sports / league / v / united
Arsenal v. Leeds United | PREMIER LEAGUE HIGHLIGHTS | 4/1/2023 | NBC Sports,arsenal v leeds united league highlights 412023 sports,5,highlights / sports / league / v / united
Chelsea v. Aston Villa | PREMIER LEAGUE HIGHLIGHTS | 4/1/2023 | NBC Sports,chelsea v aston villa league highlights 412023 sports,5,highlights / sports / league / v / united
Manchester City v. Liverpool | PREMIER LEAGUE HIGHLIGHTS | 4/1/2023 | NBC Sports,manchester city v liverpool league highlights 412023 sports,5,highlights / sports / league / v / united
Can Mikel Arteta’s Arsenal WIN the Premier League? 👀⚽️ #shorts #football #premierleague,can mikel artetas arsenal win league football premierleague,5,highlights / sports / league / v / united
Chelsea v. Everton | PREMIER LEAGUE HIGHLIGHTS | 3/18/2023 | NBC Sports,chelsea v everton league highlights 3182023 sports,5,highlights / sports / league / v / united
Blake Griffin 🥶#shorts #nba #basketball,blake griffin nba basketball,5,highlights / sports / league / v / united
Newcastle United v. Chelsea | PREMIER LEAGUE HIGHLIGHTS | 11/12/2022 | NBC Sports,newcastle united v chelsea league highlights 11122022 sports,5,highlights / sports / league / v / united
Arsenal v. Bournemouth | PREMIER LEAGUE HIGHLIGHTS | 3/4/2023 | NBC Sports,arsenal v bournemouth league highlights 342023 sports,5,highlights / sports / league / v / united
Arsenal v. Manchester United | PREMIER LEAGUE HIGHLIGHTS | 1/22/2023 | NBC Sports,arsenal v manchester united league highlights 1222023 sports,5,highlights / sports / league / v / united
Arsenal v. Manchester City | PREMIER LEAGUE HIGHLIGHTS | 2/15/2023 | NBC Sports,arsenal v manchester city league highlights 2152023 sports,5,highlights / sports / league / v / united
Highlights & Goals: Liverpool vs. Man. United 7-0 | Premier League | Telemundo Deportes,highlights goals liverpool man united 70 league telemundo deportes,5,highlights / sports / league / v / united
Leeds United v. Brighton | PREMIER LEAGUE HIGHLIGHTS | 3/11/2023 | NBC Sports,leeds united v brighton league highlights 3112023 sports,5,highlights / sports / league / v / united
Brentford v. Fulham | PREMIER LEAGUE HIGHLIGHTS | 3/6/2023 | NBC Sports,brentford v fulham league highlights 362023 sports,5,highlights / sports / league / v / united
Liverpool v. Manchester United | PREMIER LEAGUE HIGHLIGHTS | 3/5/2023 | NBC Sports,liverpool v manchester united league highlights 352023 sports,5,highlights / sports / league / v / united
Nottingham Forest v. Everton | PREMIER LEAGUE HIGHLIGHTS | 3/5/2023 | NBC Sports,nottingham forest v everton league highlights 352023 sports,5,highlights / sports / league / v / united
Highlights & Goals: Liverpool vs. Man. United 7-0 | Premier League | Telemundo Deportes,highlights goals liverpool man united 70 league telemundo deportes,5,highlights / sports / league / v / united
Arsenal v. Bournemouth | PREMIER LEAGUE HIGHLIGHTS | 3/4/2023 | NBC Sports,arsenal v bournemouth league highlights 342023 sports,5,highlights / sports / league / v / united
Arsenal v. Bournemouth | PREMIER LEAGUE HIGHLIGHTS | 3/4/2023 | NBC Sports,arsenal v bournemouth league highlights 342023 sports,5,highlights / sports / league / v / united
Manchester City v. Newcastle United | PREMIER LEAGUE HIGHLIGHTS | 3/4/2023 | NBC Sports,manchester city v newcastle united league highlights 342023 sports,5,highlights / sports / league / v / united
Brighton v. Manchester United | PREMIER LEAGUE HIGHLIGHTS | 5/7/2022 | NBC Sports,brighton v manchester united league highlights 572022 sports,5,highlights / sports / league / v / united
Brighton v. West Ham United | PREMIER LEAGUE HIGHLIGHTS | 3/4/2023 | NBC Sports,brighton v west ham united league highlights 342023 sports,5,highlights / sports / league / v / united
#1 LSU vs Texas Highlights (Great Game!) | 2023 College Baseball Highlights,lsu texas highlights game 2023 college baseball highlights,5,highlights / sports / league / v / united
Borussia Dortmund vs. Chelsea: Extended Highlights | UCL Round of 16 - Leg 1 | CBS Sports Golazo,borussia dortmund chelsea extended highlights ucl round 16 leg cbs sports golazo,5,highlights / sports / league / v / united
Highlights & Goals: Arsenal vs. Everton 4-0 | Premier League | Telemundo Deportes,highlights goals arsenal everton 40 league telemundo deportes,5,highlights / sports / league / v / united
Newcastle vs. Manchester United | Carabao Cup Highlights | ESPN FC,newcastle manchester united carabao highlights espn fc,5,highlights / sports / league / v / united
Tottenham Hotspur v. Chelsea | PREMIER LEAGUE HIGHLIGHTS | 2/26/2023 | NBC Sports,tottenham hotspur v chelsea league highlights 2262023 sports,5,highlights / sports / league / v / united
Leicester City v. Arsenal | PREMIER LEAGUE HIGHLIGHTS | 2/25/2023 | NBC Sports,leicester city v arsenal league highlights 2252023 sports,5,highlights / sports / league / v / united
Leicester City v. Arsenal | PREMIER LEAGUE HIGHLIGHTS | 2/25/2023 | NBC Sports,leicester city v arsenal league highlights 2252023 sports,5,highlights / sports / league / v / united
Fulham v. Wolves | PREMIER LEAGUE HIGHLIGHTS | 2/24/2023 | NBC Sports,fulham v wolves league highlights 2242023 sports,5,highlights / sports / league / v / united
Manchester United v. Leicester City | PREMIER LEAGUE HIGHLIGHTS | 2/19/2023 | NBC Sports,manchester united v leicester city league highlights 2192023 sports,5,highlights / sports / league / v / united
Aston Villa v. Arsenal | PREMIER LEAGUE HIGHLIGHTS | 2/18/2023 | NBC Sports,aston villa v arsenal league highlights 2182023 sports,5,highlights / sports / league / v / united
Newcastle United v. Chelsea | PREMIER LEAGUE HIGHLIGHTS | 11/12/2022 | NBC Sports,newcastle united v chelsea league highlights 11122022 sports,5,highlights / sports / league / v / united
Nottingham Forest v. Manchester City | PREMIER LEAGUE HIGHLIGHTS | 2/18/2023 | NBC Sports,nottingham forest v manchester city league highlights 2182023 sports,5,highlights / sports / league / v / united
Chelsea v. Southampton | PREMIER LEAGUE HIGHLIGHTS | 2/18/2023 | NBC Sports,chelsea v southampton league highlights 2182023 sports,5,highlights / sports / league / v / united
