Title,Cluster,Cluster Name
ultimate gamers are awesome moments,0,50 / gta / top
the sidemen play fifa 22 pro clubs,0,50 / gta / top
most offensive sidemen tinder lines,0,50 / gta / top
top 10 best games of 2021 college football season,0,50 / gta / top
w2s pranks the sidemen behind the scenes,0,50 / gta / top
sidemen tinder in real life 4 usa youtube edition,0,50 / gta / top
the 7 levels of high,0,50 / gta / top
football challenges with chrismd,0,50 / gta / top
7 days in syria in 2022,0,50 / gta / top
top 10 moments the dark knight trilogy,0,50 / gta / top
the dark knight trilogy,0,50 / gta / top
worst trip of my life,0,50 / gta / top
the 7 levels of high,0,50 / gta / top
a day in the life of a division 1 soccer player penn state,0,50 / gta / top
top 7 most insane military drills,0,50 / gta / top
sidemen giant slip and slide football,0,50 / gta / top
sidemen rank every fall guys level,0,50 / gta / top
worst sidemen trims of all time,0,50 / gta / top
sidemen gogglebox,0,50 / gta / top
the suspicious death of harry houdini,0,50 / gta / top
top 10 people survived the impossible,0,50 / gta / top
top 10 richest beggars in the world,0,50 / gta / top
top 10 most disturbing human experiments,0,50 / gta / top
luckiest people of all time,0,50 / gta / top
dominic fike being relatable 4 minutes,0,50 / gta / top
sidemen strength test,0,50 / gta / top
sidemen giant slip and slide football,0,50 / gta / top
a team of youtubers,0,50 / gta / top
the last ever sidemen pro clubs episode,0,50 / gta / top
biggest hits in nfl history,0,50 / gta / top
funniest ksi character moments,0,50 / gta / top
sidemen tinder in real life uk youtube edition,0,50 / gta / top
my top 20 fifa 15 packs,0,50 / gta / top
10 biggest lies ever told in history,0,50 / gta / top
sidemen vs 50 bots on fall guys,0,50 / gta / top
sidemen go to the arcade,0,50 / gta / top
the wheel sidemen edition,0,50 / gta / top
sidemen geoguessr battle royale,0,50 / gta / top
funny red cards,0,50 / gta / top
chest exercises ranked best to worst,0,50 / gta / top
most expensive cars of 2021,0,50 / gta / top
top most expensive fails ever,0,50 / gta / top
most expensive mistakes in history,0,50 / gta / top
moments people died inside,0,50 / gta / top
funniest sidemen fails of all time,0,50 / gta / top
the rarest fifa card in history,0,50 / gta / top
w2s rage,0,50 / gta / top
sidemen react to their reddit 3,0,50 / gta / top
sidemen 1 on 1 striker challenge,0,50 / gta / top
the best packs of all time fifa 15 countdown,0,50 / gta / top
scoring a goal on every fifa from 98 20 w2s,0,50 / gta / top
most unbelievable world records of all time,0,50 / gta / top
the most embarrassing moments in sports,0,50 / gta / top
moments people died inside,0,50 / gta / top
the sidemen are splitting up sidemen rumours,0,50 / gta / top
sidemen most likely to challenge,0,50 / gta / top
sidemen viral point game,0,50 / gta / top
the sidemen get drunk,0,50 / gta / top
sidemen football forfeits,0,50 / gta / top
sidemen ball launcher challenge,0,50 / gta / top
sidemen find out their football stats,0,50 / gta / top
the best freekick video on youtube,0,50 / gta / top
sidemen penalty shootout,0,50 / gta / top
sidemen 100000 escape room challenge,0,50 / gta / top
sidemen blind dating 4,0,50 / gta / top
the sidemen rank the best tinder lines,0,50 / gta / top
who is the best sidemen striker,0,50 / gta / top
scoring a goal on every fifa from 98 20 w2s,0,50 / gta / top
sidemen 10000 crossbar challenge,0,50 / gta / top
sidemen majority game,0,50 / gta / top
sidemen woodwork challenge,0,50 / gta / top
sidemen blind dating 4,0,50 / gta / top
sidemen penalty challenge vs 100 kids,0,50 / gta / top
sidemen 10000 call out penalties,0,50 / gta / top
sidemen football forfeits,0,50 / gta / top
the most epic search and discard ever,0,50 / gta / top
sidemen vs jme rap battle sidemen gaming,0,50 / gta / top
10 best things to do in montreal montreal travel guide,0,50 / gta / top
sidemen box of lies,0,50 / gta / top
outrageous animal moments,0,50 / gta / top
top 10 facts you didnt know about the earth,0,50 / gta / top
top 10 most dangerous flights in the world,0,50 / gta / top
ultimate penalty challenge,0,50 / gta / top
best of ksimon,0,50 / gta / top
best last minute goals in football,0,50 / gta / top
ksi one question goksi sidemen,0,50 / gta / top
inside the worlds only 7 star hotel,0,50 / gta / top
outrageous animal moments,0,50 / gta / top
the greatest fifa 17 team,0,50 / gta / top
the boy with world under his feet,0,50 / gta / top
vikkstar ronaldo,0,50 / gta / top
the best fifa team you can make,0,50 / gta / top
sidemen react among us animation 3,0,50 / gta / top
reacting to sidemen reddit,0,50 / gta / top
reacting to the 8 year evolution of the sidemen,0,50 / gta / top
most iconic football clips of all time,0,50 / gta / top
top 10 events that could have ended the world,0,50 / gta / top
the sidemen anniversary awards 2019,0,50 / gta / top
fifa 15 2000 sidemen wager,0,50 / gta / top
2000 fifa 15 sidemen tournament vs ksiolajidebt,0,50 / gta / top
2000 fifa 15 sidemen tournament vs miniminter,0,50 / gta / top
scoring 1 goal like the greatest players ever,0,50 / gta / top
greatest fifa pack opening of all time,0,50 / gta / top
scariest theories in the world,0,50 / gta / top
the most horrifying planets ever discovered,0,50 / gta / top
sidemen football forfeits,0,50 / gta / top
surprising the sidemen with rare shoes,0,50 / gta / top
sidemen forfeit golf,0,50 / gta / top
1 in a million moments in sports,0,50 / gta / top
the weakest link sidemen edition,0,50 / gta / top
sidemen silent challenge,0,50 / gta / top
the best miniminter football moments,0,50 / gta / top
biggest diving fails of all time,0,50 / gta / top
the 12 most dangerous islands,0,50 / gta / top
the best of stephen tries w2s chrismd willne,0,50 / gta / top
sidemen pub golf europe edition,0,50 / gta / top
vikkstar ronaldo,0,50 / gta / top
10 4000 football worlds most expensive football,0,50 / gta / top
most iconic vikkstar123 moments of all time 1,0,50 / gta / top
most offensive sidemen pro club moments,0,50 / gta / top
reacting to old ksi funny moments,0,50 / gta / top
countries with the best school lunches,0,50 / gta / top
uk us mcdonalds,0,50 / gta / top
ksi chrismd prank sidemen with 1000 iq play,0,50 / gta / top
revenge moments football,0,50 / gta / top
top 10 hilarious patrick star moments,0,50 / gta / top
top 10 worst patrick star moments,0,50 / gta / top
the time chrismd fooled world,0,50 / gta / top
most insane like a boss moments,0,50 / gta / top
the 10 most aggressive animals world,0,50 / gta / top
sidemen guess the income of strangers,0,50 / gta / top
rappers with the most expensive jewelery,0,50 / gta / top
w2s nearly cancelling himself season 1 tiktok,0,50 / gta / top
w2s nearly cancelling himself season 4,0,50 / gta / top
w2s nearly cancelling himself season 5,0,50 / gta / top
sidemen pub golf europe edition,0,50 / gta / top
sidemen pub golf gone wrong,0,50 / gta / top
sidemen hole in the wall,0,50 / gta / top
sidemen pub golf gone wrong,0,50 / gta / top
sidemen rage at impossible fall guys map,0,50 / gta / top
sidemen 5 second challenge,0,50 / gta / top
asking w2s join sidemen shorts,0,50 / gta / top
sidemen 5 second challenge,0,50 / gta / top
sidemen elimination tron race on gta 5,0,50 / gta / top
safe house in minecraft shorts minecraft,0,50 / gta / top
the most secure house minecraft shorts,0,50 / gta / top
busting 20 myths in gta 5 shorts,0,50 / gta / top
football teams that sidemen support ksi miniminter vikstar123 w2s behzinga sidemen,0,50 / gta / top
the vik draft challenge,0,50 / gta / top
22 minutes of sidecraft funny moments,0,50 / gta / top
sidemen best insults and shots,0,50 / gta / top
the sidemen play fifa 22 pro clubs,0,50 / gta / top
sidemenreacts funniest moments compilation part 5,0,50 / gta / top
just another typical sidemen compilation,0,50 / gta / top
sidemen pub golf gone wrong,0,50 / gta / top
sidemen football fear pong,0,50 / gta / top
most offensive sidemen cards against humanity moments,0,50 / gta / top
impossible pack top 10 packs 2,0,50 / gta / top
top 10 fifa packs ever 1,0,50 / gta / top
sidemen play brand new fall guys,0,50 / gta / top
a masterclass in football,0,50 / gta / top
a new kind of football,0,50 / gta / top
fifa 15 sidemen wager ksiolajidebt,0,50 / gta / top
2000 fifa 15 sidemen tournament vs zerkaa,0,50 / gta / top
embarrassing moments,0,50 / gta / top
2000 fifa 15 sidemen tournament vs tbjzl,0,50 / gta / top
2000 sidemen fifa tournament tbjzl ksi matchday 3,0,50 / gta / top
sidemen blind dating,0,50 / gta / top
sidemen speed dating extreme,0,50 / gta / top
most offensive sidemen cards against humanity moments,0,50 / gta / top
20 women vs 1 sidemen harry edition,0,50 / gta / top
the most impressive thing nba fan has ever done,0,50 / gta / top
happens of us shorts,0,50 / gta / top
water pool minecraft shorts minecraft,0,50 / gta / top
spongebob from hood pt 4 shorts,0,50 / gta / top
the good ending shorts,0,50 / gta / top
the emergency shorts,0,50 / gta / top
sidemen speed dating extreme,0,50 / gta / top
20 women vs 1 sidemen jidion edition,0,50 / gta / top
going 5 nba games 50 hours,0,50 / gta / top
flightreacts fall guys raging funny moments 4,0,50 / gta / top
most expensive cars of football players,0,50 / gta / top
ultimate sidemen rage moments,0,50 / gta / top
top 10 most dangerous water slides,0,50 / gta / top
reacting best behzinga rage moments,0,50 / gta / top
reacting to the best vikkstar rages,0,50 / gta / top
every nba teams best play of the decade,0,50 / gta / top
reacting to the best vikkstar rages,0,50 / gta / top
sidemen rage at worlds most frustrating game,0,50 / gta / top
flightreacts funniest fall guys moments,0,50 / gta / top
most expensive sneakers in the world,0,50 / gta / top
sneaker shoppings top 10 spenders of 2019,0,50 / gta / top
most iconic football clips of all time,0,50 / gta / top
sidemen censored moments,0,50 / gta / top
ksi lacking knowledge strength integrity 5 12 minutes,0,50 / gta / top
best goals of the season 202122,0,50 / gta / top
pointless sidemen edition,0,50 / gta / top
the sidemen rank the best tinder lines,0,50 / gta / top
the sidemen rate their own songs,0,50 / gta / top
10 4000 football worlds most expensive football,0,50 / gta / top
195 rated fut draft team of the season challenge fifa 20,0,50 / gta / top
the vik draft challenge,0,50 / gta / top
0 iq moments,0,50 / gta / top
top 10 things caught on gopro,0,50 / gta / top
sidemen 20000 among us mr beast,0,50 / gta / top
the worst crewmates of all time sidemen among us proximity,0,50 / gta / top
the ecosystem explained,0,50 / gta / top
sidemen react to their reddit 2,0,50 / gta / top
reacting to sidemen reddit,0,50 / gta / top
sidemen react sidemen reddit,0,50 / gta / top
sidemen lockdown showdown,0,50 / gta / top
worst sidemen trims of all time,0,50 / gta / top
195 rated fut draft team of the season challenge fifa 20,0,50 / gta / top
the best fifa team possible,0,50 / gta / top
the worst 26 minutes of harrys life,0,50 / gta / top
sidemen play among us but its strangest play ever sidemen gaming,0,50 / gta / top
ksi funniest moments 1,0,50 / gta / top
w2s racist moments,0,50 / gta / top
best sidemen lockdown moments,0,50 / gta / top
sidemen play among us but everyone has 200 iq sidemen gaming,0,50 / gta / top
sidemen among us the worst imposters of all time,0,50 / gta / top
biggest mistakes in football,0,50 / gta / top
w2s nearly cancelling himself season 1 tiktok,0,50 / gta / top
sidemen hacked on gta 5 cops vs robbers,0,50 / gta / top
sidemen among us but its pure chaos,0,50 / gta / top
new roles in sidemen among us,0,50 / gta / top
the best fish and chips in london best of the best,0,50 / gta / top
sidemen play among us but everyone acts sus sidemen gaming,0,50 / gta / top
sidemen among us the best shapeshifter yet,0,50 / gta / top
sidemen play among us but theres 3rd impostor sidemen gaming,0,50 / gta / top
sidemen among us but everyone is third imposter,0,50 / gta / top
sidemen shapeshifter among us gone right,0,50 / gta / top
sidemen among us the worst imposters of all time,0,50 / gta / top
iconic british moments,0,50 / gta / top
sidemen among us biggest fail,0,50 / gta / top
best of the internet 2021,0,50 / gta / top
funniest moments in football,0,50 / gta / top
sidemen football forfeits,0,50 / gta / top
w2s nearly cancelling himself season 4,0,50 / gta / top
sidemen most likely to challenge,0,50 / gta / top
sidemen shapeshifter among us,0,50 / gta / top
sidemen among us is back,0,50 / gta / top
1 more hour of sidemenreacts funniest moments,0,50 / gta / top
sidemen 1 vs 100,0,50 / gta / top
sidemen 1 vs 100,0,50 / gta / top
sidemen guess the song challenge,0,50 / gta / top
women rate the strongest sidemen,0,50 / gta / top
sidemen strength test,0,50 / gta / top
sidemen strength challenge,0,50 / gta / top
best old sidemen moments,0,50 / gta / top
ksi w2s among us masterclass,0,50 / gta / top
sidemen play among us but tobi gets his revenge sidemen gaming,0,50 / gta / top
w2s makes behzinga rage quit on among us,0,50 / gta / top
sidemen among us but the imposters try to vote each other out,0,50 / gta / top
1 billion moments,0,50 / gta / top
1 more hour of sidemenreacts funniest moments,0,50 / gta / top
i turned gta 5 into a hardcore survival game,0,50 / gta / top
1 more hour of sidemenreacts funniest moments,0,50 / gta / top
best sidemen your mum jokes 1,0,50 / gta / top
embarrassing moments,0,50 / gta / top
i built the worlds most expensive vending machine,0,50 / gta / top
i stayed in worlds most expensive penthouse,0,50 / gta / top
ksi getting bullied for 11 minutes,0,50 / gta / top
most offensive sidemen pro club moments,0,50 / gta / top
ksi watches w2s almost injure sidemen,0,50 / gta / top
the best cat jump w2s has ever seen,0,50 / gta / top
w2s behzinga football challenge,0,50 / gta / top
sidemen among us the best shapeshifter yet,0,50 / gta / top
ksi had the rest of the sidemen speechless,0,50 / gta / top
biggest betrayals in sidemen history,0,50 / gta / top
simon is man in the middle,0,50 / gta / top
rewind best gadgets of 2021,0,50 / gta / top
embarrassing moments,0,50 / gta / top
the best roasts from athletes comedy central roast,0,50 / gta / top
top 100 roast moments comedy central roast,0,50 / gta / top
w2s most played song,0,50 / gta / top
peter parker spiderman a hero in all of us,0,50 / gta / top
the dark knight trilogy,0,50 / gta / top
sidemen squid game glass bridge challenge on gta 5,0,50 / gta / top
the sidemen finally win squid game,0,50 / gta / top
martyrs the most disturbing movie ever made,0,50 / gta / top
flightreacts funniest fall guys moments,0,50 / gta / top
sidemen squid game on gta 5,0,50 / gta / top
sidemen play scuffed squid game,0,50 / gta / top
sidemen olympics 2021,0,50 / gta / top
top 10 best things do london 2025,0,50 / gta / top
the greatest sidemen moments 2021,0,50 / gta / top
flightreacts fall guys raging funny moments 4,0,50 / gta / top
sidemen olympics the new fastest sideman,0,50 / gta / top
sidemen olympics going for gold,0,50 / gta / top
sidemen olympics 2022,0,50 / gta / top
flightreacts fall guys raging funny moments 1,0,50 / gta / top
top 10 worst youtube scandals ever,0,50 / gta / top
flightreacts madden 21 raging funny moments 4,0,50 / gta / top
flightreacts fall guys raging funny moments 9,0,50 / gta / top
flightreacts fall guys raging funny moments 9,0,50 / gta / top
flightreacts fall guys raging funny moments 4,0,50 / gta / top
flightreacts fall guys raging funny moments 3,0,50 / gta / top
flightreacts fall guys raging funny moments 5,0,50 / gta / top
flightreacts fall guys raging funny moments 8,0,50 / gta / top
top 50 sidemen gta moments,0,50 / gta / top
funniest moments gaming,0,50 / gta / top
top 10 youtubers who have been arrested,0,50 / gta / top
best old sidemen abroad moments,0,50 / gta / top
family feud funny moments dumbest answers shorts,0,50 / gta / top
going for the dub in fall guys sidemen gaming,0,50 / gta / top
flightreacts fall guys raging funny moments 7,0,50 / gta / top
flightreacts fall guys raging funny moments 6,0,50 / gta / top
flightreacts dumbest moments of all time,0,50 / gta / top
minecraft temple escape 4 with the sidemen minecraft trolling,0,50 / gta / top
minecraft temple escape 3 with the sidemen minecraft trolling,0,50 / gta / top
minecraft temple escape 2 with the sidemen minecraft trolling,0,50 / gta / top
flightreacts nba 2k21 raging funny moments 4,0,50 / gta / top
flightreacts nba 2k22 raging funny moments 2,0,50 / gta / top
flightreacts fall guys raging funny moments 10,0,50 / gta / top
bullying ksi on fall guys sidemen gaming,0,50 / gta / top
minecraft temple escape 2 with the sidemen minecraft trolling,0,50 / gta / top
minecraft temple escape 1 with the sidemen minecraft trolling,0,50 / gta / top
sidemen minecraft meme olympics sidemen gaming,0,50 / gta / top
cheating against the fans sidemen geoguessr,0,50 / gta / top
ethans first time on fall guys sidemen gaming,0,50 / gta / top
can we all get to the final in fall guys sidemen gaming,0,50 / gta / top
funniest sidemen fails of all time,0,50 / gta / top
most iconic sidemen moments of all time,0,50 / gta / top
sidemen dominating on fall guys sidemen gaming,0,50 / gta / top
ksi quits on gta 5,0,50 / gta / top
harry rages at vik in gta,0,50 / gta / top
w2s raging at gta,0,50 / gta / top
funniest sidemen gta v moments,0,50 / gta / top
sidemen turn 1 into 100000 in 24 hours challenge,0,50 / gta / top
1 more hour of zias and blous funniest moments hilarious,0,50 / gta / top
the end of all default skins,0,50 / gta / top
sidemen react to parkour fails,0,50 / gta / top
sidemen react to gym fails,0,50 / gta / top
w2s being the funniest sideman 5 minutes,0,50 / gta / top
w2s nearly cancelling himself season 4,0,50 / gta / top
corinna kopf reacts 20 women vs 1 sidemen harry edition sidemensunday,0,50 / gta / top
sidemen among us the worst imposters of all time,0,50 / gta / top
1 trillion moments,0,50 / gta / top
nba most intense moments,0,50 / gta / top
going bananas in season 8,0,50 / gta / top
funniest sidemen gaming moments,0,50 / gta / top
worst ever movie cgi moments,0,50 / gta / top
sidemen react to sunday league best moments,0,50 / gta / top
most spectacular skills of season,0,50 / gta / top
among guys,0,50 / gta / top
who is the smartest sidemen member,0,50 / gta / top
skills that broke the internet,0,50 / gta / top
20 greatest boxing knockouts of all time,0,50 / gta / top
funniest football penalty moments,0,50 / gta / top
most legendary trash talk in football,0,50 / gta / top
most savage sidemen tinder lines,0,50 / gta / top
funniest sidemen pranks ever,0,50 / gta / top
the weakest link sidemen edition,0,50 / gta / top
the greatest sidemen moments 2021,0,50 / gta / top
best old sidemen moments,0,50 / gta / top
the most beautiful equation math,0,50 / gta / top
w2s funniest moments part 4,0,50 / gta / top
harry w2s telling jokes 8 minutes 23 seconds,0,50 / gta / top
amazing execution from w2s,0,50 / gta / top
how to win every game of fall guys,0,50 / gta / top
funniest troll moments in sports,0,50 / gta / top
top 21 spiderman no way home funniest moments,0,50 / gta / top
most savage sidemen tinder lines,0,50 / gta / top
sidemen 30 second categories challenge,0,50 / gta / top
sidemen 5 second challenge,0,50 / gta / top
the dark knight trilogy,0,50 / gta / top
the dark knight trilogy,0,50 / gta / top
the harry potter prophecy explained,0,50 / gta / top
jeopardy sidemen edition,0,50 / gta / top
most iconic vikkstar123 moments of all time 1,0,50 / gta / top
most legendary trash talk in football,0,50 / gta / top
sidemen tinder in real life 3,0,50 / gta / top
best fifa songs of all time 13 21,0,50 / gta / top
zias and b lou funny moments hilarious,0,50 / gta / top
sidemen blind dating 4,0,50 / gta / top
all sidemen diss tracks in order,0,50 / gta / top
the chase sidemen edition 2019,0,50 / gta / top
sidemen blind dating 4,0,50 / gta / top
sidemen one word interview,0,50 / gta / top
the worst swat team of all time ready or not,0,50 / gta / top
the conjuring the history of bathsheba sherman,0,50 / gta / top
sidemen blind dating 4,0,50 / gta / top
best old sidemen moments,0,50 / gta / top
best sidemen your mum jokes 1,0,50 / gta / top
the chase sidemen edition 2019,0,50 / gta / top
jim saves christmas party the office us,0,50 / gta / top
sidemen hide seek minecraft sidemen gaming,0,50 / gta / top
the k in ksi stands for knowledge 2,0,50 / gta / top
a day in the life of a division 1 soccer player clemson,0,50 / gta / top
worst sidemen injuries of all time,0,50 / gta / top
sidemen trivia night sidemen gaming,0,50 / gta / top
whos the smartest sideman sidemen gaming,0,50 / gta / top
sidemen 5 second challenge,0,50 / gta / top
sidemen 5 second challenge,0,50 / gta / top
the evolution of nba basketball,0,50 / gta / top
ksi among us freestyle,0,50 / gta / top
sidemen 1 vs 100,0,50 / gta / top
the weakest link sidemen edition 2,0,50 / gta / top
the special one jose mourinhos best ever moments,0,50 / gta / top
the weakest link sidemen edition 2,0,50 / gta / top
the weakest link sidemen edition,0,50 / gta / top
sidemen guess the game challenge,0,50 / gta / top
top 10 most chilling theories about real life ghosts,0,50 / gta / top
buzzfeed unsolved my favorite funny moments,0,50 / gta / top
buzzfeed unsolved my favorite funny moments,0,50 / gta / top
w2s making sidemen laugh,0,50 / gta / top
sidemen google feud,0,50 / gta / top
sidemen google feud,0,50 / gta / top
most beautiful moments of respect fair play sports,0,50 / gta / top
dwights accidental discharge the office us,0,50 / gta / top
top 10 most dramatic moments of the 2021 f1 season,0,50 / gta / top
top 10 best selling songs each year 20102020,0,50 / gta / top
the most insane piano pieces vol 1,0,50 / gta / top
top 10 best games of 202122 college basketball season,0,50 / gta / top
nba rigged moments,0,50 / gta / top
lockdown special best comedic movie moments,0,50 / gta / top
winny the pooh funny moment,0,50 / gta / top
winnie the pooh the best parts,0,50 / gta / top
funny scenes from disney the new adventures of winnie the pooh,0,50 / gta / top
greatest records in football,0,50 / gta / top
hermione sassing people 4 minutes straight,0,50 / gta / top
how josh nearly ended the sidemen,0,50 / gta / top
the price is right sidemen edition,0,50 / gta / top
ernie johnson breaking down laughing for 5 minutes straight,0,50 / gta / top
ksi getting bullied for 11 minutes,0,50 / gta / top
jims radio prank on dwight the office,0,50 / gta / top
best of dwight k schrute the office us,0,50 / gta / top
sidemen game of life in real life,0,50 / gta / top
the office wedding dance the office,0,50 / gta / top
sidemen flag game,0,50 / gta / top
zias blous funniest moments compilation part 12,0,50 / gta / top
zias and b lou funny moments hilarious,0,50 / gta / top
top 10 most difficult piano pieces,0,50 / gta / top
best christmas pranks the office,0,50 / gta / top
best of games the office us,0,50 / gta / top
the office olympiad pt 12 the office us,0,50 / gta / top
most heartwarming moments the office us,0,50 / gta / top
9986000 minutes the office us,0,50 / gta / top
the office wedding dance the office,0,50 / gta / top
bloopers vs the actual scene the office us edition comedy bites,0,50 / gta / top
pam realises jim is her soulmate the office us romcoms,0,50 / gta / top
the office wedding dance the office,0,50 / gta / top
best intro ever the office us,0,50 / gta / top
best of cold opens the office,0,50 / gta / top
best of break room the office us comedy bites,0,50 / gta / top
jims best pranks against dwight the office us,0,50 / gta / top
jim pranking dwight 12 minutes straight the office us,0,50 / gta / top
first aid fail the office us,0,50 / gta / top
season 5 bloopers the office us comedy bites,0,50 / gta / top
most underrated pranks voted by you the office us,0,50 / gta / top
sidemen cops vs robbers on gta 5,0,50 / gta / top
sidemen are hacked on gta 5,0,50 / gta / top
the greatest shot in television,0,50 / gta / top
7 minutes of zinchenko being bullied manchester city,0,50 / gta / top
sidemen woodwork challenge,0,50 / gta / top
sidemen gta death run sidemen gaming,0,50 / gta / top
first year with husky 8 weeks 1 year,0,50 / gta / top
top 50 sidemen gta moments,0,50 / gta / top
how to find the equation of tangent line using derivatives calculus 1,0,50 / gta / top
road to rage quit sidemen fifa 21 pro clubs,0,50 / gta / top
is ksi actually the smartest sideman sidemen gaming,0,50 / gta / top
just another typical sidemen compilation,0,50 / gta / top
sidemen golf but theres 1000000 on line,0,50 / gta / top
sidemen family fortunes,0,50 / gta / top
sidemen punishment pool insane,0,50 / gta / top
the sidemens best football moments,0,50 / gta / top
harry w2s being funniest sidemen 16 minutes straight,0,50 / gta / top
w2s best moments part 3,0,50 / gta / top
sidemen guess the song challenge,0,50 / gta / top
sidemen extreme minigolf,0,50 / gta / top
sidemen play golf in takeshis castle,0,50 / gta / top
saddest moments football try not to cry,0,50 / gta / top
the beauty of football greatest moments,0,50 / gta / top
this is football 201617 the beautiful game,0,50 / gta / top
sidemen hide seek minecraft sidemen gaming,0,50 / gta / top
first sidemen fortnite deathrun sidemen gaming,0,50 / gta / top
the sidemen lose their heads on gta 5,0,50 / gta / top
we are the best team in the world sidemen pro clubs,0,50 / gta / top
the fall of uconn football what happened,0,50 / gta / top
ksi funniest moments 1,0,50 / gta / top
the sidemen lose their heads on gta 5,0,50 / gta / top
w2s fifa rage compilation,0,50 / gta / top
reacting best behzinga rage moments,0,50 / gta / top
w2s live stream rage compilation among us and fifa 21 rage,0,50 / gta / top
sidemen react top w2s rage moments,0,50 / gta / top
why squidward is the most relatable character ever part 2 electric boogaloo,0,50 / gta / top
why squidward is the most relatable character ever,0,50 / gta / top
