Original_Title,Cleaned_Title,Cluster,Cluster_Name
How MICHAEL MYERS killed HALLOWEEN for everyone,how michael myers killed halloween everyone,0,Movies & Tv
How MICHAEL MYERS killed HALLOWEEN for everyone,how michael myers killed halloween everyone,0,Movies & Tv
The Office but it's just the debates,office debates,0,Movies & Tv
Michael Jackson - Billie Jean (Live at Madison Square Garden 2001),michael jackson billie jean live madison square garden 2001,0,Movies & Tv
Cringe moment at the Ambani Wedding,cringe moment ambani wedding,0,Movies & Tv
Jew Not Like Us!! Out now 🇮🇱✡️🙏😇❤️,jew like us,0,Movies & Tv
Scott Disick HOT for Kendall Jenner,scott disick hot kendall jenner,0,Movies & Tv
ULTIMATE Underrated Cold Opens that have no business being this funny,underrated cold opens business funny,0,Movies & Tv
Office PRANKS but they are just hilariously subtle,office pranks hilariously subtle,0,Movies & Tv
The Monsters Beneath Us: The Monument Mythos,monsters beneath us monument mythos,0,Movies & Tv
Inside Google’s $2.1B Office in a Transformed Freight Terminal | WSJ Open Office,inside googles 21b office transformed freight terminal wsj open office,0,Movies & Tv
olympic sports explained by the office | Comedy Bites,olympic sports explained office comedy bites,0,Movies & Tv
Uncovering the Alien Encounters of the US Government • Mystery Files,uncovering alien encounters us government mystery files,0,Movies & Tv
Inside Nvidia HQ: What a $2T Company’s Office Looks Like | WSJ Open Office,inside nvidia hq 2t companys office looks like wsj open office,0,Movies & Tv
"Smile 2 | Official Teaser Trailer (2024 Movie) - Naomi Scott, Lukas Gage",smile 2 teaser 2024 movie naomi scott lukas gage,0,Movies & Tv
Why US Malls Are Dying (And Why European Malls Aren't),us malls dying european malls arent,0,Movies & Tv
michael scott crossing the line for 9 minutes straight | The Office US | Comedy Bites,michael scott crossing line 9 minutes straight office us comedy bites,0,Movies & Tv
The Office PRANKS But They Get Progressively More Complex - The Office US,office pranks get progressively complex office us,0,Movies & Tv
the office but they're actually doing their jobs | Comedy Bites,office theyre actually jobs comedy bites,0,Movies & Tv
Office PRANKS But EVERYONE is in On The Joke - The Office US,office pranks everyone joke office us,0,Movies & Tv
the office plot twists that made my mind go a mile an hour | The Office US | Comedy Bites,office plot twists made mind go mile hour office us comedy bites,0,Movies & Tv
the office actually needing michael scott for 20 minutes 46 seconds | The Office US | Comedy Bites,office actually needing michael scott 20 minutes 46 seconds office us comedy bites,0,Movies & Tv
Creed but he Gets Progressively More Creed - The Office US,creed gets progressively creed office us,0,Movies & Tv
deeply inappropriate the office bloopers | Comedy Bites,deeply inappropriate office bloopers comedy bites,0,Movies & Tv
ULTIMATE UNDERRATED Cold Opens - The Office US,underrated cold opens office us,0,Movies & Tv
all of the office's terrible nicknames | Comedy Bites,offices terrible nicknames comedy bites,0,Movies & Tv
the entire office getting rejected for 10 minutes 38 seconds | The Office US | Comedy Bites,entire office getting rejected 10 minutes 38 seconds office us comedy bites,0,Movies & Tv
underrated insults from the office | Comedy Bites,underrated insults office comedy bites,0,Movies & Tv
The Office but it's just Dwight's Cold Opens,office dwights cold opens,0,Movies & Tv
the office conference room meetings held by anyone but michael scott - Comedy Bites,office conference room meetings held anyone michael scott comedy bites,0,Movies & Tv
20 Minutes of Improvised Moments from The Office US | Comedy Bites,20 minutes improvised office us comedy bites,0,Movies & Tv
the entire office sharing one braincell for 10 minutes straight | The Office US | Comedy Bites,entire office sharing one braincell 10 minutes straight office us comedy bites,0,Movies & Tv
The Office but the plot thickens like oatmeal - The Office US,office plot thickens like oatmeal office us,0,Movies & Tv
The Office Cold Opens that brought everyone together - The Office US,office cold opens brought everyone together office us,0,Movies & Tv
Top 100 Best Sports Bloopers 2020,100 sports bloopers 2020,0,Movies & Tv
EVERYONE Breaks: Bullpen Bloopers from The Office US | Comedy Bites,everyone breaks bullpen bloopers office us comedy bites,0,Movies & Tv
Israel has retaliated against Iran according to a senior US official,israel retaliated iran according senior us,0,Movies & Tv
ULTIMATE UNDERRATED Cold Opens - The Office US,underrated cold opens office us,0,Movies & Tv
the office memes that saved a life today... my own | Comedy Bites,office memes saved life today comedy bites,0,Movies & Tv
How to get a raise - The Office US,how get raise office us,0,Movies & Tv
PRANKS But They Get Progressively More Effortless - The Office,pranks get progressively effortless office,0,Movies & Tv
michael scott committing actual crimes for 10 minutes straight | The Office US | Comedy Bites,michael scott committing actual crimes 10 minutes straight office us comedy bites,0,Movies & Tv
Office PRANKS to Watch While YOU Procrastinate - The Office US,office pranks procrastinate office us,0,Movies & Tv
the office committing crimes for 10 minutes straight | Comedy Bites,office committing crimes 10 minutes straight comedy bites,0,Movies & Tv
jim and karen being a good couple for 8 minutes straight | The Office | Comedy Bites,jim karen good couple 8 minutes straight office comedy bites,0,Movies & Tv
Best Of... Michael Scott's Money Problems | The Office U.S. | Comedy Bites,michael scotts money problems office us comedy bites,0,Movies & Tv
Office PRANKS but it Gets Progressively Easier to Annoy Dwight - The Office US,office pranks gets progressively easier annoy dwight office us,0,Movies & Tv
Get yourself a friend like Dwight - The Office US,get friend like dwight office us,0,Movies & Tv
michael scott committing actual crimes for 10 minutes straight | The Office US | Comedy Bites,michael scott committing actual crimes 10 minutes straight office us comedy bites,0,Movies & Tv
Michael CeraVe,michael cerave,0,Movies & Tv
dwight schrute basically begging to be fired for over ten minutes | The Office US | Comedy Bites,dwight schrute basically begging fired ten minutes office us comedy bites,0,Movies & Tv
the office but they didn't hesitate | The Office US | Comedy Bites,office didnt hesitate office us comedy bites,0,Movies & Tv
Office PRANKS to Watch While You Eat - The Office US,office pranks eat office us,0,Movies & Tv
Why I am terrified of Jim Halpert,terrified jim halpert,0,Movies & Tv
Why I am terrified of Jim Halpert,terrified jim halpert,0,Movies & Tv
The Office | 8 Times Michael Scott Was Actually a Good Boss,office 8 times michael scott actually good boss,0,Movies & Tv
The Office Wedding Dance - The Office,office wedding dance office,0,Movies & Tv
Jim Finally Asks Pam Out - The Office,jim finally asks pam office,0,Movies & Tv
Anger Management - The Office US,anger management office us,0,Movies & Tv
the office bloopers but the ENTIRE cast breaks | Comedy Bites,office bloopers entire cast breaks comedy bites,0,Movies & Tv
How To Open Wine Without Cork Screw 2 Ways,how open wine without cork screw 2 ways,0,Movies & Tv
Don’t tell Jim - The Office US,dont tell jim office us,0,Movies & Tv
Intense psychologically revealing conversations - The Office US,intense psychologically revealing conversations office us,0,Movies & Tv
Office PRANKS to Watch Over The Holiday Season - The Office US,office pranks holiday season office us,0,Movies & Tv
Office PRANKS But EVERYONE is in On The Joke - The Office US,office pranks everyone joke office us,0,Movies & Tv
Office PRANKS but They Get Progressively More EXPENSIVE,office pranks get progressively expensive,0,Movies & Tv
Bride SINGS EPIC Thank You Song to Wedding Guests,bride sings epic thank song wedding guests,0,Movies & Tv
The Office Wedding Dance - The Office,office wedding dance office,0,Movies & Tv
The Office Cast Attempt Impressions - The Office US #shorts,office cast attempt impressions office us,0,Movies & Tv
Best Intro Ever - The Office US,intro ever office us,0,Movies & Tv
the office pranks that absolutely backfired | Comedy Bites,office pranks absolutely backfired comedy bites,0,Movies & Tv
jim and karen being a good couple for 8 minutes straight | The Office | Comedy Bites,jim karen good couple 8 minutes straight office comedy bites,0,Movies & Tv
jim and pam but the video ends when the sexual tension is too much | The Office US | Comedy Bites,jim pam ends sexual tension much office us comedy bites,0,Movies & Tv
UNDERRATED Office Moments You NEED to Watch - The Office US,underrated office need office us,0,Movies & Tv
Suits Cast At Prince Harry and Meghan Markle Wedding,suits cast prince harry meghan markle wedding,0,Movies & Tv
There's a Wedding in the Making | Suits,theres wedding making suits,0,Movies & Tv
Mike and Rachel's wedding planning hits a bump | Suits,mike rachels wedding planning hits bump suits,0,Movies & Tv
Office Space - The Bobs,office space bobs,0,Movies & Tv
Sidemen - How Did Fans Ruin Vikk's Wedding?,sidemen how fans ruin vikks wedding,0,Movies & Tv
Shifting Threats: U.S. Marine Corps Commercial,shifting threats us marine corps commercial,0,Movies & Tv
9 Times The Cast Broke IN an Episode of The Office US | Comedy Bites,9 times cast broke episode office us comedy bites,0,Movies & Tv
KSI PRANKS W2S!,ksi pranks w2s,0,Movies & Tv
Dwight But It Gets Progressively More Dwight - The Office US,dwight gets progressively dwight office us,0,Movies & Tv
Ray Lewis’s brotherhood with Michael Phelps❤️ #shorts #ravens,ray lewiss brotherhood michael phelps ravens,0,Movies & Tv
Pro Powerlifter pretends to be a Cleaner and Pranks confused Son with Father (Via YT: ANATOLY),pro powerlifter pretends cleaner pranks confused son father via yt anatoly,0,Movies & Tv
Office PRANKS but They Get Progressively More EXPENSIVE,office pranks get progressively expensive,0,Movies & Tv
The Office but it's Just The Tantrums - The Office US,office tantrums office us,0,Movies & Tv
Best Intro Ever - The Office US,intro ever office us,0,Movies & Tv
The Monsters Beyond Us: The Monument Mythos,monsters beyond us monument mythos,0,Movies & Tv
The Office but it Gets Progressively More Inappropriate - The Office US,office gets progressively inappropriate office us,0,Movies & Tv
LeBron was TOO COLD for this 🥶,lebron cold,0,Movies & Tv
"Michael Scott’s Emotional Farewell Song: “9,986,000 minutes” - The Office",michael scotts emotional farewell song 9986000 minutes office,0,Movies & Tv
Jim & Pam: Real Love - The Office US,jim pam real love office us,0,Movies & Tv
Pam Beesly | Not enough for you,pam beesly enough,0,Movies & Tv
Jim gets mad at Pam for not recording Cece,jim gets mad pam recording cece,0,Movies & Tv
The Office Wedding Dance - The Office,office wedding dance office,0,Movies & Tv
She Accepted Her Fate of Us CRASHING,accepted fate us crashing,0,Movies & Tv
Sidemen - How KSI's Speech Shocked Simon & Talia's Wedding,sidemen how ksis speech shocked simon talias wedding,0,Movies & Tv
Sidemen - How Randolph's Speech Ruined Simon & Talia's Wedding,sidemen how randolphs speech ruined simon talias wedding,0,Movies & Tv
Sidemen - What Went Wrong At Simon & Talia's Wedding,sidemen went wrong simon talias wedding,0,Movies & Tv
Some Of Us #jdmcarsoftiktok #jdmclothing#jdm #hondadc5 #hondacivic #jdmcars #carmeet #jdmlife#street,us jdmcarsoftiktok jdmclothingjdm hondadc5 hondacivic jdmcars carmeet jdmlifestreet,0,Movies & Tv
The Monsters Beneath Us: The Monument Mythos,monsters beneath us monument mythos,0,Movies & Tv
michael scott absolutely hating toby for 10 minutes straight | The Office US | Comedy Bites,michael scott absolutely hating toby 10 minutes straight office us comedy bites,0,Movies & Tv
TOBI PRANKS KSI,tobi pranks ksi,0,Movies & Tv
Michael B. Jordan's Insane Cheat Meal 🤤,michael b jordans insane cheat meal,0,Movies & Tv
FUNNIEST FAILS & BLOOPERS IN FOOTBALL (TRY NOT TO LAUGH),funniest fails bloopers football try laugh,0,Movies & Tv
Nickelodeon made a Open World SpongeBob Game..,nickelodeon made open world spongebob game,0,Movies & Tv
TOBI PRANKS KSI,tobi pranks ksi,0,Movies & Tv
Kobe too Cold 🥶❄️ #shorts,kobe cold,0,Movies & Tv
The Office but it Gets Progressively More Dangerous - The Office US,office gets progressively dangerous office us,0,Movies & Tv
TOBI PRANKS KSI,tobi pranks ksi,0,Movies & Tv
Top Soccer Shootout Ever With Scott Sterling - Studio C,soccer shootout ever scott sterling studio c,0,Movies & Tv
Native American Gets Revenge | Nimesh Patel | Stand Up Comedy,native american gets revenge nimesh patel stand comedy,0,Movies & Tv
JK Wedding Entrance Dance,jk wedding entrance dance,0,Movies & Tv
Tinder Date With A Cop | Nimesh Patel | Stand Up Comedy,tinder date cop nimesh patel stand comedy,0,Movies & Tv
Dwight Schrute has Ultimate Rizz - The Office US,dwight schrute rizz office us,0,Movies & Tv
JK Wedding Entrance Dance,jk wedding entrance dance,0,Movies & Tv
DATING INDIAN WOMEN | Nimesh Patel | Stand Up Comedy,dating indian women nimesh patel stand comedy,0,Movies & Tv
MORMON SOAKING | Nimesh Patel | Stand Up Comedy,mormon soaking nimesh patel stand comedy,0,Movies & Tv
BOEING INSPECTOR | Nimesh Patel | Stand Up Comedy,boeing inspector nimesh patel stand comedy,0,Movies & Tv
DRAFT KINGS DEAL | Nimesh Patel | Stand Up Comedy,draft kings deal nimesh patel stand comedy,0,Movies & Tv
ENDING SANTA ARGUMENT | Nimesh Patel | Stand Up Comedy,ending santa argument nimesh patel stand comedy,0,Movies & Tv
E.R. DOCTOR IN VEGAS | Nimesh Patel | Standup Comedy,er doctor vegas nimesh patel standup comedy,0,Movies & Tv
IS USHER WASHED UP? | Nimesh Patel | Stand Up Comedy,usher washed nimesh patel stand comedy,0,Movies & Tv
COUNTING CARDS | Nimesh Patel | Stand Up Comedy,counting cards nimesh patel stand comedy,0,Movies & Tv
Indian Jew Wants to Get Roasted | Nimesh Patel | Stand Up Comedy,indian jew wants get roasted nimesh patel stand comedy,0,Movies & Tv
HECKLER GETS ROWDY | Nimesh Patel | Stand Up Comedy,heckler gets rowdy nimesh patel stand comedy,0,Movies & Tv
CRUMPLER OR FOLDER | Nimesh Patel | Stand Up Comedy,crumpler folder nimesh patel stand comedy,0,Movies & Tv
CUBAN REFUGEE | Nimesh Patel | Stand Up Comedy,cuban refugee nimesh patel stand comedy,0,Movies & Tv
INDIAN FOOD | Nimesh Patel | Stand Up Comedy,indian food nimesh patel stand comedy,0,Movies & Tv
SURROUNDED BY KIPS | Nimesh Patel | Stand Up Comedy,surrounded kips nimesh patel stand comedy,0,Movies & Tv
WHAT IS RIZZ? | Nimesh Patel | Stand Up Comedy,rizz nimesh patel stand comedy,0,Movies & Tv
Roasting Minneapolis | Nimesh Patel | Stand Up Comedy,roasting minneapolis nimesh patel stand comedy,0,Movies & Tv
Honest Exteriors? | Nimesh Patel | Stand Up Comedy,honest exteriors nimesh patel stand comedy,0,Movies & Tv
Vaguest Job Ever | Nimesh Patel | Stand Up Comedy,vaguest job ever nimesh patel stand comedy,0,Movies & Tv
AI Writes Jokes | Nimesh Patel | Stand Up Comedy,ai writes jokes nimesh patel stand comedy,0,Movies & Tv
Dentists Gone Wild | Nimesh Patel | Stand Up Comedy,dentists gone wild nimesh patel stand comedy,0,Movies & Tv
Audience Member Has Attitude | Nimesh Patel | Stand Up Comedy,audience member attitude nimesh patel stand comedy,0,Movies & Tv
Right In There? | Nimesh Patel | Stand Up Comedy,right nimesh patel stand comedy,0,Movies & Tv
Rich Flex | Nimesh Patel | Stand Up Comedy,rich flex nimesh patel stand comedy,0,Movies & Tv
Questioning Prison Guard | Nimesh Patel | Stand Up Comedy,questioning prison guard nimesh patel stand comedy,0,Movies & Tv
World Cup Opinions | Nimesh Patel | Stand Up Comedy,world cup opinions nimesh patel stand comedy,0,Movies & Tv
Indian Rapper | Nimesh Patel | Stand Up Comedy,indian rapper nimesh patel stand comedy,0,Movies & Tv
Roasting Naples Florida | Nimesh Patel | Stand Up Comedy,roasting naples florida nimesh patel stand comedy,0,Movies & Tv
Indianapolis Halloween Costumes | Nimesh Patel | Stand Up Comedy,indianapolis halloween costumes nimesh patel stand comedy,0,Movies & Tv
What is Caving? | Nimesh Patel | Stand Up Comedy,caving nimesh patel stand comedy,0,Movies & Tv
The Idaho M*rders | Nimesh Patel | Stand Up Comedy,idaho mrders nimesh patel stand comedy,0,Movies & Tv
TRYING EXPENSIVE BOURBON | Nimesh Patel | Stand Up Comedy,trying expensive bourbon nimesh patel stand comedy,0,Movies & Tv
ROASTING WHITE RAPPER | Nimesh Patel | Stand Up Comedy,roasting white rapper nimesh patel stand comedy,0,Movies & Tv
Jim and Pam |  I want you and always will | The Office,jim pam want always office,0,Movies & Tv
Too cold 🥶🥶 #shorts,cold,0,Movies & Tv
The Office | Every Cold Open (Season 9 Part 1),office every cold open season 9 1,0,Movies & Tv
Women's Appreciation - The Office US,womens appreciation office us,0,Movies & Tv
Season 3 BLOOPERS | The Office US | Comedy Bites,season 3 bloopers office us comedy bites,0,Movies & Tv
pam and angela actually being friends for 9 minutes straight | The Office US | Comedy Bites,pam angela actually friends 9 minutes straight office us comedy bites,0,Movies & Tv
Billie Eilish gets QUIZZED by Rainn Wilson on ‘The Office' | Billboard,billie eilish gets quizzed rainn wilson office billboard,0,Movies & Tv
"9,986,000 Minutes  - The Office US",9986000 minutes office us,0,Movies & Tv
Best Brother Wedding Speech Kills Crowd (hilarious ending!),brother wedding speech kills crowd hilarious ending,0,Movies & Tv
JK Wedding Entrance Dance,jk wedding entrance dance,0,Movies & Tv
The Office Wedding Dance - The Office,office wedding dance office,0,Movies & Tv
"The Office Farewells: The Cast, Part 1",office farewells cast 1,0,Movies & Tv
The Office Cast Reunites for Zoom Wedding: Some Good News with John Krasinski (Ep. 7),office cast reunites zoom wedding good news john krasinski ep 7,0,Movies & Tv
that time the office cast broke IN AN EPISODE | #Shorts  Comedy Bites,time office cast broke episode comedy bites,0,Movies & Tv
Best Intro Ever - The Office US,intro ever office us,0,Movies & Tv
Best of the Cold Opens - The Office,cold opens office,0,Movies & Tv
Best of the Warehouse | The Office US | Comedy Bites,warehouse office us comedy bites,0,Movies & Tv
EVEN MORE Season 6 BLOOPERS | The Office US | Comedy Bites,even season 6 bloopers office us comedy bites,0,Movies & Tv
the office season 7 bloopers | The Office US | Comedy Bites,office season 7 bloopers office us comedy bites,0,Movies & Tv
Jim and Pam |  I want you and always will | The Office,jim pam want always office,0,Movies & Tv
jim halpert is the most romantic character on the office: change my mind | Comedy Bites,jim halpert romantic character office change mind comedy bites,0,Movies & Tv
Every Time Pam Was Jealous - The Office US,every time pam jealous office us,0,Movies & Tv
Worst Of... Karen Being a Karen | The Office U.S. | Comedy Bites,worst karen karen office us comedy bites,0,Movies & Tv
Everybody Hates Gabe | The Office U.S. | Comedy Bites,everybody hates gabe office us comedy bites,0,Movies & Tv
Sassiest Moments  - The Office US,sassiest office us,0,Movies & Tv
the office season 5 bloopers but make it chaotic | Comedy Bites,office season 5 bloopers make chaotic comedy bites,0,Movies & Tv
Best of the Bloopers | The Office U.S. | Comedy Bites,bloopers office us comedy bites,0,Movies & Tv
Best of Erin  - The Office US,erin office us,0,Movies & Tv
Anger Management - The Office US,anger management office us,0,Movies & Tv
Joji -  Glimpse of Us,joji glimpse us,0,Movies & Tv
Joji performing Glimpse of Us LIVE for the first time EVER,joji performing glimpse us live first time ever,0,Movies & Tv
The Monsters Beneath Us: The Monument Mythos,monsters beneath us monument mythos,0,Movies & Tv
the office season 4 bloopers | The Office U.S. | Comedy Bites,office season 4 bloopers office us comedy bites,0,Movies & Tv
the office season 3 bloopers | The Office U.S. | Comedy Bites,office season 3 bloopers office us comedy bites,0,Movies & Tv
Casting The Office | A Peacock Extra | The Office US,casting office peacock extra office us,0,Movies & Tv
Cathy Tries to Seduce Jim  - The Office US,cathy tries seduce jim office us,0,Movies & Tv
Dwight Don't Simp  - The Office US,dwight dont simp office us,0,Movies & Tv
Jim & Dwight: The Best of FRENEMIES  - The Office US,jim dwight frenemies office us,0,Movies & Tv
Michael Becomes Jim - The Office US,michael becomes jim office us,0,Movies & Tv
Michael vs Toby  - The Office US,michael toby office us,0,Movies & Tv
Stanley Hudson McFreaking Losing It (Angry Stanley) | The Office | Comedy Bites,stanley hudson mcfreaking losing angry stanley office comedy bites,0,Movies & Tv
the office's final scene made me fully sob | Comedy Bites,offices final scene made fully sob comedy bites,0,Movies & Tv
"See You Tomorrow for Lunch, Michael!  - The Office US",see tomorrow lunch michael office us,0,Movies & Tv
"9,986,000 Minutes  - The Office US",9986000 minutes office us,0,Movies & Tv
Roasting Trump Supporters | Nimesh Patel | Stand Up Comedy,roasting trump supporters nimesh patel stand comedy,0,Movies & Tv
DRAFT KINGS DEAL | Nimesh Patel | Stand Up Comedy,draft kings deal nimesh patel stand comedy,0,Movies & Tv
"Batman: Arkham Origins - Cold, Cold Heart (Full DLC Walkthrough)",batman arkham origins cold cold heart dlc walkthrough,0,Movies & Tv
NOSEY CROWD MEMBERS | Nimesh Patel | Stand Up Comedy,nosey crowd members nimesh patel stand comedy,0,Movies & Tv
BOEING INSPECTOR | Nimesh Patel | Stand Up Comedy,boeing inspector nimesh patel stand comedy,0,Movies & Tv
Audience Member Roasts Me | Nimesh Patel | Stand Up Comedy,audience member roasts nimesh patel stand comedy,0,Movies & Tv
AUDIENCE GETS ROWDY | Nimesh Patel | Stand Up Comedy,audience gets rowdy nimesh patel stand comedy,0,Movies & Tv
Ruining a First Date | Nimesh Patel | Stand Up Comedy,ruining first date nimesh patel stand comedy,0,Movies & Tv
It Will Be Fine  - The Office US,fine office us,0,Movies & Tv
It's a ridiculous choice for this climate - The Office US,ridiculous choice climate office us,0,Movies & Tv
I am not to be ******** with - The Office US,office us,0,Movies & Tv
“Voting 101” 🎤: Michael Turner - #comedy #michaelturner #donttellcomedy #shorts,voting 101 michael turner comedy michaelturner donttellcomedy,0,Movies & Tv
“Fake Doctors” 🎤: Michael Longfellow - #comedy #michaellongfellow #donttellcomedy #shorts,fake doctors michael longfellow comedy michaellongfellow donttellcomedy,0,Movies & Tv
“Voting 101” 🎤: Michael Turner - #comedy #michaelturner #donttellcomedy #shorts,voting 101 michael turner comedy michaelturner donttellcomedy,0,Movies & Tv
“Cyberbullying” 🎤: Michael Longfellow - #donttellcomedy #michaellongfellow #shorts,cyberbullying michael longfellow donttellcomedy michaellongfellow,0,Movies & Tv
The Cannibal Killing of Michael Rockefeller,cannibal killing michael rockefeller,0,Movies & Tv
Best Toby Slurs - The Office US,toby slurs office us,0,Movies & Tv
Michael Scott CROSSES THE LINE  - The Office US,michael scott crosses line office us,0,Movies & Tv
Michael Scott CROSSES THE LINE  - The Office US,michael scott crosses line office us,0,Movies & Tv
the office season 4 bloopers | The Office U.S. | Comedy Bites,office season 4 bloopers office us comedy bites,0,Movies & Tv
Season 2 Bloopers - The Office US | Comedy Bites,season 2 bloopers office us comedy bites,0,Movies & Tv
season 6 bloopers pt. 2 | The Office U.S. | Comedy Bites,season 6 bloopers pt 2 office us comedy bites,0,Movies & Tv
Marry You - Jim and Pam,marry jim pam,0,Movies & Tv
Jim & Pam - Take On The World,jim pam take world,0,Movies & Tv
Ryan VS Pam - The Office US,ryan pam office us,0,Movies & Tv
Dwight Gets Appendicitis  - The Office US,dwight gets appendicitis office us,0,Movies & Tv
michael scott actually being a good boss for 9 minutes straight | The Office U.S. | Comedy Bites,michael scott actually good boss 9 minutes straight office us comedy bites,0,Movies & Tv
"We Every ""The Office"" Deleted Scene So You Don't Have To | Comedy Bites",every office deleted scene dont comedy bites,0,Movies & Tv
Everybody Hates Gabe | The Office U.S. | Comedy Bites,everybody hates gabe office us comedy bites,0,Movies & Tv
"try not to vomit challenge | the office us, parks and recreation & more | Comedy Bites",try vomit challenge office us parks recreation comedy bites,0,Movies & Tv
The Best Of The Warehouse  - The Office US,warehouse office us,0,Movies & Tv
The Best of Michael and Erin: The Office's Sweetest Friendship | Comedy Bites,michael erin offices sweetest friendship comedy bites,0,Movies & Tv
Best of Erin  - The Office US,erin office us,0,Movies & Tv
Every Time Pam Was Jealous - The Office US,every time pam jealous office us,0,Movies & Tv
The Best Of Darryl  - The Office US,darryl office us,0,Movies & Tv
look how the turntables: dwight's pranks on jim | The Office U.S. | Comedy Bites,look how turntables dwights pranks jim office us comedy bites,0,Movies & Tv
the office's weirdest conference room scenes | The Office US | Comedy Bites,offices weirdest conference room scenes office us comedy bites,0,Movies & Tv
Dwight Don't Simp  - The Office US,dwight dont simp office us,0,Movies & Tv
Todd Packer Drugs the Office - The Office US,todd packer drugs office office us,0,Movies & Tv
Dwight's Owed Favor  - The Office US,dwights owed favor office us,0,Movies & Tv
Dwight Loves Cornell - The Office US,dwight loves cornell office us,0,Movies & Tv
Best Christmas Pranks - The Office,christmas pranks office,0,Movies & Tv
Best of the Break Room | The Office U.S. | Comedy Bites,break room office us comedy bites,0,Movies & Tv
Anger Management - The Office US,anger management office us,0,Movies & Tv
