Title,KMeans Cluster,DBSCAN Cluster,Cluster Name
cardi b wap feat megan thee stallion official audio,7,-1,Random / Miscellaneous
cardi b wap feat megan thee stallion official music video,7,-1,Random / Miscellaneous
baby keem kendrick lamar family ties official video,7,410,Random / Miscellaneous
roddy ricch the box official audio,7,-1,Random / Miscellaneous
roddy ricch the box official music video,7,-1,Random / Miscellaneous
pop smoke for the night audio lil baby dababy,7,-1,Random / Miscellaneous
jhay cortez j balvin bad bunny no me conoce remix,7,245,Random / Miscellaneous
rdcworld1 hilarious scary video comedy compilation,7,-1,Random / Miscellaneous
jhay cortez anuel aa j balvin medusa official video,7,-1,Random / Miscellaneous
pop smoke dior official video,7,321,Random / Miscellaneous
jhay cortez j balvin bad bunny no me conoce remix,7,245,Random / Miscellaneous
jhay cortez j balvin bad bunny no me conoce remix,7,245,Random / Miscellaneous
nicki minaj feeling myself official audio beyonc,7,324,Random / Miscellaneous
jhay cortez j balvin bad bunny no me conoce remix,7,245,Random / Miscellaneous
pop smoke dior official video,7,321,Random / Miscellaneous
chris brown young thug go crazy official video,7,-1,Random / Miscellaneous
rvssian rauw alejandro chris brown nostlgico official video,7,37,Random / Miscellaneous
rauw alejandro chencho corleone desesperados video oficial,7,208,Random / Miscellaneous
rauw alejandro crame video oficial,7,-1,Random / Miscellaneous
rauw alejandro x anuel aa reloj video oficial,7,-1,Random / Miscellaneous
jhay cortez anuel aa j balvin medusa official video,7,-1,Random / Miscellaneous
sebastin yatra myke towers pareja del ao official performance video,7,-1,Random / Miscellaneous
jay wheeler la curiosidad myke towers official video,7,-1,Random / Miscellaneous
pop smoke dior official video,7,321,Random / Miscellaneous
jhay cortez j balvin bad bunny no me conoce remix,7,245,Random / Miscellaneous
jay wheeler la curiosidad myke towers official video,7,-1,Random / Miscellaneous
lord huron the night we met official audio,7,284,Random / Miscellaneous
rauw alejandro crame video oficial,7,-1,Random / Miscellaneous
lewis capaldi before you go official video,7,365,Random / Miscellaneous
lord huron the night we met official audio,7,284,Random / Miscellaneous
lewis capaldi before you go official video,7,365,Random / Miscellaneous
lewis capaldi before you go official video,7,365,Random / Miscellaneous
lil wayne kobe bryant official video,7,-1,Random / Miscellaneous
pop smoke dior official video,7,321,Random / Miscellaneous
roddy ricch high fashion feat mustard official audio,7,-1,Random / Miscellaneous
meek mill going bad feat drake official video,7,415,Random / Miscellaneous
baby keem kendrick lamar family ties official video,7,410,Random / Miscellaneous
pentatonix hallelujah official video,7,215,Random / Miscellaneous
celine dion because you loved me official live video hd,7,-1,Random / Miscellaneous
jon bellion all time low official music video,7,-1,Random / Miscellaneous
jeremy zucker supercuts official video,7,238,Random / Miscellaneous
jon bellion all time low official music video,7,-1,Random / Miscellaneous
benny blanco juice wrld graduation official music video,7,37,Random / Miscellaneous
lord huron the night we met official audio,7,284,Random / Miscellaneous
gerry the pacemakers youll never walk alone official video,7,-1,Random / Miscellaneous
kendrick lamar die hard blxst amanda reifer official audio,7,-1,Random / Miscellaneous
britney spears till the world ends official video,7,-1,Random / Miscellaneous
lizzo about damn time official video,7,-1,Random / Miscellaneous
no me conoce remix jhay cortez j balvin bad bunny choreography by emir abdul gani,7,-1,Random / Miscellaneous
major lazer ellie goulding powerful feat tarrus riley official music video,7,37,Random / Miscellaneous
gayle abcdefu official music video,7,237,Random / Miscellaneous
the script hall of fame official video william,7,-1,Random / Miscellaneous
eminem lose yourself hd,7,206,Random / Miscellaneous
eminem the real slim shady official video clean version,7,-1,Random / Miscellaneous
gayle abcdefu official music video,7,237,Random / Miscellaneous
alan walker x benjamin ingrosso man on the moon official music video,7,-1,Random / Miscellaneous
juice wrld up up and away official audio,7,-1,Random / Miscellaneous
the messi era official movie,7,-1,Random / Miscellaneous
celine dion because you loved me official live video hd,7,-1,Random / Miscellaneous
spiderman 3 2007 official trailer hd,7,-1,Random / Miscellaneous
juice wrld up up and away official audio,7,-1,Random / Miscellaneous
juice wrld up up and away official audio,7,-1,Random / Miscellaneous
anson seabra i cant carry this anymore official lyric video,7,-1,Random / Miscellaneous
jaymes young happiest year official music video,7,-1,Random / Miscellaneous
kid cudi pursuit of happiness project x official music hd,7,-1,Random / Miscellaneous
soccer pump up mix hype video 2015 hd,7,306,Random / Miscellaneous
young thug bubbly with drake travis scott official audio,7,-1,Random / Miscellaneous
geazy power official video nef the pharaoh plo,7,-1,Random / Miscellaneous
dillon francis say less geazy official music video,7,-1,Random / Miscellaneous
snow patrol chasing cars official video,7,37,Random / Miscellaneous
the lumineers sleep on the floor official video,7,-1,Random / Miscellaneous
jp saxe if world was ending official video julia michaels,7,-1,Random / Miscellaneous
adele someone like you official music video,7,-1,Random / Miscellaneous
baby keem 16 official video,7,-1,Random / Miscellaneous
rauw alejandro chencho corleone desesperados video oficial,7,208,Random / Miscellaneous
pop smoke dior 8d audio best version,7,-1,Random / Miscellaneous
travis scott goosebumps kendrick lamar 8d audio,7,423,Random / Miscellaneous
jaden rainbow bap official visualizer,7,-1,Random / Miscellaneous
lil skies lust official music video dir by nicholasjandora,7,-1,Random / Miscellaneous
blocboy jb drake look alive prod by tay keith official music video shot by yooali,7,233,Random / Miscellaneous
french montana no stylist official video drake,7,-1,Random / Miscellaneous
meek mill going bad feat drake official video,7,415,Random / Miscellaneous
benny blanco juice wrld graduation official music video,7,37,Random / Miscellaneous
baby keem honest official video,7,238,Random / Miscellaneous
baby keem honest official video,7,238,Random / Miscellaneous
baby keem kendrick lamar family ties official video,7,410,Random / Miscellaneous
benny blanco juice wrld graduation official music video,7,37,Random / Miscellaneous
jabbawockeez family ties by baby keem dance video,7,-1,Random / Miscellaneous
baby keem kendrick lamar family ties official video,7,410,Random / Miscellaneous
nav status feat lil uzi vert audio,7,-1,Random / Miscellaneous
baby keem travis scott durag activity official video,7,37,Random / Miscellaneous
baby keem trademark usa official audio,7,-1,Random / Miscellaneous
baby keem kendrick lamar family ties official video,7,410,Random / Miscellaneous
meek mill going bad feat drake official video,7,415,Random / Miscellaneous
juice wrld robbery official music video,7,238,Random / Miscellaneous
benny blanco juice wrld graduation official music video,7,37,Random / Miscellaneous
jaden rainbow bap official visualizer,7,-1,Random / Miscellaneous
jaden summertime in paris willow official audio,7,402,Random / Miscellaneous
meek mill pray for em official instrumental prod by csick,7,328,Random / Miscellaneous
jon bellion all time low official music video,7,-1,Random / Miscellaneous
benny blanco juice wrld graduation official music video,7,37,Random / Miscellaneous
bazzi mine official music video,7,237,Random / Miscellaneous
bazzi paradise official music video,7,237,Random / Miscellaneous
bazzi young alive official music video,7,238,Random / Miscellaneous
jaden rainbow bap official visualizer,7,-1,Random / Miscellaneous
jaden summertime in paris willow official audio,7,402,Random / Miscellaneous
ksi holiday official music video,7,-1,Random / Miscellaneous
chamillionaire ridin official music video krayzie bone,7,37,Random / Miscellaneous
meek mill pray for em official instrumental prod by csick,7,328,Random / Miscellaneous
meek mill pray for em official instrumental prod by csick,7,328,Random / Miscellaneous
jaden summertime in paris willow official audio,7,402,Random / Miscellaneous
meek mill lord knows official instrumental remade by dell beats,7,-1,Random / Miscellaneous
meek mill lord knows official instrumental remade by dell beats,7,-1,Random / Miscellaneous
meek mill pray for em official instrumental prod by csick,7,328,Random / Miscellaneous
duke dumont ocean drive official music video,7,37,Random / Miscellaneous
wizthemc lied official lyric video,7,238,Random / Miscellaneous
wizthemc do it over official music video,7,-1,Random / Miscellaneous
jaden summertime in paris willow official audio,7,402,Random / Miscellaneous
jaden rainbow bap official visualizer,7,-1,Random / Miscellaneous
the best freekick video on youtube,7,322,Random / Miscellaneous
sr welcome to brixton music video grm daily,7,-1,Random / Miscellaneous
ksi ruined this video,7,-1,Random / Miscellaneous
big time rush boyfriend official video snoop dogg,7,-1,Random / Miscellaneous
eminem lose yourself 8d audio,7,205,Random / Miscellaneous
ksi ruined this video,7,-1,Random / Miscellaneous
outkast hey ya official hd video,7,-1,Random / Miscellaneous
snoop dogg wiz khalifa young wild free bruno mars official video,7,-1,Random / Miscellaneous
kid cudi pursuit of happiness acoustic 2021 original official audio,7,-1,Random / Miscellaneous
ksi ruined this video,7,-1,Random / Miscellaneous
cs video 1,7,-1,Random / Miscellaneous
cs video,7,-1,Random / Miscellaneous
soccer pump up mix hype video 2015 hd,7,306,Random / Miscellaneous
dominic fike 3 nights official video,7,-1,Random / Miscellaneous
dominic fike double negative skeleton milkshake official audio,7,324,Random / Miscellaneous
migos racks skinny official video,7,238,Random / Miscellaneous
ksi ricegum earthquake official music video 1080p,7,-1,Random / Miscellaneous
randolph manchild deji diss track official video,7,37,Random / Miscellaneous
ksi randolph beerus official music video,7,351,Random / Miscellaneous
kodak black zeze feat travis scott offset official audio,7,-1,Random / Miscellaneous
metro boomin space cadet feat gunna official audio,7,-1,Random / Miscellaneous
lil baby x gunna drip too hard official audio,7,313,Random / Miscellaneous
j balvin x bad bunny la cancin oasis video oficial,7,-1,Random / Miscellaneous
lil yachty minnesota quavo skippa da flippa official video,7,-1,Random / Miscellaneous
bbno rich brian edamame official video,7,37,Random / Miscellaneous
my last video with jj,7,-1,Random / Miscellaneous
calfreezy reveals his highest earning video,7,-1,Random / Miscellaneous
peach tree rascals fumari official music video,7,37,Random / Miscellaneous
chamillionaire ridin official music video krayzie bone,7,37,Random / Miscellaneous
the killers mr brightside official music video,7,-1,Random / Miscellaneous
the killers mr brightside official music video,7,-1,Random / Miscellaneous
maroon 5 misery official music video,7,-1,Random / Miscellaneous
big shaq mans not hot music video reaction michaeldapaah,7,-1,Random / Miscellaneous
tobi manny destined for greatness feat janell official music video,7,299,Random / Miscellaneous
meek mill going bad feat drake official video,7,415,Random / Miscellaneous
drake knife talk official video 21 savage project pat,7,-1,Random / Miscellaneous
wizthemc for a minute official music video,7,-1,Random / Miscellaneous
neymar the perfect chaos official trailer netflix,7,-1,Random / Miscellaneous
dominic fike 3 nights official video,7,-1,Random / Miscellaneous
jhay cortez myke towers los bo official video,7,-1,Random / Miscellaneous
gunna p power feat drake official audio,7,-1,Random / Miscellaneous
the amazing spiderman official trailer hd,7,-1,Random / Miscellaneous
nio garcia x j balvin x bad bunny am remix video oficial,7,-1,Random / Miscellaneous
6ix9ine is video game,7,-1,Random / Miscellaneous
jaden lucy official visualizer,7,-1,Random / Miscellaneous
conan gray heather official lyric video,7,37,Random / Miscellaneous
papichuloteej do better official audio,7,-1,Random / Miscellaneous
public make you mine official lyric video,7,-1,Random / Miscellaneous
public make you mine put your hand mine official video,7,-1,Random / Miscellaneous
sidemen merry merry christmas ft jme layz official music video,7,-1,Random / Miscellaneous
jason mraz have it all official video,7,-1,Random / Miscellaneous
jason mraz lucky feat colbie caillat official video hd remaster,7,-1,Random / Miscellaneous
maroon 5 sugar official music video,7,-1,Random / Miscellaneous
abba dancing queen official music video,7,238,Random / Miscellaneous
bee gees stayin alive official music video,7,37,Random / Miscellaneous
berlin take my breath away official video top gun,7,-1,Random / Miscellaneous
jaden lucy official visualizer,7,-1,Random / Miscellaneous
post malone swae lee sunflower spiderman into spiderverse official video,7,195,Random / Miscellaneous
jay wheeler la curiosidad myke towers official video,7,-1,Random / Miscellaneous
post malone swae lee sunflower spiderman into spiderverse official video,7,195,Random / Miscellaneous
jhay cortez j balvin bad bunny no me conoce remix,7,245,Random / Miscellaneous
black eyed peas j balvin ritmo bad boys for life official music video,7,-1,Random / Miscellaneous
sob x rbe paramedic official lyrics meaning verified,7,-1,Random / Miscellaneous
jhay cortez j balvin bad bunny no me conoce remix letralyrics,7,-1,Random / Miscellaneous
dj snake taki taki selena gomez ozuna cardi b official music video,7,-1,Random / Miscellaneous
black eyed peas j balvin ritmo bad boys for life official music video,7,-1,Random / Miscellaneous
bad bunny ft el alfa la romana x100pre video oficial,7,-1,Random / Miscellaneous
sean paul j balvin contra la pared lyric video,7,-1,Random / Miscellaneous
rosala j balvin con altura official video el guincho,7,-1,Random / Miscellaneous
jaden summertime in paris willow official audio,7,402,Random / Miscellaneous
suicide audio,7,-1,Random / Miscellaneous
adin ross makes it into polo gs music video,7,-1,Random / Miscellaneous
sidemen merry merry christmas ft jme layz official music video,7,-1,Random / Miscellaneous
sidemen the gift ft sx official music video,7,398,Random / Miscellaneous
becky g el alfa fulanito official video,7,234,Random / Miscellaneous
the outfield your love official hd video,7,-1,Random / Miscellaneous
earth wind fire september official hd video,7,-1,Random / Miscellaneous
abba dancing queen official music video,7,238,Random / Miscellaneous
bee gees stayin alive official music video,7,37,Random / Miscellaneous
becky g el alfa fulanito official video,7,234,Random / Miscellaneous
miley cyrus party in the usa official video,7,-1,Random / Miscellaneous
arcngel bad bunny original video oficial,7,-1,Random / Miscellaneous
logic 18002738255 alessia cara khalid official video,7,37,Random / Miscellaneous
pop smoke dior official video,7,321,Random / Miscellaneous
roddy ricch the box official audio,7,-1,Random / Miscellaneous
sidemen merry merry christmas ft jme layz official music video,7,-1,Random / Miscellaneous
becky g el alfa fulanito official video,7,234,Random / Miscellaneous
jack harlow pooh shiesty suvs black on black official audio,7,-1,Random / Miscellaneous
jack harlow face of my city feat lil baby official audio,7,-1,Random / Miscellaneous
lord huron the night we met official lyric video,7,-1,Random / Miscellaneous
labrinth jealous official video,7,215,Random / Miscellaneous
juice wrld make believe official audio,7,-1,Random / Miscellaneous
sean paul j balvin contra la pared lyric video,7,-1,Random / Miscellaneous
pop smoke dior official video,7,321,Random / Miscellaneous
jack harlow whats poppin feat dababy tory lanez lil wayne official video,7,-1,Random / Miscellaneous
eminem lose yourself 8d audio,7,205,Random / Miscellaneous
travis scott goosebumps kendrick lamar 8d audio,7,423,Random / Miscellaneous
eminem lose yourself 8d audio,7,205,Random / Miscellaneous
travis scott goosebumps kendrick lamar 8d audio,7,423,Random / Miscellaneous
pop smoke dior official video,7,321,Random / Miscellaneous
lil baby gunna drake never recover official audio,7,452,Random / Miscellaneous
cardi b wap feat megan thee stallion official audio,7,-1,Random / Miscellaneous
becky g el alfa fulanito official video,7,234,Random / Miscellaneous
pop smoke dior official video,7,321,Random / Miscellaneous
lil baby gunna drake never recover official audio,7,452,Random / Miscellaneous
drake lil baby yes indeed lyrics,7,-1,Random / Miscellaneous
the script superheroes official video,7,-1,Random / Miscellaneous
geazy i mean it official music video remo,7,-1,Random / Miscellaneous
fulanito becky g el alfa fitdance coreografia dance video,7,-1,Random / Miscellaneous
geazy i mean it official music video remo,7,-1,Random / Miscellaneous
macklemore ryan lewis thrift shop feat wanz official video,7,453,Random / Miscellaneous
070 shake guilty conscience official video,7,37,Random / Miscellaneous
pop smoke dior official video,7,321,Random / Miscellaneous
twayne nasty freestyle official music video,7,238,Random / Miscellaneous
lil baby x gunna drip too hard official audio,7,313,Random / Miscellaneous
pop smoke dior official video,7,321,Random / Miscellaneous
lil baby gunna drake never recover official audio,7,452,Random / Miscellaneous
metro boomin no complaints feat offset drake official audio,7,-1,Random / Miscellaneous
meek mill rico feat drake official audio,7,-1,Random / Miscellaneous
meek mill going bad feat drake official video,7,415,Random / Miscellaneous
offset metro boomin ric flair drip official audio,7,324,Random / Miscellaneous
tee grizzley from the d to the a lil yachty official video,7,455,Random / Miscellaneous
geazy i mean it official music video remo,7,-1,Random / Miscellaneous
aap rocky praise the lord da shine official video skepta,7,-1,Random / Miscellaneous
becky g el alfa fulanito official video,7,234,Random / Miscellaneous
fulanito becky g el alfa fitdance coreografia dance video,7,-1,Random / Miscellaneous
the script superheroes official video,7,-1,Random / Miscellaneous
bruno mars when i was your man official music video,7,-1,Random / Miscellaneous
lord huron the night we met official lyric video,7,-1,Random / Miscellaneous
freya ridings lost without you official video,7,-1,Random / Miscellaneous
jason mraz lucky feat colbie caillat official video hd remaster,7,-1,Random / Miscellaneous
offset metro boomin ric flair drip official audio,7,324,Random / Miscellaneous
metro boomin no complaints feat offset drake official audio,7,-1,Random / Miscellaneous
meek mill rico feat drake official audio,7,-1,Random / Miscellaneous
lil baby gunna drake never recover official audio,7,452,Random / Miscellaneous
quality control lil baby dababy baby audio,7,-1,Random / Miscellaneous
ferg plain jane official video,7,238,Random / Miscellaneous
pop smoke dior official video,7,321,Random / Miscellaneous
meek mill going bad feat drake official video,7,415,Random / Miscellaneous
bruno mars anderson paak silk sonic smokin out the window official music video,7,-1,Random / Miscellaneous
desiigner panda official music video,7,237,Random / Miscellaneous
lil baby woah official audio,7,-1,Random / Miscellaneous
quality control lil baby dababy baby audio,7,-1,Random / Miscellaneous
lil baby gunna drake never recover official audio,7,452,Random / Miscellaneous
offset metro boomin ric flair drip official audio,7,324,Random / Miscellaneous
tee grizzley from the d to the a lil yachty official video,7,455,Random / Miscellaneous
pop smoke dior official video,7,321,Random / Miscellaneous
lil uzi vert xo tour llif3 official lyric video,7,-1,Random / Miscellaneous
migos bad boujee lil uzi vert official video,7,-1,Random / Miscellaneous
migos walk it talk it drake official video,7,-1,Random / Miscellaneous
meek mill going bad feat drake official video,7,415,Random / Miscellaneous
jack harlow whats poppin feat dababy tory lanez lil wayne official video,7,-1,Random / Miscellaneous
aap rocky praise the lord da shine official video skepta,7,-1,Random / Miscellaneous
travis scott mafia official audio,7,-1,Random / Miscellaneous
arcngel sech romeo santos sigues con l remix video oficial,7,208,Random / Miscellaneous
lil baby gunna business is business official audio,7,-1,Random / Miscellaneous
macklemore ryan lewis thrift shop feat wanz official video,7,453,Random / Miscellaneous
abba dancing queen official music video,7,238,Random / Miscellaneous
cher believe official music video 4k remaster,7,-1,Random / Miscellaneous
ksi cap feat offset official music video,7,-1,Random / Miscellaneous
ksi x lil wayne lose official music video,7,375,Random / Miscellaneous
ed sheeran happier official music video,7,238,Random / Miscellaneous
macklemore ryan lewis thrift shop feat wanz official video,7,453,Random / Miscellaneous
chris brown look at me now official video lil wayne busta rhymes,7,-1,Random / Miscellaneous
lil baby x gunna drip too hard official audio,7,313,Random / Miscellaneous
xxxtentacion a ghetto christmas carol wshh exclusive official audio,7,-1,Random / Miscellaneous
meek mill drake going bad 8d audio,7,-1,Random / Miscellaneous
lord huron the night we met official lyric video,7,-1,Random / Miscellaneous
bruno mars talking to the moon official lyric video,7,-1,Random / Miscellaneous
bruno mars when i was your man official music video,7,-1,Random / Miscellaneous
olivia rodrigo drivers license official video,7,37,Random / Miscellaneous
ed sheeran happier official music video,7,238,Random / Miscellaneous
passenger let her go official video,7,-1,Random / Miscellaneous
lil baby x gunna drip too hard official audio,7,313,Random / Miscellaneous
boza ella official video,7,215,Random / Miscellaneous
ozuna hasta que salga el sol cap2 video oficial,7,-1,Random / Miscellaneous
jhay cortez j balvin bad bunny no me conoce remix,7,245,Random / Miscellaneous
arcngel sech romeo santos sigues con l remix video oficial,7,208,Random / Miscellaneous
rauw alejandro crame video oficial,7,-1,Random / Miscellaneous
la cama remix lunay x myke towers x ozuna chencho corleone x rauw alejandro video oficial,7,-1,Random / Miscellaneous
tee grizzley from the d to the a lil yachty official video,7,455,Random / Miscellaneous
nav gunna travis scott turks official video travis scott,7,37,Random / Miscellaneous
nav dont need friends feat lil baby,7,-1,Random / Miscellaneous
eminem lose yourself 8d audio,7,205,Random / Miscellaneous
travis scott sicko mode 8d audio drake,7,-1,Random / Miscellaneous
travis scott goosebumps kendrick lamar 8d audio,7,423,Random / Miscellaneous
pop smoke for night ft lil baby dababy 8d audio,7,-1,Random / Miscellaneous
pop smoke for the night audio lil baby dababy,7,-1,Random / Miscellaneous
lil baby x gunna drip too hard official audio,7,313,Random / Miscellaneous
tee grizzley from the d to the a lil yachty official video,7,455,Random / Miscellaneous
blocboy jb drake look alive prod by tay keith official music video shot by yooali,7,233,Random / Miscellaneous
drake lil baby yes indeed lyrics,7,-1,Random / Miscellaneous
meek mill going bad feat drake official video,7,415,Random / Miscellaneous
chris brown look at me now official video lil wayne busta rhymes,7,-1,Random / Miscellaneous
rae sremmurd no type official video,7,-1,Random / Miscellaneous
the messi era official movie,7,-1,Random / Miscellaneous
dean lewis be alright official video,7,-1,Random / Miscellaneous
shawn mendes imagination official audio,7,-1,Random / Miscellaneous
macklemore ryan lewis thrift shop feat wanz official video,7,453,Random / Miscellaneous
juice wrld robbery official music video,7,238,Random / Miscellaneous
juice wrld robbery 8d audio,7,-1,Random / Miscellaneous
juice wrld all girls are the same official music video,7,-1,Random / Miscellaneous
blocboy jb drake look alive prod by tay keith official music video shot by yooali,7,233,Random / Miscellaneous
tee grizzley from the d to the a lil yachty official video,7,455,Random / Miscellaneous
meek mill millidelphia feat swizz beats official audio,7,-1,Random / Miscellaneous
meek mill going bad feat drake official video,7,415,Random / Miscellaneous
xxxtentacion look at me 8d audio,7,-1,Random / Miscellaneous
the script hall of fame official video william,7,-1,Random / Miscellaneous
j cole no role modelz 8d audio,7,-1,Random / Miscellaneous
pop smoke for night ft lil baby dababy 8d audio,7,-1,Random / Miscellaneous
scream official trailer 2022 movie paramount pictures australia,7,-1,Random / Miscellaneous
dean lewis waves official video,7,238,Random / Miscellaneous
major lazer ellie goulding powerful feat tarrus riley official music video,7,37,Random / Miscellaneous
meek mill going bad feat drake official video,7,415,Random / Miscellaneous
meek mill litty feat tory lanez official music video,7,37,Random / Miscellaneous
sidemen the gift ft sx official music video,7,398,Random / Miscellaneous
becky g ozuna no drama official video,7,-1,Random / Miscellaneous
roddy ricch the box official music video reaction,7,-1,Random / Miscellaneous
trippie redd demon time official music video reaction w trippie redd,7,-1,Random / Miscellaneous
meek mill rico feat drake official audio,7,-1,Random / Miscellaneous
ksi houdini feat swarmz tion wayne official music video,7,-1,Random / Miscellaneous
ksi x lil wayne lose official music video,7,375,Random / Miscellaneous
keith ape x ski mask the slump god achoo official music video,7,-1,Random / Miscellaneous
dean lewis waves official video,7,238,Random / Miscellaneous
tom walker leave light on official video,7,-1,Random / Miscellaneous
