Title,Cluster,Cluster Name
ecuadors history at the world cupshorts football ecuador footballshorts,4,the / of / in / sidemen / us
the truth about the greatest sidemen moment,4,the / of / in / sidemen / us
dwight but it gets progressively more dwight the office us,4,the / of / in / sidemen / us
the total nightmare of the mandela catalogue explained,4,the / of / in / sidemen / us
matt rife scared of the dark crowd work comedy mattrife mattrifecomedy prank,4,the / of / in / sidemen / us
what is 20 of 40,4,the / of / in / sidemen / us
behind the scenes with amp world,4,the / of / in / sidemen / us
sidemen ethan is fed up of weddings,4,the / of / in / sidemen / us
sidemen will stephen tries ever join the group,4,the / of / in / sidemen / us
sidemen ethan talks about the dog ban,4,the / of / in / sidemen / us
did angry ginge watch the sidemen,4,the / of / in / sidemen / us
ksi tommy fury best interview ever,4,the / of / in / sidemen / us
sidemen the mean comments,4,the / of / in / sidemen / us
sidemen faith talks about the comments,4,the / of / in / sidemen / us
sidemen the crazy fringe,4,the / of / in / sidemen / us
the most disrespectful player in football history golden tate taunting compilation,4,the / of / in / sidemen / us
best of golden tate the most elusive nfl wr career highlights,4,the / of / in / sidemen / us
the secret behind the success of thierry henry,4,the / of / in / sidemen / us
the best of stephen tries w2s chrismd willne,4,the / of / in / sidemen / us
the best goal of this video becomes an nft,4,the / of / in / sidemen / us
the batman vs the dark knight,4,the / of / in / sidemen / us
all of w2s vikk and chris causing chaos in the anus hotel,4,the / of / in / sidemen / us
types of builders in minecraft,4,the / of / in / sidemen / us
the last time the jets didnt suck 20092011,4,the / of / in / sidemen / us
i built the ultimate cave base in minecraft hardcore,4,the / of / in / sidemen / us
these are the most legendary bo2 trickshots ever nostalgic,4,the / of / in / sidemen / us
every zombies map ranked worst to best wawbo4,4,the / of / in / sidemen / us
the community ranks every call of duty zombies from worst to best,4,the / of / in / sidemen / us
the entire zombies story in 26 minutes beginning cold war,4,the / of / in / sidemen / us
how mob of the dead saved call of duty zombies video essay,4,the / of / in / sidemen / us
the dark side of the silk road,4,the / of / in / sidemen / us
mob of the dead acidgat guide 35 seconds,4,the / of / in / sidemen / us
these are the worst maps ive ever played,4,the / of / in / sidemen / us
the fellas lose 10000 at the races,4,the / of / in / sidemen / us
office tour a day in the life of a software engineer,4,the / of / in / sidemen / us
data scientist day in life in nyc,4,the / of / in / sidemen / us
a day in the life of an engineer at goldman sachs,4,the / of / in / sidemen / us
the biggest breakup in esports history,4,the / of / in / sidemen / us
football pub golf,4,the / of / in / sidemen / us
ishowspeed helmet for sidemen charity match shorts,4,the / of / in / sidemen / us
the fellas w2s get drunk in amsterdam,4,the / of / in / sidemen / us
the things in life are never planned,4,the / of / in / sidemen / us
sharky gets stabbed in the back,4,the / of / in / sidemen / us
calling teachers by their first names on the last day of school,4,the / of / in / sidemen / us
jack black plays the worlds rarest instrument shorts,4,the / of / in / sidemen / us
which nutmeg was the football skills soccer,4,the / of / in / sidemen / us
matt the rizzler rife shorts comedy mattrife,4,the / of / in / sidemen / us
he fixes the hole in the wall,4,the / of / in / sidemen / us
the best zombies map real life,4,the / of / in / sidemen / us
these are the worst maps ive ever played,4,the / of / in / sidemen / us
5 things you didnt know about zombies mob of the dead secrets,4,the / of / in / sidemen / us
day in the life boston college,4,the / of / in / sidemen / us
a day in my life at boston college,4,the / of / in / sidemen / us
ultimate mob of the dead easter egg solo guide all parts locations pop goes the weasel tutorial,4,the / of / in / sidemen / us
5 things you didnt know about zombies mob of the dead secrets,4,the / of / in / sidemen / us
the cod zombie characters in campaign,4,the / of / in / sidemen / us
mob of the dead free blundergat 40 secs shorts,4,the / of / in / sidemen / us
call of duty game chat is wild,4,the / of / in / sidemen / us
the best players in the world still cant keep me alive call of duty world at war zombies,4,the / of / in / sidemen / us
the psychology of psychopaths predators who walk among us,4,the / of / in / sidemen / us
mob of the dead hells redeemer guide 50 seconds,4,the / of / in / sidemen / us
mob of the dead solo easter egg in 2019,4,the / of / in / sidemen / us
lego mob of the dead intro,4,the / of / in / sidemen / us
mob of the dead in real life,4,the / of / in / sidemen / us
mob of the dead in real life,4,the / of / in / sidemen / us
ultimate mob of the dead easter egg solo guide all parts locations pop goes the weasel tutorial,4,the / of / in / sidemen / us
solocoop mob of the dead easter egg guide,4,the / of / in / sidemen / us
call of duty needs to bring this back,4,the / of / in / sidemen / us
ultimate mob of the dead easter egg solo guide all parts locations pop goes the weasel tutorial,4,the / of / in / sidemen / us
fwr mob of the dead solo easter egg speedrun 185210,4,the / of / in / sidemen / us
mob of the dead solo easter egg speedrun former world record 2521,4,the / of / in / sidemen / us
mob of the dead build the plane guide 60 seconds,4,the / of / in / sidemen / us
mob of the dead acidgat guide 35 seconds,4,the / of / in / sidemen / us
mob of the dead hells redeemer guide 50 seconds,4,the / of / in / sidemen / us
this mob of the dead exclusive weapon was awesome shorts,4,the / of / in / sidemen / us
99 of cod zombies players have never seen this wonder weapon,4,the / of / in / sidemen / us
how to upgrade the hells retriever in mob of the dead,4,the / of / in / sidemen / us
ranking all 65 cod zombies maps from worst to best,4,the / of / in / sidemen / us
the worst type of zombies player,4,the / of / in / sidemen / us
the cost of a formula 1 car lewis hamilton,4,the / of / in / sidemen / us
best video game of all time gamescom2023 gaming interview,4,the / of / in / sidemen / us
mob of the dead cut content,4,the / of / in / sidemen / us
mob of the dead solo easter egg speedrun former world record 2521,4,the / of / in / sidemen / us
mob of the dead free blundergat every game complete tutorial,4,the / of / in / sidemen / us
world record mob of the dead speedrun,4,the / of / in / sidemen / us
fwr mob of the dead solo easter egg speedrun 185210,4,the / of / in / sidemen / us
pov its that time of the month shortsfeed shorts,4,the / of / in / sidemen / us
dsr on round 50 vs round 100 in cod zombies shorts gaming,4,the / of / in / sidemen / us
the unreleased version of the packapunch jingle shorts,4,the / of / in / sidemen / us
the secret shadows of evil easter egg shorts,4,the / of / in / sidemen / us
ranking every call of duty zombies game from worst to best shorts zombieshorts,4,the / of / in / sidemen / us
life when cod world at war came out shorts codshorts,4,the / of / in / sidemen / us
mob of the dead free blundergat every game complete tutorial,4,the / of / in / sidemen / us
mob of the dead easter egg 60 seconds fast guide,4,the / of / in / sidemen / us
only pros did this trick on mob of the dead shorts bo2zombies motd,4,the / of / in / sidemen / us
mob of the dead shield part locations 35 seconds,4,the / of / in / sidemen / us
mob of the dead golden spork 45 seconds,4,the / of / in / sidemen / us
secret samanthas cycle easter egg mob of the dead,4,the / of / in / sidemen / us
top 5 things die rise did right shorts,4,the / of / in / sidemen / us
i built a football pitch in my garden,4,the / of / in / sidemen / us
the rage is heavy,4,the / of / in / sidemen / us
top 10 best rooftop bars in new york nyc 2025,4,the / of / in / sidemen / us
best rooftop view in nyc,4,the / of / in / sidemen / us
apples biggest one more thing moments,4,the / of / in / sidemen / us
the most expensive football boots in the world,4,the / of / in / sidemen / us
inside the most expensive and highest penthouse in the world,4,the / of / in / sidemen / us
touring the 250000000 highest penthouse in the world,4,the / of / in / sidemen / us
mob of the dead acidgat guide 35 seconds,4,the / of / in / sidemen / us
the art of defending no fear,4,the / of / in / sidemen / us
revisiting my favorite zombies map of all time,4,the / of / in / sidemen / us
tutorial bo2 mob of the dead getting to the showers,4,the / of / in / sidemen / us
mob of the dead build the plane guide 60 seconds,4,the / of / in / sidemen / us
mob of the dead easter egg 60 seconds fast guide,4,the / of / in / sidemen / us
airplane building tutorial mob of the dead how to build the plane part locations get to roof,4,the / of / in / sidemen / us
ultimate guide to mob of the dead walkthrough all buildables mystery box locations bo2 zombies,4,the / of / in / sidemen / us
mob of the dead turning on the power generator how and where,4,the / of / in / sidemen / us
12 things nobody tells you about the university of michigan pros and cons,4,the / of / in / sidemen / us
university of michigan campus tour,4,the / of / in / sidemen / us
campus tour of the university of texas at austin utaustin,4,the / of / in / sidemen / us
the university of texas at austin full episode the college tour,4,the / of / in / sidemen / us
the campus tour university of georgia,4,the / of / in / sidemen / us
michael jordan shows off his jordans for the first time shorts nba,4,the / of / in / sidemen / us
i 1v1d my students in call of duty,4,the / of / in / sidemen / us
asereje the ketchup song just dance 4 5,4,the / of / in / sidemen / us
on the floor just dance 4 5,4,the / of / in / sidemen / us
the end of fortnite,4,the / of / in / sidemen / us
best fails of the year so far try not to laugh,4,the / of / in / sidemen / us
top 20 incredible things you must see in nyc,4,the / of / in / sidemen / us
nyc day in my life christmas time in the city,4,the / of / in / sidemen / us
chris md office transformation,4,the / of / in / sidemen / us
dont talk in the mic,4,the / of / in / sidemen / us
top 10 greatest lego sets of all time 2023 updated,4,the / of / in / sidemen / us
what happened to the arkham series side characters part 2,4,the / of / in / sidemen / us
what happened to the arkham side characters part 3,4,the / of / in / sidemen / us
sidemen who is the biggest football fan,4,the / of / in / sidemen / us
the office but its just the tantrums the office us,4,the / of / in / sidemen / us
the evolution of the joker the dc animated universe,4,the / of / in / sidemen / us
5 villains missing from the batman arkham series,4,the / of / in / sidemen / us
the blue ball,4,the / of / in / sidemen / us
the return of fortnite,4,the / of / in / sidemen / us
best intro ever the office us,4,the / of / in / sidemen / us
5 missed opportunities in the batman arkham franchise,4,the / of / in / sidemen / us
where has batman been since arkham knight who is the ghost,4,the / of / in / sidemen / us
5 hidden easter eggs and connections in the batman arkham series,4,the / of / in / sidemen / us
5 scary secrets in the batman arkham series,4,the / of / in / sidemen / us
this hidden room in arkham knight has a dark secret,4,the / of / in / sidemen / us
did you notice that these two scenes give off the same energy the office us,4,the / of / in / sidemen / us
this hidden room in arkham knight has a dark secret,4,the / of / in / sidemen / us
the world cup of takeaways mukbang,4,the / of / in / sidemen / us
the funniest game show on youtube,4,the / of / in / sidemen / us
steve carell confirms the office reboot nbc 2019,4,the / of / in / sidemen / us
volume of the solid of revolution the disc method,4,the / of / in / sidemen / us
did you notice john krasinski breaking character in this scene the office us,4,the / of / in / sidemen / us
everyone in smash is op the ultimate montage,4,the / of / in / sidemen / us
blowfly girl the full story tales from the internet,4,the / of / in / sidemen / us
try not to laugh challenge the office us,4,the / of / in / sidemen / us
find the numbers b such that the average value of,4,the / of / in / sidemen / us
batman arkham knight all achievements part 10,4,the / of / in / sidemen / us
if i wrote the batman 2,4,the / of / in / sidemen / us
the monsters beyond us the monument mythos,4,the / of / in / sidemen / us
harry w2s being the funniest man alive for 9 minutes and 19 seconds,4,the / of / in / sidemen / us
sidemen forfeit wheel of fortune,4,the / of / in / sidemen / us
the office but it gets progressively more inappropriate the office us,4,the / of / in / sidemen / us
sidemen forfeit wheel of fortune,4,the / of / in / sidemen / us
the dark knight trilogy,4,the / of / in / sidemen / us
ksi dangerous jokesksi sidemen,4,the / of / in / sidemen / us
is football broken,4,the / of / in / sidemen / us
top 10 move of 2018 wrestling,4,the / of / in / sidemen / us
searching for the five,4,the / of / in / sidemen / us
the greatest ever us open trick shots,4,the / of / in / sidemen / us
point of the year,4,the / of / in / sidemen / us
the cult in a boarding school,4,the / of / in / sidemen / us
showing talia the house ksi got us,4,the / of / in / sidemen / us
wait for the last one football soccer skills,4,the / of / in / sidemen / us
pov you find out youre 1 brazilian shorts football soccer,4,the / of / in / sidemen / us
is this the most wholesome prank in the office the office us,4,the / of / in / sidemen / us
sidemen forfeit wheel of fortune,4,the / of / in / sidemen / us
the most disturbing human experiment ever,4,the / of / in / sidemen / us
sidemen forfeit wheel of fortune,4,the / of / in / sidemen / us
the most disturbing human experiment ever,4,the / of / in / sidemen / us
apple watch se 2 review the best watch for most people,4,the / of / in / sidemen / us
greatest point ever,4,the / of / in / sidemen / us
winning with the worst poker hand shorts poker,4,the / of / in / sidemen / us
the ending,4,the / of / in / sidemen / us
my worst trickshot ever shorts,4,the / of / in / sidemen / us
1v1 aint about beating the defender its about putting it in the back of the net london,4,the / of / in / sidemen / us
rate the touch,4,the / of / in / sidemen / us
which one is your favourite football soccer skills,4,the / of / in / sidemen / us
watch the full video out now football soccer skills,4,the / of / in / sidemen / us
you just found out youre 1 brazilian football soccer skills,4,the / of / in / sidemen / us
2 skills that make you a baller football soccer skills,4,the / of / in / sidemen / us
you just found out youre 1 brazilian football soccer skills,4,the / of / in / sidemen / us
hows your touch football challenge,4,the / of / in / sidemen / us
the sounds of moons,4,the / of / in / sidemen / us
the sidemen play codenames,4,the / of / in / sidemen / us
mrbeast most viral video ever,4,the / of / in / sidemen / us
michael scotts emotional farewell song 9986000 minutes the office,4,the / of / in / sidemen / us
the art of brexit tackles,4,the / of / in / sidemen / us
top 10 tiger woods shots on the pga tour,4,the / of / in / sidemen / us
man puts everything on red at the end of the night,4,the / of / in / sidemen / us
crazy allin at 2023 world series of poker watch till the end,4,the / of / in / sidemen / us
the 50 best goals of the season top goals serie a 202223,4,the / of / in / sidemen / us
jim pam real love the office us,4,the / of / in / sidemen / us
the office wedding dance the office,4,the / of / in / sidemen / us
the raptor switches to paddles for one game,4,the / of / in / sidemen / us
fans brutally rate the sidemen,4,the / of / in / sidemen / us
american soccer players react to the sidemen,4,the / of / in / sidemen / us
the insidious universe explained 14 how all the movies connect,4,the / of / in / sidemen / us
the perfect villain for the batman 2,4,the / of / in / sidemen / us
my pitch for the batman 2,4,the / of / in / sidemen / us
tao nightclub is one of the clubs in las vegas,4,the / of / in / sidemen / us
this is football 2016 4k,4,the / of / in / sidemen / us
this is football 201617 the beautiful game,4,the / of / in / sidemen / us
who is the best sidemen striker,4,the / of / in / sidemen / us
best prank ever in football,4,the / of / in / sidemen / us
why outlast is still the best horror game,4,the / of / in / sidemen / us
she accepted her fate of us crashing,4,the / of / in / sidemen / us
best of favorite dance moves,4,the / of / in / sidemen / us
most spectacular skills of the year 2022,4,the / of / in / sidemen / us
fifa 12 playing fifa with my bro,4,the / of / in / sidemen / us
imagine playing in front of this crowd shorts,4,the / of / in / sidemen / us
who has the best college football atmosphere,4,the / of / in / sidemen / us
college football best loudest crowd reactions from the 2022 season,4,the / of / in / sidemen / us
the greatest atmosphere in sports penn state white out,4,the / of / in / sidemen / us
best sister,4,the / of / in / sidemen / us
ksi take down 10 million ksi podcast sidemen,4,the / of / in / sidemen / us
finding the inverse of a function,4,the / of / in / sidemen / us
genius plays in football 2023,4,the / of / in / sidemen / us
2014 world cup the hd movie time of our lives,4,the / of / in / sidemen / us
zerkaa knows every single flag in the world,4,the / of / in / sidemen / us
simon is quitting the sidemen,4,the / of / in / sidemen / us
best sidemen insults of all time,4,the / of / in / sidemen / us
the end of sidemen clubs,4,the / of / in / sidemen / us
ksi trolls the sidemen sdmn clubs,4,the / of / in / sidemen / us
the tallest and coolest skyscrapers of 2023,4,the / of / in / sidemen / us
the dark knight rises bruce and selina ball scene hd,4,the / of / in / sidemen / us
the funniest club session ever,4,the / of / in / sidemen / us
the arkham verse explained in 14 minutes,4,the / of / in / sidemen / us
the roast of the sidemen 2,4,the / of / in / sidemen / us
have you slept with any of the sidemen,4,the / of / in / sidemen / us
sidemen meme olympics in public,4,the / of / in / sidemen / us
sidemen meme olympics in public,4,the / of / in / sidemen / us
best player best manager end of season awards,4,the / of / in / sidemen / us
touch and pass challenge football soccer skills,4,the / of / in / sidemen / us
what even is fortnite season 3,4,the / of / in / sidemen / us
best first date ever,4,the / of / in / sidemen / us
i shot a gun for the first time,4,the / of / in / sidemen / us
atving in the middle of louisiana,4,the / of / in / sidemen / us
we slept in the same bed,4,the / of / in / sidemen / us
courages face of disappointment at the end,4,the / of / in / sidemen / us
the story lionel messi fight for glory,4,the / of / in / sidemen / us
we saw it live the greatest world cup final ever,4,the / of / in / sidemen / us
the dumbest moment in sidemen among us,4,the / of / in / sidemen / us
the jack harlow evolution shorts,4,the / of / in / sidemen / us
tricks skills in training,4,the / of / in / sidemen / us
the scariest job ever,4,the / of / in / sidemen / us
2 touches that make you a baller football skills soccer,4,the / of / in / sidemen / us
sidemen card system explained,4,the / of / in / sidemen / us
sidemen harrys new house story,4,the / of / in / sidemen / us
these are the greatest lakers fans ever,4,the / of / in / sidemen / us
the biggest clutch in among us history,4,the / of / in / sidemen / us
ishowspeed cries at the sidemen charity match,4,the / of / in / sidemen / us
mr beast being the best player sidemen charity match 2022,4,the / of / in / sidemen / us
ishowspeed reacts to his sidemen charity match goal,4,the / of / in / sidemen / us
the university of texas at austin full episode the college tour,4,the / of / in / sidemen / us
film theory joker is the hero of gotham batman the dark knight,4,the / of / in / sidemen / us
embarrassing mistakes in football 2023,4,the / of / in / sidemen / us
biggest sports hits of all time,4,the / of / in / sidemen / us
ranking cod zombies games from worst to best in 60 seconds,4,the / of / in / sidemen / us
the greatest moment in web of shadows,4,the / of / in / sidemen / us
wait for it football soccer shorts,4,the / of / in / sidemen / us
mob of the dead easter egg speedrun world record 2 player 2044,4,the / of / in / sidemen / us
the most delicious lava,4,the / of / in / sidemen / us
most humiliating skills in football,4,the / of / in / sidemen / us
2 skills that make you a baller football soccer skills,4,the / of / in / sidemen / us
2 skills that make you a baller football soccer skills,4,the / of / in / sidemen / us
heres hogg deeney best end to a football match ever,4,the / of / in / sidemen / us
2 of many things we do in maine to keep the lobster population sustainable,4,the / of / in / sidemen / us
just another day at the office shorts tech phonerepair,4,the / of / in / sidemen / us
the greatest nba debut ever,4,the / of / in / sidemen / us
sidemen tobi hated this about sidemen tinder,4,the / of / in / sidemen / us
the look at the end says it all gymcouple,4,the / of / in / sidemen / us
rate the last skill 110 football soccer skills,4,the / of / in / sidemen / us
would this work in a game football soccer skills,4,the / of / in / sidemen / us
the most disturbing human experiment ever,4,the / of / in / sidemen / us
watch experts all time favourite watch shorts,4,the / of / in / sidemen / us
guess the nba player shorts,4,the / of / in / sidemen / us
2 skills that make you a baller soccer football shorts,4,the / of / in / sidemen / us
the best introduction ever,4,the / of / in / sidemen / us
the most intense ending to a zombies easter egg,4,the / of / in / sidemen / us
zias and blou best freestyle,4,the / of / in / sidemen / us
dude missed out on the best sunflower seeds of his life,4,the / of / in / sidemen / us
rudest restaurant in the world,4,the / of / in / sidemen / us
the difference 1 ping makes,4,the / of / in / sidemen / us
2 skills that make you 1 brazilian football soccer skills,4,the / of / in / sidemen / us
the two times zombies talk to you in call of duty,4,the / of / in / sidemen / us
the power of good coaching,4,the / of / in / sidemen / us
pov you find out youre 1 brazilian shorts football soccer,4,the / of / in / sidemen / us
i took 1526 shots and my top 10 goals are insane,4,the / of / in / sidemen / us
the 10 stages of every zombies player,4,the / of / in / sidemen / us
mob of the dead easter egg speedrun world record 2 player 2044,4,the / of / in / sidemen / us
mob of the dead easter egg 60 seconds fast guide,4,the / of / in / sidemen / us
mob of the dead solo easter egg speedrun former world record 2521,4,the / of / in / sidemen / us
legendary red cards in football,4,the / of / in / sidemen / us
playing the worst rated zombies map,4,the / of / in / sidemen / us
how to beat every trap in saw 2,4,the / of / in / sidemen / us
the scariest genre of horror,4,the / of / in / sidemen / us
the paul pogba we all miss,4,the / of / in / sidemen / us
the greatest red river showdown ever a game to remember,4,the / of / in / sidemen / us
baby peach is the worst,4,the / of / in / sidemen / us
the scariest trick shorts,4,the / of / in / sidemen / us
2 skills that make you a baller skills football soccer,4,the / of / in / sidemen / us
2 skills that make you a baller football skills soccer,4,the / of / in / sidemen / us
nhl biggest hits of all time,4,the / of / in / sidemen / us
nfl big hits but they get increasingly harder part 1,4,the / of / in / sidemen / us
greatestbestmost memorable us sports moments of the last decade 20102019,4,the / of / in / sidemen / us
craziest college football hits that get increasingly more brutal,4,the / of / in / sidemen / us
wait for the last one football soccer skills,4,the / of / in / sidemen / us
2 skills that make you a baller football soccer skills,4,the / of / in / sidemen / us
the most controversial moment in football shorts football,4,the / of / in / sidemen / us
my worst date ever,4,the / of / in / sidemen / us
rocking out with the shotfun,4,the / of / in / sidemen / us
freestyling until i accidentally say the most outrageous line ever pt 2,4,the / of / in / sidemen / us
2 skills that make you a baller football soccer skills,4,the / of / in / sidemen / us
young karen in the making,4,the / of / in / sidemen / us
name 3 players to win the champions league at chelsea in 2012 challenge shorts,4,the / of / in / sidemen / us
freestyling until i accidentally say the most outrageous line ever pt 2,4,the / of / in / sidemen / us
10 years of football touch edition football soccer shorts,4,the / of / in / sidemen / us
top 10 brands that old money wear,4,the / of / in / sidemen / us
beef boss races on mario kart wii for the first time raging and,4,the / of / in / sidemen / us
ksi hunts the sidemen,4,the / of / in / sidemen / us
returning to the sidemen house,4,the / of / in / sidemen / us
2 skills that make you a baller football soccer skills,4,the / of / in / sidemen / us
griezmann is the ceo of one touch football,4,the / of / in / sidemen / us
rip the luckiest hardcore minecraft world ever,4,the / of / in / sidemen / us
college football hits that get increasingly more brutal,4,the / of / in / sidemen / us
water is the most powerful weapon,4,the / of / in / sidemen / us
the best feeling after a tough football match,4,the / of / in / sidemen / us
did the vert test in my uni and got the record,4,the / of / in / sidemen / us
harry violates ethan on among us,4,the / of / in / sidemen / us
the origin of caught in 4k shorts comedy rdcworld meme 4k,4,the / of / in / sidemen / us
asking the squad whos the most famous person in their contact list shorts,4,the / of / in / sidemen / us
