Title,Cluster,Cluster Name
best cold opens the office us,0,50 / gta / top
dunder mifflin is a quiet place the office us,0,50 / gta / top
michael stanley love pretzel day the office us,0,50 / gta / top
stanley wins push up competition the office us,0,50 / gta / top
jims dead the office us,0,50 / gta / top
jim scares dwight prank exclusive the office us,0,50 / gta / top
andy tears his scrotum the office us,0,50 / gta / top
the office signs of declining sitcom,0,50 / gta / top
nba you cost us the game moments,0,50 / gta / top
every day michael scott wakes up chooses violence the office us comedy bites,0,50 / gta / top
the best worst of jan the office us,0,50 / gta / top
even more season 6 bloopers the office us comedy bites,0,50 / gta / top
the best of stanley the office us,0,50 / gta / top
crunch those numbers again the office us,0,50 / gta / top
jim saves christmas party the office us,0,50 / gta / top
season 7 bloopers the office us comedy bites,0,50 / gta / top
the office original casting tapes,0,50 / gta / top
season 6 bloopers the office us comedy bites,0,50 / gta / top
season 5 bloopers the office us comedy bites,0,50 / gta / top
nba scary fall moments,0,50 / gta / top
the password the office us,0,50 / gta / top
valentines day at dunder mifflin the office us,0,50 / gta / top
jim dwights party planning the office us,0,50 / gta / top
jim dwight the best of frenemies the office us,0,50 / gta / top
jims wedding toast to pam the office us,0,50 / gta / top
the final ever scene the office us,0,50 / gta / top
9986000 minutes the office us,0,50 / gta / top
saddest moment the office us,0,50 / gta / top
jim ryan the office,0,50 / gta / top
the rise fall of ryan howard the office,0,50 / gta / top
jans boob job the office us,0,50 / gta / top
oh my god its jan the office us,0,50 / gta / top
season 4 bloopers the office us comedy bites,0,50 / gta / top
christmas party showdown the office,0,50 / gta / top
first aid fail the office us,0,50 / gta / top
happier pam x jim the office,0,50 / gta / top
the office being relatable 8 minutes the office us,0,50 / gta / top
nfl karma moments,0,50 / gta / top
nfl funniest micd up moments of 20202021 funny,0,50 / gta / top
karma moments,0,50 / gta / top
jim dwight the best of frenemies the office us,0,50 / gta / top
how get out of an awkward situation the office us,0,50 / gta / top
sad pam the office us comedy bites,0,50 / gta / top
harry w2s being himself 8 minutes part 3,0,50 / gta / top
nba prison rules moments,0,50 / gta / top
disrespectful moments,0,50 / gta / top
most unsportsmanlike disrespectful moments in football,0,50 / gta / top
adin ross funniest most sus moments part 3,0,50 / gta / top
pam hits michael the office us,0,50 / gta / top
michael is dating pams mom the office us,0,50 / gta / top
the moment jim pam went public with their relationship the office us,0,50 / gta / top
michael finds out about jim pams engagement the office us,0,50 / gta / top
the office wedding dance the office,0,50 / gta / top
every thats what she said ever the office us,0,50 / gta / top
reacting to harry from the sidemen,0,50 / gta / top
jim halpert office romantic the office us,0,50 / gta / top
call of duty the office us,0,50 / gta / top
jim pam karen the office love triangle comedy bites,0,50 / gta / top
season 3 bloopers the office us comedy bites,0,50 / gta / top
season 2 bloopers the office us comedy bites,0,50 / gta / top
sidemen 10000 call out penalties,0,50 / gta / top
jims wedding toast to pam the office us,0,50 / gta / top
the office us but its just all memes comedy bites,0,50 / gta / top
planking new regional manager the office us,0,50 / gta / top
most heartwarming moments the office us,0,50 / gta / top
jim pam the story the office,0,50 / gta / top
adin ross gayest moments on stream 1,0,50 / gta / top
adin ross sus moments 8 minutes straight part 4 blueface ddg zias b lou,0,50 / gta / top
sidemen tinder in real life 3,0,50 / gta / top
adin ross zias funniest laughing moments 2,0,50 / gta / top
top 5 best rapper freestyles on adin ross stream 2021,0,50 / gta / top
adin ross gayest moments on stream 1,0,50 / gta / top
adin ross gayest moments on stream 3 sus,0,50 / gta / top
jim proposes pam the office us,0,50 / gta / top
jim vs pam vs roy the office us comedy bites,0,50 / gta / top
michael toby the office us,0,50 / gta / top
the office wedding dance the office,0,50 / gta / top
season 6 bloopers the office us comedy bites,0,50 / gta / top
fail moments,0,50 / gta / top
jims best pranks against dwight the office us,0,50 / gta / top
the best of jim the office us,0,50 / gta / top
of w2s 2021,0,50 / gta / top
sidemen family fortunes,0,50 / gta / top
top 100 sidemen moments 2020,0,50 / gta / top
harry w2s being himself 8 minutes part 2,0,50 / gta / top
harry w2s being funniest sidemen 16 minutes straight,0,50 / gta / top
first aid fail the office us,0,50 / gta / top
fire drill the office us,0,50 / gta / top
dunder mifflin plays basketball the office,0,50 / gta / top
prison mike the office us,0,50 / gta / top
killing bin laden hitler toby the office us,0,50 / gta / top
michael scott sensitivity training the office us,0,50 / gta / top
picking charity the office us,0,50 / gta / top
michael scotts first last interactions the office,0,50 / gta / top
9986000 minutes the office us,0,50 / gta / top
the office wedding dance the office,0,50 / gta / top
season 2 bloopers the office us comedy bites,0,50 / gta / top
the sidemen being awkward around girls 12 more minutes straight,0,50 / gta / top
sidemen pub golf europe edition,0,50 / gta / top
best of cold opens the office,0,50 / gta / top
sidemen pub golf europe edition,0,50 / gta / top
anger management the office us,0,50 / gta / top
angry jim the office us comedy bites,0,50 / gta / top
best unscripted moments the office us,0,50 / gta / top
jim pam open your eyes the office,0,50 / gta / top
some of jim pams cutest moments the office us comedy bites,0,50 / gta / top
pam flirts with michael the office,0,50 / gta / top
season 3 bloopers the office us comedy bites,0,50 / gta / top
jim pam the love saga continues the office us,0,50 / gta / top
most heartwarming moments the office us,0,50 / gta / top
jim pranking dwight 12 minutes straight the office us,0,50 / gta / top
the office wedding dance the office,0,50 / gta / top
sidemen categories,0,50 / gta / top
season 2 bloopers the office us comedy bites,0,50 / gta / top
season 5 bloopers the office us comedy bites,0,50 / gta / top
season 4 bloopers the office us comedy bites,0,50 / gta / top
every time pam was jealous the office us,0,50 / gta / top
pam questions her entire relationship with jim the office,0,50 / gta / top
cathy tries seduce jim the office us,0,50 / gta / top
jim pam the story the office,0,50 / gta / top
why jim pam almost broke up season 9 the office,0,50 / gta / top
this is football 201617 the beautiful game,0,50 / gta / top
stupidity at its best funny fail videos failarmy,0,50 / gta / top
the wheel sidemen edition,0,50 / gta / top
sidemen big fat quiz of the year 2019,0,50 / gta / top
sidemen find out their football stats,0,50 / gta / top
20 women vs 1 sidemen harry edition,0,50 / gta / top
the weakest link sidemen edition 2,0,50 / gta / top
the weakest link sidemen edition,0,50 / gta / top
karma revenge moments in football,0,50 / gta / top
sidemen big fat quiz of the year 2019,0,50 / gta / top
sidemen family fortunes,0,50 / gta / top
ksi brings out sidemen on stage,0,50 / gta / top
most painful sidemen game ever,0,50 / gta / top
among us but its horror game,0,50 / gta / top
sidemen football forfeits,0,50 / gta / top
sidemen blind dating,0,50 / gta / top
sidemen blind dating 4,0,50 / gta / top
greatest ever sidemen trickshots,0,50 / gta / top
sidemen blind dating 4,0,50 / gta / top
sidemen blind dating but all the answers are outrageous 2,0,50 / gta / top
sidemen blind dating but all the answers are outrageous,0,50 / gta / top
the avengers game that flopped,0,50 / gta / top
among guys,0,50 / gta / top
heartbreaking football moments,0,50 / gta / top
how to win every game of fall guys,0,50 / gta / top
10 football challenges to complete the fifa 17 draft,0,50 / gta / top
which of the sidemen was it,0,50 / gta / top
buzzfeed unsolved funny moments part 1,0,50 / gta / top
sidemen wheel of fortune,0,50 / gta / top
the most outrageous game sidemen play bad people,0,50 / gta / top
the ultimate youtuber penalty challenge,0,50 / gta / top
sidemen play among us but everyone rages at each other sidemen gaming,0,50 / gta / top
the chase sidemen edition 2019,0,50 / gta / top
strangers roast the sidemen,0,50 / gta / top
harry w2s being himself 8 minutes part 5,0,50 / gta / top
sidemen big fat quiz of the year 2020,0,50 / gta / top
the extreme arsenal football challenge vs ksi ft tobi,0,50 / gta / top
sidemen total wipeout football challenge,0,50 / gta / top
nba crazy sequence moments,0,50 / gta / top
sidemen punishment pool insane,0,50 / gta / top
sidemen 10000 crossbar challenge,0,50 / gta / top
sidemen finish the lyric 3,0,50 / gta / top
is this best save world has seen 50 years sunday leagues greatest moments 4,0,50 / gta / top
sidemen manhunt in gta 5,0,50 / gta / top
sidemen hide seek in the worlds biggest toy store,0,50 / gta / top
sidemen all sports golf battle,0,50 / gta / top
sidemen w2s football challenge,0,50 / gta / top
nba from way downtown moments,0,50 / gta / top
gta 5 funny moments 301 with vikkstar gta 5 online funny moments,0,50 / gta / top
gta 5 funny moments 213 with the sidemen gta 5 online funny moments,0,50 / gta / top
sidemen play among us but thats enough me sidemen gaming,0,50 / gta / top
sidemen play among us but its strangest play ever sidemen gaming,0,50 / gta / top
sidemen ultimate football challenge,0,50 / gta / top
sidemen speed dating extreme,0,50 / gta / top
nba ultimate rage moments,0,50 / gta / top
nba oddly satisfying moments,0,50 / gta / top
nba basketball stereotypes moments 3,0,50 / gta / top
sidemen penalty shootout,0,50 / gta / top
gta 5 funny moments 207 with the sidemen gta 5 online funny moments,0,50 / gta / top
nba unsportsmanlike moments,0,50 / gta / top
w2s makes biggest tackle football history,0,50 / gta / top
sidemen pro clubs our fastest title ever,0,50 / gta / top
sidemen 8 year anniversary on gta 5,0,50 / gta / top
the worst 26 minutes of harrys life,0,50 / gta / top
braindead sidemen among us,0,50 / gta / top
999 iq sidemen among us,0,50 / gta / top
proximity chat sidemen among us,0,50 / gta / top
sidemen drunk bingo,0,50 / gta / top
sidemen impossible 100000 footgolf challenge,0,50 / gta / top
sidemen football fear pong,0,50 / gta / top
sidemen 10000 woodwork challenge,0,50 / gta / top
rockstar fooled us all lol,0,50 / gta / top
gta 5 funny moments 301 with vikkstar gta 5 online funny moments,0,50 / gta / top
gta 5 next gen funny moments 185 with the sidemen gta 5 online next gen funny moments,0,50 / gta / top
gta 5 funny moments 301 with vikkstar gta 5 online funny moments,0,50 / gta / top
gta 5 funny moments 163 last team standing dlc with the sidemen gta 5 online funny moments,0,50 / gta / top
gta 5 funny moments 187 with the sidemen gta 5 online xbox one funny moments,0,50 / gta / top
gta 5 funny moments 215 with the sidemen gta 5 online funny moments,0,50 / gta / top
best of banter buzzfeed unsolved part 8,0,50 / gta / top
best of banter buzzfeed unsolved part 5,0,50 / gta / top
best of banter buzzfeed unsolved part 10,0,50 / gta / top
best of banter buzzfeed unsolved part 9,0,50 / gta / top
the mysterious death of the boy in the box,0,50 / gta / top
buzzfeed unsolved my favorite funny moments supernatural season 2,0,50 / gta / top
the one with the glory hole best of buzzfeed unsolved supernatural season 3,0,50 / gta / top
who is the best sidemen striker,0,50 / gta / top
sidemen crossing challenge,0,50 / gta / top
sidemen football target challenge,0,50 / gta / top
gta 5 funny moments 213 with the sidemen gta 5 online funny moments,0,50 / gta / top
gta 5 funny moments 212 with the sidemen gta 5 online funny moments,0,50 / gta / top
scariest moments on buzzfeed unsolved 2,0,50 / gta / top
nba playoffs beef moments,0,50 / gta / top
gta 5 funny moments 212 with the sidemen gta 5 online funny moments,0,50 / gta / top
sidemen bin shot challenge,0,50 / gta / top
sidemen christmas football challenges,0,50 / gta / top
gta 5 funny moments 307 with vikkstar gta 5 online funny moments,0,50 / gta / top
w2s reveals controversial sidemen sunday,0,50 / gta / top
most offensive cards against humanity ever,0,50 / gta / top
snipers vs stunters gta 5 funny moments 650,0,50 / gta / top
day in the life the preseason,0,50 / gta / top
nba scary fall moments,0,50 / gta / top
ksi being bullied by sidemen 6 half minutes,0,50 / gta / top
funniest sidemen football moments,0,50 / gta / top
sidemen ultimate football challenge,0,50 / gta / top
ksi funny moments 1,0,50 / gta / top
gta 5 funny moments 305 with vikkstar gta 5 online funny moments,0,50 / gta / top
the weakest link sidemen edition,0,50 / gta / top
the most exciting voice sports gus johnson best calls of all time,0,50 / gta / top
gta 5 funny moments 148 with the sidemen gta v online funny moments,0,50 / gta / top
gta 5 funny moments 146 with the sidemen gta v online funny moments,0,50 / gta / top
gta 5 funny moments 141 with the sidemen gta v online funny moments,0,50 / gta / top
harry w2s being himself 8 minutes part 4,0,50 / gta / top
gmod death run 5 with the sidemen garrys mod deathrun,0,50 / gta / top
gmod death run 4 with the sidemen garrys mod deathrun,0,50 / gta / top
nba crazy fan moments,0,50 / gta / top
adin ross gayest moments on stream 2 sus,0,50 / gta / top
adin ross gayest moments on stream 3 sus,0,50 / gta / top
the sidemen play modern warfare sidemen gaming,0,50 / gta / top
20 women vs 1 sidemen harry edition,0,50 / gta / top
the end of bandemic sidetalk,0,50 / gta / top
10 people died in the bronx last night,0,50 / gta / top
gta 5 funny moments 558 with vikkstar,0,50 / gta / top
gta 5 funny moments 306 with vikkstar gta 5 online funny moments,0,50 / gta / top
fortnite with ksi,0,50 / gta / top
quadruple spiral gta 5 funny moments 594 with vikkstar,0,50 / gta / top
vanossgaming friends funny rage,0,50 / gta / top
most savage cards against humanity moments,0,50 / gta / top
nbas top 100 crossovers of the decade,0,50 / gta / top
nba how are you in the nba moments,0,50 / gta / top
nba suspend him moments,0,50 / gta / top
motorbike death run gta 5 funny moments 654,0,50 / gta / top
ridiculous pool trick shots 10 minutes of awesomeness,0,50 / gta / top
top 25 best pool shots of all time,0,50 / gta / top
3d ultra minigolf 4 with the sidemen mini golf,0,50 / gta / top
nestl the most evil business world,0,50 / gta / top
gta 5 funny moments 299 with vikkstar gta 5 online funny moments,0,50 / gta / top
best ball game ever supraball,0,50 / gta / top
3d ultra minigolf 5 with vikkstar mini golf,0,50 / gta / top
3d ultra minigolf 2 with the sidemen mini golf,0,50 / gta / top
gta 5 funny moments 320 with vikkstar gta 5 online funny moments,0,50 / gta / top
gta 5 funny moments 293 with vikkstar gta 5 online funny moments,0,50 / gta / top
gta 5 funny moments 478 with vikkstar,0,50 / gta / top
3d ultra minigolf 10 with vikkstar mini golf,0,50 / gta / top
3d ultra minigolf 3 with the sidemen mini golf,0,50 / gta / top
harry w2s being himself 8 minutes part 3,0,50 / gta / top
most savage cards against humanity moments,0,50 / gta / top
gmod deathrun funny moments minecraft edition knowledge,0,50 / gta / top
sidemenreacts funniest moments compilation,0,50 / gta / top
most painful challenge ever golf with friends,0,50 / gta / top
the most beautiful equation math,0,50 / gta / top
sidemen crossbar challenge,0,50 / gta / top
20 20 10 ksi,0,50 / gta / top
my best round yet golf with friends,0,50 / gta / top
new race game mode golf with friends,0,50 / gta / top
harry styles ghost of,0,50 / gta / top
gta 5 funny moments 481 with vikkstar,0,50 / gta / top
most savage cards against humanity moments,0,50 / gta / top
best sidemen cards against humanity moments,0,50 / gta / top
nba iconic celebration moments,0,50 / gta / top
gta 5 funny moments 419 with vikkstar gta 5 online funny moments,0,50 / gta / top
nba rare moments,0,50 / gta / top
three shot challenge golf with friends,0,50 / gta / top
gta 5 funny moments 556 with vikkstar,0,50 / gta / top
sidemen squid game on gta 5,0,50 / gta / top
gta 5 funny moments 589 with vikkstar,0,50 / gta / top
gta 5 funny moments 534 with vikkstar,0,50 / gta / top
7 sidemen vs dream minecraft manhunt,0,50 / gta / top
sidemen house challenge in minecraft sidemen gaming,0,50 / gta / top
sidemen minecraft meme olympics sidemen gaming,0,50 / gta / top
harry w2s being himself 8 minutes part 2,0,50 / gta / top
w2s making sidemen laugh,0,50 / gta / top
gta 5 funny moments 533 with vikkstar,0,50 / gta / top
minecraft temple escape 4 with the sidemen minecraft trolling,0,50 / gta / top
minecraft temple escape 3 with the sidemen minecraft trolling,0,50 / gta / top
minecraft temple escape 2 with the sidemen minecraft trolling,0,50 / gta / top
minecraft temple escape 1 with the sidemen minecraft trolling,0,50 / gta / top
the sidemen battle minecraft sidecraft 4,0,50 / gta / top
gta 5 funny moments 420 with vikkstar gta 5 online funny moments,0,50 / gta / top
gta 5 funny moments 418 with vikkstar gta 5 online funny moments,0,50 / gta / top
reacting to the funniest tiktoks with harry,0,50 / gta / top
gta 5 funny moments 369 with vikkstar gta 5 online funny moments,0,50 / gta / top
football vlog with the sidemen,0,50 / gta / top
you top 10 behind scenes secrets about show,0,50 / gta / top
harry w2s being himself 8 minutes,0,50 / gta / top
the country of paris,0,50 / gta / top
ksi being bullied 14 minutes straight sidemen reddit fans,0,50 / gta / top
gta 5 funny moments soggy ramp rage wksi zerkaa w2s vikkstar miniminter,0,50 / gta / top
gta 5 funny moments 521 with vikkstar,0,50 / gta / top
the last ever sidemen gta,0,50 / gta / top
sidemen abandoned challenge,0,50 / gta / top
gta 5 funny moments 523 with vikkstar,0,50 / gta / top
gta 5 funny moments 588 with vikkstar,0,50 / gta / top
gta 5 funny moments 545 with vikkstar,0,50 / gta / top
gta 5 funny moments 557 with vikkstar,0,50 / gta / top
gta 5 funny moments 539 with vikkstar,0,50 / gta / top
gta 5 funny moments 512 with vikkstar,0,50 / gta / top
gta 5 funny moments 370 with vikkstar gta 5 online funny moments,0,50 / gta / top
sidemen categories,0,50 / gta / top
gta 5 funny moments 511 with vikkstar,0,50 / gta / top
sidemen minecraft meme olympics sidemen gaming,0,50 / gta / top
gta 5 funny moments 408 with vikkstar gta 5 online funny moments,0,50 / gta / top
gta 5 funny moments 407 with vikkstar gta 5 online funny moments,0,50 / gta / top
gta 5 funny moments 502 with vikkstar,0,50 / gta / top
gta 5 funny moments 510 with vikkstar,0,50 / gta / top
modded death race gta 5 funny moments 592 with vikkstar,0,50 / gta / top
gta 5 funny moments 582 with vikkstar,0,50 / gta / top
gta 5 funny moments 581 with vikkstar,0,50 / gta / top
gta 5 funny moments 506 with vikkstar,0,50 / gta / top
gta 5 funny moments 439 with vikkstar,0,50 / gta / top
gta 5 funny moments 321 with vikkstar gta 5 online funny moments,0,50 / gta / top
sidemen pro clubs,0,50 / gta / top
gta 5 funny moments 441 with vikkstar,0,50 / gta / top
gta 5 funny moments 509 with vikkstar,0,50 / gta / top
funniest race ever gta 5 funny moments,0,50 / gta / top
laughing heart attack gta 5 funny moments,0,50 / gta / top
more of my best laughs,0,50 / gta / top
ethan behzinga sidemens funniest laugh compilation 14 minutes,0,50 / gta / top
gta 5 funny moments 530 with vikkstar,0,50 / gta / top
gta 5 funny moments 536 with vikkstar,0,50 / gta / top
gta 5 funny moments 540 with vikkstar,0,50 / gta / top
gta 5 funny moments 579 with vikkstar,0,50 / gta / top
gta 5 funny moments 521 with vikkstar,0,50 / gta / top
gta 5 funny moments 367 with vikkstar gta 5 online funny moments,0,50 / gta / top
gta 5 funny moments 417 with vikkstar gta 5 online funny moments,0,50 / gta / top
gta 5 funny moments 469 with vikkstar,0,50 / gta / top
downhill chaos gta 5 funny moments 748,0,50 / gta / top
gta 5 funny moments 541 with vikkstar,0,50 / gta / top
gta 5 funny moments 365 with vikkstar gta 5 online funny moments,0,50 / gta / top
gta 5 funny moments 320 with vikkstar gta 5 online funny moments,0,50 / gta / top
gta 5 funny moments 430 with vikkstar gta 5 online funny moments,0,50 / gta / top
gta 5 funny moments 521 with vikkstar,0,50 / gta / top
gta 5 funny moments 457 with vikkstar,0,50 / gta / top
gta 5 funny moments 508 with vikkstar,0,50 / gta / top
gta 5 funny moments 507 with vikkstar,0,50 / gta / top
gta 5 funny moments 575 with vikkstar,0,50 / gta / top
gta 5 funny moments 396 with vikkstar gta 5 online funny moments,0,50 / gta / top
gta 5 pc funny moments 292 with vikkstar gta 5 pc online funny moments 1080p 60fps,0,50 / gta / top
gta 5 funny moments 452 with vikkstar,0,50 / gta / top
gta 5 funny moments 320 with vikkstar gta 5 online funny moments,0,50 / gta / top
gta 5 funny moments 330 with vikkstar gta 5 online funny moments,0,50 / gta / top
gta 5 funny moments 394 with vikkstar gta 5 online funny moments,0,50 / gta / top
nfl apologizing moments,0,50 / gta / top
the ultimate behzinga rage compilation,0,50 / gta / top
gta 5 funny moments soggy ramp rage wksi zerkaa w2s vikkstar miniminter,0,50 / gta / top
top 50 sidemen gta moments,0,50 / gta / top
sidemen crossing challenge,0,50 / gta / top
top 50 sidemen gta moments,0,50 / gta / top
gta 5 funny moments soggy ramp rage wksi zerkaa w2s vikkstar miniminter,0,50 / gta / top
gta 5 funny moments 393 with vikkstar gta 5 online funny moments,0,50 / gta / top
sidemen penalty challenge vs 100 kids,0,50 / gta / top
sidemen 10000 woodwork challenge,0,50 / gta / top
goalkeeper challenge vs ksi,0,50 / gta / top
zias what doin with that blou moments part 2,0,50 / gta / top
sidemen indoor penalty challenge,0,50 / gta / top
fall of 118 hardcore minecraft world,0,50 / gta / top
adin ross gayest moments on stream 3 sus,0,50 / gta / top
ksi being mistreated funny compilation,0,50 / gta / top
heartbraking beautiful moments football,0,50 / gta / top
heartbreaking football moments,0,50 / gta / top
adin ross funniest most sus moments with rappers part 1,0,50 / gta / top
sidemen 500 car challenge,0,50 / gta / top
jim pam real love the office us,0,50 / gta / top
everything wrong with venom in 16 minutes or less,0,50 / gta / top
andy tears his scrotum the office us,0,50 / gta / top
jim pam love at first sight the office us,0,50 / gta / top
jim confesses his love the office us,0,50 / gta / top
the illusion of self,0,50 / gta / top
this is football 201617 the beautiful game,0,50 / gta / top
vikkstar is sus,0,50 / gta / top
sidemen impossible 100000 footgolf challenge,0,50 / gta / top
nba playoffs 2021 best moments to remember,0,50 / gta / top
ksi funniest moments pt6,0,50 / gta / top
sidemen all sports golf battle,0,50 / gta / top
sidemen woodwork challenge,0,50 / gta / top
the most iconic sports moments of decade,0,50 / gta / top
adin ross gayest moments on stream 1,0,50 / gta / top
worst soccer injury ever history,0,50 / gta / top
top 10 worst soccer injuries of all time,0,50 / gta / top
the best freekick video on youtube,0,50 / gta / top
sidemen charades,0,50 / gta / top
adin ross funniest moments compilation part 3,0,50 / gta / top
adin ross zias funniest laughing moments,0,50 / gta / top
ksi funny moments 1,0,50 / gta / top
w2s best moments 2021,0,50 / gta / top
adin ross sus moments for 10 minutes straight ft polo g lil tjay zias duke dennis,0,50 / gta / top
adin ross funniest moments compilation part 8,0,50 / gta / top
adin ross zias funniest laughing moments,0,50 / gta / top
the worst college student america,0,50 / gta / top
adin ross sus moments for 10 minutes straight ft polo g lil tjay zias duke dennis,0,50 / gta / top
best ethan lines sidemen tinder 3,0,50 / gta / top
the most dangerous sport in the world nfl,0,50 / gta / top
adin ross funniest moments compilation part 8,0,50 / gta / top
best of ksi try not to laugh 4,0,50 / gta / top
adin ross sus moments for 10 minutes straight ft polo g lil tjay zias duke dennis,0,50 / gta / top
sidemen speed dating extreme,0,50 / gta / top
sidemen 5 second challenge,0,50 / gta / top
shaq picks out his top 10 rappers,0,50 / gta / top
try not laugh gta v meme edition,0,50 / gta / top
sidemen whisper challenge,0,50 / gta / top
most savage nfl trash talk moments hd,0,50 / gta / top
nfl hot mic moments,0,50 / gta / top
worst referee calls of all time nfl,0,50 / gta / top
the weakest link sidemen edition,0,50 / gta / top
sidemen vs 100 kids football match,0,50 / gta / top
adin ross funniest moments compilation part 5,0,50 / gta / top
adin ross zias funniest laughing moments,0,50 / gta / top
adin ross zias funniest laughing moments,0,50 / gta / top
nba prison rules moments,0,50 / gta / top
sidemen vs 100 kids football match,0,50 / gta / top
nfl sticking up for your teammate moments part 2,0,50 / gta / top
w2s being awkward 7 minutes 12 seconds,0,50 / gta / top
sidemen tinder,0,50 / gta / top
nfl unfair moments,0,50 / gta / top
an interview with the sidemen,0,50 / gta / top
interview with the sidemen,0,50 / gta / top
funniest videos 2020,0,50 / gta / top
the sidemen spent 2 days on cruise this happened,0,50 / gta / top
simon miniminter being worst sideman 10 minutes,0,50 / gta / top
sidemen 10000 basketball challenge,0,50 / gta / top
the greatest semifinal playoff game ever,0,50 / gta / top
sidemen tinder,0,50 / gta / top
ksi exposes us but no one believes him among us w sidemen friends,0,50 / gta / top
nfl dirtiest cheap shots of all time,0,50 / gta / top
sidemen play among us but everyone acts sus sidemen gaming,0,50 / gta / top
harry breaks set of sidemen video,0,50 / gta / top
most underrated national championship game ever a game remember,0,50 / gta / top
funny football moments 2021,0,50 / gta / top
