Title,Cluster,Cluster Name
getting older pt 2 erica rhodes comedy ericarhodes donttellcomedy shorts,0,the / in / a / of / shorts
married questions noah findling comedy noahfindling donttellcomedy shorts,0,the / in / a / of / shorts
fake doctors michael longfellow comedy michaellongfellow donttellcomedy shorts,0,the / in / a / of / shorts
uncle sal part 2 ralph guerra standupcomedy donttellcomedy jokes comedy standup shorts,0,the / in / a / of / shorts
republican ex murahd shawki comedy murahdshawki donttellcomedy shorts,0,the / in / a / of / shorts
done with sex jordan jensen standupcomedy donttellcomedy standup shorts,0,the / in / a / of / shorts
affogato torio van grol standupcomedy donttellcomedy standup shorts,0,the / in / a / of / shorts
the incel epidemic chlo hilliard donttellcomedy standupcomedy standup shorts,0,the / in / a / of / shorts
voting 101 michael turner comedy michaelturner donttellcomedy shorts,0,the / in / a / of / shorts
anxiety emily catalano comedy emilycatalano donttellcomedy shorts,0,the / in / a / of / shorts
dating as a female comedian jordan jensen comedy jordanjensen donttellcomedy shorts,0,the / in / a / of / shorts
florida man napoleon emill comedy napoleonemill donttellcomedy shorts,0,the / in / a / of / shorts
surviving the holocaust noah findling noahfindling donttellcomedy shorts,0,the / in / a / of / shorts
turning 40 chlo hilliard donttellcomedy standupcomedy standup shorts,0,the / in / a / of / shorts
autism kiry shabazz comedy kiryshabazz donttellcomedy shorts,0,the / in / a / of / shorts
crazy ride share driver pt 1 the mandal man donttellcomedy standupcomedy shorts,0,the / in / a / of / shorts
rescue dogs jason cheny comedy jasoncheny donttellcomedy shorts,0,the / in / a / of / shorts
hookups for a cause torio van grol standupcomedy donttellcomedy standup shorts,0,the / in / a / of / shorts
catcalling jenny zigrino comedy jennyzigrino donttellcomedy shorts,0,the / in / a / of / shorts
secondrate name the mandal man donttellcomedy standupcomedy shorts,0,the / in / a / of / shorts
bad therapist jordan jensen standupcomedy donttellcomedy standup shorts,0,the / in / a / of / shorts
tsa check jenny zigrino standupcomedy donttellcomedy standup shorts,0,the / in / a / of / shorts
pretty good set tho ismael loutfi comedy ismaelloutfi donttellcomedy shorts,0,the / in / a / of / shorts
crazy ride share driver pt 2 the mandal man donttellcomedy standupcomedy shorts,0,the / in / a / of / shorts
viking ancestry hanna evensen comedy hannaevensen donttellcomedy shorts,0,the / in / a / of / shorts
adhd symptoms murahd shawki comedy murahdshawki donttellcomedy shorts,0,the / in / a / of / shorts
dangerously woke ismael loutfi comedy ismaelloutfi donttellcomedy shorts,0,the / in / a / of / shorts
making new friends ahmed bharoocha comedy ahmedbharoocha donttellcomedy shorts,0,the / in / a / of / shorts
couples massages ahamed weinberg comedy ahamedweinberg donttellcomedy shorts,0,the / in / a / of / shorts
teaching poetry amy silverberg amysilverberg donttellcomedy comedy shorts,0,the / in / a / of / shorts
urinal conundrum ahmed bharoocha comedy ahmedbharoocha donttellcomedy shorts,0,the / in / a / of / shorts
liberals vs conservatives caleb lush caleblush donttellcomedy comedy shorts,0,the / in / a / of / shorts
selfdefense irene tu comedy irenetu donttellcomedy shorts,0,the / in / a / of / shorts
dumb hot amy silverberg donttellcomedy amysilverberg comedy shorts,0,the / in / a / of / shorts
women in the midwest shapel lacey shapellacey shorts donttellcomedy,0,the / in / a / of / shorts
chemistry morgan jay morganjay shorts donttellcomedy,0,the / in / a / of / shorts
first serious gf emily catalano comedy emilycatalano donttellcomedy shorts,0,the / in / a / of / shorts
controversial commercials brad sativa comedy bradsativa donttellcomedy shorts,0,the / in / a / of / shorts
bisexual kelly ryan comedy kellyryan donttellcomedy shorts,0,the / in / a / of / shorts
edgy erica rhodes comedy ericarhodes donttellcomedy shorts,0,the / in / a / of / shorts
instagram entrepreneurs ralph barbosa comedy ralphbarbosa donttellcomedy shorts,0,the / in / a / of / shorts
vegan roommate napoleon emill donttellcomedy shorts comedy,0,the / in / a / of / shorts
pinocchio ahmed bharoocha comedy ahmedbharoocha donttellcomedy shorts,0,the / in / a / of / shorts
fck body positivity jenny zigrino standupcomedy donttellcomedy standup shorts,0,the / in / a / of / shorts
reporting a terrorist kiry shabazz comedy kiryshabazz donttellcomedy shorts,0,the / in / a / of / shorts
dining room divorce court laura severse donttellcomedy comedy lauraseverse shorts,0,the / in / a / of / shorts
naps mike lebovitz standupcomedy donttellcomedy standup shorts,0,the / in / a / of / shorts
hair loss matthew broussard standupcomedy donttellcomedy shorts,0,the / in / a / of / shorts
sf vs boston hanna evensen comedy hannaevensen donttellcomedy shorts,0,the / in / a / of / shorts
econ 101 ralph barbosa comedy ralphbarbosa donttellcomedy shorts,0,the / in / a / of / shorts
eating meat jason cheny comedy jasoncheny donttellcomedy shorts,0,the / in / a / of / shorts
the truth hurts darius bennett standupcomedy donttellcomedy dariusbennett shorts,0,the / in / a / of / shorts
everyone has a type geoffrey asmus standupcomedy donttellcomedy geoffreyasmus shorts,0,the / in / a / of / shorts
trauma therapy jordan jensen standupcomedy donttellcomedy standup shorts,0,the / in / a / of / shorts
gyno visit carmen lagala standupcomedy donttellcomedy standup shorts,0,the / in / a / of / shorts
hating on couples damon sumner standupcomedy donttellcomedy shorts,0,the / in / a / of / shorts
baseball emily catalano comedy emilycatalano donttellcomedy shorts,0,the / in / a / of / shorts
magic pineapples carmen lagala standupcomedy donttellcomedy standup shorts,0,the / in / a / of / shorts
pizza politics dan boulger standupcomedy donttellcomedy standup shorts,0,the / in / a / of / shorts
doggy style jessica michelle singleton comedy donttellcomedy shorts,0,the / in / a / of / shorts
nature documentaries brittany carney standupcomedy donttellcomedy standup shorts,0,the / in / a / of / shorts
diabetic travel tips dan boulger standupcomedy donttellcomedy standup shorts,0,the / in / a / of / shorts
anxiety cure noah findling noahfindling donttellcomedy shorts,0,the / in / a / of / shorts
cyberbullying michael longfellow donttellcomedy michaellongfellow shorts,0,the / in / a / of / shorts
dont trust tums matthew broussard standupcomedy donttellcomedy shorts,0,the / in / a / of / shorts
my nipples fell off the mandal man donttellcomedy standupcomedy shorts,0,the / in / a / of / shorts
catholic dirty talk zach brazo donttellcomedy zachbrazao standupcomedy shorts,0,the / in / a / of / shorts
lebron of therapists ralph barbosa comedy ralphbarbosa donttellcomedy shorts,0,the / in / a / of / shorts
sober cole garrett standupcomedy donttellcomedy colegarrett standup shorts,0,the / in / a / of / shorts
flip floppers danny jolles donttellcomedy standupcomedy donttellcomedy dannyjolles shorts,0,the / in / a / of / shorts
serial killers carmen lagala donttellcomedy carmenlagala standup comedy shorts,0,the / in / a / of / shorts
drinking age ron taylor standupcomedy donttellcomedy standup shorts shorts30,0,the / in / a / of / shorts
nobody believes in god zach brazo donttellcomedy zachbrazao standupcomedy shorts,0,the / in / a / of / shorts
8 mile sam ike donttellcomedy comedy samike shorts rap,0,the / in / a / of / shorts
respect erica rhodes comedy ericarhodes donttellcomedy shorts,0,the / in / a / of / shorts
the best excuse dan boulger standupcomedy donttellcomedy standup shorts,0,the / in / a / of / shorts
vasectomy heard round the world sean sullivan standupcomedy donttellcomedy standup shorts,0,the / in / a / of / shorts
old disney sucks danny jolles donttellcomedy standupcomedy dannyjolles shorts,0,the / in / a / of / shorts
sorority drunk jc currais standupcomedy donttellcomedy standup shorts,0,the / in / a / of / shorts
movie remakes emily catalano emilycatalano donttellcomedy standup standupcomedy shorts,0,the / in / a / of / shorts
halloween costumes logan guntzelman standupcomedy donttellcomedy standup shorts halloween,0,the / in / a / of / shorts
comorbidities al park donttellcomedy alpark standup comedy shorts,0,the / in / a / of / shorts
hawaii sam ike donttellcomedy comedy samike shorts hawaii travel,0,the / in / a / of / shorts
british accents usama siddiquee donttellcomedy usamasiddiquee standup comedy shorts,0,the / in / a / of / shorts
uber drivers carmen lagala donttellcomedy carmenlagala standup comedy shorts,0,the / in / a / of / shorts
portland is intense emily ruskowski donttellcomedy comedy shorts portland maine,0,the / in / a / of / shorts
male birth control usama siddiquee donttellcomedy usamasiddiquee standup comedy shorts,0,the / in / a / of / shorts
drunk driving ron taylor standupcomedy donttellcomedy standup shorts,0,the / in / a / of / shorts
depression zoltan kaszas donttellcomedy zoltankaszas standup comedy shorts,0,the / in / a / of / shorts
spayed and confused andrea jin donttellcomedy andreajin standup comedy shorts,0,the / in / a / of / shorts
dirty talk geoffrey asmus standupcomedy donttellcomedy geoffreyasmus shorts,0,the / in / a / of / shorts
moms rights rachel mac standupcomedy donttellcomedy geoffreyasmus shorts,0,the / in / a / of / shorts
bulk food stores andrea jin donttellcomedy andreajin standup comedy shorts,0,the / in / a / of / shorts
social media ralph barbosa comedy ralphbarbosa donttellcomedy shorts,0,the / in / a / of / shorts
psa brad sativa donttellcomedy comedy bradsativa shorts,0,the / in / a / of / shorts
brown sx symbols usama siddiquee donttellcomedy usamasiddiquee standup comedy shorts,0,the / in / a / of / shorts
dating tips rachel mac standupcomedy donttellcomedy rachelmac shorts,0,the / in / a / of / shorts
mobster on mushrooms zack chapaloni donttellcomedy zackchapaloni standup comedy shorts,0,the / in / a / of / shorts
soulmate requirements sydnee washington donttellcomedy sydneewashington comedy shorts,0,the / in / a / of / shorts
censorship zack chapaloni donttellcomedy zackchapaloni standup comedy shorts,0,the / in / a / of / shorts
mental vs physical health zoltan kaszas donttellcomedy zoltankaszas standup comedy shorts,0,the / in / a / of / shorts
mrs doubtfire emily catalano emilycatalano donttellcomedy standup standupcomedy shorts,0,the / in / a / of / shorts
mutt owner solidarity matt obrien mattobrien donttellcomedy standupcomedy shorts,0,the / in / a / of / shorts
sad animal videos sydnee washington donttellcomedy sydneewashington comedy shorts,0,the / in / a / of / shorts
roleplaying julia hladkowicz juliahladkowicz donttellcomedy standupcomedy shorts,0,the / in / a / of / shorts
heart meds wilin out mondaypunday standup comedy donttellcomedy shorts jokes,0,the / in / a / of / shorts
asian bisexual andrea jin donttellcomedy andreajin standup comedy shorts,0,the / in / a / of / shorts
free speech matt obrien mattobrien donttellcomedy standupcomedy shorts,0,the / in / a / of / shorts
great british baking show julia hladkowicz juliahladkowicz donttellcomedy comedy shorts,0,the / in / a / of / shorts
conspiracy theorists are cool danny jolles donttellcomedy standupcomedy dannyjolles shorts,0,the / in / a / of / shorts
fat beautiful jenny zigrino standupcomedy donttellcomedy standup shorts,0,the / in / a / of / shorts
instagram vs tiktok usama siddiquee donttellcomedy usamasiddiquee standup comedy shorts,0,the / in / a / of / shorts
fcking a 10 rachel mac standupcomedy donttellcomedy rachelmac shorts,0,the / in / a / of / shorts
nonconfrontational orion levine donttellcomedy orionlevine standup comedy shorts,0,the / in / a / of / shorts
new birth control hack rachel mac standupcomedy donttellcomedy rachelmac shorts,0,the / in / a / of / shorts
toxic masculinity kiry shabazz comedy kiryshabazz donttellcomedy shorts,0,the / in / a / of / shorts
stable relationship chris estrada comedy chrisestrada donttellcomedy shorts,0,the / in / a / of / shorts
white rapper orion levine donttellcomedy orionlevine standup comedy shorts,0,the / in / a / of / shorts
mustard jesus trejo donttellcomedy jesustrejo standup comedy shorts,0,the / in / a / of / shorts
hot person privilege chris estrada comedy chrisestrada donttellcomedy shorts,0,the / in / a / of / shorts
essential workers emily ruskowski donttellcomedy emilyruskowski standup comedy shorts,0,the / in / a / of / shorts
air fryer jesus trejo donttellcomedy jesustrejo standup comedy shorts,0,the / in / a / of / shorts
80 of women rachel mac standupcomedy donttellcomedy rachelmac shorts,0,the / in / a / of / shorts
teaching gen z liz blanc standupcomedy donttellcomedy lizblanc shorts,0,the / in / a / of / shorts
high school dad willie macc williemacc donttellcomedy standupcomedy shorts,0,the / in / a / of / shorts
masters degree shain brenden shainbrenden donttellcomedy standupcomedy shorts,0,the / in / a / of / shorts
should teachers carry liz blanc standupcomedy donttellcomedy lizblanc shorts,0,the / in / a / of / shorts
i trapped every boss in minecraft hardcore,0,the / in / a / of / shorts
15 minutes of pure gabriel fluffy iglesias standup,0,the / in / a / of / shorts
texas vs california ralph barbosa stand up comedy,0,the / in / a / of / shorts
ralph barbosa saves the earth,0,the / in / a / of / shorts
the cannibal killing of michael rockefeller,0,the / in / a / of / shorts
batman arkham city riddler trophies park row,0,the / in / a / of / shorts
why i wouldnt draft zach wilson,0,the / in / a / of / shorts
best 1v4 sd clutches in cod history,0,the / in / a / of / shorts
batman arkham city walkthrough chapter 22 mister freeze boss fight,0,the / in / a / of / shorts
the true stories of the warren hauntings the conjuring annabelle amityville and other encounters,0,the / in / a / of / shorts
meeting australians with great games,0,the / in / a / of / shorts
ralph barbosa hood nightclubs standup on the spot,0,the / in / a / of / shorts
ole ole ola soy argentina song for 3 minutes with english lyrics,0,the / in / a / of / shorts
2022 fifa world cup argentinas emiliano martnez usmnts matt turner more in top ten saves,0,the / in / a / of / shorts
ralph barbosa hood nightclubs standup on the spot,0,the / in / a / of / shorts
batman arkham city save the gcpd officers 22,0,the / in / a / of / shorts
something a little different,0,the / in / a / of / shorts
mic testing in a modern warfare 2 lobby funny moment,0,the / in / a / of / shorts
mw2 trash talk is back,0,the / in / a / of / shorts
ralph barbosa saves the earth,0,the / in / a / of / shorts
ralph barbosa growing up,0,the / in / a / of / shorts
ralph barbosa for new yorkers eyes only,0,the / in / a / of / shorts
ralph barbosa not so equal pay,0,the / in / a / of / shorts
ralph barbosa mom standupcomedy comedy,0,the / in / a / of / shorts
ralph barbosa for president,0,the / in / a / of / shorts
ralph barbosa entre nos the winners 3 special on hbomax standupcomedy,0,the / in / a / of / shorts
ralph barbosa migos full special entre nos winners 3 on hbomax standupcomedy,0,the / in / a / of / shorts
jimmy o yang explains his dad rap music shorts,0,the / in / a / of / shorts
pete davidson on ariana grande shorts,0,the / in / a / of / shorts
no rule for gay dudes pete davidson shorts,0,the / in / a / of / shorts
lost my sniping touch,0,the / in / a / of / shorts
playing the obj or trying to atleast,0,the / in / a / of / shorts
spankin em up,0,the / in / a / of / shorts
going for diamond skorp,0,the / in / a / of / shorts
peter parker being everyones favorite chaotic doofus for 12 minutes,0,the / in / a / of / shorts
football boots youve never seen before part 6,0,the / in / a / of / shorts
kevin hart bluffs worlds no 1 poker player daniel negreanu,0,the / in / a / of / shorts
get paid to work from home with beyond fianance subscribe for daily leads digitalnomad remotejob,0,the / in / a / of / shorts
fastest ever ice cream delivery to joe bidens whitehouse shorts,0,the / in / a / of / shorts
making things right,0,the / in / a / of / shorts
jerry seinfeld the worlds fattest man,0,the / in / a / of / shorts
tips for becoming pro,0,the / in / a / of / shorts
what can 1 million buy in new york city,0,the / in / a / of / shorts
what can 1 million buy in new york city,0,the / in / a / of / shorts
that trigger finger,0,the / in / a / of / shorts
types of high school teachers,0,the / in / a / of / shorts
jetta id love to change the world matstubs remix ft desiigner,0,the / in / a / of / shorts
uw master of science in computational finance and risk management,0,the / in / a / of / shorts
my first 1600 tattoo bang bang nyc w okanuckun,0,the / in / a / of / shorts
join the fifaworldcupchallenge,0,the / in / a / of / shorts
winning 100000 on warzone,0,the / in / a / of / shorts
world reacts to scump winning 100k in warzone ft formal shotzzy,0,the / in / a / of / shorts
exploring the xbox 360 store in 2022,0,the / in / a / of / shorts
team envyus vs optic gaming grand finals bo5 2 cwl championship 2017,0,the / in / a / of / shorts
i got duck hunt into elite smash in 9 minutes,0,the / in / a / of / shorts
ralph barbosa entre nos the winners 3 special on hbomax standupcomedy,0,the / in / a / of / shorts
heart meds wilin out mondaypunday standup comedy donttellcomedy shorts jokes,0,the / in / a / of / shorts
asian bisexual andrea jin donttellcomedy andreajin standup comedy shorts,0,the / in / a / of / shorts
free speech matt obrien mattobrien donttellcomedy standupcomedy shorts,0,the / in / a / of / shorts
great british baking show julia hladkowicz juliahladkowicz donttellcomedy comedy shorts,0,the / in / a / of / shorts
conspiracy theorists are cool danny jolles donttellcomedy standupcomedy dannyjolles shorts,0,the / in / a / of / shorts
fat beautiful jenny zigrino standupcomedy donttellcomedy standup shorts,0,the / in / a / of / shorts
instagram vs tiktok usama siddiquee donttellcomedy usamasiddiquee standup comedy shorts,0,the / in / a / of / shorts
fcking a 10 rachel mac standupcomedy donttellcomedy rachelmac shorts,0,the / in / a / of / shorts
nonconfrontational orion levine donttellcomedy orionlevine standup comedy shorts,0,the / in / a / of / shorts
new birth control hack rachel mac standupcomedy donttellcomedy rachelmac shorts,0,the / in / a / of / shorts
toxic masculinity kiry shabazz comedy kiryshabazz donttellcomedy shorts,0,the / in / a / of / shorts
stable relationship chris estrada comedy chrisestrada donttellcomedy shorts,0,the / in / a / of / shorts
white rapper orion levine donttellcomedy orionlevine standup comedy shorts,0,the / in / a / of / shorts
can 1 foot shaq dunk,0,the / in / a / of / shorts
the sides did cure cancer thats the problem wolf of wall street shorts,0,the / in / a / of / shorts
biggest call of duty cheating scandals,0,the / in / a / of / shorts
scumpiis philosophy of life,0,the / in / a / of / shorts
my christmas old carol happy holiday,0,the / in / a / of / shorts
new york city guide best breakfast spots,0,the / in / a / of / shorts
10 iconic nyc restaurants to visit when social distancing is over legendary eats marathon,0,the / in / a / of / shorts
the 3 best classic nyc diners you must visit before theyre gone,0,the / in / a / of / shorts
so many headshots fortnite battle royale gameplay ninja,0,the / in / a / of / shorts
xbox series x review one year later,0,the / in / a / of / shorts
one in the chamber knife master,0,the / in / a / of / shorts
moving at the speed of light 14 sens,0,the / in / a / of / shorts
jim and dwight prank todd packer the office,0,the / in / a / of / shorts
these kids cant believe they saw messi in the tunnel vs croatia,0,the / in / a / of / shorts
nuked out,0,the / in / a / of / shorts
malones cones kevins ice cream stand the office,0,the / in / a / of / shorts
sidemen lose their minds playing mario,0,the / in / a / of / shorts
super smash bros is impossible,0,the / in / a / of / shorts
argentina netherlands penalty shootout and postmatch fight,0,the / in / a / of / shorts
pamaj scump 2v2 vs pro players i carried scump,0,the / in / a / of / shorts
killing the dog from duck hunt,0,the / in / a / of / shorts
i got duck hunt into elite smash in 9 minutes,0,the / in / a / of / shorts
duck hunt can trick shot guide neutral,0,the / in / a / of / shorts
fortnite brought back tilted towers,0,the / in / a / of / shorts
my ultimate setup tour,0,the / in / a / of / shorts
back and forth great public match game,0,the / in / a / of / shorts
ive been placed the 3v4,0,the / in / a / of / shorts
an unexpected change of plans,0,the / in / a / of / shorts
the raptor switches to paddles for one game,0,the / in / a / of / shorts
the clawcam,0,the / in / a / of / shorts
college decision reactions 2022 ivies duke vandy nyu unc and more,0,the / in / a / of / shorts
my college decisions 2021 harvard acceptance brown upenn georgetown tufts 10 more,0,the / in / a / of / shorts
no safety schools college decision reactions 2021 princeton stanford penn cornell more,0,the / in / a / of / shorts
the new chokii,0,the / in / a / of / shorts
the struggle is realer than the grind,0,the / in / a / of / shorts
the grind the struggle,0,the / in / a / of / shorts
how to play duck hunt in super smash bros ultimate guide combos,0,the / in / a / of / shorts
argentinas epic penalty shootout with the netherlands every angle,0,the / in / a / of / shorts
inside a 75000000 aspen ski mansion on the market architectural digest,0,the / in / a / of / shorts
veorra the city,0,the / in / a / of / shorts
importance of sticking,0,the / in / a / of / shorts
the house thus far flawless,0,the / in / a / of / shorts
duck hunt guide super smash bros ultimate,0,the / in / a / of / shorts
kickin it was disneys weirdest show,0,the / in / a / of / shorts
ishowspeed gets so confused shorts ishowspeed memes subscribe,0,the / in / a / of / shorts
why ksi rage quit sidemen group chat,0,the / in / a / of / shorts
tbjzls first kiss shorts,0,the / in / a / of / shorts
just because were police officers doesnt mean were not entitled to a break shorts police,0,the / in / a / of / shorts
muhammed ali fights a kid in tv studio,0,the / in / a / of / shorts
curry and his dad share a wholesome moment hoops4life viral,0,the / in / a / of / shorts
ex gangster talks about life after crime shorts fyp crime gangster ladbible,0,the / in / a / of / shorts
dallas food is different,0,the / in / a / of / shorts
police pull me over at 3am,0,the / in / a / of / shorts
whos ready for some magic fifa shortsfifaworldcup,0,the / in / a / of / shorts
pete davidson on ariana grande shorts,0,the / in / a / of / shorts
ping pong ball challenge,0,the / in / a / of / shorts
its a chocolate clock,0,the / in / a / of / shorts
the anchor,0,the / in / a / of / shorts
describe the world cup so far in one word fifa shortsfifaworldcup ad,0,the / in / a / of / shorts
stick your predictions in the comments fifa shortsfifaworldcup ad,0,the / in / a / of / shorts
harry calls viks fianc a b,0,the / in / a / of / shorts
i built a 20000 world cup watchzone,0,the / in / a / of / shorts
warren hue shows his super saiyan freestyle ability in front of da goat himself,0,the / in / a / of / shorts
eminem till i collapse hd,0,the / in / a / of / shorts
jake gyllenhaal till i collapse,0,the / in / a / of / shorts
jetta id love to change the world matstubs remix ft desiigner,0,the / in / a / of / shorts
goosebumpsremix ft 21 savage,0,the / in / a / of / shorts
top 10 swiss villages 2022 most beautiful towns in switzerland best places travel guide,0,the / in / a / of / shorts
video making in optichouse2013 thats a problem,0,the / in / a / of / shorts
sidemen sabotage ksi on forfeit mario kart,0,the / in / a / of / shorts
touring the 5 best restaurants at pier 17 jolie serhant new development tour,0,the / in / a / of / shorts
touring the prettiest fidi nyc development jolie at 77 greenwich serhant new development tour,0,the / in / a / of / shorts
nyc guide to downtown brooklyn streets of new york,0,the / in / a / of / shorts
touring a duplex central park nyc penthouse w ryan serhant 880 fifth avenue pha serhant tour,0,the / in / a / of / shorts
inside the most luxurious penthouse in nyc 277 5th avenue ph54 serhant new development tour,0,the / in / a / of / shorts
the plaza hotel new york city an in depth look inside,0,the / in / a / of / shorts
21 most magnificent mansions in new york city,0,the / in / a / of / shorts
angela kevin and oscars 3000 accounting mystery the office,0,the / in / a / of / shorts
scumpii takes that detour,0,the / in / a / of / shorts
rocking out with the shotfun,0,the / in / a / of / shorts
i graduated from the university of washington seattle computer science major on my birthday,0,the / in / a / of / shorts
university of north carolina buzzin across america,0,the / in / a / of / shorts
shine bright like a an94,0,the / in / a / of / shorts
nyc christmas hudson yards christmas lights vessel 2022,0,the / in / a / of / shorts
every way that batman has defeated superman,0,the / in / a / of / shorts
the ohio state university buzzin across america,0,the / in / a / of / shorts
san diego state university buzzin across america,0,the / in / a / of / shorts
the sniper showdown,0,the / in / a / of / shorts
every time tony stark learned from his mistakes,0,the / in / a / of / shorts
the gonadolaaaas,0,the / in / a / of / shorts
swerming in gamebattles matches what next,0,the / in / a / of / shorts
making myself look as good as i am nadeshot rebuttle video kidding,0,the / in / a / of / shorts
the man that ended racism shorts foryou,0,the / in / a / of / shorts
hitler gets rejected by uw cse,0,the / in / a / of / shorts
the hardpoint gun,0,the / in / a / of / shorts
the apex sniper,0,the / in / a / of / shorts
a day in my life at the university of washington computer science major cherry blossom at uw,0,the / in / a / of / shorts
