Title,Cluster,Cluster Name
the young teacher when students find their social media shorts school class,0,the / in / a / of / shorts
think we can remember these iconic dances blindly dance reaction challenge,0,the / in / a / of / shorts
outplayed an entire squad in zero builds,0,the / in / a / of / shorts
why white people date minorities,0,the / in / a / of / shorts
ishowspeed drives mongraal insane ishowspeed fortniteog shorts,0,the / in / a / of / shorts
another outrageous question from harry,0,the / in / a / of / shorts
how teammates come friends shorts sports basketball,0,the / in / a / of / shorts
warden vs every mob in minecraft bedrock edition minecraft 119 warden vs all mobs,0,the / in / a / of / shorts
new controller hardpoint time fail,0,the / in / a / of / shorts
shine bright like a an94,0,the / in / a / of / shorts
50 cent just a lil bit explicit,0,the / in / a / of / shorts
the fabric of christmas full movie romantic christmas movies empress movies,0,the / in / a / of / shorts
british guys crazy for college football traditions atmospheres 2023,0,the / in / a / of / shorts
tanjiro be doing this everytime he beat a demon rdcworld1 anime demonslayer,0,the / in / a / of / shorts
ay mark was talkin right here send this to whoever needs to hear this rdcworld1 inspiration,0,the / in / a / of / shorts
double rims be disrespectful sometimes comedy rdcworld shorts basketball,0,the / in / a / of / shorts
if instagram bots existed in real life rdc rdcworld comedy instagram bot twitch,0,the / in / a / of / shorts
when restaurants only got off brand drinks rdcworld rdc comedy restaurant skit,0,the / in / a / of / shorts
signs a dude is fake crazy rdc rdcworld skit hood comedy,0,the / in / a / of / shorts
the worlds softest sport,0,the / in / a / of / shorts
wearing 10 bras to see my husbands reaction couplegoals relationship couple,0,the / in / a / of / shorts
breaking down cfp matchups between michiganalabama and washingtontexas no 1 cfb show,0,the / in / a / of / shorts
auburn students welcome the tigers to jordanhare,0,the / in / a / of / shorts
pat mcafee called the dawgs and then picked the tide,0,the / in / a / of / shorts
who wouldve guessed the dragonfire is t1,0,the / in / a / of / shorts
the impossible rise of washington football the complete kalen deboer rebuild,0,the / in / a / of / shorts
booger mcfarland upset with alabama over fsu in the cfp cfp selection show,0,the / in / a / of / shorts
the college football playoff teams revealed cfp selection show,0,the / in / a / of / shorts
did washingtons jalen mcmillan really just catch that shorts,0,the / in / a / of / shorts
2022 washington huskies record prediction,0,the / in / a / of / shorts
oregon ducks vs washington huskies the calm before the storm,0,the / in / a / of / shorts
greatest loudest from tennessee vs alabama field storming rocky top team entrance,0,the / in / a / of / shorts
delaney glazer 50 cent just a lil bit,0,the / in / a / of / shorts
beginner hiphop dance class to in da club by 50 cent just having fun dance,0,the / in / a / of / shorts
getting sturdy with heels on dance liz sanchez,0,the / in / a / of / shorts
i built a diamond factory in minecraft hardcore,0,the / in / a / of / shorts
i reached 1000 levels in minecraft hardcore,0,the / in / a / of / shorts
caught in providence i have 92 cents only,0,the / in / a / of / shorts
dude has no chill,0,the / in / a / of / shorts
matt buys his mom a house mattrife,0,the / in / a / of / shorts
mike mcdaniel to much bruh,0,the / in / a / of / shorts
i built the worlds smallest minecraft base,0,the / in / a / of / shorts
i built the worlds largest minecraft furnace,0,the / in / a / of / shorts
pytorch tutorial a quick preview,0,the / in / a / of / shorts
ex 1 solve an autonomous de ivp logistic growth using separation of variables,0,the / in / a / of / shorts
ex 2 solve an autonomous de ivp logistic growth using separation of variables,0,the / in / a / of / shorts
the man who got banned from vegas for winning 11m,0,the / in / a / of / shorts
he won 115m in vegas and got banned for life,0,the / in / a / of / shorts
akaash singh comedy shorts short standupcomedy aakash like subscribe andrewschulz,0,the / in / a / of / shorts
ex solve a differential equation that models the change in a bank account balance,0,the / in / a / of / shorts
ex initial value problem using separation of variables in the form y eaybx,0,the / in / a / of / shorts
ex solve an ivp using separation of variables in the form yaxbxy2,0,the / in / a / of / shorts
ex write a differential equation to model the change in a bank account,0,the / in / a / of / shorts
write a differential equation to model the change in a bank account changing deposit amount,0,the / in / a / of / shorts
1v4 in a 150000 tourney,0,the / in / a / of / shorts
an awkward time to hit a clip fyp warzone callofduty fypviral fazeadapt mw2,0,the / in / a / of / shorts
ex 2 initial value problem using separation of variables in the form yayb,0,the / in / a / of / shorts
i tested minecrafts best traveling method,0,the / in / a / of / shorts
ex 1 initial value problem using separation of variables in the form y ky,0,the / in / a / of / shorts
ex solve an ivp using separation of variables in the form yaxybx,0,the / in / a / of / shorts
ex solve an ivp with a separable differential equation in the form dydttt2yy,0,the / in / a / of / shorts
epic final round at the masters ea sports pga tour career mode part 89,0,the / in / a / of / shorts
modern family phil is a basketballer,0,the / in / a / of / shorts
ex solve an ivp with a separable differential equation in the form yaxybx,0,the / in / a / of / shorts
ex solve an ivp with a separable differential equation in the form y6xdydx1x,0,the / in / a / of / shorts
harvey pranks mike with michael jordan suits suits harveyspecter mikeross michaeljordan,0,the / in / a / of / shorts
big bang event was actually a banger,0,the / in / a / of / shorts
no middle name mr reacher shorts viral viralvideo jackreacher,0,the / in / a / of / shorts
matt rife standupcomedy standup,0,the / in / a / of / shorts
mike and rachel are finally reunited suits,0,the / in / a / of / shorts
mike and rachel say yes suits,0,the / in / a / of / shorts
theres a wedding in the making suits,0,the / in / a / of / shorts
rachel is wedding planning suits,0,the / in / a / of / shorts
mike and rachels wedding planning hits a bump suits,0,the / in / a / of / shorts
mike rachels future is threatened suits,0,the / in / a / of / shorts
rachel admits her and logan kissed suits,0,the / in / a / of / shorts
everything is opposite,0,the / in / a / of / shorts
moving at the speed of light 14 sens,0,the / in / a / of / shorts
legendary sprint speeds in football,0,the / in / a / of / shorts
minigolf crossbar challenge golf it,0,the / in / a / of / shorts
sandstorm minigolf golf it,0,the / in / a / of / shorts
new controller hardpoint time fail,0,the / in / a / of / shorts
indian with a white girl,0,the / in / a / of / shorts
jada smith mark normand comedy standup shorts,0,the / in / a / of / shorts
cant imagine,0,the / in / a / of / shorts
shotzzy is an easy read,0,the / in / a / of / shorts
trump was even trolling the taliban,0,the / in / a / of / shorts
buying 50 cheeseburgers and handing them out,0,the / in / a / of / shorts
why does jj always ask awkward questions,0,the / in / a / of / shorts
justice for ukraine,0,the / in / a / of / shorts
south indian history lesson from a comedian,0,the / in / a / of / shorts
let her wait,0,the / in / a / of / shorts
time to buy some jeans buddy,0,the / in / a / of / shorts
grand rapids is great,0,the / in / a / of / shorts
every mallu ever,0,the / in / a / of / shorts
taking over the family business,0,the / in / a / of / shorts
eddie murphy came to my show,0,the / in / a / of / shorts
why the irs sucks,0,the / in / a / of / shorts
latino with no rizz,0,the / in / a / of / shorts
the greatest wingman,0,the / in / a / of / shorts
my firsthand experience with hasan minhajs story,0,the / in / a / of / shorts
youre looking at the indian lavar ball,0,the / in / a / of / shorts
most confused indian,0,the / in / a / of / shorts
search and destroy,0,the / in / a / of / shorts
swarming with the naked type,0,the / in / a / of / shorts
c4 we had our problems now we have moar,0,the / in / a / of / shorts
going for diamond skorp,0,the / in / a / of / shorts
mike ross in prison suits pd tv,0,the / in / a / of / shorts
mike and louis see eye to eye suits,0,the / in / a / of / shorts
youre dead in my lawfirm suits,0,the / in / a / of / shorts
this is football 2010s decade recap,0,the / in / a / of / shorts
top 15 emotional farewells in football legends saying goodbye,0,the / in / a / of / shorts
rocking out with the shotfun,0,the / in / a / of / shorts
dropping the hamr,0,the / in / a / of / shorts
cristiano ronaldo goes sneaker shopping with complex,0,the / in / a / of / shorts
the best vapormax yet nike vapormax 2023 review,0,the / in / a / of / shorts
if you see a man wearing any of these sneakers beware vapormax jordan4,0,the / in / a / of / shorts
is this nikes vapormax yet,0,the / in / a / of / shorts
harvey and mike take a spontaneous trip to atlantic city shorts suits,0,the / in / a / of / shorts
why does italy have 6000 ghost towns hidden italy,0,the / in / a / of / shorts
swiftor says lets count to one,0,the / in / a / of / shorts
is michigan underrated in this undefeated season shorts michiganfootball bigten jimharbaugh,0,the / in / a / of / shorts
dk metcalf was shook shorts,0,the / in / a / of / shorts
one second song challenge,0,the / in / a / of / shorts
brought a nerf gun to the shooting range,0,the / in / a / of / shorts
1 in 1000000 free kicks,0,the / in / a / of / shorts
she paid him 400 to spend the night with her catchmeifyoucan leonardodicaprio funnyshorts,0,the / in / a / of / shorts
that one bad student thats super smart without trying,0,the / in / a / of / shorts
auburn students welcome the tigers to jordanhare,0,the / in / a / of / shorts
most confused indian,0,the / in / a / of / shorts
signs of a single man,0,the / in / a / of / shorts
brother took the genes,0,the / in / a / of / shorts
norway amsterdam ill be there first week of january i cant imagine a colder sounding place,0,the / in / a / of / shorts
caught in providence apologies to fianc shorts,0,the / in / a / of / shorts
helping out a small business in mexico,0,the / in / a / of / shorts
the hardest negotiation in shark tank shorts motivation,0,the / in / a / of / shorts
ksi asks talia the most awkward question ever,0,the / in / a / of / shorts
the perfect dog skills skills dog facts family,0,the / in / a / of / shorts
how much should an engagement ring cost streetphotography nyc,0,the / in / a / of / shorts
why the irs sucks,0,the / in / a / of / shorts
scumpii and nade 2v2 nuketown vs pros,0,the / in / a / of / shorts
are mike and rachel having second thoughts rachel and mikes wedding suits,0,the / in / a / of / shorts
pour one out for our man nick cannon cause kevin hart came swingin wildnout shorts,0,the / in / a / of / shorts
her balance is impressive,0,the / in / a / of / shorts
what changed my mind about investing in tesla youtube short,0,the / in / a / of / shorts
shaquille oneal tips are amazing,0,the / in / a / of / shorts
tom holland on working with tobey and andrew tomtomorrowspiderman spidermannowayhome shorts,0,the / in / a / of / shorts
best shark tank speech ever,0,the / in / a / of / shorts
he was my favourite player rhian brewster uncut,0,the / in / a / of / shorts
matt rife faces his biggest fear scariest moment of his life,0,the / in / a / of / shorts
rescued this man from life in the friend zone,0,the / in / a / of / shorts
i cast bobbi althoff in offset music vid,0,the / in / a / of / shorts
pro player gets intercepted by a high schooler,0,the / in / a / of / shorts
the truth about mark cubans investments motivation billionaire money,0,the / in / a / of / shorts
every mallu ever,0,the / in / a / of / shorts
i met a saxophonist at the airport piano saxophone,0,the / in / a / of / shorts
approximate a function value of a solution to a de using eulers method,0,the / in / a / of / shorts
approximate a solution to a de using eulers method,0,the / in / a / of / shorts
ex determine which function is a solution to a second order differential equation,0,the / in / a / of / shorts
ex 1 verify a solution to a differential equation find a particular solution,0,the / in / a / of / shorts
ex find two exponential function solutions to a differential equation,0,the / in / a / of / shorts
our hungarian american accent challenge,0,the / in / a / of / shorts
this man gave me free hungarian lessons,0,the / in / a / of / shorts
only call of duty ogs remember this,0,the / in / a / of / shorts
optic big tymer insane ace in bo2 throwback tournament that jump shot though,0,the / in / a / of / shorts
something a little different,0,the / in / a / of / shorts
that trigger finger,0,the / in / a / of / shorts
gordon actually likes the food shorts,0,the / in / a / of / shorts
part 1 does zero exist young sheldon shorts,0,the / in / a / of / shorts
rachel zane and harvey specter meet mike ross grandma shorts,0,the / in / a / of / shorts
gmod death run 22 with the sidemen garrys mod deathrun,0,the / in / a / of / shorts
aladdin a whole new world high quality,0,the / in / a / of / shorts
just dance 4 mr saxobeat alexandra stan 5 stars,0,the / in / a / of / shorts
olivia rodrigo revealing the original inappropriate lyrics from her guts album olivia music,0,the / in / a / of / shorts
50 cent on being shot 9 times,0,the / in / a / of / shorts
terry bradshaw asks steve harvey to go easy on him celebrity family feud shorts,0,the / in / a / of / shorts
patty confirmed barry was the flash shorts flash,0,the / in / a / of / shorts
acting like a bot then popping off,0,the / in / a / of / shorts
matt rife crowd work reunited at last mattrife mattrifecomedy standup prank,0,the / in / a / of / shorts
thierry henry threatens to leave the studio over this transfer question,0,the / in / a / of / shorts
mike tyson being asked who is better him or ali shocking answer boxing miketyson muhammadali,0,the / in / a / of / shorts
the iconic moment harvey proposed to donna shorts suits,0,the / in / a / of / shorts
2v2 gamemode golf with friends,0,the / in / a / of / shorts
my rage breaks the game tower unite mini golf,0,the / in / a / of / shorts
sunday league ref states his laws do you appreciate this sundayleaguefootball football referee,0,the / in / a / of / shorts
how jamie foxx met kanye west,0,the / in / a / of / shorts
which youtube footballer could go pro,0,the / in / a / of / shorts
mike ross outsmarts rachel zane suits shorts suits,0,the / in / a / of / shorts
sidemen how did fans ruin vikks wedding,0,the / in / a / of / shorts
uw husky entrance 2023 night time,0,the / in / a / of / shorts
shine bright like a an94,0,the / in / a / of / shorts
just dance katy perry hot n cold,0,the / in / a / of / shorts
just dance 4 mr saxobeat alexandra stan 5 stars,0,the / in / a / of / shorts
integral of x3tan1x as a power series,0,the / in / a / of / shorts
ex use a maclaurin polynomial for sinbxn to approximate an integral,0,the / in / a / of / shorts
determine the maclaurin series and polynomial for function in the form ax2ebx,0,the / in / a / of / shorts
ex determine a taylor polynomial for a square root function,0,the / in / a / of / shorts
ex find a maclaurin polynomial and the interval for a given error cosx,0,the / in / a / of / shorts
what is sleep paralysis my experience mechanism causes and tips,0,the / in / a / of / shorts
average value of a quadratic function and values of c such that fcave value,0,the / in / a / of / shorts
a find the average value of f on the given intervalb find c fave fc fx x32 25,0,the / in / a / of / shorts
ex determine the work required to pump water out of trough isosceles triangle,0,the / in / a / of / shorts
50 cent went hard on this interview,0,the / in / a / of / shorts
handcuffs vs parkour is it possible,0,the / in / a / of / shorts
matt rife crowd work 3 kids already mattrife comedy mattrifecomedy prank,0,the / in / a / of / shorts
the offer in shark tank shorts motivation,0,the / in / a / of / shorts
worlds first crane trickshot in mw3,0,the / in / a / of / shorts
training days my individual training session in 44 seconds,0,the / in / a / of / shorts
mike calls off his wedding with rachel series viral mikeross harvey rachel suits netflix,0,the / in / a / of / shorts
suits 10 minutes of harvey specter closing deals,0,the / in / a / of / shorts
the suits cast being chaotic,0,the / in / a / of / shorts
supra vs ferrari thefastandthefurious shorts,0,the / in / a / of / shorts
ray needs to do four perfect dap ups to join kai cenat his gang in jail,0,the / in / a / of / shorts
mike leaves rachel at the altar before going to jail shorts suits,0,the / in / a / of / shorts
classic suits moments that changed everything,0,the / in / a / of / shorts
the scandalous relationships of harvey specter suits,0,the / in / a / of / shorts
jhay cortez bad bunny no me conoce en vivo,0,the / in / a / of / shorts
bad bunny no me conoce x100pre tour barclays center live 12619,0,the / in / a / of / shorts
burn ellie goulding just dance 2015 cool music for dancing,0,the / in / a / of / shorts
just dance 2017 worth it by fifth harmony ft kid ink full game play,0,the / in / a / of / shorts
just dance 2018 naughty girl,0,the / in / a / of / shorts
just dance 4 mr saxobeat alexandra stan 5 stars,0,the / in / a / of / shorts
chachi matt steffanina dance compilation,0,the / in / a / of / shorts
we took 100 shots vs a 50 rated keeper and scored goals,0,the / in / a / of / shorts
how to stop missing input moves with terry bogard,0,the / in / a / of / shorts
mike takes down witness suits shorts,0,the / in / a / of / shorts
the harvey and louis fight does indeed exist shorts suits,0,the / in / a / of / shorts
zoey x zach the other zoey,0,the / in / a / of / shorts
harvey specter being an absolute savage for 1 minute straight shorts suits,0,the / in / a / of / shorts
rachel zane getting a huge crush on mike ross shorts,0,the / in / a / of / shorts
we took 100 shots vs a 50 rated keeper and scored goals,0,the / in / a / of / shorts
no touchies after 8pm,0,the / in / a / of / shorts
ex find the hydrostatic force on a dam in the shape of a degree 4 polynomial,0,the / in / a / of / shorts
ex find the hydrostatic force on a semicircle window submerged in water,0,the / in / a / of / shorts
ex find the centroid of a bounded region involving the sine function using the ti84,0,the / in / a / of / shorts
who turned mike ross in who is behind the anonymous email suits,0,the / in / a / of / shorts
louiss confession louis made a huge mistake suits,0,the / in / a / of / shorts
louis wants to sue harvey suits,0,the / in / a / of / shorts
louis now knows about mikes secret louis confronts jessica suits,0,the / in / a / of / shorts
miniminter tastes glowberry prime for the first time,0,the / in / a / of / shorts
declined by every race,0,the / in / a / of / shorts
deji shows off mindblowing trick,0,the / in / a / of / shorts
w2s defends jesus,0,the / in / a / of / shorts
sidemen forfeit wheel of fortune,0,the / in / a / of / shorts
find the centroid of a bounded region involving two quadratic functions,0,the / in / a / of / shorts
find the centroid of a bounded region involving two quadratic functions,0,the / in / a / of / shorts
find the centroid of the region bounded by the given curves,0,the / in / a / of / shorts
example 1 finding the volume of a torus using pappuss centroid theorem,0,the / in / a / of / shorts
ex find the hydrostatic force on a vertical plate in the shape of an isosceles triangle,0,the / in / a / of / shorts
elf 210 best movie quote bye buddy hope you find your dad 2003,0,the / in / a / of / shorts
mike rachel perfect,0,the / in / a / of / shorts
mike loses his grandma suits,0,the / in / a / of / shorts
harvey exposes rachel for cheating on mike suits,0,the / in / a / of / shorts
mike and rachel first kiss and beat kiss,0,the / in / a / of / shorts
why rachel doesnt go to mikes place suits suits mikeross rachelzane meghanmarkle shorts,0,the / in / a / of / shorts
logan and rachel kissed mike punches logan mike breaks up with rachel suits,0,the / in / a / of / shorts
the fellas go wild in mexico sidemen holiday,0,the / in / a / of / shorts
budapest in 4k,0,the / in / a / of / shorts
i tested man united fans football skills football manchesterunited premierleague rashford,0,the / in / a / of / shorts
galantis runaway u i gioni remix,0,the / in / a / of / shorts
stranded at sea for 24 hours sharkfilled waters,0,the / in / a / of / shorts
i lived in a luxury airport for 4 days nobody noticed,0,the / in / a / of / shorts
never forget the brilliance of philippe coutinho,0,the / in / a / of / shorts
fnaf plus got me shivering my timbers,0,the / in / a / of / shorts
i made an army of sub pigs hardcore minecraft,0,the / in / a / of / shorts
i trapped every boss in minecraft hardcore,0,the / in / a / of / shorts
creepy and weird stuff in old minecraft,0,the / in / a / of / shorts
sidemen spill your guts or fill your guts 2,0,the / in / a / of / shorts
nick all star brawl 2 is lit,0,the / in / a / of / shorts
delete og fortnite,0,the / in / a / of / shorts
the complete five nights at freddys story explained,0,the / in / a / of / shorts
euro 2016 montage magic in the air,0,the / in / a / of / shorts
shakira waka waka this time for africa the official 2010 fifa world cup song,0,the / in / a / of / shorts
pitbull hey baby drop it to the floor ft tpain,0,the / in / a / of / shorts
just dance katy perry hot n cold,0,the / in / a / of / shorts
california gurls katy perry ft snoop dogg just dance 3,0,the / in / a / of / shorts
dynamite taio cruz just dance 3,0,the / in / a / of / shorts
just dance 4 mr saxobeat alexandra stan 5 stars,0,the / in / a / of / shorts
the complete five nights at freddys story explained,0,the / in / a / of / shorts
the mystery of the bomb collar bank heist,0,the / in / a / of / shorts
how to stop missing input moves with terry bogard,0,the / in / a / of / shorts
laserface by gareth emery seattle wamu 2019 full set live,0,the / in / a / of / shorts
harvey takes down his rival suits,0,the / in / a / of / shorts
ranking every spiderman villian a tier list,0,the / in / a / of / shorts
evolution of web swinging in spiderman games 2012 2023 shorts spiderman ps5,0,the / in / a / of / shorts
did you know in marvels spider man 2 spiderman2,0,the / in / a / of / shorts
practice makes perfect,0,the / in / a / of / shorts
the complete five nights at freddys story explained,0,the / in / a / of / shorts
the haunted home of the duyck family ghost files,0,the / in / a / of / shorts
marouane fellaini touch of class,0,the / in / a / of / shorts
phil jones the legend,0,the / in / a / of / shorts
maguire moments man united will never forget,0,the / in / a / of / shorts
disturbing things from around the internet vol 8,0,the / in / a / of / shorts
chris rock on will smith slap,0,the / in / a / of / shorts
all symbiote transformation scenes 2023 spiderman 2 ps5 4k 60fps venom scream antivenom etc,0,the / in / a / of / shorts
no way home theory mj still remembers peter parker,0,the / in / a / of / shorts
all three spideys learn about each other spider man no way home with captions,0,the / in / a / of / shorts
mj wants to move in with peter and cuddle up marvels spiderman 2 ps5 spiderman2,0,the / in / a / of / shorts
bro even tricked mom during his commitment shorts,0,the / in / a / of / shorts
this nike ad shorts football ronaldo nike zlatan,0,the / in / a / of / shorts
spiderman 2s swing steering assistance do you want to swing fast or realistically spiderman2ps5,0,the / in / a / of / shorts
ranking all 55 saw traps worst to best,0,the / in / a / of / shorts
18 every member of the venom symbiote family explored,0,the / in / a / of / shorts
batman arkham origins all 8 assassins full boss battle fight gameplay,0,the / in / a / of / shorts
victoria justice freak the freak out full song lyrics hd,0,the / in / a / of / shorts
big time rush boyfriend big time rush nickelodeon,0,the / in / a / of / shorts
spider man 2 all suits for miles morales spider man 2 ps5 all suits spiderman2ps5,0,the / in / a / of / shorts
an iconic tinder line,0,the / in / a / of / shorts
kai gets violated,0,the / in / a / of / shorts
a very sidemen intro,0,the / in / a / of / shorts
w2s traps deji,0,the / in / a / of / shorts
deji messes up,0,the / in / a / of / shorts
kumbaya my lord,0,the / in / a / of / shorts
ksi caught cheating,0,the / in / a / of / shorts
vikkstar got humbled,0,the / in / a / of / shorts
w2s violates behz,0,the / in / a / of / shorts
iconic ksi tinder moment,0,the / in / a / of / shorts
w2s violates behz,0,the / in / a / of / shorts
w2s violates miniminter,0,the / in / a / of / shorts
sigma vikkstar,0,the / in / a / of / shorts
ksis magic trick,0,the / in / a / of / shorts
w2s near cancelled moment,0,the / in / a / of / shorts
she was mind blown,0,the / in / a / of / shorts
super useful python function python programming coding,0,the / in / a / of / shorts
the underdog how ian terry won big brother 14,0,the / in / a / of / shorts
sar perch ti amo the french version shorts,0,the / in / a / of / shorts
we tested the worlds rarest football boots,0,the / in / a / of / shorts
borussia dortmund fans you will never walk alone ynwa vs wolfsburg,0,the / in / a / of / shorts
spine tingling rendition of youll never walk alone with the kop,0,the / in / a / of / shorts
ac milan song shorts,0,the / in / a / of / shorts
ecuadors history at the world cupshorts football ecuador footballshorts,0,the / in / a / of / shorts
this iran fan got emotional during the national anthem shorts worldcup qatar,0,the / in / a / of / shorts
