Original_Title,Cleaned_Title,Cluster,Cluster_Name
Crystal Palace v. Manchester City | PREMIER LEAGUE HIGHLIGHTS | 3/14/2022 | NBC Sports,crystal palace v manchester city league highlights 3142022 sports,5,highlights / sports / league / v / united
West Ham United v. Aston Villa | PREMIER LEAGUE HIGHLIGHTS | 3/13/2022 | NBC Sports,west ham united v aston villa league highlights 3132022 sports,5,highlights / sports / league / v / united
Arsenal v. Leicester City | PREMIER LEAGUE HIGHLIGHTS | 3/13/2022 | NBC Sports,arsenal v leicester city league highlights 3132022 sports,5,highlights / sports / league / v / united
Brighton v. Liverpool | PREMIER LEAGUE HIGHLIGHTS | 3/12/2022 | NBC Sports,brighton v liverpool league highlights 3122022 sports,5,highlights / sports / league / v / united
Liverpool vs. Inter Milan: Extended Highlights | UCL Round of 16 - Leg 2 | CBS Sports Golazo,liverpool inter milan extended highlights ucl round 16 leg cbs sports golazo,5,highlights / sports / league / v / united
Arsenal v. Wolves | PREMIER LEAGUE HIGHLIGHTS | 2/24/2022 | NBC Sports,arsenal v wolves league highlights 2242022 sports,5,highlights / sports / league / v / united
Watford v. Arsenal | PREMIER LEAGUE HIGHLIGHTS | 3/6/2022 | NBC Sports,watford v arsenal league highlights 362022 sports,5,highlights / sports / league / v / united
Manchester City v. Manchester United | PREMIER LEAGUE HIGHLIGHTS | 3/6/2022 | NBC Sports,manchester city v manchester united league highlights 362022 sports,5,highlights / sports / league / v / united
Aston Villa v. Southampton | PREMIER LEAGUE HIGHLIGHTS | 3/5/2022 | NBC Sports,aston villa v southampton league highlights 352022 sports,5,highlights / sports / league / v / united
Liverpool v. West Ham United | PREMIER LEAGUE HIGHLIGHTS | 3/5/2022 | NBC Sports,liverpool v west ham united league highlights 352022 sports,5,highlights / sports / league / v / united
Burnley v. Leicester City | PREMIER LEAGUE HIGHLIGHTS | 3/1/2022 | NBC Sports,burnley v leicester city league highlights 312022 sports,5,highlights / sports / league / v / united
Manchester United v. Liverpool | PREMIER LEAGUE HIGHLIGHTS | 10/24/2021 | NBC Sports,manchester united v liverpool league highlights 10242021 sports,5,highlights / sports / league / v / united
Leeds United v. Liverpool | PREMIER LEAGUE HIGHLIGHTS | 9/12/2021 | NBC Sports,leeds united v liverpool league highlights 9122021 sports,5,highlights / sports / league / v / united
West Ham United v. Wolves | PREMIER LEAGUE HIGHLIGHTS | 2/27/2022 | NBC Sports,west ham united v wolves league highlights 2272022 sports,5,highlights / sports / league / v / united
Atlético Madrid vs. Man. United: Extended Highlights | UCL Round of 16 - Leg 1 | CBS Sports Golazo,atltico madrid man united extended highlights ucl round 16 leg cbs sports golazo,5,highlights / sports / league / v / united
Leicester City v. Manchester United | PREMIER LEAGUE HIGHLIGHTS | 10/16/2021 | NBC Sports,leicester city v manchester united league highlights 10162021 sports,5,highlights / sports / league / v / united
Arsenal v. Wolves | PREMIER LEAGUE HIGHLIGHTS | 2/24/2022 | NBC Sports,arsenal v wolves league highlights 2242022 sports,5,highlights / sports / league / v / united
Manchester United v. Watford | PREMIER LEAGUE HIGHLIGHTS | 2/26/2022 | NBC Sports,manchester united v watford league highlights 2262022 sports,5,highlights / sports / league / v / united
Leeds United v. Tottenham Hotspur | PREMIER LEAGUE HIGHLIGHTS | 2/26/2022 | NBC Sports,leeds united v tottenham hotspur league highlights 2262022 sports,5,highlights / sports / league / v / united
Chelsea vs. LOSC Lille: Extended Highlights | Round of 16 - 1st Leg | CBS Sports Golazo,chelsea losc lille extended highlights round 16 1st leg cbs sports golazo,5,highlights / sports / league / v / united
Manchester City vs. Paris Saint-Germain: Extended Highlights | Group Stage - MD 5 | CBS Sports Go…,manchester city paris saintgermain extended highlights group stage md cbs sports go,5,highlights / sports / league / v / united
Paris Saint-Germain vs. RB Leipzig: Extended Highlights | Group Stage - Match Day 3 | CBS Sports …,paris saintgermain rb leipzig extended highlights group stage match day cbs sports,5,highlights / sports / league / v / united
Leeds United v. Manchester United | PREMIER LEAGUE HIGHLIGHTS | 2/20/2022 | NBC Sports,leeds united v manchester united league highlights 2202022 sports,5,highlights / sports / league / v / united
Wolves v. Leicester City | PREMIER LEAGUE HIGHLIGHTS | 2/20/2022 | NBC Sports,wolves v leicester city league highlights 2202022 sports,5,highlights / sports / league / v / united
Arsenal v. Brentford | PREMIER LEAGUE HIGHLIGHTS | 2/19/2022 | NBC Sports,arsenal v brentford league highlights 2192022 sports,5,highlights / sports / league / v / united
Manchester City v. Tottenham Hotspur | PREMIER LEAGUE HIGHLIGHTS | 2/19/2022 | NBC Sports,manchester city v tottenham hotspur league highlights 2192022 sports,5,highlights / sports / league / v / united
Manchester United v. Brighton | PREMIER LEAGUE HIGHLIGHTS | 2/15/2022 | NBC Sports,manchester united v brighton league highlights 2152022 sports,5,highlights / sports / league / v / united
PSG vs. Real Madrid: Extended Highlights | Round of 16 - Leg 1 | CBS Sports Golazo,psg real madrid extended highlights round 16 leg cbs sports golazo,5,highlights / sports / league / v / united
PSG vs. Man. City: Extended Highlights | UCL Group Stage MD 2 | CBS Sports Golazo,psg man city extended highlights ucl group stage md cbs sports golazo,5,highlights / sports / league / v / united
Tottenham Hotspur v. Southampton | PREMIER LEAGUE HIGHLIGHTS | 2/9/2022 | NBC Sports,tottenham hotspur v southampton league highlights 292022 sports,5,highlights / sports / league / v / united
"NBA ""Bad Sportsmanship! 💔"" MOMENTS",nba bad sportsmanship,5,highlights / sports / league / v / united
Manchester United v. Southampton | PREMIER LEAGUE HIGHLIGHTS | 2/12/2022 | NBC Sports,manchester united v southampton league highlights 2122022 sports,5,highlights / sports / league / v / united
"Eden Hazard, N'Golo Kante combine for Chelsea goal against Man City | Premier League | NBC Sports",eden hazard ngolo kante combine chelsea goal against man city league sports,5,highlights / sports / league / v / united
Aston Villa v. Leeds United | PREMIER LEAGUE HIGHLIGHTS | 2/9/2022 | NBC Sports,aston villa v leeds united league highlights 292022 sports,5,highlights / sports / league / v / united
Tottenham Hotspur v. Southampton | PREMIER LEAGUE HIGHLIGHTS | 2/9/2022 | NBC Sports,tottenham hotspur v southampton league highlights 292022 sports,5,highlights / sports / league / v / united
Newcastle United v. Everton | PREMIER LEAGUE HIGHLIGHTS | 2/8/2022 | NBC Sports,newcastle united v everton league highlights 282022 sports,5,highlights / sports / league / v / united
Burnley v. Manchester United | PREMIER LEAGUE HIGHLIGHTS | 2/8/2022 | NBC Sports,burnley v manchester united league highlights 282022 sports,5,highlights / sports / league / v / united
Scoring A Goal With Every Premier League Football From 2000-2020,scoring goal every league football 20002020,5,highlights / sports / league / v / united
Bengals vs. Chiefs AFC Championship Highlights | NFL 2021,bengals chiefs afc championship highlights nfl 2021,5,highlights / sports / league / v / united
Demarai Gray stoppage-time stunner gets Everton in front | Premier League | NBC Sports,demarai gray stoppagetime stunner gets everton front league sports,5,highlights / sports / league / v / united
Chelsea v. Tottenham Hotspur | PREMIER LEAGUE HIGHLIGHTS | 1/23/2022 | NBC Sports,chelsea v tottenham hotspur league highlights 1232022 sports,5,highlights / sports / league / v / united
Chelsea v. Tottenham Hotspur | PREMIER LEAGUE HIGHLIGHTS | 1/23/2022 | NBC Sports,chelsea v tottenham hotspur league highlights 1232022 sports,5,highlights / sports / league / v / united
Aston Villa v. Manchester United | PREMIER LEAGUE HIGHLIGHTS | 1/15/2022 | NBC Sports,aston villa v manchester united league highlights 1152022 sports,5,highlights / sports / league / v / united
West Ham United v. Leeds United | PREMIER LEAGUE HIGHLIGHTS | 1/16/2022 | NBC Sports,west ham united v leeds united league highlights 1162022 sports,5,highlights / sports / league / v / united
Liverpool v. Brentford | PREMIER LEAGUE HIGHLIGHTS | 1/16/2022 | NBC Sports,liverpool v brentford league highlights 1162022 sports,5,highlights / sports / league / v / united
Manchester City v. Chelsea | PREMIER LEAGUE HIGHLIGHTS | 1/15/2022 | NBC Sports,manchester city v chelsea league highlights 1152022 sports,5,highlights / sports / league / v / united
Leicester City v. Manchester United | PREMIER LEAGUE HIGHLIGHTS | 10/16/2021 | NBC Sports,leicester city v manchester united league highlights 10162021 sports,5,highlights / sports / league / v / united
Roma vs. Juventus: Extended Highlights | Serie A | CBS Sports Golazo,roma juventus extended highlights serie cbs sports golazo,5,highlights / sports / league / v / united
Vikings vs. Packers Week 17 Highlights | NFL 2021,vikings packers week 17 highlights nfl 2021,5,highlights / sports / league / v / united
"Top Premier League Matchweek 21 takeaways: Arsenal impress, Everton depress | NBC Sports",league matchweek 21 takeaways arsenal impress everton depress sports,5,highlights / sports / league / v / united
Manchester United v. Wolves | PREMIER LEAGUE HIGHLIGHTS | 1/3/2022 | NBC Sports,manchester united v wolves league highlights 132022 sports,5,highlights / sports / league / v / united
Manchester City slip past Arsenal amid controversy | Premier League Update | NBC Sports,manchester city slip past arsenal amid controversy league update sports,5,highlights / sports / league / v / united
Arsenal v. Manchester City | PREMIER LEAGUE HIGHLIGHTS | 1/1/2022 | NBC Sports,arsenal v manchester city league highlights 112022 sports,5,highlights / sports / league / v / united
Leicester City v. Manchester United | PREMIER LEAGUE HIGHLIGHTS | 10/16/2021 | NBC Sports,leicester city v manchester united league highlights 10162021 sports,5,highlights / sports / league / v / united
Tottenham Hotspur v. Liverpool | PREMIER LEAGUE HIGHLIGHTS | 12/19/2021 | NBC Sports,tottenham hotspur v liverpool league highlights 12192021 sports,5,highlights / sports / league / v / united
"NBA ""Hood Basketball"" MOMENTS",nba hood basketball,5,highlights / sports / league / v / united
Demarai Gray stoppage-time stunner gets Everton in front | Premier League | NBC Sports,demarai gray stoppagetime stunner gets everton front league sports,5,highlights / sports / league / v / united
Liverpool v. Newcastle | PREMIER LEAGUE HIGHLIGHTS | 12/16/2021 | NBC Sports,liverpool v newcastle league highlights 12162021 sports,5,highlights / sports / league / v / united
Most Unsportsmanlike & Disrespectful Moments In Football,unsportsmanlike disrespectful football,5,highlights / sports / league / v / united
Arsenal v. West Ham United | PREMIER LEAGUE HIGHLIGHTS | 12/15/2021 | NBC Sports,arsenal v west ham united league highlights 12152021 sports,5,highlights / sports / league / v / united
"NBA ""Basketball Stereotypes"" MOMENTS #2",nba basketball stereotypes,5,highlights / sports / league / v / united
Most Unsportsmanlike & Disrespectful Moments In Football,unsportsmanlike disrespectful football,5,highlights / sports / league / v / united
Manchester City v. Wolves | PREMIER LEAGUE HIGHLIGHTS | 12/11/2021 | NBC Sports,manchester city v wolves league highlights 12112021 sports,5,highlights / sports / league / v / united
Bayern Munich vs. Barcelona: Extended Highlights | Group Stage - MD 6 | CBS Sports Golazo,bayern munich barcelona extended highlights group stage md cbs sports golazo,5,highlights / sports / league / v / united
Everton v. Arsenal | PREMIER LEAGUE HIGHLIGHTS | 12/6/2021 | NBC Sports,everton v arsenal league highlights 1262021 sports,5,highlights / sports / league / v / united
#2 Michigan vs #13 Iowa Highlights | Big 10 Championship Game | 2021 College Football Highlights,michigan 13 iowa highlights big championship game 2021 college football highlights,5,highlights / sports / league / v / united
#9 Baylor vs #5 Oklahoma State Highlights | Big 12 Championship | 2021 College Football Highlights,baylor oklahoma state highlights big 12 championship 2021 college football highlights,5,highlights / sports / league / v / united
#3 Alabama vs #1 Georgia Highlights | SEC Championship Game | 2021 College Football Highlights,alabama georgia highlights sec championship game 2021 college football highlights,5,highlights / sports / league / v / united
#10 Oregon vs #17 Utah Highlights | Pac 12 Championship Game | 2021 College Football Highlights,oregon 17 utah highlights pac 12 championship game 2021 college football highlights,5,highlights / sports / league / v / united
Manchester United v. Arsenal | PREMIER LEAGUE HIGHLIGHTS | 12/2/2021 | NBC Sports,manchester united v arsenal league highlights 1222021 sports,5,highlights / sports / league / v / united
Southampton v. Leicester City | PREMIER LEAGUE HIGHLIGHTS | 12/1/2021 | NBC Sports,southampton v leicester city league highlights 1212021 sports,5,highlights / sports / league / v / united
Everton v. Liverpool | PREMIER LEAGUE HIGHLIGHTS | 12/1/2021 | NBC Sports,everton v liverpool league highlights 1212021 sports,5,highlights / sports / league / v / united
Leicester City v. Watford | PREMIER LEAGUE HIGHLIGHTS | 11/28/2021 | NBC Sports,leicester city v watford league highlights 11282021 sports,5,highlights / sports / league / v / united
Chelsea v. Manchester United | PREMIER LEAGUE HIGHLIGHTS | 11/28/2021 | NBC Sports,chelsea v manchester united league highlights 11282021 sports,5,highlights / sports / league / v / united
Manchester City v. West Ham United | PREMIER LEAGUE HIGHLIGHTS | 11/28/2021 | NBC Sports,manchester city v west ham united league highlights 11282021 sports,5,highlights / sports / league / v / united
Liverpool v. Southampton | PREMIER LEAGUE HIGHLIGHTS | 11/27/2021 | NBC Sports,liverpool v southampton league highlights 11272021 sports,5,highlights / sports / league / v / united
#2 Ohio State v #5 Michigan (2021) | College Football Week 13 | 2021 College Football Highlights,ohio state v michigan 2021 college football week 13 2021 college football highlights,5,highlights / sports / league / v / united
Football vs Soccer Trick Shots | Dude Perfect,football soccer trick shots dude perfect,5,highlights / sports / league / v / united
"NBA ""Basketball Stereotypes"" MOMENTS #3",nba basketball stereotypes,5,highlights / sports / league / v / united
Liverpool vs. FC Porto: Extended Highlights | Group Stage - MD 5 | CBS Sports Golazo,liverpool fc porto extended highlights group stage md cbs sports golazo,5,highlights / sports / league / v / united
Manchester City vs. Paris Saint-Germain: Extended Highlights | Group Stage - MD 5 | CBS Sports Go…,manchester city paris saintgermain extended highlights group stage md cbs sports go,5,highlights / sports / league / v / united
Chelsea vs. Juventus: Extended Highlights | Group Stage - MD 5 | CBS Sports Golazo,chelsea juventus extended highlights group stage md cbs sports golazo,5,highlights / sports / league / v / united
"NBA ""Unsportsmanlike"" MOMENTS",nba unsportsmanlike,5,highlights / sports / league / v / united
Liverpool v. Arsenal | PREMIER LEAGUE HIGHLIGHTS | 11/20/2021 | NBC Sports,liverpool v arsenal league highlights 11202021 sports,5,highlights / sports / league / v / united
Watford v. Manchester United | PREMIER LEAGUE HIGHLIGHTS | 11/20/2021 | NBC Sports,watford v manchester united league highlights 11202021 sports,5,highlights / sports / league / v / united
Tobi & Chris MD 2-Touch Shooting Challenge VS Premier League Footballers!,tobi chris md 2touch shooting challenge league footballers,5,highlights / sports / league / v / united
Leicester City v. Chelsea | PREMIER LEAGUE HIGHLIGHTS | 11/20/2021 | NBC Sports,leicester city v chelsea league highlights 11202021 sports,5,highlights / sports / league / v / united
Watford v. Manchester United | PREMIER LEAGUE HIGHLIGHTS | 11/20/2021 | NBC Sports,watford v manchester united league highlights 11202021 sports,5,highlights / sports / league / v / united
#8 Oklahoma vs #13 Baylor Highlights | College Football Week 11 | 2021 College Football Highlights,oklahoma 13 baylor highlights college football week 11 2021 college football highlights,5,highlights / sports / league / v / united
#1 Alabama vs Texas A&M Highlights | College Football Week 6 | 2021 College Football Highlights,alabama texas am highlights college football week 2021 college football highlights,5,highlights / sports / league / v / united
#6 Oklahoma vs #21 Texas Highlights (GAME OF THE YEAR!?) | Week 6 | 2021 College Football Highlights,oklahoma 21 texas highlights game year week 2021 college football highlights,5,highlights / sports / league / v / united
#2 Alabama vs LSU Highlights | College Football Week 10 | 2021 College Football Highlights,alabama lsu highlights college football week 2021 college football highlights,5,highlights / sports / league / v / united
Packers vs. Chiefs Week 9 Highlights | NFL 2021,packers chiefs week highlights nfl 2021,5,highlights / sports / league / v / united
Manchester United v. Manchester City | PREMIER LEAGUE HIGHLIGHTS | 11/6/2021 | NBC Sports,manchester united v manchester city league highlights 1162021 sports,5,highlights / sports / league / v / united
#1 Georgia vs Missouri Highlights | College Football Week 10 | 2021 College Football Highlights,georgia missouri highlights college football week 2021 college football highlights,5,highlights / sports / league / v / united
Manchester United v. Manchester City | PREMIER LEAGUE HIGHLIGHTS | 11/6/2021 | NBC Sports,manchester united v manchester city league highlights 1162021 sports,5,highlights / sports / league / v / united
Borussia Dortmund vs. Ajax: Extended Highlights | Group Stage - Match Day 4 | CBS Sports Golazo,borussia dortmund ajax extended highlights group stage match day cbs sports golazo,5,highlights / sports / league / v / united
Liverpool vs. Atlético Madrid: Extended Highlights | Group Stage - Match Day 4 | CBS Sports Golazo,liverpool atltico madrid extended highlights group stage match day cbs sports golazo,5,highlights / sports / league / v / united
RB Leipzig vs. Paris Saint-Germain: Extended Highlights | Group Stage - Match Day 4 | CBS Sports …,rb leipzig paris saintgermain extended highlights group stage match day cbs sports,5,highlights / sports / league / v / united
Southampton v.  Tottenham | PREMIER LEAGUE HIGHLIGHTS | 1/1/20 | NBC Sports,southampton v tottenham league highlights 1120 sports,5,highlights / sports / league / v / united
Sevilla vs. LOSC: Extended Highlights | Group Stage - Match Day 4 | CBS Sports Golazo,sevilla losc extended highlights group stage match day cbs sports golazo,5,highlights / sports / league / v / united
Tottenham Hotspur v. Chelsea | PREMIER LEAGUE HIGHLIGHTS | 12/22/19 | NBC Sports,tottenham hotspur v chelsea league highlights 122219 sports,5,highlights / sports / league / v / united
Arsenal v. Liverpool | PREMIER LEAGUE CLASSIC MATCH | 12/22/17 | NBC Sports,arsenal v liverpool league classic match 122217 sports,5,highlights / sports / league / v / united
Arsenal v. Manchester United | PREMIER LEAGUE HIGHLIGHTS | 1/1/20 | NBC Sports,arsenal v manchester united league highlights 1120 sports,5,highlights / sports / league / v / united
Arsenal v. Chelsea | PREMIER LEAGUE CLASSIC MATCH | 1/3/18 | NBC Sports,arsenal v chelsea league classic match 1318 sports,5,highlights / sports / league / v / united
Arsenal v. Chelsea | PREMIER LEAGUE HIGHLIGHTS | 12/29/19 | NBC Sports,arsenal v chelsea league highlights 122919 sports,5,highlights / sports / league / v / united
Liverpool v. Tottenham | PREMIER LEAGUE HIGHLIGHTS | 10/27/19 | NBC Sports,liverpool v tottenham league highlights 102719 sports,5,highlights / sports / league / v / united
Liverpool v. Manchester City | PREMIER LEAGUE HIGHLIGHTS | 11/10/19 | NBC Sports,liverpool v manchester city league highlights 111019 sports,5,highlights / sports / league / v / united
Wolves v. Manchester City | PREMIER LEAGUE HIGHLIGHTS | 12/27/19 | NBC Sports,wolves v manchester city league highlights 122719 sports,5,highlights / sports / league / v / united
Wolves v. Everton | PREMIER LEAGUE HIGHLIGHTS | 11/01/2021 | NBC Sports,wolves v everton league highlights 11012021 sports,5,highlights / sports / league / v / united
#6 Michigan vs #8 Michigan State Highlights | College Football Week 9 | 2021 College Football,michigan michigan state highlights college football week 2021 college football,5,highlights / sports / league / v / united
#5 Ohio State vs #20 Penn State Highlights | College Football Week 9 | 2021 College Football,ohio state 20 penn state highlights college football week 2021 college football,5,highlights / sports / league / v / united
Manchester City v. Crystal Palace | PREMIER LEAGUE HIGHLIGHTS | 10/30/2021 | NBC Sports,manchester city v crystal palace league highlights 10302021 sports,5,highlights / sports / league / v / united
Tottenham Hotspur v. Manchester United | PREMIER LEAGUE HIGHLIGHTS | 10/30/2021 | NBC Sports,tottenham hotspur v manchester united league highlights 10302021 sports,5,highlights / sports / league / v / united
James Madison vs North Dakota State Highlights | 2020 FCS Championship Highlights | College Football,james madison north dakota state highlights 2020 fcs championship highlights college football,5,highlights / sports / league / v / united
Clemson vs. LSU: CFP National Championship | College Football Highlights,clemson lsu cfp national championship college football highlights,5,highlights / sports / league / v / united
Packers vs. Cardinals Week 8 Highlights | NFL 2021,packers cardinals week highlights nfl 2021,5,highlights / sports / league / v / united
#3 Clemson vs #2 Ohio State Highlights 2019 College Football Playoff Highlights,clemson ohio state highlights 2019 college football playoff highlights,5,highlights / sports / league / v / united
#4 Oklahoma vs #1 LSU Highlights 2019 College Football Playoff Highlights,oklahoma lsu highlights 2019 college football playoff highlights,5,highlights / sports / league / v / united
Clemson vs. LSU: CFP National Championship | College Football Highlights,clemson lsu cfp national championship college football highlights,5,highlights / sports / league / v / united
West Ham United v. Tottenham Hotspur | PREMIER LEAGUE HIGHLIGHTS | 10/24/2021 | NBC Sports,west ham united v tottenham hotspur league highlights 10242021 sports,5,highlights / sports / league / v / united
Manchester United v. Liverpool | PREMIER LEAGUE HIGHLIGHTS | 10/24/2021 | NBC Sports,manchester united v liverpool league highlights 10242021 sports,5,highlights / sports / league / v / united
#10 Oregon vs UCLA Highlights | College Football Week 8 | 2021 College Football Highlights,oregon ucla highlights college football week 2021 college football highlights,5,highlights / sports / league / v / united
Leeds United v. Wolves | PREMIER LEAGUE HIGHLIGHTS | 10/23/2021 | NBC Sports,leeds united v wolves league highlights 10232021 sports,5,highlights / sports / league / v / united
Arsenal v. Aston Villa | PREMIER LEAGUE HIGHLIGHTS | 10/22/2021 | NBC Sports,arsenal v aston villa league highlights 10222021 sports,5,highlights / sports / league / v / united
Vitesse vs. Tottenham: Extended Highlights | UECL Group Stage MD3 | CBS Sports Golazo,vitesse tottenham extended highlights uecl group stage md3 cbs sports golazo,5,highlights / sports / league / v / united
Atlético de Madrid vs. Liverpool: Extended Highlights | Group Stage-Match Day 3 | CBS Sports Golazo,atltico de madrid liverpool extended highlights group stagematch day cbs sports golazo,5,highlights / sports / league / v / united
Newcastle United v. Manchester United | PREMIER LEAGUE HIGHLIGHTS | 10/6/19 | NBC Sports,newcastle united v manchester united league highlights 10619 sports,5,highlights / sports / league / v / united
Newcastle v. Manchester United | PREMIER LEAGUE HIGHLIGHTS | 10/17/2020 | NBC Sports,newcastle v manchester united league highlights 10172020 sports,5,highlights / sports / league / v / united
Atlético de Madrid vs. Liverpool: Extended Highlights | Group Stage-Match Day 3 | CBS Sports Golazo,atltico de madrid liverpool extended highlights group stagematch day cbs sports golazo,5,highlights / sports / league / v / united
Paris Saint-Germain vs. RB Leipzig: Extended Highlights | Group Stage - Match Day 3 | CBS Sports …,paris saintgermain rb leipzig extended highlights group stage match day cbs sports,5,highlights / sports / league / v / united
Bills vs. Titans Week 6 Highlights | NFL 2021,bills titans week highlights nfl 2021,5,highlights / sports / league / v / united
LSU vs #20 Florida Highlights | College Football Week 7 | 2021 College Football Highlights,lsu 20 florida highlights college football week 2021 college football highlights,5,highlights / sports / league / v / united
Leicester City v. Manchester United | PREMIER LEAGUE HIGHLIGHTS | 10/16/2021 | NBC Sports,leicester city v manchester united league highlights 10162021 sports,5,highlights / sports / league / v / united
PSG vs. Man. City: Extended Highlights | UCL Group Stage MD 2 | CBS Sports Golazo,psg man city extended highlights ucl group stage md cbs sports golazo,5,highlights / sports / league / v / united
Newcastle United v. Tottenham Hotspur | PREMIER LEAGUE HIGHLIGHTS | 10/17/2021 | NBC Sports,newcastle united v tottenham hotspur league highlights 10172021 sports,5,highlights / sports / league / v / united
Aston Villa v. Wolves | PREMIER LEAGUE HIGHLIGHTS | 10/16/2021 | NBC Sports,aston villa v wolves league highlights 10162021 sports,5,highlights / sports / league / v / united
