Title,Cluster,Cluster Name
top 5 best m2 mac accessories for productivity 2023,0,50 / gta / top
harry w2s being the funniest man alive 9 minutes 19 seconds,0,50 / gta / top
the office but it gets progressively more inappropriate the office us,0,50 / gta / top
sidemen reverse 20 vs 1 tana mongeau edition,0,50 / gta / top
the dark knight trilogy,0,50 / gta / top
ksi dangerous jokesksi sidemen,0,50 / gta / top
top 10 move of 2018 wrestling,0,50 / gta / top
the greatest ever us open trick shots,0,50 / gta / top
embarrassing moments,0,50 / gta / top
point of year,0,50 / gta / top
sidemen w2s diss track unreleased shorts,0,50 / gta / top
is this most wholesome prank the office the office us,0,50 / gta / top
the most disturbing human experiment ever,0,50 / gta / top
the most disturbing human experiment ever,0,50 / gta / top
vanossgaming friends funny rage,0,50 / gta / top
apple watch se 2 review the best watch most people,0,50 / gta / top
20 women vs 1 sidemen harry edition,0,50 / gta / top
greatest point ever,0,50 / gta / top
winning with the worst poker hand shorts poker,0,50 / gta / top
the ending,0,50 / gta / top
my worst trickshot ever shorts,0,50 / gta / top
5 foot 6 foot football challenges,0,50 / gta / top
best football moments 2010 2020 decade recap,0,50 / gta / top
hows your touch football challenge,0,50 / gta / top
the sounds of moons,0,50 / gta / top
horror moments football,0,50 / gta / top
the sidemen play codenames,0,50 / gta / top
sidemen slap game,0,50 / gta / top
sidemen helmet game,0,50 / gta / top
5 second challenge,0,50 / gta / top
michael scotts emotional farewell song 9986000 minutes the office,0,50 / gta / top
is football 2023 amazing moments,0,50 / gta / top
funniest ishowspeed fifa moments,0,50 / gta / top
the 50 best goals of season top goals serie a 202223,0,50 / gta / top
jim pam real love the office us,0,50 / gta / top
the office wedding dance the office,0,50 / gta / top
fans brutally rate the sidemen,0,50 / gta / top
american soccer players react to the sidemen,0,50 / gta / top
is football 2023 amazing moments,0,50 / gta / top
sidemen vs professional poker player tournament,0,50 / gta / top
this is football 201617 the beautiful game,0,50 / gta / top
who is the best sidemen striker,0,50 / gta / top
best prank ever football,0,50 / gta / top
why outlast is still the best horror game,0,50 / gta / top
best of favorite dance moves,0,50 / gta / top
fifa 12 playing fifa with my bro,0,50 / gta / top
who has best college football atmosphere,0,50 / gta / top
best sister,0,50 / gta / top
ksi take down 10 million ksi podcast sidemen,0,50 / gta / top
w2s behzinga sidemen,0,50 / gta / top
simon is quitting the sidemen,0,50 / gta / top
best sidemen insults of all time,0,50 / gta / top
the end of sidemen clubs,0,50 / gta / top
ksi trolls the sidemen sdmn clubs,0,50 / gta / top
the funniest club session ever,0,50 / gta / top
the arkham verse explained 14 minutes,0,50 / gta / top
revenge moments football,0,50 / gta / top
the roast of the sidemen 2,0,50 / gta / top
w2s most offensive moments,0,50 / gta / top
sidemen saddest moment sidemen nostalgia harry 20 1,0,50 / gta / top
have you slept with any of the sidemen,0,50 / gta / top
sidemen meme olympics in public,0,50 / gta / top
sidemen meme olympics in public,0,50 / gta / top
5 foot 6 foot football challenges,0,50 / gta / top
best player best manager end of season awards,0,50 / gta / top
sidemen saddest moment sidemen nostalgia harry 20 1,0,50 / gta / top
best first date ever,0,50 / gta / top
top 50 sidemen gta moments,0,50 / gta / top
the dumbest moment sidemen among us,0,50 / gta / top
the scariest job ever,0,50 / gta / top
sidemen card system explained,0,50 / gta / top
sidemen harrys new house story,0,50 / gta / top
these are the greatest lakers fans ever,0,50 / gta / top
the biggest clutch in among us history,0,50 / gta / top
rose reacts to harry w2s lewis being bog for 11 minutes,0,50 / gta / top
funniest ishowspeed fifa moments,0,50 / gta / top
mr beast being best player sidemen charity match 2022,0,50 / gta / top
ishowspeed reacts to his sidemen charity match goal,0,50 / gta / top
top 50 sidemen gta moments,0,50 / gta / top
the university of texas at austin full episode the college tour,0,50 / gta / top
top 50 sidemen gta moments,0,50 / gta / top
best sidemen cards against humanity moments,0,50 / gta / top
most offensive sidemen cards against humanity moments,0,50 / gta / top
biggest sports hits of all time,0,50 / gta / top
the greatest moment web of shadows,0,50 / gta / top
the most delicious lava,0,50 / gta / top
the greatest nba debut ever,0,50 / gta / top
sidemen tobi hated this about sidemen tinder,0,50 / gta / top
would this work game football soccer skills,0,50 / gta / top
the most disturbing human experiment ever,0,50 / gta / top
learn 5 brazilian skills that look insane,0,50 / gta / top
2 skills that make baller soccer football shorts,0,50 / gta / top
the best introduction ever,0,50 / gta / top
dude missed out on the best sunflower seeds of his life,0,50 / gta / top
rudest restaurant in the world,0,50 / gta / top
the power of good coaching,0,50 / gta / top
i took 1526 shots my top 10 goals are insane,0,50 / gta / top
the 10 stages of every zombies player,0,50 / gta / top
revenge moments,0,50 / gta / top
the scariest trick shorts,0,50 / gta / top
nhl biggest hits of all time,0,50 / gta / top
greatestbestmost memorable us sports moments of last decade 20102019,0,50 / gta / top
the most controversial moment football shorts football,0,50 / gta / top
my worst date ever,0,50 / gta / top
10 years of football touch edition football soccer shorts,0,50 / gta / top
top 10 brands that old money wear,0,50 / gta / top
ksi hunts the sidemen,0,50 / gta / top
returning to the sidemen house,0,50 / gta / top
college football hits that get increasingly more brutal,0,50 / gta / top
the best feeling after tough football match,0,50 / gta / top
harry violates ethan on among us,0,50 / gta / top
the origin of caught 4k shorts comedy rdcworld meme 4k,0,50 / gta / top
can become one of the best in the world arsenal eye moiss caicedo transfer shorts,0,50 / gta / top
top 5 midfielders right now,0,50 / gta / top
harry is the most famous sidemen,0,50 / gta / top
gta 5 funny moments 403 with vikkstar gta 5 online funny moments,0,50 / gta / top
gta 5 funny moments 325 with vikkstar gta 5 online funny moments,0,50 / gta / top
10 famous minecraft maps lost time,0,50 / gta / top
football or rugby the most insane tackles 2022,0,50 / gta / top
top 3 dodgeball plays ever,0,50 / gta / top
sidemen ethan gets put on the spot,0,50 / gta / top
ksi listens to the most outrageous funeral speech,0,50 / gta / top
funniest clip from 20 1 sidemen kai cenat,0,50 / gta / top
gta 5 funny moments 153 with the sidemen gta 5 online funny moments,0,50 / gta / top
the golden gun or shorts,0,50 / gta / top
gta 5 funny moments 500 best of with vikkstar,0,50 / gta / top
the monsters beneath us the monument mythos,0,50 / gta / top
americans hate the sidemen,0,50 / gta / top
the good the bad the ucky more highlights from lowlife,0,50 / gta / top
one of the sidemen is down bad,0,50 / gta / top
the truth about sidemen tinder,0,50 / gta / top
the worst thing about filming sidemen,0,50 / gta / top
sidemen harry never missed a sidemen sunday,0,50 / gta / top
the worlds best dressed indian,0,50 / gta / top
w2s funny moments,0,50 / gta / top
sidemen one word interview,0,50 / gta / top
the difference,0,50 / gta / top
the art of defending,0,50 / gta / top
w2s dark past sidemen nostalgia w2s funny,0,50 / gta / top
ksis instant regret part 2 shorts sidemen ksi,0,50 / gta / top
gta 5 funny moments 328 with vikkstar gta 5 online funny moments,0,50 / gta / top
gta 5 funny moments 288 with vikkstar gta 5 online funny moments,0,50 / gta / top
the first time chrismd met w2s ksi,0,50 / gta / top
the sidemen roast chrismds trim 20 seconds straight,0,50 / gta / top
the greatest save football history shorts,0,50 / gta / top
w2s the karen,0,50 / gta / top
vikkstar,0,50 / gta / top
michael scott absolutely hating toby 10 minutes straight the office us comedy bites,0,50 / gta / top
sidemen monopoly,0,50 / gta / top
sidemen vs professional poker player tournament,0,50 / gta / top
when players get angry furious moments 2023 3,0,50 / gta / top
one of the best sunday league goals you will ever see incredible one touch football,0,50 / gta / top
the coldest fights football,0,50 / gta / top
the shocking story of ksi fan sidemen,0,50 / gta / top
gta 5 funny moments 264 with the sidemen gta 5 online funny moments,0,50 / gta / top
best sidemen cards against humanity moments,0,50 / gta / top
dana white on the worst fight in ufc history,0,50 / gta / top
i stayed at the most expensive hotel london,0,50 / gta / top
top 20 comedy movies of century so far,0,50 / gta / top
making jj rage gta 5 funny moments 635,0,50 / gta / top
downhill caddy obstacle course gta 5 funny moments 636,0,50 / gta / top
gta 5 funny moments 304 with vikkstar gta 5 online funny moments,0,50 / gta / top
gta 5 funny moments 269 with the sidemen gta 5 online funny moments,0,50 / gta / top
gta 5 funny moments 335 with vikkstar gta 5 online funny moments,0,50 / gta / top
sidemen is harry the biggest chelsea fan,0,50 / gta / top
most badass man in history,0,50 / gta / top
gta 5 funny moments 442 with vikkstar,0,50 / gta / top
gta 5 funny moments 483 with vikkstar,0,50 / gta / top
gta 5 funny moments 484 with vikkstar,0,50 / gta / top
gta 5 funny moments 464 with vikkstar,0,50 / gta / top
gta 5 funny moments 324 with vikkstar gta 5 online funny moments,0,50 / gta / top
sidemen simon reveals the richest sidemen member,0,50 / gta / top
ksi caught in 4k,0,50 / gta / top
top g vikkstar,0,50 / gta / top
the roast of the sidemen 2,0,50 / gta / top
top 50 sidemen gta moments,0,50 / gta / top
gta 5 funny moments 267 with the sidemen gta 5 online funny moments,0,50 / gta / top
gta 5 funny moments 313 with vikkstar gta 5 online funny moments,0,50 / gta / top
gta 5 funny moments 298 with vikkstar gta 5 online funny moments,0,50 / gta / top
top 50 sidemen gta moments,0,50 / gta / top
gta 5 funny moments 230 with the sidemen gta 5 online funny moments,0,50 / gta / top
gta 5 funny moments 227 with the sidemen gta 5 online funny moments,0,50 / gta / top
sidemen 5 second challenge controversial edition,0,50 / gta / top
gta 5 funny moments 282 with vikkstar gta 5 online funny moments,0,50 / gta / top
the most disgusting shoes world,0,50 / gta / top
w2s cute date sidemen nostalgia harry 20 1,0,50 / gta / top
ethan behzinga sidemens funniest laugh compilation 14 minutes,0,50 / gta / top
gta 5 funny moments 285 with vikkstar gta 5 online funny moments,0,50 / gta / top
gta 5 funny moments 268 with the sidemen gta 5 online funny moments,0,50 / gta / top
gta 5 funny moments 302 with vikkstar gta 5 online funny moments,0,50 / gta / top
gta 5 funny moments 330 with vikkstar gta 5 online funny moments,0,50 / gta / top
gta 5 funny moments 332 with vikkstar gta 5 online funny moments,0,50 / gta / top
the most disturbing haunted house of all time mckamey manor,0,50 / gta / top
gta 5 funny moments 333 with vikkstar gta 5 online funny moments,0,50 / gta / top
sidemen pictionary,0,50 / gta / top
the most disturbing haunted house of all time mckamey manor,0,50 / gta / top
reacting best behzinga rage moments,0,50 / gta / top
the ultimate behzinga rage compilation,0,50 / gta / top
gta 5 funny moments 297 with vikkstar gta 5 online funny moments,0,50 / gta / top
funniest fails bloopers in football try not to laugh,0,50 / gta / top
gta 5 funny moments 476 with vikkstar,0,50 / gta / top
the greatest spring break ever,0,50 / gta / top
the chase sidemen edition 2019,0,50 / gta / top
gta 5 funny moments 200 best of with the sidemen gta 5 online funny moments,0,50 / gta / top
double killing twice same game among us w sidemen friends,0,50 / gta / top
sidemen ethans first date with faith,0,50 / gta / top
gta 5 funny moments 299 with vikkstar gta 5 online funny moments,0,50 / gta / top
gta 5 funny moments 296 with vikkstar gta 5 online funny moments,0,50 / gta / top
gta 5 funny moments 287 with vikkstar gta 5 online funny moments,0,50 / gta / top
gta 5 funny moments 251 with the sidemen gta 5 online funny moments,0,50 / gta / top
best of gta 5 funny moments 700,0,50 / gta / top
the chase sidemen edition 2019,0,50 / gta / top
the weakest link sidemen edition,0,50 / gta / top
gta 5 funny moments 166 with the sidemen gta 5 online funny moments,0,50 / gta / top
gta 5 funny moments 152 with the sidemen gta 5 online funny moments,0,50 / gta / top
gta 5 funny moments 542 with vikkstar,0,50 / gta / top
the most insane voice world,0,50 / gta / top
best of gta 5 funny moments 600 with vikkstar,0,50 / gta / top
the most disturbing most questionable dialogue history,0,50 / gta / top
most outrageous among us moment,0,50 / gta / top
gta 5 funny moments the moist wet waves return gta v online,0,50 / gta / top
gta 5 funny moments 320 with vikkstar gta 5 online funny moments,0,50 / gta / top
gta 5 funny moments 290 with vikkstar gta 5 online funny moments,0,50 / gta / top
zerkaa goes god mode in gta 5,0,50 / gta / top
sidemen pick youtube of year sidemen,0,50 / gta / top
w2s funny moments,0,50 / gta / top
the most sus sidemen charades game,0,50 / gta / top
how harry joined the sidemen,0,50 / gta / top
gta 5 funny moments 291 with vikkstar gta 5 online funny moments,0,50 / gta / top
gta 5 funny moments 293 with vikkstar gta 5 online funny moments,0,50 / gta / top
gta 5 funny moments 312 with vikkstar gta 5 online funny moments,0,50 / gta / top
gta 5 funny moments 393 with vikkstar gta 5 online funny moments,0,50 / gta / top
gta 5 funny moments 541 with vikkstar,0,50 / gta / top
gta 5 funny moments 303 with vikkstar gta 5 online funny moments,0,50 / gta / top
gta 5 funny moments 301 with vikkstar gta 5 online funny moments,0,50 / gta / top
gta 5 funny moments 521 with vikkstar,0,50 / gta / top
gta 5 funny moments 365 with vikkstar gta 5 online funny moments,0,50 / gta / top
gta 5 funny moments 336 with vikkstar gta 5 online funny moments,0,50 / gta / top
gta 5 funny moments 229 with the sidemen gta 5 online funny moments,0,50 / gta / top
gta 5 funny moments 417 with vikkstar gta 5 online funny moments,0,50 / gta / top
the very best of trivial pursuit the sidemen,0,50 / gta / top
the most iconic celebrations of all time football,0,50 / gta / top
ksi caught in 4k,0,50 / gta / top
sidemen flinch challenge,0,50 / gta / top
most famous contact not in the nba shorts,0,50 / gta / top
best sidemen cards against humanity moments,0,50 / gta / top
three shot challenge golf with friends,0,50 / gta / top
the most attractive sidemen shorts,0,50 / gta / top
zerkaa rages at among us,0,50 / gta / top
worst but best exam seeitoff podcast,0,50 / gta / top
the best beef in youtube history podcast seeitoff,0,50 / gta / top
the dark knight trilogy,0,50 / gta / top
the roast of the sidemen 2,0,50 / gta / top
the roast of the sidemen 2,0,50 / gta / top
stephen tries best moments,0,50 / gta / top
sidemen giant football challenge,0,50 / gta / top
the office but it gets progressively more dangerous the office us,0,50 / gta / top
sidemen football forfeits,0,50 / gta / top
the dark knight trilogy,0,50 / gta / top
sidemen tinder in real life original edition,0,50 / gta / top
the drink off vs w2s,0,50 / gta / top
calfreezy ranks the sidemen,0,50 / gta / top
ksi caught in 4k,0,50 / gta / top
w2s being w2s,0,50 / gta / top
w2s being awkward 7 minutes 12 seconds,0,50 / gta / top
harry the nonce,0,50 / gta / top
the fans or player,0,50 / gta / top
sidemen speed dating extreme,0,50 / gta / top
sidemen all sports golf battle,0,50 / gta / top
my best round yet golf with friends,0,50 / gta / top
sidemen w2s football challenge,0,50 / gta / top
who is the best sidemen football player,0,50 / gta / top
best dances of 2020,0,50 / gta / top
who is the best sidemen football player,0,50 / gta / top
20 women vs 1 sidemen harry edition,0,50 / gta / top
sidemen speed dating extreme,0,50 / gta / top
sidemen blind dating,0,50 / gta / top
20 women vs 1 sidemen harry edition,0,50 / gta / top
sidemen blind dating 4,0,50 / gta / top
sidemen blind dating 3,0,50 / gta / top
sidemen pub golf europe edition,0,50 / gta / top
youtubers play the greatest childhood football games of all time,0,50 / gta / top
sidemen blind dating 4,0,50 / gta / top
the weakest link sidemen edition 2,0,50 / gta / top
the weakest link sidemen edition,0,50 / gta / top
speedy gonzales best moments,0,50 / gta / top
ranking top 10 youtube videos of all time,0,50 / gta / top
sidemen among us but the impostor is invisible,0,50 / gta / top
the dark knight trilogy,0,50 / gta / top
the sidemen duel minecraft sidecraft 6,0,50 / gta / top
the dark knight trilogy,0,50 / gta / top
the sidemen duel minecraft sidecraft 6,0,50 / gta / top
the sidemen play trivial pursuit sidemen gaming,0,50 / gta / top
is ksi actually the smartest sideman sidemen gaming,0,50 / gta / top
the most outrageous youtube moment 2023,0,50 / gta / top
the greatest freestyle on adin ross stream,0,50 / gta / top
adin ross freestyle,0,50 / gta / top
whats your most awkward time in bed,0,50 / gta / top
whats the most sus thing youve done with your boys,0,50 / gta / top
how play bobsled the drinking game,0,50 / gta / top
how play baseball the drinking game,0,50 / gta / top
how play corners the drinking game,0,50 / gta / top
this is greatest sidemen ever,0,50 / gta / top
sidemen pub golf gone wrong,0,50 / gta / top
the roast of the sidemen 2,0,50 / gta / top
48 hours in barcelona ft the top 10 bars restaurants,0,50 / gta / top
sidemen play minecraft minecraft sidecraft 1,0,50 / gta / top
the most streamed rap songs of all time,0,50 / gta / top
beautiful moments of respect,0,50 / gta / top
emotional moments,0,50 / gta / top
the best freekick video on youtube,0,50 / gta / top
10 years of coding 13 minutes,0,50 / gta / top
sidemen flag challenge,0,50 / gta / top
dwight schrute has ultimate rizz the office us,0,50 / gta / top
sidemen man vs food challenge,0,50 / gta / top
sidemen tiktok challenge,0,50 / gta / top
my most exclusive unboxing ever,0,50 / gta / top
harry w2s top cancelled moments,0,50 / gta / top
best football team ever,0,50 / gta / top
scump reacts to his greatest moments,0,50 / gta / top
1 year of coding 5 minutes computer science first year,0,50 / gta / top
sidemen tinder in real life 4 usa youtube edition,0,50 / gta / top
the consolelog of css,0,50 / gta / top
1 year of coding 5 minutes computer science first year,0,50 / gta / top
sidemen vs beta squad among us in real life,0,50 / gta / top
sidemen one word interview,0,50 / gta / top
have you slept with any of the sidemen,0,50 / gta / top
all of calculus 3 8 minutes,0,50 / gta / top
the legendary story of lionel messi,0,50 / gta / top
the office every cold open season 9 part 1,0,50 / gta / top
top 10 high school basketball mixtapes of all time,0,50 / gta / top
the office top 10 most searched for clips of all time,0,50 / gta / top
10 types of tas,0,50 / gta / top
womens appreciation the office us,0,50 / gta / top
season 3 bloopers the office us comedy bites,0,50 / gta / top
the most disturbing hijacking tv history,0,50 / gta / top
peter drury best commentaries the poet of world football,0,50 / gta / top
the most iconic sporting moments ever,0,50 / gta / top
20 women vs 1 sidemen kai cenat edition,0,50 / gta / top
pam angela actually being friends 9 minutes straight the office us comedy bites,0,50 / gta / top
9986000 minutes the office us,0,50 / gta / top
the office wedding dance the office,0,50 / gta / top
the office farewells the cast part 1,0,50 / gta / top
that time office cast broke in an episode shorts comedy bites,0,50 / gta / top
sidemen saddest moment sidemen nostalgia harry 20 1,0,50 / gta / top
best intro ever the office us,0,50 / gta / top
best of cold opens the office,0,50 / gta / top
best of warehouse the office us comedy bites,0,50 / gta / top
even more season 6 bloopers the office us comedy bites,0,50 / gta / top
office season 7 bloopers the office us comedy bites,0,50 / gta / top
the best sniper live commentary ever,0,50 / gta / top
every time pam was jealous the office us,0,50 / gta / top
worst of karen being karen the office us comedy bites,0,50 / gta / top
everybody hates gabe the office us comedy bites,0,50 / gta / top
awkward moments the office us,0,50 / gta / top
sassiest moments the office us,0,50 / gta / top
office season 5 bloopers but make it chaotic comedy bites,0,50 / gta / top
the little things,0,50 / gta / top
best of bloopers the office us comedy bites,0,50 / gta / top
steve carell deserving an emmy 10 minutes straight the office us comedy bites,0,50 / gta / top
the new chokii,0,50 / gta / top
best of erin the office us,0,50 / gta / top
anger management the office us,0,50 / gta / top
the rise fall of ryan howard the office,0,50 / gta / top
the most effective strategy,0,50 / gta / top
joji glimpse of us,0,50 / gta / top
joji performing glimpse of us live first time ever,0,50 / gta / top
the monsters beneath us the monument mythos,0,50 / gta / top
the conjuring the history of valak horror history,0,50 / gta / top
sidemen among us sheriff role the dumbest lobby ever,0,50 / gta / top
office season 4 bloopers the office us comedy bites,0,50 / gta / top
office season 3 bloopers the office us comedy bites,0,50 / gta / top
casting the office a peacock extra the office us,0,50 / gta / top
bed bugs save day the office us,0,50 / gta / top
cathy tries seduce jim the office us,0,50 / gta / top
dwight dont simp the office us,0,50 / gta / top
jim dwight the best of frenemies the office us,0,50 / gta / top
jim ryan the office,0,50 / gta / top
michael becomes jim the office us,0,50 / gta / top
michael toby the office us,0,50 / gta / top
see you tomorrow lunch michael the office us,0,50 / gta / top
9986000 minutes the office us,0,50 / gta / top
the office deep cuts comedy bites,0,50 / gta / top
the duo the pooo,0,50 / gta / top
january 5 2023,0,50 / gta / top
sidemen among us jester role,0,50 / gta / top
high on life funny moments,0,50 / gta / top
the most disturbing haunted house of all time mckamey manor,0,50 / gta / top
the clawcam,0,50 / gta / top
harry w2s almost cancelling himself 10 mins straight w2s most cancelled,0,50 / gta / top
ninja trolling 10 humiliating enemy epic reactions bo2 funny moments,0,50 / gta / top
beating tranzit easter egg under 10 minutes,0,50 / gta / top
my most expensive unboxing of 2019,0,50 / gta / top
the most hypebeast unboxing ive ever done,0,50 / gta / top
whats best song of 2022,0,50 / gta / top
the gonadolaaaas,0,50 / gta / top
the most hypebeast unboxing ive ever done,0,50 / gta / top
babylon the fall of richest city of all time,0,50 / gta / top
the best christmas magic trick ever,0,50 / gta / top
one of best moment the office theoffice comedy sitcom tvshow,0,50 / gta / top
best pitstop of all time shorts f1 lewishamilton,0,50 / gta / top
shaq says kobe michael jordan are the best nba players ever,0,50 / gta / top
w2s funniest moments part 17,0,50 / gta / top
jack harlow funny moments,0,50 / gta / top
sidemen secret santa,0,50 / gta / top
comedy standupcomedy shorts funny therapy dating,0,50 / gta / top
its ridiculous choice this climate the office us,0,50 / gta / top
batman arkham city 5 minutes of batarang fail,0,50 / gta / top
funny or fraud emily catalano comedy emilycatalano donttellcomedy shorts,0,50 / gta / top
the best excuse dan boulger standupcomedy donttellcomedy standup shorts,0,50 / gta / top
the most disturbing cult of all time the ant hill kids,0,50 / gta / top
compilation best of ralph barbosa,0,50 / gta / top
best toby slurs the office us,0,50 / gta / top
10 things batman arkham players hate,0,50 / gta / top
the office holiday trivia night the office us,0,50 / gta / top
michael scott crosses the line the office us,0,50 / gta / top
one moment that perfectly sums up every core character the office us,0,50 / gta / top
michael scott crosses the line the office us,0,50 / gta / top
football boots we all remember part 67,0,50 / gta / top
office season 4 bloopers the office us comedy bites,0,50 / gta / top
season 2 bloopers the office us comedy bites,0,50 / gta / top
season 6 bloopers pt 2 the office us comedy bites,0,50 / gta / top
jim pam take on the world,0,50 / gta / top
sidemen 20000 big fat quiz of the year,0,50 / gta / top
ryan vs pam the office us,0,50 / gta / top
dwight gets appendicitis the office us,0,50 / gta / top
best cr7 football boots of alltime part 6,0,50 / gta / top
football boots we all remember part 53,0,50 / gta / top
football boots we all remember part 30,0,50 / gta / top
football boots we all remember part 45,0,50 / gta / top
football boots we all remember part 54,0,50 / gta / top
football boots we all remember part 59,0,50 / gta / top
football boots we all remember part 66,0,50 / gta / top
football boots we all remember part 39,0,50 / gta / top
the art of defending,0,50 / gta / top
sidemen 20000 big fat quiz of the year,0,50 / gta / top
michael scott actually being good boss 9 minutes straight the office us comedy bites,0,50 / gta / top
feel good moments the office us,0,50 / gta / top
selling women the office us,0,50 / gta / top
drunk disorderly the office us,0,50 / gta / top
everybody hates gabe the office us comedy bites,0,50 / gta / top
try not vomit challenge office us parks recreation more comedy bites,0,50 / gta / top
the best of the warehouse the office us,0,50 / gta / top
the offices biggest lies the office us,0,50 / gta / top
the best of michael erin the offices sweetest friendship comedy bites,0,50 / gta / top
best of erin the office us,0,50 / gta / top
every time pam was jealous the office us,0,50 / gta / top
party central the office us,0,50 / gta / top
the best of darryl the office us,0,50 / gta / top
the rise fall of ryan howard the office,0,50 / gta / top
whats your most awkward time in bed,0,50 / gta / top
the rise fall of ryan howard the office,0,50 / gta / top
