Original_Title,Cleaned_Title,Cluster,Cluster_Name
Brighton v. Fulham | PREMIER LEAGUE HIGHLIGHTS | 3/8/2025 | NBC Sports,brighton v fulham league highlights 382025 sports,5,highlights / sports / league / v / united
Newcastle United v. Nottingham Forest | PREMIER LEAGUE HIGHLIGHTS | 2/23/2025 | NBC Sports,newcastle united v nottingham forest league highlights 2232025 sports,5,highlights / sports / league / v / united
Arsenal v. West Ham United | PREMIER LEAGUE HIGHLIGHTS | 2/22/2025 | NBC Sports,arsenal v west ham united league highlights 2222025 sports,5,highlights / sports / league / v / united
Everton v. Manchester United | PREMIER LEAGUE HIGHLIGHTS | 2/22/2025 | NBC Sports,everton v manchester united league highlights 2222025 sports,5,highlights / sports / league / v / united
Brighton v. Chelsea | PREMIER LEAGUE HIGHLIGHTS | 2/14/2025 | NBC Sports,brighton v chelsea league highlights 2142025 sports,5,highlights / sports / league / v / united
MUST SEE: Goodison Park ERUPTS with Tarkowski's equalizer v. Liverpool | Premier League | NBC Sports,must see goodison park erupts tarkowskis equalizer v liverpool league sports,5,highlights / sports / league / v / united
Demarai Gray stoppage-time stunner gets Everton in front | Premier League | NBC Sports,demarai gray stoppagetime stunner gets everton front league sports,5,highlights / sports / league / v / united
Everton v. Liverpool | PREMIER LEAGUE HIGHLIGHTS | 2/12/2025 | NBC Sports,everton v liverpool league highlights 2122025 sports,5,highlights / sports / league / v / united
Joe Willock gives Newcastle United liftoff against Chelsea | Premier League | NBC Sports,joe willock gives newcastle united liftoff against chelsea league sports,5,highlights / sports / league / v / united
Juventus vs. PSV: Extended Highlights | UCL Knockout Phase Play-off Leg 1 | CBS Sports Golazo,juventus psv extended highlights ucl knockout phase playoff leg cbs sports golazo,5,highlights / sports / league / v / united
HILARIOUS SUNDAY LEAGUE FOOTBALL MOMENTS!,hilarious sunday league football,5,highlights / sports / league / v / united
Manchester United v. Crystal Palace | PREMIER LEAGUE HIGHLIGHTS | 2/2/2025 | NBC Sports,manchester united v crystal palace league highlights 222025 sports,5,highlights / sports / league / v / united
Nottingham Forest v. Brighton | PREMIER LEAGUE HIGHLIGHTS | 2/1/2025 | NBC Sports,nottingham forest v brighton league highlights 212025 sports,5,highlights / sports / league / v / united
Nottingham Forest v. Brighton | PREMIER LEAGUE HIGHLIGHTS | 2/1/2025 | NBC Sports,nottingham forest v brighton league highlights 212025 sports,5,highlights / sports / league / v / united
Tottenham Hotspur v. Leicester City | PREMIER LEAGUE HIGHLIGHTS | 1/26/2025 | NBC Sports,tottenham hotspur v leicester city league highlights 1262025 sports,5,highlights / sports / league / v / united
Sunday league ⚽ #sundayleague #sundayleaguefootball #ranking #tiktok #meme,sunday league sundayleague sundayleaguefootball ranking tiktok meme,5,highlights / sports / league / v / united
Feyenoord vs. Bayern: Extended Highlights | UCL League Phase MD 7 | CBS Sports Golazo,feyenoord bayern extended highlights ucl league phase md cbs sports golazo,5,highlights / sports / league / v / united
Man. United vs. Rangers: Extended Highlights | UEL League Phase MD 7 | CBS Sports Golazo,man united rangers extended highlights uel league phase md cbs sports golazo,5,highlights / sports / league / v / united
PSG vs. Man. City: Extended Highlights | UCL League Phase MD 7 | CBS Sports Golazo,psg man city extended highlights ucl league phase md cbs sports golazo,5,highlights / sports / league / v / united
Benfica vs. Barcelona: Extended Highlights | UCL League Phase MD 7 | CBS Sports,benfica barcelona extended highlights ucl league phase md cbs sports,5,highlights / sports / league / v / united
"Is the NBA becoming a ""daddy's money"" league?",nba becoming daddys money league,5,highlights / sports / league / v / united
Chelsea v. Wolves | PREMIER LEAGUE HIGHLIGHTS | 1/20/2025 | NBC Sports,chelsea v wolves league highlights 1202025 sports,5,highlights / sports / league / v / united
Manchester United v. Brighton | PREMIER LEAGUE HIGHLIGHTS | 1/19/2025 | NBC Sports,manchester united v brighton league highlights 1192025 sports,5,highlights / sports / league / v / united
Manchester United v. Southampton | PREMIER LEAGUE HIGHLIGHTS | 1/16/2025 | NBC Sports,manchester united v southampton league highlights 1162025 sports,5,highlights / sports / league / v / united
INTER-MILAN 2-3 | EXTENDED HIGHLIGHTS | EA SPORTS FC Supercup 2025,intermilan 23 extended highlights ea sports fc supercup 2025,5,highlights / sports / league / v / united
Aston Villa v. Brighton | PREMIER LEAGUE HIGHLIGHTS | 12/30/2024 | NBC Sports,aston villa v brighton league highlights 12302024 sports,5,highlights / sports / league / v / united
Manchester United v. Newcastle United | PREMIER LEAGUE HIGHLIGHTS | 12/30/2024 | NBC Sports,manchester united v newcastle united league highlights 12302024 sports,5,highlights / sports / league / v / united
Ipswich Town v. Chelsea | PREMIER LEAGUE HIGHLIGHTS | 12/30/2024 | NBC Sports,ipswich town v chelsea league highlights 12302024 sports,5,highlights / sports / league / v / united
Chelsea vs. Shamrock Rovers: Extended Highlights | UECL League Phase MD 6 | CBS Sports Golazo,chelsea shamrock rovers extended highlights uecl league phase md cbs sports golazo,5,highlights / sports / league / v / united
CAICEDO is the best midfielder in the Premier League 🫣 #football #soccer  #premierleague,caicedo midfielder league football soccer premierleague,5,highlights / sports / league / v / united
Nottingham Forest v. Aston Villa | PREMIER LEAGUE HIGHLIGHTS | 12/14/2024 | NBC Sports,nottingham forest v aston villa league highlights 12142024 sports,5,highlights / sports / league / v / united
Newcastle United v. Liverpool | PREMIER LEAGUE HIGHLIGHTS | 12/4/2024 | NBC Sports,newcastle united v liverpool league highlights 1242024 sports,5,highlights / sports / league / v / united
Atalanta vs. Real Madrid: Extended Highlights | UCL League Phase MD 6 | CBS Sports Golazo,atalanta real madrid extended highlights ucl league phase md cbs sports golazo,5,highlights / sports / league / v / united
Tottenham Hotspur v. Chelsea | PREMIER LEAGUE HIGHLIGHTS | 12/8/2024 | NBC Sports,tottenham hotspur v chelsea league highlights 1282024 sports,5,highlights / sports / league / v / united
Leicester City v. Manchester United | PREMIER LEAGUE HIGHLIGHTS | 10/16/2021 | NBC Sports,leicester city v manchester united league highlights 10162021 sports,5,highlights / sports / league / v / united
Leicester City v. Brighton | PREMIER LEAGUE HIGHLIGHTS | 12/8/2024 | NBC Sports,leicester city v brighton league highlights 1282024 sports,5,highlights / sports / league / v / united
Fulham v. Arsenal | PREMIER LEAGUE HIGHLIGHTS | 12/8/2024 | NBC Sports,fulham v arsenal league highlights 1282024 sports,5,highlights / sports / league / v / united
CBS Sports Network,cbs sports network,5,highlights / sports / league / v / united
CBS Sports Network,cbs sports network,5,highlights / sports / league / v / united
Chelsea vs. Gent: Extended Highlights | UECL League Phase MD 1 | CBS Sports Golazo,chelsea gent extended highlights uecl league phase md cbs sports golazo,5,highlights / sports / league / v / united
Liverpool vs. Bologna: Extended Highlights | UCL League Phase MD 2 | CBS Sports Golazo,liverpool bologna extended highlights ucl league phase md cbs sports golazo,5,highlights / sports / league / v / united
RB Leipzig vs. Juventus: Extended Highlights | UCL League Phase MD 2 | CBS Sports Golazo,rb leipzig juventus extended highlights ucl league phase md cbs sports golazo,5,highlights / sports / league / v / united
Lille vs. Real Madrid: Extended Highlights | UCL League Phase MD 2 | CBS Sports Golazo,lille real madrid extended highlights ucl league phase md cbs sports golazo,5,highlights / sports / league / v / united
Kai Cenat's Little Basketball Association CHAMPIONSHIP Highlights,kai cenats little basketball association championship highlights,5,highlights / sports / league / v / united
Borussia Dortmund vs. Celtic: Extended Highlights | UCL League Phase MD 2 | CBS Sports Golazo,borussia dortmund celtic extended highlights ucl league phase md cbs sports golazo,5,highlights / sports / league / v / united
Bayer Leverkusen vs. AC Milan: Extended Highlights | UCL League Phase MD 2 | CBS Sports Golazo,bayer leverkusen ac milan extended highlights ucl league phase md cbs sports golazo,5,highlights / sports / league / v / united
PSV vs. Sporting: Extended Highlights | UCL League Phase MD 2 | CBS Sports Golazo,psv sporting extended highlights ucl league phase md cbs sports golazo,5,highlights / sports / league / v / united
Barcelona vs. Young Boys: Extended Highlights | UCL League Phase MD 2 | CBS Sports Golazo,barcelona young boys extended highlights ucl league phase md cbs sports golazo,5,highlights / sports / league / v / united
Arsenal vs. PSG: Extended Highlights | UCL League Phase MD 2 | CBS Sports Golazo,arsenal psg extended highlights ucl league phase md cbs sports golazo,5,highlights / sports / league / v / united
Crystal Palace v. Manchester United | PREMIER LEAGUE HIGHLIGHTS | 9/21/2024 | NBC Sports,crystal palace v manchester united league highlights 9212024 sports,5,highlights / sports / league / v / united
Top 10 Most Handsome Football Players in the NFL,handsome football players nfl,5,highlights / sports / league / v / united
Denver Broncos vs. Seattle Seahawks | NFL 2024 Week 1 Game Highlights,denver broncos seattle seahawks nfl 2024 week game highlights,5,highlights / sports / league / v / united
Top Plays of The 2023 Regular Season | NFL Highlights,plays 2023 regular season nfl highlights,5,highlights / sports / league / v / united
USC Trojans vs. LSU Tigers | Full Game Highlights | ESPN College Football,usc trojans lsu tigers game highlights espn college football,5,highlights / sports / league / v / united
Newcastle United v. Tottenham Hotspur | PREMIER LEAGUE HIGHLIGHTS | 9/1/2024 | NBC Sports,newcastle united v tottenham hotspur league highlights 912024 sports,5,highlights / sports / league / v / united
Everton v. Bournemouth | PREMIER LEAGUE HIGHLIGHTS | 8/31/2024 | NBC Sports,everton v bournemouth league highlights 8312024 sports,5,highlights / sports / league / v / united
Bournemouth v. Newcastle United | PREMIER LEAGUE HIGHLIGHTS | 8/25/2024 | NBC Sports,bournemouth v newcastle united league highlights 8252024 sports,5,highlights / sports / league / v / united
Crystal Palace v. West Ham United | PREMIER LEAGUE HIGHLIGHTS | 8/24/2024 | NBC Sports,crystal palace v west ham united league highlights 8242024 sports,5,highlights / sports / league / v / united
Liverpool v. Brentford | PREMIER LEAGUE HIGHLIGHTS | 8/25/2024 | NBC Sports,liverpool v brentford league highlights 8252024 sports,5,highlights / sports / league / v / united
Brighton v. Manchester United | PREMIER LEAGUE HIGHLIGHTS | 8/24/2024 | NBC Sports,brighton v manchester united league highlights 8242024 sports,5,highlights / sports / league / v / united
Aston Villa v. Arsenal | PREMIER LEAGUE HIGHLIGHTS | 8/24/2024 | NBC Sports,aston villa v arsenal league highlights 8242024 sports,5,highlights / sports / league / v / united
Chelsea 2-0 Servette | HIGHLIGHTS - Extended | UEFA Europa Conference League 2024/25,chelsea 20 servette highlights extended uefa europa conference league 202425,5,highlights / sports / league / v / united
Young Boys vs. Galatasaray: Extended Highlights | UCL Qualifiers Play-offs | CBS Sports Golazo,young boys galatasaray extended highlights ucl qualifiers playoffs cbs sports golazo,5,highlights / sports / league / v / united
Aston Villa v. West Ham United | PREMIER LEAGUE HIGHLIGHTS | 8/17/2024 | NBC Sports,aston villa v west ham united league highlights 8172024 sports,5,highlights / sports / league / v / united
Nottingham Forest v. Bournemouth | PREMIER LEAGUE HIGHLIGHTS | 8/17/2024 | NBC Sports,nottingham forest v bournemouth league highlights 8172024 sports,5,highlights / sports / league / v / united
Everton v. Brighton | PREMIER LEAGUE HIGHLIGHTS | 8/17/2024 | NBC Sports,everton v brighton league highlights 8172024 sports,5,highlights / sports / league / v / united
Manchester United v. Fulham | PREMIER LEAGUE HIGHLIGHTS | 8/16/2024 | NBC Sports,manchester united v fulham league highlights 8162024 sports,5,highlights / sports / league / v / united
Highlights: USMNT vs. Brazil (En Español) | 6/12/24 | NBC Sports,highlights usmnt brazil en espaol 61224 sports,5,highlights / sports / league / v / united
"Washington vs Stanford | NCAA College Soccer | Highlights - October 22, 2023",washington stanford ncaa college soccer highlights october 22 2023,5,highlights / sports / league / v / united
Top 25 Premier League goals of 2023-24 season | NBC Sports,25 league goals 202324 season sports,5,highlights / sports / league / v / united
0% Sportsmanship in Football,0 sportsmanship football,5,highlights / sports / league / v / united
CBS Sports Network,cbs sports network,5,highlights / sports / league / v / united
Chelsea v. Bournemouth | PREMIER LEAGUE HIGHLIGHTS | 5/19/2024 | NBC Sports,chelsea v bournemouth league highlights 5192024 sports,5,highlights / sports / league / v / united
Manchester United v. Arsenal | PREMIER LEAGUE HIGHLIGHTS | 5/12/2024 | NBC Sports,manchester united v arsenal league highlights 5122024 sports,5,highlights / sports / league / v / united
Nottingham Forest v. Chelsea | PREMIER LEAGUE HIGHLIGHTS | 5/11/2024 | NBC Sports,nottingham forest v chelsea league highlights 5112024 sports,5,highlights / sports / league / v / united
Tottenham Hotspur v. Burnley | PREMIER LEAGUE HIGHLIGHTS | 5/11/2024 | NBC Sports,tottenham hotspur v burnley league highlights 5112024 sports,5,highlights / sports / league / v / united
Crystal Palace v. Manchester United | PREMIER LEAGUE HIGHLIGHTS | 5/6/2024 | NBC Sports,crystal palace v manchester united league highlights 562024 sports,5,highlights / sports / league / v / united
Brighton v. Aston Villa | PREMIER LEAGUE HIGHLIGHTS | 5/5/2024 | NBC Sports,brighton v aston villa league highlights 552024 sports,5,highlights / sports / league / v / united
Liverpool v. Tottenham Hotspur | PREMIER LEAGUE HIGHLIGHTS | 5/5/2024 | NBC Sports,liverpool v tottenham hotspur league highlights 552024 sports,5,highlights / sports / league / v / united
Chelsea v. West Ham United | PREMIER LEAGUE HIGHLIGHTS | 5/5/2024 | NBC Sports,chelsea v west ham united league highlights 552024 sports,5,highlights / sports / league / v / united
Arsenal v. Bournemouth | PREMIER LEAGUE HIGHLIGHTS | 5/4/2024 | NBC Sports,arsenal v bournemouth league highlights 542024 sports,5,highlights / sports / league / v / united
Luton Town v. Everton | PREMIER LEAGUE HIGHLIGHTS | 5/3/2024 | NBC Sports,luton town v everton league highlights 532024 sports,5,highlights / sports / league / v / united
Roma vs. Bayer Leverkusen: Extended Highlights | UEL Semi-Finals 1st Leg | CBS Sports Golazo,roma bayer leverkusen extended highlights uel semifinals 1st leg cbs sports golazo,5,highlights / sports / league / v / united
Chelsea v. Tottenham Hotspur | PREMIER LEAGUE HIGHLIGHTS | 5/2/2024 | NBC Sports,chelsea v tottenham hotspur league highlights 522024 sports,5,highlights / sports / league / v / united
Bayern vs. Real Madrid: Extended Highlights | UCL Semi-Finals 1st Leg | CBS Sports Golazo,bayern real madrid extended highlights ucl semifinals 1st leg cbs sports golazo,5,highlights / sports / league / v / united
Arsenal v. Chelsea | PREMIER LEAGUE HIGHLIGHTS | 4/23/2024 | NBC Sports,arsenal v chelsea league highlights 4232024 sports,5,highlights / sports / league / v / united
Every Premier League goal from Matchweek 34 (2023-24) | NBC Sports,every league goal matchweek 34 202324 sports,5,highlights / sports / league / v / united
CHAMPIONS LEAGUE SCORERS Quiz #football #ucl #footballquiz,champions league scorers quiz football ucl footballquiz,5,highlights / sports / league / v / united
PSG #football #rolando #new #soccer #messi #viral #fifa #cr7,psg football rolando soccer messi viral fifa cr7,5,highlights / sports / league / v / united
Wolves v. Arsenal | PREMIER LEAGUE HIGHLIGHTS | 4/20/2024 | NBC Sports,wolves v arsenal league highlights 4202024 sports,5,highlights / sports / league / v / united
Borussia Dortmund vs. Atlético Madrid: Extended Highlights | UCL Quarter-Finals 2nd Leg | CBS Sports,borussia dortmund atltico madrid extended highlights ucl quarterfinals 2nd leg cbs sports,5,highlights / sports / league / v / united
Manchester City v. Luton Town | PREMIER LEAGUE HIGHLIGHTS | 4/13/2024 | NBC Sports,manchester city v luton town league highlights 4132024 sports,5,highlights / sports / league / v / united
Bournemouth v. Manchester United | PREMIER LEAGUE HIGHLIGHTS | 4/13/2024 | NBC Sports,bournemouth v manchester united league highlights 4132024 sports,5,highlights / sports / league / v / united
Burnley v. Brighton | PREMIER LEAGUE HIGHLIGHTS | 4/13/2024 | NBC Sports,burnley v brighton league highlights 4132024 sports,5,highlights / sports / league / v / united
Newcastle United v. Tottenham Hotspur | PREMIER LEAGUE HIGHLIGHTS | 4/13/2024 | NBC Sports,newcastle united v tottenham hotspur league highlights 4132024 sports,5,highlights / sports / league / v / united
Bayer Leverkusen vs. West Ham: Extended Highlights | UEL Quarter-Finals 1st Leg | CBS Sports Golazo,bayer leverkusen west ham extended highlights uel quarterfinals 1st leg cbs sports golazo,5,highlights / sports / league / v / united
Real Madrid vs. Man. City: Extended Highlights | UCL Quarter-Finals 1st Leg | CBS Sports Golazo,real madrid man city extended highlights ucl quarterfinals 1st leg cbs sports golazo,5,highlights / sports / league / v / united
HIGHLIGHTS | Liverpool 0-3 Atalanta | UEFA Europa League 2023/24 - 4tos | TUDN,highlights liverpool 03 atalanta uefa europa league 202324 4tos tudn,5,highlights / sports / league / v / united
Real Madrid vs. Man. City: Extended Highlights | UCL Quarter-Finals 1st Leg | CBS Sports Golazo,real madrid man city extended highlights ucl quarterfinals 1st leg cbs sports golazo,5,highlights / sports / league / v / united
HIGHLIGHTS - Real Madrid 3-3 Man City | UEFA Champions League 2023/24 - 4tos | TUDN,highlights real madrid 33 man city uefa champions league 202324 4tos tudn,5,highlights / sports / league / v / united
Arsenal vs. Bayern: Extended Highlights | UCL Quarter-Finals 1st Leg | CBS Sports Golazo,arsenal bayern extended highlights ucl quarterfinals 1st leg cbs sports golazo,5,highlights / sports / league / v / united
Real Madrid vs. Man. City: Extended Highlights | UCL Quarter-Finals 1st Leg | CBS Sports Golazo,real madrid man city extended highlights ucl quarterfinals 1st leg cbs sports golazo,5,highlights / sports / league / v / united
Every Premier League goal from Matchweek 32 (2023-24) | NBC Sports,every league goal matchweek 32 202324 sports,5,highlights / sports / league / v / united
Tottenham Hotspur v. Nottingham Forest | PREMIER LEAGUE HIGHLIGHTS | 4/6/2024 | NBC Sports,tottenham hotspur v nottingham forest league highlights 462024 sports,5,highlights / sports / league / v / united
Sheffield United v. Chelsea | PREMIER LEAGUE HIGHLIGHTS | 4/6/2024 | NBC Sports,sheffield united v chelsea league highlights 462024 sports,5,highlights / sports / league / v / united
Manchester United v. Liverpool | PREMIER LEAGUE HIGHLIGHTS | 4/6/2024 | NBC Sports,manchester united v liverpool league highlights 462024 sports,5,highlights / sports / league / v / united
Aston Villa v. Brentford | PREMIER LEAGUE HIGHLIGHTS | 4/6/2024 | NBC Sports,aston villa v brentford league highlights 462024 sports,5,highlights / sports / league / v / united
Brighton v. Arsenal | PREMIER LEAGUE HIGHLIGHTS | 4/6/2024 | NBC Sports,brighton v arsenal league highlights 462024 sports,5,highlights / sports / league / v / united
Luton Town v. Bournemouth | PREMIER LEAGUE HIGHLIGHTS | 4/6/2024 | NBC Sports,luton town v bournemouth league highlights 462024 sports,5,highlights / sports / league / v / united
West Ham United v. Wolves | PREMIER LEAGUE HIGHLIGHTS | 4/6/2024 | NBC Sports,west ham united v wolves league highlights 462024 sports,5,highlights / sports / league / v / united
Chelsea v. Manchester United | PREMIER LEAGUE HIGHLIGHTS | 4/4/2024 | NBC Sports,chelsea v manchester united league highlights 442024 sports,5,highlights / sports / league / v / united
Liverpool v. Sheffield United | PREMIER LEAGUE HIGHLIGHTS | 4/4/2024 | NBC Sports,liverpool v sheffield united league highlights 442024 sports,5,highlights / sports / league / v / united
Arsenal v. Luton Town | PREMIER LEAGUE HIGHLIGHTS | 4/3/2024 | NBC Sports,arsenal v luton town league highlights 432024 sports,5,highlights / sports / league / v / united
Manchester City v. Aston Villa | PREMIER LEAGUE HIGHLIGHTS | 4/3/2024 | NBC Sports,manchester city v aston villa league highlights 432024 sports,5,highlights / sports / league / v / united
Burnley v. Wolves | PREMIER LEAGUE HIGHLIGHTS | 4/2/2024 | NBC Sports,burnley v wolves league highlights 422024 sports,5,highlights / sports / league / v / united
West Ham United v. Tottenham Hotspur | PREMIER LEAGUE HIGHLIGHTS | 4/2/2024 | NBC Sports,west ham united v tottenham hotspur league highlights 422024 sports,5,highlights / sports / league / v / united
Newcastle United v. Everton | PREMIER LEAGUE HIGHLIGHTS | 4/2/2024 | NBC Sports,newcastle united v everton league highlights 422024 sports,5,highlights / sports / league / v / united
Arsenal v. Manchester United | PREMIER LEAGUE HIGHLIGHTS | 9/3/2023 | NBC Sports,arsenal v manchester united league highlights 932023 sports,5,highlights / sports / league / v / united
Arsenal v. Liverpool | PREMIER LEAGUE HIGHLIGHTS | 2/4/2024 | NBC Sports,arsenal v liverpool league highlights 242024 sports,5,highlights / sports / league / v / united
THE RUN IN: Story of the 2023-24 Premier League title race so far | NBC Sports,run story 202324 league title race far sports,5,highlights / sports / league / v / united
HIGHLIGHTS | Panamá 0-3 México | CONCACAF Nations League 2024 - Semis | TUDN,highlights panam 03 mxico concacaf nations league 2024 semis tudn,5,highlights / sports / league / v / united
Manchester City vs. Real Madrid: Extended Highlights | UCL Semi-Finals - Leg 1 | CBS Sports Golazo,manchester city real madrid extended highlights ucl semifinals leg cbs sports golazo,5,highlights / sports / league / v / united
Brighton & Hove Albion vs. Roma: Extended Highlights | UEL Round of 16 2nd Leg | CBS Sports Golazo,brighton hove albion roma extended highlights uel round 16 2nd leg cbs sports golazo,5,highlights / sports / league / v / united
Arsenal vs. Porto: Extended Highlights | UCL Round of 16 2nd Leg | CBS Sports Golazo,arsenal porto extended highlights ucl round 16 2nd leg cbs sports golazo,5,highlights / sports / league / v / united
Bayer Leverkusen vs. Qarabağ: Extended Highlights | UEL Round of 16 2nd Leg | CBS Sports Golazo,bayer leverkusen qaraba extended highlights uel round 16 2nd leg cbs sports golazo,5,highlights / sports / league / v / united
Demarai Gray stoppage-time stunner gets Everton in front | Premier League | NBC Sports,demarai gray stoppagetime stunner gets everton front league sports,5,highlights / sports / league / v / united
Joe Willock gives Newcastle United liftoff against Chelsea | Premier League | NBC Sports,joe willock gives newcastle united liftoff against chelsea league sports,5,highlights / sports / league / v / united
Bournemouth v. Luton Town | PREMIER LEAGUE HIGHLIGHTS | 3/13/2024 | NBC Sports,bournemouth v luton town league highlights 3132024 sports,5,highlights / sports / league / v / united
Atlético Madrid vs. Inter: Extended Highlights | UCL Round of 16 2nd Leg | CBS Sports Golazo,atltico madrid inter extended highlights ucl round 16 2nd leg cbs sports golazo,5,highlights / sports / league / v / united
Chelsea v. Newcastle United | PREMIER LEAGUE HIGHLIGHTS | 3/11/2024 | NBC Sports,chelsea v newcastle united league highlights 3112024 sports,5,highlights / sports / league / v / united
Barcelona vs. Napoli: Extended Highlights | UCL Round of 16 2nd Leg | CBS Sports Golazo,barcelona napoli extended highlights ucl round 16 2nd leg cbs sports golazo,5,highlights / sports / league / v / united
Arsenal v. Brentford | PREMIER LEAGUE HIGHLIGHTS | 3/9/2024 | NBC Sports,arsenal v brentford league highlights 392024 sports,5,highlights / sports / league / v / united
Liverpool v. Manchester City | PREMIER LEAGUE HIGHLIGHTS | 3/10/2024 | NBC Sports,liverpool v manchester city league highlights 3102024 sports,5,highlights / sports / league / v / united
Aston Villa v. Tottenham Hotspur | PREMIER LEAGUE HIGHLIGHTS | 3/10/2024 | NBC Sports,aston villa v tottenham hotspur league highlights 3102024 sports,5,highlights / sports / league / v / united
Manchester United v. Everton | PREMIER LEAGUE HIGHLIGHTS | 3/9/2024 | NBC Sports,manchester united v everton league highlights 392024 sports,5,highlights / sports / league / v / united
Arsenal v. Brentford | PREMIER LEAGUE HIGHLIGHTS | 3/9/2024 | NBC Sports,arsenal v brentford league highlights 392024 sports,5,highlights / sports / league / v / united
Sheffield United v. Arsenal | PREMIER LEAGUE HIGHLIGHTS | 3/4/2024 | NBC Sports,sheffield united v arsenal league highlights 342024 sports,5,highlights / sports / league / v / united
Manchester City v. Manchester United | PREMIER LEAGUE HIGHLIGHTS | 3/3/2024 | NBC Sports,manchester city v manchester united league highlights 332024 sports,5,highlights / sports / league / v / united
Everton v. West Ham United | PREMIER LEAGUE HIGHLIGHTS | 3/2/2024 | NBC Sports,everton v west ham united league highlights 322024 sports,5,highlights / sports / league / v / united
